number,value,params_fund_net_buying,params_institutional_weight,params_number_fund_holdings,params_pe,params_revenue_growth,params_roe,params_stock_weight_option,params_take_profit,params_trailing_stop_loss,state
550,0.35648157584496176,0.15000000000000002,0.275,0.4,0.22500000000000003,0.47500000000000003,0.07500000000000001,equal,0.47500000000000003,0.22500000000000003,COMPLETE
551,0.48512590163025776,0.125,0.37500000000000006,0.425,0.2,0.45,0.07500000000000001,equal,0.47500000000000003,0.25,COMPLETE
552,0.1131023564741771,0.175,0.35000000000000003,0.45,0.22500000000000003,0.47500000000000003,0.22500000000000003,equal,0.47500000000000003,0.25,COMPLETE
553,0.5118509686148531,0.125,0.37500000000000006,0.375,0.22500000000000003,0.45,0.07500000000000001,equal,0.47500000000000003,0.25,COMPLETE
554,-0.14305501983622007,0.15000000000000002,0.30000000000000004,0.425,0.15,0.47500000000000003,0.375,equal,0.47500000000000003,0.22500000000000003,COMPLETE
555,0.5199540953948878,0.15000000000000002,0.32500000000000007,0.4,0.22500000000000003,0.47500000000000003,0.07500000000000001,equal,0.47500000000000003,0.25,COMPLETE
556,0.5561933915843672,0.2,0.37500000000000006,0.425,0.22500000000000003,0.45,0.07500000000000001,equal,0.47500000000000003,0.22500000000000003,COMPLETE
557,0.2149839707645236,0.45,0.37500000000000006,0.425,0.22500000000000003,0.47500000000000003,0.1,equal,0.47500000000000003,0.22500000000000003,COMPLETE
558,0.5220452061556516,0.15000000000000002,0.37500000000000006,0.45,0.2,0.45,0.07500000000000001,equal,0.47500000000000003,0.22500000000000003,COMPLETE
559,0.5796959505723952,0.175,0.37500000000000006,0.45,0.22500000000000003,0.47500000000000003,0.07500000000000001,equal,0.47500000000000003,0.22500000000000003,COMPLETE
560,0.40910673195839786,0.2,0.37500000000000006,0.1,0.22500000000000003,0.47500000000000003,0.07500000000000001,equal,0.47500000000000003,0.22500000000000003,COMPLETE
561,0.260445610508791,0.2,0.4,0.45,0.22500000000000003,0.47500000000000003,0.1,equal,0.1,0.22500000000000003,COMPLETE
562,-0.05346717143430807,0.15000000000000002,0.4,0.45,0.22500000000000003,0.45,0.2,equal,0.47500000000000003,0.22500000000000003,COMPLETE
563,0.49149853777990726,0.2,0.37500000000000006,0.45,0.22500000000000003,0.47500000000000003,0.07500000000000001,equal,0.47500000000000003,0.22500000000000003,COMPLETE
564,0.5352747274654162,0.175,0.4,0.45,0.22500000000000003,0.47500000000000003,0.07500000000000001,equal,0.45,0.2,COMPLETE
565,0.47305950428820503,0.22500000000000003,0.42500000000000004,0.45,0.22500000000000003,0.47500000000000003,0.1,equal,0.45,0.2,COMPLETE
566,0.3683271534675832,0.2,0.4,0.47500000000000003,0.2,0.45,0.07500000000000001,equal,0.45,0.175,COMPLETE
567,0.6081389498078562,0.175,0.42500000000000004,0.47500000000000003,0.22500000000000003,0.47500000000000003,0.1,equal,0.45,0.22500000000000003,COMPLETE
568,0.5590159597313233,0.175,0.42500000000000004,0.47500000000000003,0.22500000000000003,0.45,0.1,equal,0.45,0.22500000000000003,COMPLETE
569,0.398465720948795,0.22500000000000003,0.42500000000000004,0.47500000000000003,0.2,0.45,0.1,equal,0.45,0.2,COMPLETE
570,0.48816348914485663,0.2,0.42500000000000004,0.47500000000000003,0.22500000000000003,0.45,0.1,equal,0.45,0.22500000000000003,COMPLETE
571,0.5590159597313238,0.15000000000000002,0.42500000000000004,0.47500000000000003,0.2,0.45,0.1,equal,0.45,0.22500000000000003,COMPLETE
572,0.5590159597313233,0.175,0.42500000000000004,0.47500000000000003,0.22500000000000003,0.45,0.1,equal,0.45,0.22500000000000003,COMPLETE
573,0.5590159597313233,0.175,0.42500000000000004,0.47500000000000003,0.2,0.45,0.1,equal,0.45,0.22500000000000003,COMPLETE
574,0.4647173273921225,0.2,0.42500000000000004,0.47500000000000003,0.2,0.45,0.1,equal,0.45,0.22500000000000003,COMPLETE
575,0.567556815547331,0.175,0.45000000000000007,0.47500000000000003,0.2,0.45,0.1,equal,0.45,0.22500000000000003,COMPLETE
576,0.398465720948795,0.22500000000000003,0.42500000000000004,0.47500000000000003,0.2,0.45,0.1,equal,0.45,0.2,COMPLETE
577,0.567556815547331,0.175,0.45000000000000007,0.47500000000000003,0.2,0.45,0.1,equal,0.45,0.22500000000000003,COMPLETE
578,0.32453588515183124,0.2,0.42500000000000004,0.47500000000000003,0.2,0.425,0.1,equal,0.45,0.22500000000000003,COMPLETE
579,0.567556815547331,0.175,0.45000000000000007,0.47500000000000003,0.2,0.45,0.1,equal,0.45,0.22500000000000003,COMPLETE
580,0.3713655376254499,0.175,0.42500000000000004,0.47500000000000003,0.2,0.425,0.1,equal,0.45,0.22500000000000003,COMPLETE
581,0.3899853780729847,0.25,0.42500000000000004,0.47500000000000003,0.2,0.45,0.125,equal,0.45,0.22500000000000003,COMPLETE
582,0.4449722261591228,0.175,0.45000000000000007,0.47500000000000003,0.175,0.45,0.1,equal,0.45,0.22500000000000003,COMPLETE
583,0.398465720948795,0.22500000000000003,0.42500000000000004,0.47500000000000003,0.2,0.45,0.1,equal,0.45,0.2,COMPLETE
584,0.567556815547331,0.175,0.45000000000000007,0.47500000000000003,0.2,0.45,0.1,equal,0.45,0.22500000000000003,COMPLETE
585,0.444972226159123,0.175,0.42500000000000004,0.47500000000000003,0.2,0.425,0.125,equal,0.45,0.22500000000000003,COMPLETE
586,0.38732915755958053,0.2,0.42500000000000004,0.47500000000000003,0.175,0.45,0.1,equal,0.45,0.22500000000000003,COMPLETE
587,0.32990240696437667,0.175,0.45000000000000007,0.47500000000000003,0.2,0.425,0.125,equal,0.45,0.22500000000000003,COMPLETE
588,0.5222378460910371,0.175,0.45000000000000007,0.47500000000000003,0.2,0.45,0.1,equal,0.45,0.2,COMPLETE
589,0.35626198428737665,0.175,0.45000000000000007,0.45,0.175,0.425,0.1,equal,0.45,0.22500000000000003,COMPLETE
590,0.5157026663935265,0.2,0.45000000000000007,0.47500000000000003,0.2,0.45,0.1,equal,0.45,0.2,COMPLETE
591,0.32946291294773916,0.175,0.45000000000000007,0.45,0.2,0.45,0.1,equal,0.45,0.22500000000000003,COMPLETE
592,0.4881634891448569,0.22500000000000003,0.4,0.47500000000000003,0.2,0.45,0.1,equal,0.45,0.22500000000000003,COMPLETE
593,0.513206094410869,0.2,0.42500000000000004,0.45,0.2,0.45,0.1,equal,0.45,0.2,COMPLETE
594,0.5042416036636584,0.2,0.4,0.47500000000000003,0.2,0.45,0.125,equal,0.45,0.22500000000000003,COMPLETE
595,0.35920756849369534,0.175,0.42500000000000004,0.47500000000000003,0.175,0.425,0.1,equal,0.45,0.22500000000000003,COMPLETE
596,0.5812588376929125,0.175,0.4,0.45,0.2,0.45,0.1,equal,0.45,0.22500000000000003,COMPLETE
597,0.27354333020439464,0.2,0.45000000000000007,0.45,0.2,0.425,0.125,equal,0.45,0.2,COMPLETE
598,0.1952993336083241,0.175,0.42500000000000004,0.7250000000000001,0.2,0.45,0.1,equal,0.45,0.22500000000000003,COMPLETE
599,0.10364523062402163,0.175,0.07500000000000001,0.45,0.175,0.45,0.1,equal,0.45,0.22500000000000003,COMPLETE
600,0.5503474518006696,0.175,0.4,0.45,0.2,0.45,0.125,equal,0.45,0.2,COMPLETE
601,0.48542524816622,0.2,0.45000000000000007,0.45,0.2,0.45,0.1,equal,0.45,0.22500000000000003,COMPLETE
602,0.444972226159123,0.175,0.42500000000000004,0.47500000000000003,0.2,0.425,0.125,equal,0.45,0.22500000000000003,COMPLETE
603,0.4881634891448569,0.22500000000000003,0.4,0.45,0.2,0.45,0.1,equal,0.45,0.22500000000000003,COMPLETE
604,0.17360277208460712,0.3,0.45000000000000007,0.47500000000000003,0.2,0.425,0.15000000000000002,equal,0.45,0.2,COMPLETE
605,0.5006128648460061,0.175,0.42500000000000004,0.45,0.175,0.45,0.1,equal,0.425,0.22500000000000003,COMPLETE
606,0.4881634891448569,0.2,0.4,0.47500000000000003,0.2,0.45,0.1,equal,0.45,0.22500000000000003,COMPLETE
607,0.08409024265740132,0.7250000000000001,0.4,0.25,0.2,0.45,0.1,equal,0.425,0.2,COMPLETE
608,0.4804827800088423,0.175,0.42500000000000004,0.45,0.2,0.45,0.125,equal,0.45,0.22500000000000003,COMPLETE
609,0.230745661368614,0.175,0.4,0.47500000000000003,0.2,0.4,0.1,equal,0.45,0.22500000000000003,COMPLETE
610,0.30087147730550057,0.2,0.45000000000000007,0.45,0.175,0.425,0.1,equal,0.425,0.2,COMPLETE
611,0.46733306736946134,0.175,0.42500000000000004,0.5,0.2,0.45,0.1,equal,0.45,0.22500000000000003,COMPLETE
612,0.4881634891448569,0.25,0.4,0.47500000000000003,0.2,0.45,0.1,equal,0.45,0.22500000000000003,COMPLETE
613,0.1738666106642749,0.2,0.4,0.47500000000000003,0.475,0.425,0.1,equal,0.425,0.22500000000000003,COMPLETE
614,0.34267653146069577,0.175,0.45000000000000007,0.5,0.22500000000000003,0.45,0.125,equal,0.45,0.25,COMPLETE
615,0.5352747274654174,0.22500000000000003,0.42500000000000004,0.45,0.2,0.45,0.1,equal,0.425,0.2,COMPLETE
616,0.576390899820631,0.15000000000000002,0.42500000000000004,0.5,0.175,0.45,0.1,equal,0.45,0.22500000000000003,COMPLETE
617,0.3299024069643757,0.175,0.45000000000000007,0.45,0.175,0.425,0.125,equal,0.45,0.22500000000000003,COMPLETE
618,0.30407122504689627,0.2,0.45000000000000007,0.5,0.175,0.45,0.125,equal,0.35000000000000003,0.2,COMPLETE
619,0.576390899820631,0.15000000000000002,0.42500000000000004,0.5,0.175,0.45,0.1,equal,0.45,0.22500000000000003,COMPLETE
620,0.4599202177796677,0.15000000000000002,0.45000000000000007,0.5,0.175,0.425,0.1,equal,0.45,0.22500000000000003,COMPLETE
621,0.25417206689725924,0.175,0.42500000000000004,0.5,0.175,0.45,0.125,equal,0.45,0.2,COMPLETE
622,0.24304583012241446,0.35000000000000003,0.42500000000000004,0.47500000000000003,0.175,0.425,0.1,equal,0.45,0.22500000000000003,COMPLETE
623,0.5763908998206309,0.15000000000000002,0.45000000000000007,0.5,0.175,0.45,0.1,equal,0.45,0.22500000000000003,COMPLETE
624,0.3592075684936952,0.15000000000000002,0.45000000000000007,0.5,0.175,0.425,0.125,equal,0.45,0.22500000000000003,COMPLETE
625,0.5763908998206309,0.15000000000000002,0.45000000000000007,0.5,0.175,0.45,0.1,equal,0.45,0.22500000000000003,COMPLETE
626,0.5763908998206309,0.15000000000000002,0.45000000000000007,0.5,0.175,0.45,0.1,equal,0.47500000000000003,0.22500000000000003,COMPLETE
627,0.38404727456896215,0.15000000000000002,0.45000000000000007,0.5,0.175,0.45,0.125,equal,0.47500000000000003,0.2,COMPLETE
628,0.4599202177796677,0.15000000000000002,0.45000000000000007,0.5,0.175,0.425,0.1,equal,0.47500000000000003,0.22500000000000003,COMPLETE
629,0.5763908998206309,0.15000000000000002,0.45000000000000007,0.5,0.175,0.45,0.1,equal,0.47500000000000003,0.22500000000000003,COMPLETE
630,0.4556156620186443,0.15000000000000002,0.47500000000000003,0.5,0.175,0.45,0.1,equal,0.47500000000000003,0.22500000000000003,COMPLETE
631,0.38404727456896215,0.15000000000000002,0.47500000000000003,0.5,0.175,0.45,0.125,equal,0.47500000000000003,0.2,COMPLETE
632,0.4599202177796677,0.15000000000000002,0.45000000000000007,0.5,0.175,0.425,0.1,equal,0.47500000000000003,0.22500000000000003,COMPLETE
633,0.5763908998206309,0.15000000000000002,0.45000000000000007,0.5,0.175,0.45,0.1,equal,0.47500000000000003,0.25,COMPLETE
634,0.4556156620186443,0.15000000000000002,0.47500000000000003,0.5,0.175,0.45,0.1,equal,0.47500000000000003,0.25,COMPLETE
635,0.5763908998206309,0.15000000000000002,0.45000000000000007,0.5,0.175,0.45,0.1,equal,0.47500000000000003,0.25,COMPLETE
636,0.3592075684936952,0.15000000000000002,0.47500000000000003,0.5,0.15000000000000002,0.425,0.125,equal,0.47500000000000003,0.25,COMPLETE
637,0.4599202177796677,0.15000000000000002,0.45000000000000007,0.5,0.175,0.425,0.1,equal,0.47500000000000003,0.25,COMPLETE
638,0.2224757557234217,0.15000000000000002,0.2,0.5,0.175,0.45,0.1,equal,0.47500000000000003,0.25,COMPLETE
639,0.4361466098619967,0.175,0.47500000000000003,0.5,0.175,0.45,0.125,equal,0.47500000000000003,0.25,COMPLETE
640,0.3592075684936952,0.15000000000000002,0.45000000000000007,0.5,0.15000000000000002,0.425,0.1,equal,0.47500000000000003,0.25,COMPLETE
641,0.4361466098619967,0.175,0.47500000000000003,0.5,0.175,0.45,0.125,equal,0.47500000000000003,0.22500000000000003,COMPLETE
642,0.5763908998206309,0.15000000000000002,0.45000000000000007,0.5,0.175,0.45,0.1,equal,0.47500000000000003,0.25,COMPLETE
643,0.43614660986199627,0.15000000000000002,0.45000000000000007,0.5,0.175,0.45,0.15000000000000002,equal,0.47500000000000003,0.25,COMPLETE
644,0.10770394046061252,0.15000000000000002,0.45000000000000007,0.5,0.05,0.45,0.45,equal,0.47500000000000003,0.22500000000000003,COMPLETE
645,0.19872238577093732,0.175,0.47500000000000003,0.5,0.175,0.45,0.1,equal,0.07500000000000001,0.25,COMPLETE
646,0.2714229752812657,0.15000000000000002,0.45000000000000007,0.525,0.175,0.45,0.1,equal,0.47500000000000003,0.2,COMPLETE
647,0.4830993261945362,0.175,0.45000000000000007,0.5,0.175,0.45,0.1,equal,0.47500000000000003,0.25,COMPLETE
648,0.4599202177796677,0.175,0.47500000000000003,0.5,0.15000000000000002,0.45,0.125,equal,0.47500000000000003,0.22500000000000003,COMPLETE
649,0.4599202177796677,0.15000000000000002,0.5,0.525,0.15000000000000002,0.45,0.1,equal,0.47500000000000003,0.22500000000000003,COMPLETE
650,0.4361466098619966,0.15000000000000002,0.45000000000000007,0.5,0.175,0.45,0.125,equal,0.47500000000000003,0.25,COMPLETE
651,0.4599202177796677,0.175,0.47500000000000003,0.5,0.175,0.45,0.1,equal,0.47500000000000003,0.22500000000000003,COMPLETE
652,0.1113766850424832,0.2,0.45000000000000007,0.5,0.175,0.45,0.1,equal,0.15000000000000002,0.2,COMPLETE
653,0.4709243217890622,0.15000000000000002,0.5,0.525,0.175,0.45,0.1,equal,0.47500000000000003,0.22500000000000003,COMPLETE
654,0.24694422970420304,0.2,0.45000000000000007,0.5,0.15000000000000002,0.425,0.1,equal,0.47500000000000003,0.25,COMPLETE
655,0.45992021777966785,0.15000000000000002,0.47500000000000003,0.525,0.175,0.45,0.125,equal,0.47500000000000003,0.22500000000000003,COMPLETE
656,0.4830993261945362,0.175,0.45000000000000007,0.5,0.175,0.45,0.1,equal,0.47500000000000003,0.25,COMPLETE
657,0.013274417660304356,0.8500000000000001,0.42500000000000004,0.1,0.15000000000000002,0.425,0.1,equal,0.47500000000000003,0.2,COMPLETE
658,0.5738548444231835,0.175,0.42500000000000004,0.47500000000000003,0.175,0.45,0.1,equal,0.47500000000000003,0.22500000000000003,COMPLETE
659,0.5738548444231841,0.175,0.42500000000000004,0.47500000000000003,0.175,0.45,0.125,equal,0.47500000000000003,0.22500000000000003,COMPLETE
660,-0.0477214797118055,0.6500000000000001,0.42500000000000004,0.175,0.175,0.45,0.125,equal,0.47500000000000003,0.22500000000000003,COMPLETE
661,0.5738548444231835,0.175,0.42500000000000004,0.47500000000000003,0.175,0.45,0.1,equal,0.47500000000000003,0.22500000000000003,COMPLETE
662,0.2541720668972588,0.2,0.42500000000000004,0.5,0.175,0.45,0.125,equal,0.47500000000000003,0.2,COMPLETE
663,0.3213605432355453,0.175,0.42500000000000004,0.5,0.15000000000000002,0.45,0.1,equal,0.47500000000000003,0.22500000000000003,COMPLETE
664,0.4449722261591228,0.2,0.45000000000000007,0.47500000000000003,0.175,0.45,0.125,equal,0.47500000000000003,0.22500000000000003,COMPLETE
665,0.3403135734422616,0.22500000000000003,0.42500000000000004,0.47500000000000003,0.175,0.45,0.1,equal,0.47500000000000003,0.22500000000000003,COMPLETE
666,0.35666420377202357,0.15000000000000002,0.42500000000000004,0.525,0.15000000000000002,0.45,0.1,equal,0.47500000000000003,0.25,COMPLETE
667,0.5503474518006689,0.175,0.42500000000000004,0.47500000000000003,0.175,0.47500000000000003,0.1,equal,0.47500000000000003,0.2,COMPLETE
668,0.4830993261945362,0.15000000000000002,0.42500000000000004,0.525,0.175,0.45,0.1,equal,0.47500000000000003,0.22500000000000003,COMPLETE
669,-0.315106608165415,0.15000000000000002,0.42500000000000004,0.5,0.175,0.425,0.15000000000000002,equal,0.47500000000000003,0.05,COMPLETE
670,0.2081836663304569,0.175,0.4,0.5,0.175,0.47500000000000003,0.175,equal,0.47500000000000003,0.25,COMPLETE
671,0.5738548444231846,0.15000000000000002,0.42500000000000004,0.47500000000000003,0.175,0.47500000000000003,0.1,equal,0.47500000000000003,0.22500000000000003,COMPLETE
672,0.1952993336083242,0.15000000000000002,0.4,0.6500000000000001,0.175,0.47500000000000003,0.125,equal,0.47500000000000003,0.22500000000000003,COMPLETE
673,0.31743121608713765,0.15000000000000002,0.42500000000000004,0.525,0.15000000000000002,0.47500000000000003,0.1,equal,0.47500000000000003,0.2,COMPLETE
674,0.42000983579433604,0.125,0.4,0.525,0.175,0.47500000000000003,0.1,equal,0.5,0.25,COMPLETE
675,0.5964835222873249,0.15000000000000002,0.4,0.47500000000000003,0.175,0.47500000000000003,0.125,equal,0.47500000000000003,0.25,COMPLETE
676,0.3729372311883861,0.125,0.4,0.5,0.175,0.47500000000000003,0.125,equal,0.5,0.25,COMPLETE
677,0.25083245062343035,0.15000000000000002,0.4,0.47500000000000003,0.175,0.47500000000000003,0.15000000000000002,equal,0.47500000000000003,0.25,COMPLETE
678,0.3426615052517905,0.15000000000000002,0.4,0.5,0.175,0.47500000000000003,0.15000000000000002,equal,0.47500000000000003,0.25,COMPLETE
679,0.36539676942202837,0.125,0.4,0.47500000000000003,0.175,0.47500000000000003,0.125,linear,0.47500000000000003,0.25,COMPLETE
680,0.19308909815965147,0.15000000000000002,0.42500000000000004,0.47500000000000003,0.15000000000000002,0.22500000000000003,0.125,equal,0.5,0.25,COMPLETE
681,0.49385546351277976,0.125,0.42500000000000004,0.525,0.175,0.47500000000000003,0.125,equal,0.47500000000000003,0.22500000000000003,COMPLETE
682,0.3426615052517905,0.15000000000000002,0.4,0.5,0.175,0.47500000000000003,0.15000000000000002,equal,0.47500000000000003,0.22500000000000003,COMPLETE
683,0.4914989408289015,0.125,0.42500000000000004,0.5,0.15000000000000002,0.47500000000000003,0.1,equal,0.5,0.25,COMPLETE
684,0.5964835222873249,0.15000000000000002,0.4,0.47500000000000003,0.175,0.47500000000000003,0.125,equal,0.47500000000000003,0.22500000000000003,COMPLETE
685,0.43465936274549033,0.2,0.42500000000000004,0.47500000000000003,0.175,0.47500000000000003,0.125,equal,0.47500000000000003,0.2,COMPLETE
686,0.38636108255618334,0.175,0.4,0.5,0.175,0.47500000000000003,0.125,equal,0.5,0.25,COMPLETE
687,0.4842392783507934,0.175,0.4,0.47500000000000003,0.175,0.47500000000000003,0.15000000000000002,equal,0.47500000000000003,0.22500000000000003,COMPLETE
688,0.5999431722654397,0.15000000000000002,0.42500000000000004,0.47500000000000003,0.175,0.47500000000000003,0.125,equal,0.47500000000000003,0.22500000000000003,COMPLETE
689,0.2088750215166817,0.15000000000000002,0.45000000000000007,0.525,0.175,0.47500000000000003,0.15000000000000002,equal,0.175,0.25,COMPLETE
690,0.241630649076915,0.15000000000000002,0.4,0.5,0.15000000000000002,0.05,0.125,equal,0.47500000000000003,0.22500000000000003,COMPLETE
691,0.5999431722654397,0.15000000000000002,0.42500000000000004,0.47500000000000003,0.175,0.47500000000000003,0.125,equal,0.47500000000000003,0.25,COMPLETE
692,0.3180598811136212,0.125,0.45000000000000007,0.525,0.175,0.47500000000000003,0.15000000000000002,equal,0.5,0.25,COMPLETE
693,0.3729372311883861,0.125,0.4,0.5,0.175,0.47500000000000003,0.125,equal,0.47500000000000003,0.25,COMPLETE
694,0.49385546351277976,0.125,0.42500000000000004,0.525,0.175,0.47500000000000003,0.125,equal,0.47500000000000003,0.25,COMPLETE
695,0.34472331380134424,0.15000000000000002,0.45000000000000007,0.47500000000000003,0.175,0.47500000000000003,0.15000000000000002,equal,0.5,0.25,COMPLETE
696,0.5964835222873249,0.15000000000000002,0.4,0.47500000000000003,0.175,0.47500000000000003,0.125,equal,0.47500000000000003,0.25,COMPLETE
697,0.09320862773398905,0.5,0.4,0.45,0.175,0.47500000000000003,0.15000000000000002,equal,0.47500000000000003,0.25,COMPLETE
698,0.3256257511907125,0.125,0.4,0.5,0.15000000000000002,0.47500000000000003,0.125,linear,0.5,0.25,COMPLETE
699,0.5964835222873249,0.15000000000000002,0.4,0.47500000000000003,0.175,0.47500000000000003,0.125,equal,0.47500000000000003,0.25,COMPLETE
700,0.1455164769999152,0.15000000000000002,0.37500000000000006,0.5,0.175,0.47500000000000003,0.15000000000000002,equal,0.47500000000000003,0.25,COMPLETE
701,0.3426615052517905,0.15000000000000002,0.4,0.5,0.175,0.47500000000000003,0.15000000000000002,equal,0.47500000000000003,0.25,COMPLETE
702,0.15113302198989553,0.125,0.37500000000000006,0.525,0.175,0.47500000000000003,0.175,equal,0.5,0.25,COMPLETE
703,0.49544404336059245,0.15000000000000002,0.4,0.47500000000000003,0.15000000000000002,0.47500000000000003,0.125,equal,0.47500000000000003,0.25,COMPLETE
704,0.34246045373846584,0.125,0.37500000000000006,0.47500000000000003,0.175,0.47500000000000003,0.125,equal,0.47500000000000003,0.25,COMPLETE
705,0.3729372311883861,0.125,0.4,0.5,0.175,0.47500000000000003,0.125,equal,0.47500000000000003,0.25,COMPLETE
706,0.5964835222873247,0.15000000000000002,0.4,0.5,0.175,0.47500000000000003,0.125,equal,0.5,0.25,COMPLETE
707,0.2648241800525918,0.15000000000000002,0.37500000000000006,0.47500000000000003,0.175,0.47500000000000003,0.15000000000000002,equal,0.5,0.25,COMPLETE
708,0.26679189570651535,0.125,0.4,0.525,0.15000000000000002,0.47500000000000003,0.125,equal,0.5,0.25,COMPLETE
709,0.34246045373846584,0.15000000000000002,0.37500000000000006,0.47500000000000003,0.175,0.47500000000000003,0.125,equal,0.5,0.25,COMPLETE
710,0.28753509263556315,0.125,0.4,0.525,0.175,0.47500000000000003,0.125,equal,0.5,0.25,COMPLETE
711,0.25717021725130323,0.15000000000000002,0.37500000000000006,0.5,0.15000000000000002,0.47500000000000003,0.125,equal,0.5,0.22500000000000003,COMPLETE
712,0.271080514787438,0.125,0.4,0.5,0.175,0.47500000000000003,0.15000000000000002,equal,0.5,0.25,COMPLETE
713,0.20818366633045718,0.15000000000000002,0.42500000000000004,0.47500000000000003,0.175,0.47500000000000003,0.15000000000000002,equal,0.5,0.22500000000000003,COMPLETE
714,0.4780302241684589,0.175,0.37500000000000006,0.47500000000000003,0.15000000000000002,0.47500000000000003,0.125,equal,0.47500000000000003,0.25,COMPLETE
715,0.17127694159180618,0.125,0.4,0.45,0.175,0.47500000000000003,0.125,equal,0.2,0.22500000000000003,COMPLETE
716,0.527936659908561,0.15000000000000002,0.42500000000000004,0.5,0.175,0.47500000000000003,0.125,equal,0.47500000000000003,0.2,COMPLETE
717,0.3774369832378611,0.125,0.4,0.47500000000000003,0.175,0.47500000000000003,0.125,equal,0.47500000000000003,0.25,COMPLETE
718,0.013673066328583089,0.15000000000000002,0.9500000000000001,0.47500000000000003,0.175,0.47500000000000003,0.15000000000000002,equal,0.5,0.22500000000000003,COMPLETE
719,0.3847070897461425,0.175,0.37500000000000006,0.5,0.15000000000000002,0.47500000000000003,0.125,equal,0.47500000000000003,0.25,COMPLETE
