number,value,params_fund_net_buying,params_institutional_weight,params_number_fund_holdings,params_pe,params_revenue_growth,params_roe,params_stock_weight_option,params_take_profit,params_trailing_stop_loss,state
4936,0.4053487311717485,0.2,0.4,0.47500000000000003,0.2,0.47500000000000003,0.05,equal,0.35000000000000003,0.4,COMPLETE
4937,0.34045999660598447,0.25,0.5,0.47500000000000003,0.175,0.5,0.05,equal,0.35000000000000003,0.4,COMPLETE
4938,0.48135057869143705,0.175,0.45000000000000007,0.5,0.2,0.47500000000000003,0.05,equal,0.4,0.4,COMPLETE
4939,0.01787476502011534,0.125,0.47500000000000003,0.55,0.05,0.5,0.425,linear,0.375,0.4,COMPLETE
4940,0.4934411703914466,0.22500000000000003,0.45000000000000007,0.45,0.22500000000000003,0.5,0.07500000000000001,equal,0.375,0.425,COMPLETE
4941,0.5941024261577028,0.2,0.47500000000000003,0.47500000000000003,0.15000000000000002,0.47500000000000003,0.05,equal,0.4,0.4,COMPLETE
4942,0.4469214305327784,0.175,0.42500000000000004,0.525,0.2,0.47500000000000003,0.05,equal,0.35000000000000003,0.4,COMPLETE
4943,0.4614226773947566,0.25,0.47500000000000003,0.47500000000000003,0.175,0.5,0.05,equal,0.35000000000000003,0.4,COMPLETE
4944,0.06631564428985967,0.2,0.42500000000000004,0.47500000000000003,0.125,0.125,0.07500000000000001,equal,0.375,0.425,COMPLETE
4945,0.2451911344529835,0.22500000000000003,0.5,0.47500000000000003,0.125,0.275,0.05,equal,0.375,0.4,COMPLETE
4946,0.5997514435684571,0.2,0.45000000000000007,0.47500000000000003,0.2,0.47500000000000003,0.05,equal,0.4,0.4,COMPLETE
4947,0.591339204862471,0.22500000000000003,0.42500000000000004,0.45,0.175,0.47500000000000003,0.07500000000000001,equal,0.375,0.4,COMPLETE
4948,0.3569697811348363,0.3,0.45000000000000007,0.45,0.175,0.5,0.05,equal,0.375,0.4,COMPLETE
4949,0.5220480628754841,0.2,0.525,0.5,0.175,0.47500000000000003,0.07500000000000001,equal,0.375,0.425,COMPLETE
4950,0.31428084562102615,0.22500000000000003,0.4,0.47500000000000003,0.22500000000000003,0.5,0.05,equal,0.35000000000000003,0.375,COMPLETE
4951,0.5997514435684571,0.175,0.47500000000000003,0.5,0.175,0.5,0.05,equal,0.4,0.4,COMPLETE
4952,0.33509650686447257,0.275,0.5,0.45,0.2,0.47500000000000003,0.05,equal,0.4,0.375,COMPLETE
4953,0.501970367471683,0.25,0.45000000000000007,0.45,0.22500000000000003,0.5,0.07500000000000001,equal,0.375,0.4,COMPLETE
4954,0.6310795334192679,0.22500000000000003,0.47500000000000003,0.45,0.2,0.47500000000000003,0.05,equal,0.375,0.425,COMPLETE
4955,0.6131078359831612,0.2,0.42500000000000004,0.47500000000000003,0.175,0.5,0.05,equal,0.35000000000000003,0.375,COMPLETE
4956,0.5827025892697926,0.15000000000000002,0.45000000000000007,0.5,0.22500000000000003,0.47500000000000003,0.07500000000000001,equal,0.35000000000000003,0.4,COMPLETE
4957,0.43577109558440186,0.22500000000000003,0.5,0.47500000000000003,0.175,0.5,0.05,equal,0.4,0.45,COMPLETE
4958,0.49396850482477395,0.175,0.42500000000000004,0.5,0.15000000000000002,0.47500000000000003,0.05,equal,0.375,0.375,COMPLETE
4959,0.5083477353823325,0.2,0.47500000000000003,0.47500000000000003,0.2,0.45,0.05,equal,0.375,0.4,COMPLETE
4960,0.5624760737684107,0.175,0.45000000000000007,0.47500000000000003,0.175,0.47500000000000003,0.07500000000000001,linear,0.35000000000000003,0.375,COMPLETE
4961,-0.013101399440500115,0.55,0.47500000000000003,0.07500000000000001,0.22500000000000003,0.5,0.05,equal,0.375,0.375,COMPLETE
4962,0.5965006572114382,0.25,0.42500000000000004,0.45,0.175,0.47500000000000003,0.07500000000000001,equal,0.4,0.4,COMPLETE
4963,0.24805061983365495,0.22500000000000003,0.525,0.45,0.22500000000000003,0.5,0.05,equal,0.35000000000000003,0.425,COMPLETE
4964,0.47090754718436856,0.2,0.37500000000000006,0.47500000000000003,0.15000000000000002,0.47500000000000003,0.05,equal,0.375,0.375,COMPLETE
4965,0.43577109558440197,0.22500000000000003,0.5,0.45,0.175,0.5,0.05,equal,0.4,0.4,COMPLETE
4966,0.10710612121382498,0.25,0.4,0.45,0.2,0.22500000000000003,0.05,equal,0.35000000000000003,0.375,COMPLETE
4967,0.049419832550176596,0.47500000000000003,0.45000000000000007,0.22500000000000003,0.2,0.45,0.07500000000000001,equal,0.375,0.375,COMPLETE
4968,0.5019703674716831,0.2,0.47500000000000003,0.47500000000000003,0.22500000000000003,0.5,0.05,equal,0.375,0.4,COMPLETE
4969,0.605661696379761,0.175,0.45000000000000007,0.5,0.15000000000000002,0.47500000000000003,0.05,equal,0.375,0.4,COMPLETE
4970,0.06212987413527194,0.6250000000000001,0.47500000000000003,0.3,0.125,0.5,0.35000000000000003,equal,0.35000000000000003,0.425,COMPLETE
4971,0.4955266915830957,0.15000000000000002,0.4,0.5,0.22500000000000003,0.47500000000000003,0.07500000000000001,equal,0.4,0.375,COMPLETE
4972,0.6262730764699653,0.2,0.42500000000000004,0.47500000000000003,0.175,0.5,0.05,equal,0.375,0.375,COMPLETE
4973,0.610744279636008,0.22500000000000003,0.45000000000000007,0.45,0.2,0.45,0.05,equal,0.35000000000000003,0.375,COMPLETE
4974,0.2660067602976019,0.22500000000000003,0.5,0.45,0.22500000000000003,0.5,0.07500000000000001,equal,0.4,0.4,COMPLETE
4975,0.6310795334192674,0.25,0.47500000000000003,0.45,0.2,0.47500000000000003,0.05,equal,0.375,0.4,COMPLETE
4976,0.5779780130622139,0.175,0.45000000000000007,0.5,0.15000000000000002,0.47500000000000003,0.05,equal,0.425,0.375,COMPLETE
4977,-0.18073888278491984,0.2,0.42500000000000004,0.47500000000000003,0.05,0.5,0.45,equal,0.375,0.4,COMPLETE
4978,0.2471436516959351,0.175,0.5,0.5,0.2,0.25,0.07500000000000001,equal,0.375,0.425,COMPLETE
4979,0.5582329997978936,0.2,0.45000000000000007,0.47500000000000003,0.15000000000000002,0.47500000000000003,0.05,equal,0.4,0.375,COMPLETE
4980,0.4702110117134355,0.25,0.47500000000000003,0.45,0.175,0.5,0.05,equal,0.35000000000000003,0.425,COMPLETE
4981,0.3732921525490337,0.275,0.42500000000000004,0.45,0.2,0.45,0.05,equal,0.35000000000000003,0.4,COMPLETE
4982,0.2944699902327158,0.15000000000000002,0.45000000000000007,0.525,0.175,0.5,0.175,linear,0.375,0.375,COMPLETE
4983,0.6452196301118838,0.22500000000000003,0.42500000000000004,0.45,0.2,0.47500000000000003,0.05,equal,0.375,0.375,COMPLETE
4984,0.27664742278310833,0.275,0.4,0.45,0.22500000000000003,0.45,0.15000000000000002,equal,0.375,0.375,COMPLETE
4985,0.47876410433626115,0.275,0.35000000000000003,0.45,0.2,0.45,0.07500000000000001,equal,0.375,0.375,COMPLETE
4986,0.46450906280351756,0.25,0.37500000000000006,0.47500000000000003,0.2,0.45,0.05,equal,0.375,0.375,COMPLETE
4987,0.4880244711974631,0.275,0.37500000000000006,0.45,0.2,0.45,0.05,equal,0.375,0.375,COMPLETE
4988,0.49090917283963775,0.25,0.35000000000000003,0.47500000000000003,0.2,0.45,0.05,equal,0.375,0.375,COMPLETE
4989,0.4318716190453568,0.3,0.35000000000000003,0.45,0.2,0.45,0.07500000000000001,equal,0.375,0.375,COMPLETE
4990,0.490682359424763,0.25,0.37500000000000006,0.45,0.2,0.45,0.05,equal,0.375,0.375,COMPLETE
4991,0.4661386777305077,0.25,0.4,0.47500000000000003,0.2,0.45,0.07500000000000001,equal,0.4,0.375,COMPLETE
4992,0.46450906280351756,0.25,0.37500000000000006,0.47500000000000003,0.2,0.45,0.05,equal,0.375,0.375,COMPLETE
4993,0.4973398109084568,0.25,0.4,0.47500000000000003,0.2,0.45,0.05,equal,0.375,0.375,COMPLETE
4994,0.4435506249317441,0.275,0.4,0.45,0.2,0.45,0.05,equal,0.4,0.375,COMPLETE
4995,0.4663441843694829,0.25,0.4,0.47500000000000003,0.2,0.47500000000000003,0.05,equal,0.375,0.375,COMPLETE
4996,0.4435535906749382,0.25,0.37500000000000006,0.47500000000000003,0.2,0.47500000000000003,0.05,equal,0.375,0.375,COMPLETE
4997,0.4983249192499295,0.25,0.4,0.47500000000000003,0.2,0.45,0.07500000000000001,equal,0.375,0.375,COMPLETE
4998,0.45509657084409283,0.275,0.4,0.45,0.2,0.47500000000000003,0.05,equal,0.4,0.375,COMPLETE
4999,0.4231822392551329,0.22500000000000003,0.4,0.47500000000000003,0.2,0.47500000000000003,0.07500000000000001,equal,0.35000000000000003,0.375,COMPLETE
