number,value,params_fund_net_buying,params_institutional_weight,params_number_fund_holdings,params_pe,params_revenue_growth,params_roe,params_stock_weight_option,params_take_profit,params_trailing_stop_loss,state
1992,0.40575483525548084,0.22500000000000003,0.5,0.4,0.275,0.425,0.07500000000000001,softmax,0.35000000000000003,0.275,COMPLETE
1993,0.3573227020745625,0.22500000000000003,0.42500000000000004,0.425,0.25,0.45,0.1,softmax,0.325,0.3,COMPLETE
1994,0.3942928016385402,0.275,0.4,0.45,0.25,0.45,0.07500000000000001,softmax,0.25,0.3,COMPLETE
1995,0.3581779276103495,0.22500000000000003,0.45000000000000007,0.425,0.275,0.425,0.07500000000000001,softmax,0.4,0.325,COMPLETE
1996,0.5138937181593662,0.25,0.45000000000000007,0.45,0.25,0.45,0.07500000000000001,softmax,0.325,0.275,COMPLETE
1997,0.36589055288157546,0.2,0.47500000000000003,0.375,0.25,0.45,0.1,softmax,0.275,0.3,COMPLETE
1998,0.44734872724363517,0.22500000000000003,0.37500000000000006,0.425,0.25,0.45,0.07500000000000001,softmax,0.3,0.275,COMPLETE
1999,0.3971563246708784,0.2,0.5,0.4,0.25,0.45,0.07500000000000001,softmax,0.5,0.3,COMPLETE
2000,0.3666001461025425,0.25,0.47500000000000003,0.45,0.275,0.425,0.07500000000000001,softmax,0.325,0.325,COMPLETE
2001,0.5013074780361509,0.2,0.42500000000000004,0.4,0.25,0.45,0.07500000000000001,softmax,0.275,0.275,COMPLETE
2002,0.3013635145401832,0.25,0.525,0.425,0.25,0.45,0.1,softmax,0.3,0.3,COMPLETE
2003,0.35787468621477053,0.2,0.45000000000000007,0.4,0.275,0.425,0.07500000000000001,softmax,0.375,0.275,COMPLETE
2004,0.08305187606693949,0.8,0.42500000000000004,0.15000000000000002,0.25,0.45,0.07500000000000001,softmax,0.275,0.3,COMPLETE
2005,0.5948552654002763,0.22500000000000003,0.4,0.425,0.25,0.45,0.07500000000000001,softmax,0.375,0.275,COMPLETE
2006,0.08812960355811071,0.22500000000000003,0.45000000000000007,0.425,0.25,0.25,0.3,softmax,0.325,0.325,COMPLETE
2007,0.39691153997480283,0.2,0.47500000000000003,0.4,0.25,0.45,0.07500000000000001,softmax,0.35000000000000003,0.35000000000000003,COMPLETE
2008,0.49226198842692276,0.22500000000000003,0.42500000000000004,0.425,0.25,0.45,0.07500000000000001,softmax,0.4,0.275,COMPLETE
2009,0.34218334690694857,0.25,0.45000000000000007,0.45,0.25,0.425,0.1,softmax,0.5,0.3,COMPLETE
2010,0.3639108548052567,0.175,0.4,0.375,0.275,0.45,0.07500000000000001,softmax,0.35000000000000003,0.275,COMPLETE
2011,0.37334394326406806,0.275,0.5,0.45,0.275,0.425,0.05,softmax,0.375,0.3,COMPLETE
2012,0.20573527243587436,0.375,0.47500000000000003,0.425,0.25,0.47500000000000003,0.05,linear,0.5,0.325,COMPLETE
2013,0.12603365365886832,0.22500000000000003,0.42500000000000004,0.45,0.325,0.47500000000000003,0.07500000000000001,softmax,0.5,0.3,COMPLETE
2014,-0.11875740084664249,0.2,0.45000000000000007,0.47500000000000003,0.07500000000000001,0.45,0.425,softmax,0.5,0.3,COMPLETE
2015,0.2418085998479767,0.2,0.5750000000000001,0.4,0.25,0.47500000000000003,0.05,softmax,0.3,0.25,COMPLETE
2016,0.3203833542915501,0.2,0.47500000000000003,0.47500000000000003,0.25,0.47500000000000003,0.1,linear,0.25,0.275,COMPLETE
2017,0.5100300048557904,0.22500000000000003,0.42500000000000004,0.45,0.275,0.45,0.05,softmax,0.5,0.325,COMPLETE
2018,0.44734872724363517,0.22500000000000003,0.37500000000000006,0.425,0.25,0.45,0.07500000000000001,softmax,0.35000000000000003,0.275,COMPLETE
2019,0.2080823445018694,0.25,0.5,0.45,0.3,0.325,0.05,softmax,0.275,0.3,COMPLETE
2020,0.3369884294873449,0.2,0.45000000000000007,0.4,0.25,0.5,0.05,linear,0.4,0.25,COMPLETE
2021,0.4678780579171416,0.175,0.4,0.375,0.25,0.47500000000000003,0.07500000000000001,softmax,0.5,0.275,COMPLETE
2022,0.5316497004832001,0.22500000000000003,0.47500000000000003,0.45,0.22500000000000003,0.45,0.07500000000000001,equal,0.3,0.3,COMPLETE
2023,-0.0030941756788125333,0.175,0.42500000000000004,0.375,0.275,0.07500000000000001,0.05,equal,0.22500000000000003,0.275,COMPLETE
2024,0.6054729525697832,0.25,0.45000000000000007,0.45,0.22500000000000003,0.47500000000000003,0.05,equal,0.47500000000000003,0.25,COMPLETE
2025,0.3021807281576988,0.2,0.45000000000000007,0.4,0.25,0.425,0.1,linear,0.47500000000000003,0.325,COMPLETE
2026,0.23996899557497428,0.22500000000000003,0.47500000000000003,0.425,0.25,0.5,0.07500000000000001,equal,0.5,0.3,COMPLETE
2027,0.3562046470609066,0.2,0.4,0.47500000000000003,0.22500000000000003,0.47500000000000003,0.05,equal,0.47500000000000003,0.275,COMPLETE
2028,0.4869264286134911,0.25,0.42500000000000004,0.45,0.275,0.45,0.05,softmax,0.325,0.25,COMPLETE
2029,0.2713798651056758,0.22500000000000003,0.5,0.425,0.25,0.47500000000000003,0.07500000000000001,equal,0.5,0.325,COMPLETE
2030,0.5621537701018904,0.2,0.45000000000000007,0.47500000000000003,0.275,0.45,0.05,equal,0.47500000000000003,0.3,COMPLETE
2031,0.40982396755878264,0.175,0.47500000000000003,0.375,0.275,0.425,0.07500000000000001,equal,0.5,0.275,COMPLETE
2032,0.089420344718688,0.3,0.2,0.45,0.22500000000000003,0.3,0.05,equal,0.47500000000000003,0.3,COMPLETE
2033,0.4153884575242992,0.25,0.42500000000000004,0.425,0.25,0.47500000000000003,0.07500000000000001,softmax,0.5,0.3,COMPLETE
2034,0.2333189294493866,0.275,0.45000000000000007,0.45,0.25,0.5,0.1,equal,0.325,0.275,COMPLETE
2035,0.05061799179250778,0.2,0.525,0.4,0.275,0.45,0.05,equal,0.47500000000000003,0.05,COMPLETE
2036,0.4684947100202378,0.22500000000000003,0.4,0.425,0.275,0.45,0.05,equal,0.5,0.25,COMPLETE
2037,0.34283487590443745,0.15000000000000002,0.45000000000000007,0.35000000000000003,0.25,0.47500000000000003,0.07500000000000001,equal,0.47500000000000003,0.325,COMPLETE
2038,0.61946283466519,0.22500000000000003,0.47500000000000003,0.425,0.22500000000000003,0.47500000000000003,0.05,linear,0.5,0.275,COMPLETE
2039,0.372544481107579,0.175,0.37500000000000006,0.5,0.22500000000000003,0.47500000000000003,0.05,softmax,0.47500000000000003,0.25,COMPLETE
2040,0.21389007844489005,0.2,0.42500000000000004,0.47500000000000003,0.35000000000000003,0.45,0.1,equal,0.5,0.3,COMPLETE
2041,0.2660067602976019,0.25,0.5,0.45,0.25,0.5,0.07500000000000001,equal,0.47500000000000003,0.5,COMPLETE
2042,-0.18240987575425557,0.175,0.47500000000000003,0.5,0.05,0.45,0.5,equal,0.4,0.275,COMPLETE
2043,0.4262276866870688,0.22500000000000003,0.42500000000000004,0.425,0.25,0.47500000000000003,0.07500000000000001,equal,0.5,0.3,COMPLETE
2044,0.5198583468295963,0.175,0.4,0.5,0.275,0.45,0.05,softmax,0.47500000000000003,0.325,COMPLETE
2045,-0.015459403365346042,0.2,0.45000000000000007,0.4,0.25,0.5,0.25,equal,0.47500000000000003,0.275,COMPLETE
2046,0.6054729525697832,0.25,0.45000000000000007,0.45,0.22500000000000003,0.47500000000000003,0.05,equal,0.5,0.275,COMPLETE
2047,0.46947091757555937,0.22500000000000003,0.37500000000000006,0.425,0.25,0.47500000000000003,0.07500000000000001,equal,0.47500000000000003,0.25,COMPLETE
2048,0.042091951519083015,0.2,0.975,0.47500000000000003,0.375,0.425,0.05,equal,0.5,0.3,COMPLETE
2049,0.3819958560088381,0.22500000000000003,0.47500000000000003,0.425,0.22500000000000003,0.45,0.07500000000000001,softmax,0.47500000000000003,0.275,COMPLETE
2050,0.3949660303860146,0.15000000000000002,0.525,0.35000000000000003,0.15000000000000002,0.47500000000000003,0.05,equal,0.35000000000000003,0.3,COMPLETE
2051,0.11233990056848897,0.275,0.42500000000000004,0.6000000000000001,0.2,0.4,0.07500000000000001,linear,0.5,0.25,COMPLETE
2052,0.16886653354328213,0.2,0.45000000000000007,0.4,0.2,0.175,0.1,equal,0.5,0.35000000000000003,COMPLETE
2053,0.1681660759798893,0.175,0.55,0.375,0.275,0.1,0.05,equal,0.47500000000000003,0.275,COMPLETE
2054,0.015723361293840808,0.6250000000000001,0.5,0.35,0.25,0.5,0.07500000000000001,equal,0.275,0.3,COMPLETE
2055,0.06739161945494263,0.22500000000000003,0.42500000000000004,0.425,0.22500000000000003,0.45,0.05,softmax,0.47500000000000003,0.07500000000000001,COMPLETE
2056,0.33078752244668075,0.25,0.47500000000000003,0.45,0.25,0.47500000000000003,0.07500000000000001,equal,0.5,0.3,COMPLETE
2057,0.3192510248102497,0.175,0.4,0.47500000000000003,0.25,0.5,0.05,equal,0.22500000000000003,0.375,COMPLETE
2058,0.32247017265598976,0.2,0.45000000000000007,0.4,0.22500000000000003,0.425,0.07500000000000001,equal,0.47500000000000003,0.325,COMPLETE
2059,0.0037849513247543154,0.22500000000000003,0.47500000000000003,0.45,0.25,0.47500000000000003,0.275,equal,0.5,0.275,COMPLETE
2060,0.08506535025518933,0.2,0.5,0.47500000000000003,0.4,0.45,0.05,softmax,0.47500000000000003,0.3,COMPLETE
2061,0.3782849007411186,0.25,0.42500000000000004,0.45,0.3,0.45,0.05,equal,0.5,0.275,COMPLETE
2062,0.3067594904384331,0.22500000000000003,0.45000000000000007,0.425,0.25,0.47500000000000003,0.1,equal,0.25,0.325,COMPLETE
2063,0.3012326080384818,0.2,0.4,0.4,0.25,0.5,0.07500000000000001,linear,0.47500000000000003,0.25,COMPLETE
2064,0.16849249065628225,0.275,0.47500000000000003,0.45,0.22500000000000003,0.275,0.05,equal,0.5,0.3,COMPLETE
2065,0.6246360197681785,0.22500000000000003,0.45000000000000007,0.425,0.22500000000000003,0.47500000000000003,0.05,equal,0.47500000000000003,0.25,COMPLETE
2066,0.481250495247723,0.2,0.42500000000000004,0.47500000000000003,0.22500000000000003,0.45,0.07500000000000001,softmax,0.5,0.275,COMPLETE
2067,0.26065663712082976,0.175,0.7000000000000001,0.375,0.22500000000000003,0.47500000000000003,0.05,equal,0.47500000000000003,0.3,COMPLETE
2068,0.4653066686961454,0.15000000000000002,0.47500000000000003,0.5,0.25,0.45,0.07500000000000001,equal,0.5,0.25,COMPLETE
2069,0.6054729525697832,0.22500000000000003,0.42500000000000004,0.425,0.22500000000000003,0.47500000000000003,0.05,equal,0.47500000000000003,0.275,COMPLETE
2070,0.27477357051761,0.45,0.45000000000000007,0.425,0.25,0.5,0.05,equal,0.5,0.325,COMPLETE
2071,0.3971563246708784,0.2,0.5,0.4,0.25,0.45,0.07500000000000001,softmax,0.47500000000000003,0.3,COMPLETE
2072,0.32565108631895157,0.25,0.42500000000000004,0.45,0.25,0.47500000000000003,0.1,equal,0.5,0.275,COMPLETE
2073,0.5927991613131749,0.22500000000000003,0.45000000000000007,0.45,0.22500000000000003,0.45,0.07500000000000001,equal,0.5,0.275,COMPLETE
2074,0.47798198103716916,0.175,0.4,0.47500000000000003,0.275,0.425,0.05,equal,0.47500000000000003,0.3,COMPLETE
2075,0.4374566919523639,0.25,0.47500000000000003,0.45,0.25,0.5,0.05,linear,0.5,0.35000000000000003,COMPLETE
2076,0.3493851684085263,0.2,0.45000000000000007,0.4,0.25,0.47500000000000003,0.07500000000000001,equal,0.47500000000000003,0.25,COMPLETE
2077,0.48207576967302523,0.175,0.37500000000000006,0.47500000000000003,0.22500000000000003,0.47500000000000003,0.05,softmax,0.375,0.25,COMPLETE
2078,0.5076403907873439,0.22500000000000003,0.42500000000000004,0.425,0.25,0.45,0.07500000000000001,equal,0.5,0.325,COMPLETE
2079,0.3876733242368896,0.2,0.5,0.4,0.22500000000000003,0.47500000000000003,0.05,equal,0.47500000000000003,0.275,COMPLETE
2080,0.2946089183905207,0.25,0.42500000000000004,0.45,0.25,0.5,0.05,equal,0.5,0.3,COMPLETE
2081,0.39065972465186416,0.22500000000000003,0.47500000000000003,0.425,0.2,0.375,0.07500000000000001,equal,0.47500000000000003,0.3,COMPLETE
2082,0.5502254744008226,0.2,0.45000000000000007,0.47500000000000003,0.15000000000000002,0.47500000000000003,0.05,softmax,0.47500000000000003,0.275,COMPLETE
2083,0.507361811140203,0.275,0.4,0.45,0.22500000000000003,0.45,0.07500000000000001,equal,0.3,0.3,COMPLETE
2084,0.5045682576022636,0.2,0.45000000000000007,0.4,0.275,0.425,0.05,equal,0.5,0.325,COMPLETE
2085,0.40982396755878303,0.25,0.47500000000000003,0.45,0.25,0.45,0.1,equal,0.5,0.275,COMPLETE
2086,0.23147221353201425,0.175,0.5,0.4,0.25,0.5,0.07500000000000001,equal,0.47500000000000003,0.25,COMPLETE
2087,0.5927036028123709,0.22500000000000003,0.42500000000000004,0.425,0.22500000000000003,0.47500000000000003,0.05,softmax,0.5,0.275,COMPLETE
2088,0.5197190178850898,0.175,0.45000000000000007,0.5,0.275,0.45,0.05,linear,0.47500000000000003,0.3,COMPLETE
2089,0.26988904778163125,0.22500000000000003,0.47500000000000003,0.425,0.25,0.47500000000000003,0.07500000000000001,equal,0.325,0.25,COMPLETE
2090,0.5236671143685783,0.22500000000000003,0.42500000000000004,0.425,0.2,0.45,0.05,equal,0.5,0.3,COMPLETE
2091,0.4488916413238875,0.25,0.4,0.45,0.275,0.425,0.07500000000000001,equal,0.47500000000000003,0.325,COMPLETE
2092,0.6021780566265794,0.2,0.47500000000000003,0.47500000000000003,0.22500000000000003,0.47500000000000003,0.05,equal,0.47500000000000003,0.275,COMPLETE
2093,0.2316305922079956,0.3,0.525,0.425,0.25,0.5,0.1,softmax,0.5,0.25,COMPLETE
2094,0.48464981269855983,0.275,0.45000000000000007,0.45,0.2,0.45,0.05,equal,0.45,0.3,COMPLETE
2095,0.25306827561487594,0.2,0.42500000000000004,0.47500000000000003,0.3,0.4,0.07500000000000001,equal,0.425,0.275,COMPLETE
2096,0.417603062281051,0.22500000000000003,0.47500000000000003,0.425,0.25,0.47500000000000003,0.05,equal,0.5,0.3,COMPLETE
2097,0.06319481429367135,0.2,0.4,0.4,0.25,0.47500000000000003,0.2,equal,0.47500000000000003,0.275,COMPLETE
2098,0.40120971816562045,0.15000000000000002,0.65,0.5,0.275,0.2,0.07500000000000001,softmax,0.5,0.325,COMPLETE
2099,0.455791644577927,0.2,0.45000000000000007,0.47500000000000003,0.22500000000000003,0.45,0.07500000000000001,equal,0.25,0.275,COMPLETE
2100,0.35214575644078805,0.25,0.5,0.45,0.25,0.5,0.05,equal,0.275,0.3,COMPLETE
2101,0.583497847245953,0.22500000000000003,0.42500000000000004,0.425,0.22500000000000003,0.47500000000000003,0.05,linear,0.4,0.25,COMPLETE
2102,0.3724313931539709,0.175,0.45000000000000007,0.375,0.25,0.45,0.1,equal,0.45,0.3,COMPLETE
2103,0.5213506906568275,0.175,0.45000000000000007,0.4,0.25,0.47500000000000003,0.07500000000000001,equal,0.5,0.275,COMPLETE
2104,0.2663277343691133,0.2,0.37500000000000006,0.47500000000000003,0.2,0.425,0.05,softmax,0.47500000000000003,0.325,COMPLETE
2105,0.45750136201285074,0.25,0.47500000000000003,0.45,0.25,0.5,0.05,equal,0.45,0.275,COMPLETE
2106,0.5812588376929125,0.22500000000000003,0.4,0.425,0.22500000000000003,0.45,0.07500000000000001,equal,0.47500000000000003,0.3,COMPLETE
2107,0.6054729525697832,0.22500000000000003,0.42500000000000004,0.425,0.22500000000000003,0.47500000000000003,0.05,equal,0.5,0.22500000000000003,COMPLETE
2108,0.33128247828755697,0.2,0.525,0.47500000000000003,0.25,0.5,0.05,equal,0.45,0.175,COMPLETE
2109,0.3664814961402269,0.175,0.5,0.375,0.22500000000000003,0.45,0.07500000000000001,softmax,0.47500000000000003,0.25,COMPLETE
2110,0.4340896000448778,0.25,0.45000000000000007,0.45,0.25,0.47500000000000003,0.07500000000000001,equal,0.5,0.3,COMPLETE
2111,0.27901978008870854,0.22500000000000003,0.55,0.45,0.22500000000000003,0.47500000000000003,0.05,equal,0.47500000000000003,0.35000000000000003,COMPLETE
2112,-0.1355855931824038,0.275,0.47500000000000003,0.45,0.25,0.45,0.1,equal,0.47500000000000003,0.125,COMPLETE
2113,0.4468944463665856,0.2,0.45000000000000007,0.4,0.2,0.425,0.07500000000000001,linear,0.3,0.25,COMPLETE
2114,0.2866052664684034,0.2,0.42500000000000004,0.47500000000000003,0.275,0.47500000000000003,0.05,equal,0.5,0.3,COMPLETE
2115,0.16990715791809152,0.15000000000000002,0.4,0.7500000000000001,0.25,0.5,0.05,softmax,0.5,0.325,COMPLETE
2116,0.18529250419436694,0.22500000000000003,0.47500000000000003,0.425,0.275,0.325,0.07500000000000001,equal,0.45,0.275,COMPLETE
2117,0.5015797626641589,0.2,0.42500000000000004,0.425,0.2,0.45,0.05,equal,0.47500000000000003,0.25,COMPLETE
2118,0.5483272012540686,0.175,0.45000000000000007,0.4,0.275,0.45,0.05,equal,0.5,0.275,COMPLETE
2119,0.060245529394032986,0.22500000000000003,0.5,0.45,0.25,0.47500000000000003,0.175,equal,0.47500000000000003,0.3,COMPLETE
2120,0.2588091384522558,0.25,0.4,0.45,0.25,0.47500000000000003,0.07500000000000001,softmax,0.47500000000000003,0.275,COMPLETE
2121,0.3364885177482658,0.22500000000000003,0.6250000000000001,0.425,0.2,0.45,0.05,equal,0.375,0.275,COMPLETE
2122,0.26523715407853915,0.175,0.45000000000000007,0.47500000000000003,0.275,0.35000000000000003,0.07500000000000001,equal,0.5,0.22500000000000003,COMPLETE
2123,0.37698700305478755,0.2,0.42500000000000004,0.4,0.25,0.5,0.05,equal,0.45,0.3,COMPLETE
2124,0.2928188300410425,0.25,0.47500000000000003,0.45,0.25,0.47500000000000003,0.1,equal,0.5,0.3,COMPLETE
2125,0.5254026584387246,0.2,0.47500000000000003,0.425,0.22500000000000003,0.47500000000000003,0.05,linear,0.35000000000000003,0.325,COMPLETE
2126,0.4973265899582382,0.15000000000000002,0.42500000000000004,0.5,0.275,0.425,0.07500000000000001,softmax,0.47500000000000003,0.275,COMPLETE
2127,0.5118723179709881,0.22500000000000003,0.45000000000000007,0.425,0.22500000000000003,0.45,0.07500000000000001,equal,0.47500000000000003,0.25,COMPLETE
2128,0.27137986510567524,0.175,0.5,0.375,0.25,0.5,0.05,equal,0.5,0.325,COMPLETE
2129,0.4295871278000796,0.25,0.37500000000000006,0.45,0.22500000000000003,0.45,0.07500000000000001,equal,0.425,0.35000000000000003,COMPLETE
2130,0.5105312565021094,0.22500000000000003,0.4,0.425,0.15000000000000002,0.47500000000000003,0.05,equal,0.47500000000000003,0.3,COMPLETE
2131,0.5231966380692723,0.2,0.42500000000000004,0.4,0.22500000000000003,0.47500000000000003,0.05,softmax,0.45,0.25,COMPLETE
2132,-0.09038009407005551,0.525,0.45000000000000007,0.275,0.2,0.45,0.05,equal,0.5,0.275,COMPLETE
2133,0.22567619173581654,0.22500000000000003,0.45000000000000007,0.45,0.25,0.5,0.1,equal,0.47500000000000003,0.3,COMPLETE
2134,0.19582788370792822,0.325,0.47500000000000003,0.425,0.2,0.425,0.07500000000000001,equal,0.5,0.275,COMPLETE
2135,0.5146797748870202,0.275,0.42500000000000004,0.45,0.22500000000000003,0.47500000000000003,0.05,equal,0.45,0.275,COMPLETE
2136,0.5182853939620602,0.2,0.5,0.47500000000000003,0.22500000000000003,0.45,0.07500000000000001,softmax,0.325,0.325,COMPLETE
2137,0.2898802151790518,0.22500000000000003,0.25,0.425,0.25,0.47500000000000003,0.07500000000000001,equal,0.47500000000000003,0.25,COMPLETE
2138,0.397732001449455,0.175,0.47500000000000003,0.4,0.275,0.45,0.05,linear,0.5,0.3,COMPLETE
2139,0.3151421904015151,0.22500000000000003,0.4,0.425,0.25,0.5,0.1,equal,0.5,0.22500000000000003,COMPLETE
2140,0.6054729525697832,0.25,0.45000000000000007,0.45,0.22500000000000003,0.47500000000000003,0.05,equal,0.47500000000000003,0.25,COMPLETE
2141,0.5279610128682569,0.175,0.47500000000000003,0.47500000000000003,0.275,0.45,0.05,equal,0.45,0.3,COMPLETE
2142,0.2419621570126914,0.4,0.42500000000000004,0.425,0.25,0.47500000000000003,0.07500000000000001,softmax,0.5,0.275,COMPLETE
2143,-0.0037972368327786714,0.2,0.07500000000000001,0.47500000000000003,0.22500000000000003,0.47500000000000003,0.05,equal,0.47500000000000003,0.3,COMPLETE
2144,0.21402370513641594,0.15000000000000002,0.525,0.375,0.25,0.5,0.07500000000000001,equal,0.47500000000000003,0.275,COMPLETE
2145,0.5015797626641589,0.2,0.45000000000000007,0.45,0.2,0.45,0.05,equal,0.5,0.325,COMPLETE
2146,0.37136553762544977,0.22500000000000003,0.42500000000000004,0.45,0.2,0.425,0.07500000000000001,equal,0.45,0.25,COMPLETE
2147,-0.09826818979098229,0.675,0.5,0.3,0.25,0.47500000000000003,0.05,softmax,0.4,0.3,COMPLETE
2148,0.29026712822580614,0.25,0.45000000000000007,0.45,0.25,0.47500000000000003,0.1,equal,0.5,0.275,COMPLETE
2149,0.5145429589423836,0.2,0.4,0.47500000000000003,0.275,0.45,0.05,equal,0.47500000000000003,0.275,COMPLETE
2150,0.23996899557497428,0.22500000000000003,0.47500000000000003,0.425,0.25,0.5,0.07500000000000001,equal,0.47500000000000003,0.3,COMPLETE
2151,0.48461280384900524,0.2,0.37500000000000006,0.4,0.2,0.425,0.07500000000000001,linear,0.5,0.3,COMPLETE
2152,0.47587885701917154,0.25,0.42500000000000004,0.45,0.275,0.45,0.05,equal,0.45,0.325,COMPLETE
2153,0.46077993745090373,0.175,0.45000000000000007,0.5,0.22500000000000003,0.45,0.07500000000000001,softmax,0.5,0.25,COMPLETE
2154,0.020323294796711938,0.15000000000000002,0.47500000000000003,0.375,0.1,0.47500000000000003,0.35000000000000003,equal,0.425,0.275,COMPLETE
2155,0.4340896000448783,0.22500000000000003,0.42500000000000004,0.425,0.25,0.5,0.05,equal,0.47500000000000003,0.3,COMPLETE
2156,0.6246360197681787,0.2,0.45000000000000007,0.47500000000000003,0.22500000000000003,0.47500000000000003,0.05,equal,0.5,0.25,COMPLETE
2157,0.2713798651056758,0.22500000000000003,0.5,0.425,0.25,0.47500000000000003,0.07500000000000001,equal,0.47500000000000003,0.325,COMPLETE
2158,0.46435438874915147,0.25,0.45000000000000007,0.45,0.275,0.45,0.05,softmax,0.45,0.275,COMPLETE
2159,0.2330196079543058,0.2,0.47500000000000003,0.4,0.25,0.47500000000000003,0.1,equal,0.47500000000000003,0.3,COMPLETE
2160,0.4459517314225108,0.275,0.4,0.45,0.2,0.45,0.05,equal,0.425,0.275,COMPLETE
2161,0.4982113749092352,0.175,0.42500000000000004,0.5,0.25,0.47500000000000003,0.07500000000000001,equal,0.5,0.3,COMPLETE
2162,0.3718099009228868,0.2,0.37500000000000006,0.4,0.25,0.5,0.05,linear,0.47500000000000003,0.25,COMPLETE
2163,0.019107464984590237,0.22500000000000003,0.42500000000000004,0.425,0.22500000000000003,0.125,0.07500000000000001,equal,0.5,0.35000000000000003,COMPLETE
2164,0.5350803620033155,0.175,0.45000000000000007,0.4,0.275,0.45,0.05,softmax,0.47500000000000003,0.275,COMPLETE
2165,0.4858776278351101,0.25,0.47500000000000003,0.45,0.22500000000000003,0.47500000000000003,0.05,equal,0.5,0.3,COMPLETE
2166,0.3923215206816297,0.22500000000000003,0.5,0.425,0.15000000000000002,0.45,0.07500000000000001,equal,0.45,0.25,COMPLETE
2167,0.3406407320044571,0.35000000000000003,0.4,0.425,0.22500000000000003,0.425,0.05,equal,0.5,0.325,COMPLETE
2168,0.3435345058328817,0.2,0.47500000000000003,0.47500000000000003,0.25,0.5,0.1,equal,0.47500000000000003,0.22500000000000003,COMPLETE
2169,0.42155087512096334,0.25,0.45000000000000007,0.45,0.25,0.47500000000000003,0.07500000000000001,softmax,0.45,0.275,COMPLETE
2170,0.034922356103655586,0.6000000000000001,0.42500000000000004,0.375,0.25,0.5,0.07500000000000001,equal,0.5,0.3,COMPLETE
2171,0.6431900236904107,0.22500000000000003,0.47500000000000003,0.425,0.22500000000000003,0.47500000000000003,0.05,equal,0.47500000000000003,0.325,COMPLETE
2172,0.41839647054414575,0.22500000000000003,0.525,0.4,0.22500000000000003,0.45,0.05,equal,0.45,0.35000000000000003,COMPLETE
2173,0.40982396755878314,0.2,0.5,0.4,0.22500000000000003,0.4,0.07500000000000001,equal,0.45,0.35000000000000003,COMPLETE
