number,value,params_fund_net_buying,params_institutional_weight,params_number_fund_holdings,params_pe,params_revenue_growth,params_roe,params_stock_weight_option,params_take_profit,params_trailing_stop_loss,state
2714,0.0615572037191391,0.25,0.45000000000000007,0.425,0.2,0.25,0.05,equal,0.47500000000000003,0.325,COMPLETE
2715,0.3413298045983341,0.175,0.42500000000000004,0.375,0.3,0.45,0.05,softmax,0.5,0.275,COMPLETE
2716,0.338312179231834,0.22500000000000003,0.47500000000000003,0.45,0.25,0.5,0.07500000000000001,equal,0.47500000000000003,0.25,COMPLETE
2717,0.5279610128682566,0.22500000000000003,0.5,0.45,0.22500000000000003,0.45,0.05,equal,0.47500000000000003,0.275,COMPLETE
2718,0.34823595379713296,0.2,0.45000000000000007,0.4,0.25,0.47500000000000003,0.07500000000000001,equal,0.375,0.3,COMPLETE
2719,0.5648664609825738,0.22500000000000003,0.4,0.425,0.22500000000000003,0.47500000000000003,0.05,equal,0.5,0.3,COMPLETE
2720,0.45201230414555177,0.15000000000000002,0.35000000000000003,0.5,0.275,0.425,0.05,softmax,0.47500000000000003,0.275,COMPLETE
2721,0.4878838659609678,0.175,0.37500000000000006,0.375,0.25,0.47500000000000003,0.07500000000000001,equal,0.5,0.325,COMPLETE
2722,0.09751796876741438,0.22500000000000003,0.42500000000000004,0.425,0.275,0.45,0.05,equal,0.275,0.1,COMPLETE
2723,0.3294116636756379,0.25,0.47500000000000003,0.45,0.25,0.47500000000000003,0.07500000000000001,equal,0.5,0.275,COMPLETE
2724,0.5838063644732047,0.175,0.45000000000000007,0.47500000000000003,0.22500000000000003,0.45,0.05,equal,0.47500000000000003,0.25,COMPLETE
2725,0.3518400698856481,0.3,0.47500000000000003,0.425,0.25,0.5,0.07500000000000001,equal,0.47500000000000003,0.22500000000000003,COMPLETE
2726,0.4061451084621981,0.2,0.5,0.4,0.22500000000000003,0.45,0.05,softmax,0.4,0.3,COMPLETE
2727,0.44239184235984785,0.275,0.42500000000000004,0.425,0.25,0.47500000000000003,0.07500000000000001,equal,0.325,0.25,COMPLETE
2728,0.4565280003211528,0.2,0.45000000000000007,0.47500000000000003,0.3,0.45,0.05,equal,0.5,0.3,COMPLETE
2729,0.3294116636756379,0.25,0.47500000000000003,0.45,0.25,0.47500000000000003,0.07500000000000001,equal,0.47500000000000003,0.275,COMPLETE
2730,0.38627937724427375,0.2,0.4,0.4,0.25,0.5,0.05,equal,0.5,0.35000000000000003,COMPLETE
2731,0.4122863435762381,0.175,0.525,0.47500000000000003,0.275,0.4,0.05,softmax,0.47500000000000003,0.3,COMPLETE
2732,0.5965893494737751,0.22500000000000003,0.45000000000000007,0.45,0.2,0.45,0.05,equal,0.47500000000000003,0.275,COMPLETE
2733,0.38015215658333035,0.25,0.42500000000000004,0.425,0.22500000000000003,0.425,0.07500000000000001,equal,0.5,0.325,COMPLETE
2734,0.07232614586709452,0.8750000000000001,0.47500000000000003,0.05,0.22500000000000003,0.47500000000000003,0.05,equal,0.47500000000000003,0.3,COMPLETE
2735,0.277555368223483,0.22500000000000003,0.5,0.45,0.25,0.47500000000000003,0.07500000000000001,equal,0.5,0.275,COMPLETE
2736,0.4089361937450785,0.15000000000000002,0.45000000000000007,0.5,0.25,0.5,0.05,softmax,0.47500000000000003,0.25,COMPLETE
2737,0.34283487590443745,0.2,0.42500000000000004,0.4,0.25,0.45,0.1,equal,0.47500000000000003,0.3,COMPLETE
2738,0.2775553682234829,0.22500000000000003,0.5,0.425,0.22500000000000003,0.47500000000000003,0.05,equal,0.5,0.22500000000000003,COMPLETE
2739,0.5675568155473311,0.175,0.42500000000000004,0.47500000000000003,0.22500000000000003,0.45,0.07500000000000001,equal,0.5,0.325,COMPLETE
2740,0.23147221353201425,0.2,0.47500000000000003,0.4,0.25,0.47500000000000003,0.07500000000000001,equal,0.47500000000000003,0.25,COMPLETE
2741,0.42776866814390613,0.25,0.37500000000000006,0.425,0.275,0.45,0.05,softmax,0.5,0.22500000000000003,COMPLETE
2742,0.275696899623532,0.275,0.4,0.425,0.25,0.5,0.05,equal,0.47500000000000003,0.275,COMPLETE
2743,0.32946291294773944,0.2,0.45000000000000007,0.45,0.22500000000000003,0.425,0.1,equal,0.47500000000000003,0.275,COMPLETE
2744,0.3758144889502546,0.22500000000000003,0.47500000000000003,0.45,0.25,0.47500000000000003,0.07500000000000001,equal,0.5,0.3,COMPLETE
2745,0.5353989139898288,0.2,0.45000000000000007,0.4,0.22500000000000003,0.47500000000000003,0.05,equal,0.47500000000000003,0.3,COMPLETE
2746,0.4225152505548522,0.22500000000000003,0.42500000000000004,0.425,0.25,0.5,0.05,softmax,0.5,0.35000000000000003,COMPLETE
2747,0.46530666869614534,0.175,0.47500000000000003,0.47500000000000003,0.22500000000000003,0.45,0.07500000000000001,equal,0.47500000000000003,0.325,COMPLETE
2748,0.4328476490063634,0.25,0.45000000000000007,0.45,0.25,0.47500000000000003,0.07500000000000001,equal,0.5,0.275,COMPLETE
2749,0.3768374383395167,0.22500000000000003,0.5,0.425,0.15000000000000002,0.45,0.05,equal,0.275,0.3,COMPLETE
2750,0.20995589188364872,0.25,0.45000000000000007,0.425,0.25,0.5,0.1,equal,0.35000000000000003,0.25,COMPLETE
2751,0.48135215746291576,0.22500000000000003,0.42500000000000004,0.45,0.2,0.45,0.05,equal,0.47500000000000003,0.275,COMPLETE
2752,0.26455891490319994,0.2,0.525,0.47500000000000003,0.25,0.47500000000000003,0.07500000000000001,softmax,0.5,0.25,COMPLETE
2753,0.4121666747663413,0.175,0.47500000000000003,0.375,0.2,0.4,0.05,equal,0.47500000000000003,0.3,COMPLETE
2754,0.36255181819795357,0.2,0.4,0.4,0.275,0.425,0.05,equal,0.3,0.25,COMPLETE
2755,0.45858672746388385,0.275,0.45000000000000007,0.425,0.275,0.45,0.05,equal,0.425,0.325,COMPLETE
2756,0.4498599752215728,0.22500000000000003,0.42500000000000004,0.45,0.25,0.47500000000000003,0.07500000000000001,equal,0.375,0.275,COMPLETE
2757,0.4515467258391141,0.2,0.4,0.4,0.25,0.47500000000000003,0.07500000000000001,softmax,0.5,0.3,COMPLETE
2758,0.2540713970744251,0.25,0.5,0.425,0.25,0.5,0.1,equal,0.47500000000000003,0.275,COMPLETE
2759,0.6246360197681791,0.22500000000000003,0.47500000000000003,0.45,0.22500000000000003,0.47500000000000003,0.05,equal,0.47500000000000003,0.35000000000000003,COMPLETE
2760,0.24131255993395517,0.2,0.45000000000000007,0.45,0.5,0.45,0.05,equal,0.5,0.3,COMPLETE
2761,0.3523713506370821,0.175,0.42500000000000004,0.47500000000000003,0.175,0.425,0.07500000000000001,equal,0.47500000000000003,0.25,COMPLETE
2762,0.5581714399373455,0.22500000000000003,0.47500000000000003,0.425,0.22500000000000003,0.45,0.05,softmax,0.5,0.325,COMPLETE
2763,0.4328476490063634,0.25,0.45000000000000007,0.45,0.25,0.47500000000000003,0.07500000000000001,equal,0.47500000000000003,0.275,COMPLETE
2764,0.38221802940478006,0.175,0.5,0.5,0.25,0.5,0.05,equal,0.5,0.3,COMPLETE
2765,0.04717592765729664,0.15000000000000002,0.42500000000000004,0.375,0.175,0.15000000000000002,0.05,equal,0.325,0.2,COMPLETE
2766,0.4575086123375976,0.2,0.4,0.4,0.22500000000000003,0.45,0.07500000000000001,equal,0.25,0.22500000000000003,COMPLETE
2767,0.3771690410976627,0.22500000000000003,0.47500000000000003,0.425,0.275,0.45,0.05,softmax,0.47500000000000003,0.275,COMPLETE
2768,0.5353989139898288,0.2,0.45000000000000007,0.4,0.22500000000000003,0.47500000000000003,0.05,equal,0.5,0.325,COMPLETE
2769,0.4340896000448781,0.25,0.45000000000000007,0.425,0.25,0.47500000000000003,0.07500000000000001,equal,0.425,0.3,COMPLETE
2770,-0.12012350043683495,0.22500000000000003,0.5,0.425,0.25,0.5,0.05,equal,0.47500000000000003,0.07500000000000001,COMPLETE
2771,0.48816348914485647,0.2,0.42500000000000004,0.47500000000000003,0.22500000000000003,0.45,0.07500000000000001,equal,0.5,0.25,COMPLETE
2772,0.0668224482645031,0.275,0.37500000000000006,0.425,0.275,0.275,0.1,softmax,0.47500000000000003,0.175,COMPLETE
2773,0.5005309948142406,0.175,0.525,0.47500000000000003,0.22500000000000003,0.47500000000000003,0.05,equal,0.47500000000000003,0.275,COMPLETE
2774,-0.10590674085559568,0.35000000000000003,0.47500000000000003,0.5750000000000001,0.125,0.425,0.35000000000000003,equal,0.5,0.22500000000000003,COMPLETE
2775,0.44185439477077654,0.22500000000000003,0.45000000000000007,0.45,0.25,0.47500000000000003,0.07500000000000001,equal,0.45,0.275,COMPLETE
2776,0.5046121885151558,0.25,0.45000000000000007,0.45,0.2,0.45,0.05,equal,0.45,0.3,COMPLETE
2777,0.26645563899722674,0.22500000000000003,0.35000000000000003,0.425,0.25,0.5,0.07500000000000001,softmax,0.5,0.375,COMPLETE
2778,0.5188784338694653,0.2,0.42500000000000004,0.4,0.2,0.425,0.05,equal,0.47500000000000003,0.25,COMPLETE
2779,0.29758391090076963,0.15000000000000002,0.47500000000000003,0.375,0.22500000000000003,0.47500000000000003,0.05,equal,0.35000000000000003,0.275,COMPLETE
2780,0.49987014765620225,0.2,0.4,0.4,0.22500000000000003,0.45,0.07500000000000001,equal,0.5,0.325,COMPLETE
2781,0.5511589083626213,0.22500000000000003,0.5,0.45,0.275,0.45,0.05,equal,0.375,0.3,COMPLETE
2782,0.6054729525697827,0.25,0.45000000000000007,0.425,0.22500000000000003,0.47500000000000003,0.05,equal,0.47500000000000003,0.25,COMPLETE
2783,0.3401357807628005,0.2,0.42500000000000004,0.4,0.25,0.47500000000000003,0.07500000000000001,softmax,0.45,0.3,COMPLETE
2784,0.277555368223483,0.175,0.55,0.47500000000000003,0.25,0.5,0.05,equal,0.4,0.275,COMPLETE
2785,0.2494877075730962,0.25,0.47500000000000003,0.675,0.275,0.325,0.07500000000000001,equal,0.47500000000000003,0.3,COMPLETE
2786,0.2723904422859233,0.425,0.4,0.3,0.2,0.45,0.05,equal,0.5,0.275,COMPLETE
2787,0.12764876309755985,0.22500000000000003,0.2,0.45,0.25,0.47500000000000003,0.07500000000000001,equal,0.47500000000000003,0.35000000000000003,COMPLETE
2788,0.6036814141043536,0.2,0.47500000000000003,0.45,0.22500000000000003,0.47500000000000003,0.05,softmax,0.3,0.25,COMPLETE
2789,0.3569088680825225,0.275,0.42500000000000004,0.425,0.25,0.45,0.1,equal,0.45,0.325,COMPLETE
2790,0.39809080479658093,0.175,0.45000000000000007,0.5,0.25,0.5,0.05,equal,0.5,0.275,COMPLETE
2791,0.2260247602771848,0.22500000000000003,0.42500000000000004,0.45,0.15000000000000002,0.425,0.05,equal,0.5,0.3,COMPLETE
2792,0.39486054790956016,0.25,0.47500000000000003,0.425,0.22500000000000003,0.45,0.07500000000000001,equal,0.47500000000000003,0.25,COMPLETE
2793,0.09301884272384461,0.2,0.5,0.4,0.275,0.1,0.07500000000000001,softmax,0.47500000000000003,0.3,COMPLETE
2794,0.6246360197681787,0.175,0.45000000000000007,0.47500000000000003,0.22500000000000003,0.47500000000000003,0.05,equal,0.45,0.4,COMPLETE
2795,0.3251520791595951,0.22500000000000003,0.42500000000000004,0.45,0.25,0.5,0.1,equal,0.425,0.275,COMPLETE
2796,0.6431900236904107,0.22500000000000003,0.47500000000000003,0.425,0.22500000000000003,0.47500000000000003,0.05,equal,0.5,0.325,COMPLETE
2797,0.25201893599129843,0.22500000000000003,0.525,0.6000000000000001,0.22500000000000003,0.5,0.05,equal,0.325,0.325,COMPLETE
2798,0.2351855886973054,0.2,0.525,0.4,0.22500000000000003,0.5,0.05,softmax,0.47500000000000003,0.35000000000000003,COMPLETE
2799,0.26600676029760195,0.25,0.525,0.425,0.22500000000000003,0.5,0.05,equal,0.47500000000000003,0.325,COMPLETE
2800,0.5200012342861265,0.2,0.5,0.45,0.22500000000000003,0.47500000000000003,0.05,equal,0.5,0.35000000000000003,COMPLETE
2801,0.38767332423688905,0.175,0.5,0.375,0.22500000000000003,0.47500000000000003,0.05,equal,0.47500000000000003,0.325,COMPLETE
2802,0.11613622278353028,0.8500000000000001,0.5,0.07500000000000001,0.22500000000000003,0.5,0.05,equal,0.45,0.325,COMPLETE
2803,0.21217510154537744,0.22500000000000003,0.5,0.425,0.2,0.2,0.05,equal,0.5,0.35000000000000003,COMPLETE
2804,0.2673349040698488,0.25,0.525,0.425,0.22500000000000003,0.47500000000000003,0.05,softmax,0.47500000000000003,0.35000000000000003,COMPLETE
2805,0.3557119441207935,0.3,0.5,0.425,0.22500000000000003,0.5,0.05,equal,0.5,0.35000000000000003,COMPLETE
2806,0.24805061983365495,0.2,0.525,0.45,0.22500000000000003,0.47500000000000003,0.05,equal,0.47500000000000003,0.325,COMPLETE
2807,0.6021780566265794,0.175,0.47500000000000003,0.47500000000000003,0.22500000000000003,0.47500000000000003,0.05,equal,0.45,0.325,COMPLETE
2808,0.4587160048116591,0.275,0.47500000000000003,0.425,0.22500000000000003,0.5,0.05,equal,0.47500000000000003,0.325,COMPLETE
2809,0.3614820869805982,0.22500000000000003,0.5,0.45,0.1,0.47500000000000003,0.05,softmax,0.5,0.325,COMPLETE
2810,-0.17330587070656292,0.15000000000000002,0.47500000000000003,0.35000000000000003,0.125,0.47500000000000003,0.375,equal,0.425,0.325,COMPLETE
2811,0.5307954049525634,0.2,0.47500000000000003,0.4,0.22500000000000003,0.47500000000000003,0.05,equal,0.5,0.325,COMPLETE
2812,0.22157326229358193,0.22500000000000003,0.5,0.45,0.22500000000000003,0.5,0.05,equal,0.1,0.35000000000000003,COMPLETE
2813,0.13812063083303852,0.45,0.47500000000000003,0.275,0.2,0.47500000000000003,0.05,equal,0.45,0.325,COMPLETE
2814,0.26700591581959293,0.22500000000000003,0.55,0.425,0.22500000000000003,0.47500000000000003,0.05,softmax,0.47500000000000003,0.35000000000000003,COMPLETE
2815,-0.024499468508519598,0.6250000000000001,0.47500000000000003,0.22500000000000003,0.2,0.47500000000000003,0.05,equal,0.5,0.325,COMPLETE
2816,0.37202469510180686,0.25,0.5,0.45,0.22500000000000003,0.5,0.05,equal,0.47500000000000003,0.325,COMPLETE
2817,0.5005309948142406,0.175,0.525,0.47500000000000003,0.22500000000000003,0.47500000000000003,0.05,equal,0.5,0.325,COMPLETE
2818,0.2274327699387169,0.2,0.47500000000000003,0.4,0.22500000000000003,0.22500000000000003,0.05,equal,0.45,0.35000000000000003,COMPLETE
2819,0.3753203927159727,0.2,0.47500000000000003,0.4,0.2,0.375,0.05,softmax,0.47500000000000003,0.325,COMPLETE
2820,-0.1008155828479054,0.22500000000000003,0.5,0.425,0.05,0.5,0.45,equal,0.5,0.325,COMPLETE
2821,0.5251931191195675,0.25,0.45000000000000007,0.425,0.175,0.47500000000000003,0.05,equal,0.47500000000000003,0.325,COMPLETE
2822,0.5005309948142407,0.175,0.5,0.5,0.22500000000000003,0.47500000000000003,0.05,equal,0.5,0.325,COMPLETE
2823,0.1306683451637033,0.22500000000000003,0.45000000000000007,0.45,0.35000000000000003,0.5,0.05,equal,0.47500000000000003,0.325,COMPLETE
2824,0.42921716052663605,0.275,0.47500000000000003,0.425,0.22500000000000003,0.47500000000000003,0.05,softmax,0.45,0.325,COMPLETE
2825,0.6021780566265794,0.2,0.47500000000000003,0.47500000000000003,0.22500000000000003,0.47500000000000003,0.05,equal,0.47500000000000003,0.35000000000000003,COMPLETE
2826,0.1879921354994329,0.2,0.45000000000000007,0.4,0.175,0.5,0.175,equal,0.5,0.325,COMPLETE
2827,0.4070483447355311,0.15000000000000002,0.37500000000000006,0.525,0.22500000000000003,0.47500000000000003,0.05,equal,0.47500000000000003,0.35000000000000003,COMPLETE
2828,0.4858776278351101,0.25,0.47500000000000003,0.45,0.22500000000000003,0.47500000000000003,0.05,equal,0.5,0.325,COMPLETE
2829,0.6111211701632566,0.22500000000000003,0.45000000000000007,0.45,0.22500000000000003,0.47500000000000003,0.05,softmax,0.45,0.3,COMPLETE
2830,0.47594553862564104,0.22500000000000003,0.47500000000000003,0.45,0.22500000000000003,0.5,0.05,equal,0.47500000000000003,0.3,COMPLETE
2831,0.5813863673023744,0.175,0.45000000000000007,0.47500000000000003,0.2,0.47500000000000003,0.05,equal,0.4,0.325,COMPLETE
2832,0.4153658382516887,0.2,0.5,0.4,0.2,0.47500000000000003,0.05,equal,0.425,0.3,COMPLETE
2833,0.4587160048116586,0.25,0.45000000000000007,0.425,0.22500000000000003,0.5,0.05,equal,0.5,0.3,COMPLETE
2834,0.27901978008870854,0.25,0.525,0.425,0.22500000000000003,0.47500000000000003,0.05,equal,0.47500000000000003,0.325,COMPLETE
2835,0.5927036028123709,0.22500000000000003,0.42500000000000004,0.425,0.22500000000000003,0.47500000000000003,0.05,softmax,0.47500000000000003,0.275,COMPLETE
2836,0.3963488033196543,0.2,0.4,0.4,0.25,0.5,0.05,equal,0.325,0.35000000000000003,COMPLETE
2837,0.6021780566265795,0.175,0.47500000000000003,0.5,0.2,0.47500000000000003,0.05,equal,0.5,0.3,COMPLETE
2838,0.6246360197681787,0.22500000000000003,0.45000000000000007,0.45,0.22500000000000003,0.47500000000000003,0.05,equal,0.45,0.325,COMPLETE
2839,0.39935451488144474,0.2,0.5,0.47500000000000003,0.25,0.5,0.05,equal,0.5,0.275,COMPLETE
2840,0.5825103880791113,0.275,0.42500000000000004,0.425,0.22500000000000003,0.47500000000000003,0.05,softmax,0.47500000000000003,0.3,COMPLETE
2841,0.5353989139898288,0.2,0.45000000000000007,0.4,0.22500000000000003,0.47500000000000003,0.05,equal,0.45,0.275,COMPLETE
2842,0.4986911476052483,0.25,0.47500000000000003,0.45,0.22500000000000003,0.47500000000000003,0.05,equal,0.35000000000000003,0.3,COMPLETE
2843,0.2802284819721419,0.22500000000000003,0.65,0.425,0.25,0.5,0.05,equal,0.5,0.35000000000000003,COMPLETE
2844,0.4321456321756257,0.15000000000000002,0.4,0.35000000000000003,0.2,0.47500000000000003,0.05,equal,0.47500000000000003,0.275,COMPLETE
2845,0.38681632751820194,0.22500000000000003,0.5,0.45,0.25,0.5,0.05,softmax,0.45,0.325,COMPLETE
2846,0.23301960795430562,0.175,0.47500000000000003,0.375,0.25,0.47500000000000003,0.07500000000000001,equal,0.5,0.3,COMPLETE
2847,0.5054849364970323,0.2,0.42500000000000004,0.4,0.175,0.47500000000000003,0.05,equal,0.47500000000000003,0.275,COMPLETE
2848,0.047872228265071086,0.22500000000000003,0.45000000000000007,0.425,0.1,0.47500000000000003,0.3,equal,0.275,0.3,COMPLETE
2849,0.277555368223483,0.2,0.525,0.45,0.25,0.47500000000000003,0.07500000000000001,equal,0.5,0.275,COMPLETE
2850,0.2289104956646252,0.25,0.47500000000000003,0.425,0.25,0.35000000000000003,0.2,softmax,0.47500000000000003,0.3,COMPLETE
2851,0.3970026978503066,0.2,0.42500000000000004,0.47500000000000003,0.22500000000000003,0.5,0.05,equal,0.4,0.325,COMPLETE
2852,0.30399345972258796,0.4,0.45000000000000007,0.425,0.25,0.5,0.05,equal,0.375,0.275,COMPLETE
2853,-0.06180604151974824,0.22500000000000003,0.4,0.45,0.25,0.47500000000000003,0.25,equal,0.45,0.3,COMPLETE
2854,0.35571194412079343,0.275,0.47500000000000003,0.425,0.22500000000000003,0.47500000000000003,0.07500000000000001,equal,0.5,0.3,COMPLETE
2855,0.3749469621557042,0.175,0.5,0.375,0.22500000000000003,0.47500000000000003,0.05,softmax,0.47500000000000003,0.3,COMPLETE
2856,0.27797622039489334,0.15000000000000002,0.42500000000000004,0.375,0.25,0.5,0.07500000000000001,equal,0.25,0.275,COMPLETE
2857,0.49228915390870925,0.25,0.45000000000000007,0.45,0.15000000000000002,0.47500000000000003,0.05,equal,0.47500000000000003,0.325,COMPLETE
2858,0.41536583825168816,0.2,0.5,0.4,0.2,0.45,0.07500000000000001,equal,0.5,0.375,COMPLETE
2859,0.1079775598729043,0.22500000000000003,0.42500000000000004,0.425,0.2,0.25,0.05,equal,0.3,0.275,COMPLETE
2860,0.3645228242185726,0.175,0.47500000000000003,0.5,0.25,0.5,0.07500000000000001,equal,0.47500000000000003,0.3,COMPLETE
2861,0.42361220566761687,0.22500000000000003,0.37500000000000006,0.45,0.22500000000000003,0.47500000000000003,0.05,softmax,0.5,0.325,COMPLETE
2862,0.4840573096194215,0.2,0.45000000000000007,0.47500000000000003,0.2,0.45,0.05,equal,0.47500000000000003,0.3,COMPLETE
2863,0.1147986652332018,0.55,0.4,0.4,0.25,0.47500000000000003,0.07500000000000001,equal,0.45,0.275,COMPLETE
2864,0.5210527709871444,0.25,0.45000000000000007,0.425,0.2,0.45,0.05,equal,0.5,0.275,COMPLETE
2865,0.19769535177659026,0.2,0.225,0.4,0.22500000000000003,0.47500000000000003,0.05,equal,0.45,0.325,COMPLETE
2866,0.3247940790535373,0.22500000000000003,0.47500000000000003,0.45,0.25,0.5,0.07500000000000001,softmax,0.47500000000000003,0.275,COMPLETE
2867,0.2535902283545856,0.5,0.42500000000000004,0.425,0.22500000000000003,0.47500000000000003,0.05,equal,0.5,0.3,COMPLETE
2868,0.5342181630118251,0.25,0.45000000000000007,0.45,0.22500000000000003,0.45,0.07500000000000001,equal,0.47500000000000003,0.3,COMPLETE
2869,0.06575337009679569,0.675,0.5,0.125,0.22500000000000003,0.47500000000000003,0.05,equal,0.5,0.275,COMPLETE
2870,0.5779780130622139,0.175,0.45000000000000007,0.47500000000000003,0.2,0.45,0.05,equal,0.47500000000000003,0.325,COMPLETE
2871,0.19420274365016865,0.3,0.4,0.425,0.45,0.125,0.07500000000000001,softmax,0.45,0.35000000000000003,COMPLETE
2872,0.21018206098773556,0.275,0.55,0.425,0.25,0.5,0.07500000000000001,equal,0.47500000000000003,0.275,COMPLETE
2873,0.6246360197681791,0.22500000000000003,0.47500000000000003,0.45,0.22500000000000003,0.47500000000000003,0.05,equal,0.425,0.3,COMPLETE
2874,0.2656720407680736,0.2,0.525,0.47500000000000003,0.2,0.3,0.05,equal,0.5,0.275,COMPLETE
2875,0.48135215746291576,0.22500000000000003,0.42500000000000004,0.45,0.2,0.45,0.05,equal,0.47500000000000003,0.325,COMPLETE
2876,0.4470863637691785,0.25,0.45000000000000007,0.425,0.25,0.47500000000000003,0.07500000000000001,softmax,0.375,0.3,COMPLETE
2877,0.5005309948142408,0.175,0.5,0.47500000000000003,0.2,0.45,0.05,equal,0.5,0.25,COMPLETE
2878,0.27137986510567547,0.2,0.47500000000000003,0.4,0.25,0.5,0.05,equal,0.45,0.375,COMPLETE
2879,0.1855311330604217,0.325,0.37500000000000006,0.425,0.25,0.47500000000000003,0.07500000000000001,equal,0.47500000000000003,0.3,COMPLETE
2880,0.48135215746291576,0.22500000000000003,0.42500000000000004,0.45,0.2,0.45,0.05,equal,0.425,0.25,COMPLETE
2881,0.3387817222823557,0.2,0.45000000000000007,0.4,0.25,0.47500000000000003,0.07500000000000001,softmax,0.5,0.3,COMPLETE
2882,0.23996899557497367,0.175,0.47500000000000003,0.375,0.25,0.5,0.05,equal,0.47500000000000003,0.35000000000000003,COMPLETE
2883,0.4266321167616825,0.25,0.4,0.425,0.2,0.45,0.05,equal,0.45,0.275,COMPLETE
2884,0.2330196079543058,0.2,0.47500000000000003,0.4,0.25,0.47500000000000003,0.07500000000000001,equal,0.5,0.3,COMPLETE
2885,0.45654752703652574,0.22500000000000003,0.42500000000000004,0.45,0.175,0.45,0.07500000000000001,equal,0.47500000000000003,0.325,COMPLETE
2886,0.6246360197681787,0.22500000000000003,0.45000000000000007,0.45,0.22500000000000003,0.47500000000000003,0.05,equal,0.47500000000000003,0.25,COMPLETE
2887,0.36749989024044255,0.175,0.5,0.5,0.25,0.5,0.05,softmax,0.5,0.275,COMPLETE
2888,0.3364885177482658,0.25,0.5750000000000001,0.425,0.22500000000000003,0.47500000000000003,0.07500000000000001,equal,0.325,0.275,COMPLETE
2889,0.4840573096194215,0.2,0.45000000000000007,0.47500000000000003,0.2,0.45,0.05,equal,0.47500000000000003,0.3,COMPLETE
2890,0.5105312565021094,0.22500000000000003,0.4,0.425,0.15000000000000002,0.47500000000000003,0.05,equal,0.5,0.325,COMPLETE
2891,0.42498242750395293,0.15000000000000002,0.42500000000000004,0.375,0.175,0.45,0.05,equal,0.45,0.275,COMPLETE
2892,0.31534174630827994,0.175,0.47500000000000003,0.5,0.25,0.47500000000000003,0.07500000000000001,softmax,0.47500000000000003,0.25,COMPLETE
