number,value,params_fund_net_buying,params_institutional_weight,params_number_fund_holdings,params_pe,params_revenue_growth,params_roe,params_stock_weight_option,params_take_profit,params_trailing_stop_loss,state
3441,0.4686353038907793,0.2,0.5,0.45,0.175,0.5,0.05,equal,0.325,0.35000000000000003,COMPLETE
3442,0.450237329580842,0.2,0.47500000000000003,0.45,0.175,0.5,0.05,equal,0.325,0.35000000000000003,COMPLETE
3443,0.6178023927042292,0.2,0.47500000000000003,0.45,0.15000000000000002,0.5,0.05,equal,0.325,0.35000000000000003,COMPLETE
3444,-0.02985597929831659,0.175,0.45000000000000007,0.45,0.125,0.5,0.325,equal,0.325,0.35000000000000003,COMPLETE
3445,0.3812708332045353,0.22500000000000003,0.525,0.45,0.175,0.5,0.05,equal,0.325,0.35000000000000003,COMPLETE
3446,0.4702110117134355,0.22500000000000003,0.47500000000000003,0.45,0.175,0.5,0.05,equal,0.3,0.35000000000000003,COMPLETE
3447,0.5991697496493733,0.15000000000000002,0.5,0.47500000000000003,0.15000000000000002,0.5,0.05,equal,0.325,0.375,COMPLETE
3448,0.4702110117134355,0.22500000000000003,0.45000000000000007,0.45,0.175,0.5,0.05,equal,0.325,0.35000000000000003,COMPLETE
3449,0.6409572857839799,0.2,0.45000000000000007,0.45,0.175,0.5,0.05,equal,0.325,0.35000000000000003,COMPLETE
3450,0.37840116146761144,0.175,0.5,0.45,0.175,0.5,0.05,equal,0.325,0.35000000000000003,COMPLETE
3451,0.450237329580842,0.2,0.47500000000000003,0.45,0.175,0.5,0.05,equal,0.325,0.35000000000000003,COMPLETE
3452,0.6178023927042292,0.2,0.47500000000000003,0.45,0.15000000000000002,0.5,0.05,equal,0.325,0.35000000000000003,COMPLETE
3453,0.4502373295808427,0.22500000000000003,0.5,0.45,0.175,0.5,0.05,equal,0.3,0.35000000000000003,COMPLETE
3454,0.6364178817607221,0.175,0.47500000000000003,0.45,0.175,0.5,0.05,equal,0.3,0.35000000000000003,COMPLETE
3455,0.30769214195588557,0.2,0.55,0.45,0.15000000000000002,0.5,0.05,equal,0.325,0.35000000000000003,COMPLETE
3456,0.37840116146761144,0.175,0.5,0.45,0.175,0.5,0.05,equal,0.325,0.35000000000000003,COMPLETE
3457,0.4702110117134355,0.22500000000000003,0.47500000000000003,0.45,0.175,0.5,0.05,equal,0.325,0.375,COMPLETE
3458,-0.12602635333031742,0.2,0.47500000000000003,0.45,0.125,0.5,0.35000000000000003,equal,0.3,0.35000000000000003,COMPLETE
3459,0.526555993118065,0.15000000000000002,0.45000000000000007,0.47500000000000003,0.175,0.5,0.05,equal,0.325,0.35000000000000003,COMPLETE
3460,0.5032479503012194,0.22500000000000003,0.47500000000000003,0.45,0.15000000000000002,0.5,0.05,equal,0.325,0.35000000000000003,COMPLETE
3461,0.14503785603704777,0.2,0.525,0.45,0.175,0.5,0.2,equal,0.3,0.375,COMPLETE
3462,0.45023732958084206,0.175,0.5,0.47500000000000003,0.175,0.5,0.05,equal,0.325,0.35000000000000003,COMPLETE
3463,0.4702110117134355,0.22500000000000003,0.45000000000000007,0.45,0.175,0.5,0.05,equal,0.325,0.375,COMPLETE
3464,0.6598179598808656,0.2,0.45000000000000007,0.425,0.175,0.5,0.05,equal,0.3,0.375,COMPLETE
3465,0.48880535148613324,0.22500000000000003,0.47500000000000003,0.425,0.175,0.5,0.05,equal,0.3,0.4,COMPLETE
3466,0.435616804105196,0.2,0.5,0.425,0.15000000000000002,0.5,0.05,equal,0.3,0.375,COMPLETE
3467,0.5263865284454596,0.175,0.45000000000000007,0.425,0.175,0.5,0.05,equal,0.3,0.375,COMPLETE
3468,0.3903053159259171,0.22500000000000003,0.47500000000000003,0.425,0.15000000000000002,0.5,0.05,equal,0.275,0.375,COMPLETE
3469,0.6598179598808656,0.2,0.45000000000000007,0.425,0.175,0.5,0.05,equal,0.3,0.375,COMPLETE
3470,0.48880535148613324,0.22500000000000003,0.47500000000000003,0.425,0.175,0.5,0.05,equal,0.3,0.4,COMPLETE
3471,0.24805061983365523,0.175,0.525,0.425,0.175,0.5,0.05,equal,0.275,0.375,COMPLETE
3472,0.435616804105196,0.2,0.5,0.425,0.15000000000000002,0.5,0.05,equal,0.3,0.375,COMPLETE
3473,0.4702110117134354,0.22500000000000003,0.45000000000000007,0.425,0.175,0.5,0.05,equal,0.3,0.4,COMPLETE
3474,0.6364178817607221,0.175,0.47500000000000003,0.425,0.175,0.5,0.05,equal,0.3,0.375,COMPLETE
3475,0.46416982020024244,0.2,0.45000000000000007,0.425,0.15000000000000002,0.5,0.05,equal,0.275,0.375,COMPLETE
3476,0.48880535148613324,0.2,0.47500000000000003,0.425,0.175,0.5,0.05,equal,0.3,0.4,COMPLETE
3477,0.3949660303860146,0.15000000000000002,0.5,0.425,0.175,0.5,0.05,equal,0.3,0.375,COMPLETE
3478,0.41792589777208683,0.22500000000000003,0.45000000000000007,0.425,0.175,0.5,0.05,equal,0.275,0.375,COMPLETE
3479,0.5078572944374544,0.22500000000000003,0.45000000000000007,0.425,0.15000000000000002,0.5,0.05,equal,0.3,0.375,COMPLETE
3480,0.4017015614537133,0.15000000000000002,0.47500000000000003,0.4,0.175,0.5,0.05,equal,0.275,0.375,COMPLETE
3481,0.5062739829022324,0.175,0.45000000000000007,0.425,0.15000000000000002,0.5,0.05,equal,0.3,0.4,COMPLETE
3482,0.24805061983365495,0.2,0.525,0.425,0.175,0.5,0.05,equal,0.3,0.375,COMPLETE
3483,0.48880535148613324,0.2,0.47500000000000003,0.425,0.175,0.5,0.05,equal,0.3,0.375,COMPLETE
3484,0.35464950946792045,0.22500000000000003,0.5,0.425,0.175,0.5,0.05,equal,0.275,0.375,COMPLETE
3485,0.5263865284454596,0.175,0.45000000000000007,0.425,0.175,0.5,0.05,equal,0.3,0.4,COMPLETE
3486,0.34065045033948366,0.22500000000000003,0.7250000000000001,0.425,0.175,0.5,0.05,equal,0.275,0.375,COMPLETE
3487,0.5042416119803572,0.175,0.47500000000000003,0.425,0.15000000000000002,0.5,0.05,equal,0.3,0.375,COMPLETE
3488,0.6598179598808656,0.2,0.45000000000000007,0.425,0.175,0.5,0.05,equal,0.3,0.375,COMPLETE
3489,0.37840116146761166,0.2,0.5,0.425,0.175,0.5,0.05,equal,0.3,0.4,COMPLETE
3490,0.41385899084600636,0.22500000000000003,0.47500000000000003,0.425,0.15000000000000002,0.5,0.05,equal,0.3,0.4,COMPLETE
3491,0.503065376926356,0.175,0.45000000000000007,0.4,0.175,0.5,0.05,equal,0.275,0.4,COMPLETE
3492,-0.0651642436846979,0.5750000000000001,0.5,0.4,0.175,0.5,0.05,equal,0.275,0.375,COMPLETE
3493,0.4367595902554935,0.22500000000000003,0.47500000000000003,0.425,0.175,0.5,0.05,equal,0.275,0.375,COMPLETE
3494,0.1418933931739565,0.2,0.45000000000000007,0.425,0.175,0.5,0.22500000000000003,equal,0.3,0.4,COMPLETE
3495,0.41385899084600636,0.22500000000000003,0.47500000000000003,0.425,0.15000000000000002,0.5,0.05,equal,0.3,0.375,COMPLETE
3496,0.4538248164068305,0.15000000000000002,0.45000000000000007,0.375,0.175,0.5,0.05,equal,0.3,0.375,COMPLETE
3497,0.2021349601548479,0.45,0.5,0.425,0.175,0.5,0.05,equal,0.3,0.4,COMPLETE
3498,0.41536583825168827,0.175,0.525,0.4,0.15000000000000002,0.5,0.05,equal,0.275,0.375,COMPLETE
3499,0.4880611576383899,0.2,0.45000000000000007,0.425,0.15000000000000002,0.5,0.05,equal,0.3,0.375,COMPLETE
3500,0.4367595902554935,0.22500000000000003,0.47500000000000003,0.425,0.175,0.5,0.05,equal,0.275,0.375,COMPLETE
3501,0.48880535148613324,0.2,0.47500000000000003,0.425,0.175,0.5,0.05,equal,0.3,0.4,COMPLETE
3502,0.5263865284454596,0.175,0.45000000000000007,0.4,0.175,0.5,0.05,equal,0.3,0.375,COMPLETE
3503,0.35464950946792045,0.22500000000000003,0.5,0.425,0.175,0.5,0.05,equal,0.275,0.375,COMPLETE
3504,0.6598179598808656,0.2,0.45000000000000007,0.425,0.175,0.5,0.05,equal,0.3,0.4,COMPLETE
3505,0.5236943238613958,0.2,0.47500000000000003,0.4,0.15000000000000002,0.5,0.05,equal,0.3,0.4,COMPLETE
3506,0.02297753364617439,0.22500000000000003,0.9500000000000001,0.425,0.175,0.5,0.05,equal,0.3,0.425,COMPLETE
3507,0.061138047850212485,0.15000000000000002,0.525,0.4,0.175,0.5,0.3,equal,0.3,0.45,COMPLETE
3508,0.41792589777208683,0.22500000000000003,0.45000000000000007,0.425,0.175,0.5,0.05,equal,0.275,0.425,COMPLETE
3509,0.5081969201559845,0.175,0.45000000000000007,0.4,0.15000000000000002,0.5,0.05,equal,0.3,0.375,COMPLETE
3510,0.3734703386477225,0.2,0.47500000000000003,0.4,0.175,0.5,0.05,equal,0.3,0.4,COMPLETE
3511,0.24805061983365573,0.2,0.5,0.4,0.175,0.5,0.05,equal,0.275,0.425,COMPLETE
3512,-0.11593177709223515,0.22500000000000003,0.45000000000000007,0.425,0.1,0.5,0.375,equal,0.3,0.375,COMPLETE
3513,0.3120287942167749,0.15000000000000002,0.5,0.8,0.175,0.5,0.05,equal,0.3,0.4,COMPLETE
3514,0.4367595902554935,0.22500000000000003,0.47500000000000003,0.425,0.175,0.5,0.05,equal,0.275,0.425,COMPLETE
3515,0.5042416119803572,0.175,0.47500000000000003,0.4,0.15000000000000002,0.5,0.05,equal,0.3,0.4,COMPLETE
3516,0.31221898798568604,0.2,0.25,0.4,0.175,0.5,0.05,equal,0.3,0.4,COMPLETE
3517,0.4702110117134354,0.22500000000000003,0.45000000000000007,0.425,0.175,0.5,0.05,equal,0.3,0.4,COMPLETE
3518,0.2480506198336554,0.2,0.55,0.4,0.175,0.5,0.05,equal,0.275,0.4,COMPLETE
3519,0.5078572944374544,0.22500000000000003,0.45000000000000007,0.425,0.15000000000000002,0.5,0.05,equal,0.3,0.425,COMPLETE
3520,0.24805061983365523,0.175,0.5,0.375,0.175,0.5,0.05,equal,0.275,0.425,COMPLETE
3521,0.5081969201559845,0.175,0.45000000000000007,0.4,0.15000000000000002,0.5,0.05,equal,0.3,0.425,COMPLETE
3522,0.48880535148613324,0.2,0.47500000000000003,0.425,0.175,0.5,0.05,equal,0.3,0.4,COMPLETE
3523,0.6598179598808656,0.2,0.45000000000000007,0.425,0.175,0.5,0.05,equal,0.3,0.4,COMPLETE
3524,0.41385899084600636,0.22500000000000003,0.47500000000000003,0.425,0.15000000000000002,0.5,0.05,equal,0.3,0.4,COMPLETE
3525,0.5230249105589782,0.175,0.47500000000000003,0.375,0.175,0.5,0.05,equal,0.275,0.4,COMPLETE
3526,0.307692141955886,0.22500000000000003,0.5750000000000001,0.425,0.175,0.5,0.05,equal,0.3,0.425,COMPLETE
3527,-0.10731249177078095,0.2,0.42500000000000004,0.4,0.025,0.5,0.47500000000000003,equal,0.3,0.425,COMPLETE
3528,0.3949660303860146,0.15000000000000002,0.5,0.375,0.175,0.5,0.05,equal,0.275,0.45,COMPLETE
3529,0.41792589777208683,0.22500000000000003,0.45000000000000007,0.425,0.175,0.5,0.05,equal,0.275,0.4,COMPLETE
3530,0.30769214195588634,0.2,0.525,0.4,0.15000000000000002,0.5,0.05,equal,0.3,0.425,COMPLETE
3531,0.4538248164068305,0.175,0.42500000000000004,0.4,0.2,0.5,0.05,equal,0.3,0.4,COMPLETE
3532,0.48880535148613324,0.22500000000000003,0.47500000000000003,0.425,0.175,0.5,0.05,equal,0.3,0.425,COMPLETE
3533,0.545118328989346,0.2,0.45000000000000007,0.4,0.175,0.5,0.05,equal,0.3,0.425,COMPLETE
3534,0.520733451174167,0.22500000000000003,0.5,0.425,0.15000000000000002,0.5,0.05,equal,0.3,0.4,COMPLETE
3535,0.34187403534153155,0.175,0.47500000000000003,0.4,0.2,0.5,0.05,equal,0.275,0.4,COMPLETE
3536,0.45382481640683053,0.125,0.45000000000000007,0.375,0.175,0.5,0.05,equal,0.3,0.4,COMPLETE
3537,0.37347033864772267,0.2,0.42500000000000004,0.4,0.2,0.5,0.05,equal,0.3,0.425,COMPLETE
3538,0.0897874283746593,0.9,0.45000000000000007,0.05,0.175,0.5,0.05,equal,0.3,0.4,COMPLETE
3539,0.16416303770206833,0.125,0.525,0.4,0.2,0.5,0.05,equal,0.3,0.4,COMPLETE
3540,0.5078572944374544,0.22500000000000003,0.45000000000000007,0.425,0.15000000000000002,0.5,0.05,equal,0.3,0.4,COMPLETE
3541,0.28040991389873304,0.4,0.47500000000000003,0.425,0.175,0.5,0.05,equal,0.275,0.375,COMPLETE
3542,0.24805061983365523,0.175,0.5,0.375,0.2,0.5,0.05,equal,0.275,0.425,COMPLETE
3543,0.5081969201559844,0.2,0.42500000000000004,0.4,0.175,0.5,0.05,equal,0.3,0.4,COMPLETE
3544,0.545118328989346,0.2,0.45000000000000007,0.4,0.175,0.5,0.05,equal,0.3,0.4,COMPLETE
3545,0.48880535148613324,0.22500000000000003,0.47500000000000003,0.425,0.2,0.5,0.05,equal,0.3,0.4,COMPLETE
3546,0.21220068508697473,0.35000000000000003,0.42500000000000004,0.425,0.2,0.5,0.05,equal,0.275,0.4,COMPLETE
3547,0.4982635090343307,0.15000000000000002,0.5,0.4,0.15000000000000002,0.5,0.05,equal,0.3,0.425,COMPLETE
3548,0.5263865284454596,0.175,0.45000000000000007,0.4,0.175,0.5,0.05,equal,0.3,0.4,COMPLETE
3549,0.3495795787465572,0.2,0.47500000000000003,0.4,0.175,0.5,0.05,equal,0.275,0.4,COMPLETE
3550,0.4360371733194324,0.175,0.42500000000000004,0.4,0.175,0.5,0.05,equal,0.3,0.4,COMPLETE
3551,0.0274820013631466,0.525,0.45000000000000007,0.22500000000000003,0.2,0.5,0.05,equal,0.275,0.4,COMPLETE
3552,0.07124004498993394,0.22500000000000003,0.5,0.425,0.175,0.5,0.25,equal,0.3,0.4,COMPLETE
3553,0.48880535148613324,0.2,0.47500000000000003,0.425,0.2,0.5,0.05,equal,0.3,0.425,COMPLETE
3554,0.12144195882054243,0.22500000000000003,0.525,0.425,0.175,0.5,0.275,equal,0.3,0.4,COMPLETE
3555,0.3903053159259171,0.22500000000000003,0.47500000000000003,0.425,0.15000000000000002,0.5,0.05,equal,0.275,0.4,COMPLETE
3556,0.37347033864772267,0.2,0.42500000000000004,0.4,0.2,0.5,0.05,equal,0.3,0.4,COMPLETE
3557,0.4367595902554933,0.2,0.47500000000000003,0.425,0.175,0.5,0.05,equal,0.275,0.375,COMPLETE
3558,0.488805351486133,0.22500000000000003,0.45000000000000007,0.425,0.2,0.5,0.05,equal,0.3,0.4,COMPLETE
3559,0.395976425403893,0.175,0.42500000000000004,0.375,0.15000000000000002,0.5,0.05,equal,0.3,0.375,COMPLETE
3560,0.37347033864772244,0.2,0.45000000000000007,0.4,0.2,0.5,0.05,equal,0.3,0.375,COMPLETE
3561,0.24805061983365523,0.175,0.5,0.4,0.175,0.5,0.05,equal,0.3,0.375,COMPLETE
3562,0.22085938363517624,0.15000000000000002,0.47500000000000003,0.35000000000000003,0.175,0.5,0.175,equal,0.275,0.4,COMPLETE
3563,0.488805351486133,0.2,0.45000000000000007,0.425,0.2,0.5,0.05,equal,0.3,0.425,COMPLETE
3564,0.5621436021069504,0.22500000000000003,0.42500000000000004,0.425,0.175,0.5,0.05,equal,0.275,0.375,COMPLETE
3565,0.3784011614676116,0.22500000000000003,0.5,0.425,0.175,0.5,0.05,equal,0.3,0.4,COMPLETE
3566,0.5081969201559845,0.175,0.45000000000000007,0.4,0.15000000000000002,0.5,0.05,equal,0.3,0.375,COMPLETE
3567,0.48880535148613324,0.2,0.47500000000000003,0.425,0.2,0.5,0.05,equal,0.3,0.375,COMPLETE
3568,0.5434355287985899,0.2,0.42500000000000004,0.425,0.175,0.5,0.05,equal,0.275,0.375,COMPLETE
3569,0.48880535148613324,0.22500000000000003,0.47500000000000003,0.425,0.2,0.5,0.05,equal,0.3,0.425,COMPLETE
3570,0.5081969201559844,0.2,0.45000000000000007,0.4,0.15000000000000002,0.5,0.05,equal,0.3,0.4,COMPLETE
3571,0.24805061983365567,0.15000000000000002,0.525,0.375,0.2,0.5,0.05,equal,0.3,0.375,COMPLETE
3572,0.5621436021069504,0.22500000000000003,0.42500000000000004,0.425,0.175,0.5,0.05,equal,0.275,0.4,COMPLETE
3573,-0.07319495308587029,0.175,0.45000000000000007,0.375,0.1,0.5,0.4,equal,0.3,0.375,COMPLETE
3574,0.24805061983365523,0.175,0.5,0.4,0.175,0.5,0.05,equal,0.275,0.375,COMPLETE
3575,0.48880535148613324,0.22500000000000003,0.47500000000000003,0.425,0.175,0.5,0.05,equal,0.3,0.4,COMPLETE
3576,0.37347033864772244,0.2,0.45000000000000007,0.4,0.2,0.5,0.05,equal,0.3,0.375,COMPLETE
3577,0.488805351486133,0.22500000000000003,0.45000000000000007,0.425,0.2,0.5,0.05,equal,0.3,0.375,COMPLETE
3578,0.4304171434604923,0.15000000000000002,0.42500000000000004,0.4,0.2,0.5,0.05,equal,0.275,0.425,COMPLETE
3579,0.48880535148613324,0.2,0.47500000000000003,0.425,0.175,0.5,0.05,equal,0.3,0.375,COMPLETE
3580,0.37840116146761166,0.2,0.5,0.425,0.175,0.5,0.05,equal,0.3,0.4,COMPLETE
3581,0.48880535148613324,0.22500000000000003,0.47500000000000003,0.425,0.175,0.5,0.05,equal,0.3,0.4,COMPLETE
3582,0.37602473342518894,0.175,0.42500000000000004,0.375,0.15000000000000002,0.5,0.05,equal,0.275,0.375,COMPLETE
3583,0.5078572944374544,0.22500000000000003,0.45000000000000007,0.425,0.15000000000000002,0.5,0.05,equal,0.3,0.375,COMPLETE
3584,0.24805061983365523,0.175,0.5,0.4,0.2,0.5,0.05,equal,0.3,0.4,COMPLETE
3585,0.5081969201559844,0.2,0.42500000000000004,0.4,0.175,0.5,0.05,equal,0.3,0.375,COMPLETE
3586,0.4367595902554935,0.22500000000000003,0.47500000000000003,0.425,0.175,0.5,0.05,equal,0.275,0.4,COMPLETE
3587,0.23086160558325436,0.325,0.45000000000000007,0.3,0.2,0.5,0.05,equal,0.275,0.375,COMPLETE
3588,0.2480506198336554,0.2,0.55,0.425,0.175,0.5,0.05,equal,0.3,0.375,COMPLETE
3589,-0.12602635333031742,0.2,0.47500000000000003,0.425,0.125,0.5,0.35000000000000003,equal,0.275,0.425,COMPLETE
3590,0.2480506198336554,0.2,0.525,0.4,0.2,0.5,0.05,equal,0.3,0.4,COMPLETE
3591,0.5683276500062574,0.22500000000000003,0.42500000000000004,0.425,0.15000000000000002,0.5,0.05,equal,0.3,0.375,COMPLETE
3592,0.3784011614676116,0.22500000000000003,0.5,0.425,0.175,0.5,0.05,equal,0.3,0.4,COMPLETE
3593,-0.19833377715521683,0.175,0.45000000000000007,0.4,0.05,0.5,0.45,equal,0.275,0.375,COMPLETE
3594,0.3668251435920902,0.175,0.47500000000000003,0.375,0.2,0.5,0.05,equal,0.3,0.375,COMPLETE
3595,0.6598179598808656,0.2,0.45000000000000007,0.425,0.175,0.5,0.05,equal,0.3,0.375,COMPLETE
3596,0.4367595902554931,0.22500000000000003,0.42500000000000004,0.425,0.2,0.5,0.05,equal,0.275,0.4,COMPLETE
3597,0.24805061983365573,0.2,0.5,0.4,0.175,0.5,0.05,equal,0.3,0.375,COMPLETE
3598,0.04128162183029951,0.7000000000000001,0.47500000000000003,0.275,0.125,0.5,0.325,equal,0.3,0.4,COMPLETE
3599,0.4304171434604921,0.15000000000000002,0.45000000000000007,0.375,0.2,0.5,0.05,equal,0.275,0.375,COMPLETE
3600,0.3618051395319093,0.175,0.42500000000000004,0.4,0.15000000000000002,0.5,0.05,equal,0.3,0.375,COMPLETE
3601,0.4367595902554935,0.22500000000000003,0.47500000000000003,0.425,0.175,0.5,0.05,equal,0.275,0.4,COMPLETE
3602,0.37347033864772244,0.2,0.45000000000000007,0.4,0.2,0.5,0.05,equal,0.3,0.375,COMPLETE
3603,0.24805061983365495,0.22500000000000003,0.525,0.425,0.175,0.5,0.05,equal,0.3,0.4,COMPLETE
3604,0.3668251435920902,0.175,0.47500000000000003,0.4,0.2,0.5,0.05,equal,0.3,0.375,COMPLETE
3605,0.24805061983365573,0.2,0.5,0.4,0.175,0.5,0.05,equal,0.3,0.375,COMPLETE
3606,-0.09849863975817046,0.22500000000000003,0.025,0.425,0.15000000000000002,0.5,0.05,equal,0.275,0.375,COMPLETE
3607,0.12430308981874229,0.2,0.45000000000000007,0.4,0.175,0.5,0.22500000000000003,equal,0.275,0.4,COMPLETE
3608,0.4102999984046434,0.175,0.42500000000000004,0.375,0.2,0.47500000000000003,0.05,equal,0.3,0.375,COMPLETE
3609,0.4702110117134354,0.22500000000000003,0.45000000000000007,0.425,0.175,0.5,0.05,equal,0.3,0.4,COMPLETE
3610,0.34065045033948366,0.2,0.775,0.4,0.2,0.47500000000000003,0.05,equal,0.3,0.375,COMPLETE
3611,0.4304171434604923,0.15000000000000002,0.42500000000000004,0.4,0.2,0.5,0.05,equal,0.275,0.375,COMPLETE
3612,0.3895149293047199,0.175,0.47500000000000003,0.375,0.15000000000000002,0.47500000000000003,0.05,equal,0.3,0.425,COMPLETE
3613,0.48880535148613324,0.22500000000000003,0.47500000000000003,0.425,0.175,0.5,0.05,equal,0.3,0.375,COMPLETE
3614,0.4153658382516887,0.2,0.5,0.4,0.2,0.47500000000000003,0.05,equal,0.3,0.4,COMPLETE
3615,-0.005525402185236221,0.22500000000000003,0.45000000000000007,0.425,0.2,0.175,0.05,equal,0.3,0.4,COMPLETE
3616,0.3391714439613494,0.175,0.42500000000000004,0.375,0.175,0.5,0.05,equal,0.275,0.375,COMPLETE
3617,0.46636935811011165,0.2,0.45000000000000007,0.4,0.15000000000000002,0.47500000000000003,0.05,equal,0.3,0.4,COMPLETE
3618,0.24473059620990956,0.22500000000000003,0.47500000000000003,0.425,0.175,0.47500000000000003,0.2,equal,0.275,0.45,COMPLETE
3619,0.545118328989346,0.2,0.45000000000000007,0.4,0.175,0.5,0.05,equal,0.3,0.375,COMPLETE
3620,0.49828149350771994,0.175,0.42500000000000004,0.375,0.15000000000000002,0.47500000000000003,0.05,equal,0.3,0.375,COMPLETE
3621,0.37344206733337226,0.22500000000000003,0.5,0.425,0.2,0.5,0.05,equal,0.275,0.4,COMPLETE
3622,0.05779923331084007,0.525,0.47500000000000003,0.425,0.175,0.5,0.05,equal,0.3,0.375,COMPLETE
3623,0.5451183289893459,0.2,0.45000000000000007,0.4,0.2,0.47500000000000003,0.05,equal,0.3,0.375,COMPLETE
3624,0.3311738241972628,0.25,0.5,0.425,0.2,0.47500000000000003,0.05,equal,0.275,0.375,COMPLETE
3625,0.36180513953190924,0.15000000000000002,0.42500000000000004,0.375,0.175,0.5,0.05,equal,0.3,0.4,COMPLETE
3626,0.33732447042914976,0.425,0.47500000000000003,0.425,0.175,0.5,0.05,equal,0.3,0.425,COMPLETE
3627,0.06155720371913931,0.22500000000000003,0.45000000000000007,0.425,0.2,0.22500000000000003,0.05,equal,0.3,0.4,COMPLETE
3628,0.41536583825168827,0.175,0.525,0.4,0.15000000000000002,0.47500000000000003,0.05,equal,0.275,0.375,COMPLETE
3629,0.48880535148613324,0.25,0.47500000000000003,0.425,0.175,0.5,0.05,equal,0.3,0.375,COMPLETE
3630,0.5062739829022321,0.2,0.42500000000000004,0.4,0.2,0.47500000000000003,0.05,equal,0.3,0.375,COMPLETE
3631,0.5039372685270612,0.22500000000000003,0.5,0.425,0.15000000000000002,0.47500000000000003,0.05,equal,0.3,0.4,COMPLETE
3632,0.4093319488333807,0.15000000000000002,0.45000000000000007,0.4,0.2,0.47500000000000003,0.05,equal,0.275,0.375,COMPLETE
3633,0.48880535148613324,0.2,0.47500000000000003,0.425,0.175,0.5,0.05,equal,0.325,0.375,COMPLETE
3634,0.5434355287985899,0.2,0.42500000000000004,0.425,0.175,0.5,0.05,equal,0.275,0.4,COMPLETE
3635,0.5260054103748681,0.22500000000000003,0.45000000000000007,0.425,0.2,0.47500000000000003,0.05,equal,0.3,0.4,COMPLETE
3636,0.33241678519664486,0.175,0.47500000000000003,0.7250000000000001,0.175,0.5,0.05,equal,0.3,0.375,COMPLETE
3637,0.36254263611819915,0.25,0.5,0.425,0.2,0.47500000000000003,0.05,equal,0.325,0.375,COMPLETE
3638,0.26041570934749014,0.2,0.45000000000000007,0.4,0.2,0.25,0.05,equal,0.3,0.425,COMPLETE
3639,0.24805061983365495,0.22500000000000003,0.525,0.425,0.175,0.5,0.05,equal,0.325,0.375,COMPLETE
3640,0.3076921419558854,0.2,0.65,0.4,0.15000000000000002,0.47500000000000003,0.05,equal,0.325,0.4,COMPLETE
3641,0.4167744640949152,0.175,0.42500000000000004,0.35000000000000003,0.175,0.5,0.05,equal,0.3,0.375,COMPLETE
3642,0.6409572857839799,0.25,0.47500000000000003,0.425,0.2,0.47500000000000003,0.05,equal,0.325,0.4,COMPLETE
3643,0.3664449779268237,0.125,0.42500000000000004,0.35000000000000003,0.175,0.5,0.05,equal,0.275,0.375,COMPLETE
3644,0.5260054103748681,0.22500000000000003,0.45000000000000007,0.425,0.2,0.47500000000000003,0.05,equal,0.3,0.4,COMPLETE
3645,0.12143527793054226,0.8250000000000001,0.47500000000000003,0.1,0.175,0.5,0.05,equal,0.3,0.425,COMPLETE
3646,0.46239760856645373,0.22500000000000003,0.45000000000000007,0.425,0.15000000000000002,0.47500000000000003,0.05,equal,0.275,0.375,COMPLETE
3647,0.24805061983365523,0.175,0.5,0.4,0.175,0.5,0.05,equal,0.3,0.375,COMPLETE
3648,0.5451183289893459,0.2,0.45000000000000007,0.4,0.2,0.47500000000000003,0.05,equal,0.325,0.375,COMPLETE
3649,0.3309577064015729,0.2,0.47500000000000003,0.4,0.175,0.5,0.05,linear,0.275,0.375,COMPLETE
3650,0.49654490382128624,0.25,0.42500000000000004,0.425,0.15000000000000002,0.47500000000000003,0.05,equal,0.3,0.45,COMPLETE
3651,0.07602364284450297,0.7750000000000001,0.45000000000000007,0.1,0.175,0.5,0.05,equal,0.325,0.4,COMPLETE
3652,0.24805061983365495,0.22500000000000003,0.525,0.425,0.2,0.47500000000000003,0.05,equal,0.3,0.4,COMPLETE
