number,value,params_fund_net_buying,params_institutional_weight,params_number_fund_holdings,params_pe,params_revenue_growth,params_roe,params_stock_weight_option,params_take_profit,params_trailing_stop_loss,state
3845,0.5408356776365567,0.25,0.45000000000000007,0.425,0.175,0.5,0.07500000000000001,equal,0.3,0.375,COMPLETE
3846,-0.005730517182566009,0.22500000000000003,0.4,0.425,0.2,0.1,0.05,equal,0.325,0.325,COMPLETE
3847,0.4017015614537136,0.15000000000000002,0.47500000000000003,0.375,0.175,0.5,0.05,equal,0.275,0.375,COMPLETE
3848,0.5081969201559845,0.175,0.45000000000000007,0.4,0.15000000000000002,0.5,0.05,equal,0.3,0.325,COMPLETE
3849,0.5827025892697925,0.2,0.45000000000000007,0.45,0.175,0.47500000000000003,0.07500000000000001,equal,0.3,0.375,COMPLETE
3850,0.05973691259701744,0.22500000000000003,0.5,0.425,0.425,0.5,0.05,equal,0.375,0.35000000000000003,COMPLETE
3851,0.6321192294830849,0.25,0.42500000000000004,0.425,0.2,0.47500000000000003,0.05,equal,0.35000000000000003,0.4,COMPLETE
3852,0.41536583825168827,0.2,0.525,0.4,0.175,0.47500000000000003,0.07500000000000001,equal,0.3,0.325,COMPLETE
3853,0.48880535148613313,0.22500000000000003,0.47500000000000003,0.45,0.2,0.5,0.05,equal,0.3,0.375,COMPLETE
3854,0.49654490382128624,0.275,0.42500000000000004,0.425,0.15000000000000002,0.47500000000000003,0.05,equal,0.325,0.35000000000000003,COMPLETE
3855,0.5590158464883748,0.175,0.47500000000000003,0.4,0.175,0.5,0.05,equal,0.4,0.375,COMPLETE
3856,0.15848107190259184,0.6500000000000001,0.4,0.3,0.175,0.5,0.07500000000000001,equal,0.275,0.325,COMPLETE
3857,-0.011756496153447538,0.22500000000000003,0.45000000000000007,0.45,0.125,0.47500000000000003,0.35000000000000003,linear,0.3,0.425,COMPLETE
3858,0.6409572857839799,0.2,0.45000000000000007,0.45,0.2,0.47500000000000003,0.05,equal,0.325,0.4,COMPLETE
3859,0.13913000507833928,0.175,0.15,0.4,0.2,0.5,0.05,equal,0.35000000000000003,0.35000000000000003,COMPLETE
3860,0.34999340142128565,0.125,0.47500000000000003,0.375,0.175,0.47500000000000003,0.07500000000000001,equal,0.3,0.325,COMPLETE
3861,0.6131078359831612,0.2,0.42500000000000004,0.45,0.175,0.5,0.05,equal,0.325,0.35000000000000003,COMPLETE
3862,0.5027160912080834,0.25,0.45000000000000007,0.425,0.2,0.47500000000000003,0.05,equal,0.275,0.375,COMPLETE
3863,0.14075131602117466,0.55,0.5,0.2,0.2,0.35000000000000003,0.07500000000000001,equal,0.3,0.4,COMPLETE
3864,0.48880535148613324,0.22500000000000003,0.47500000000000003,0.425,0.175,0.5,0.05,equal,0.325,0.375,COMPLETE
3865,0.3655395115183837,0.15000000000000002,0.42500000000000004,0.35000000000000003,0.15000000000000002,0.47500000000000003,0.05,equal,0.375,0.375,COMPLETE
3866,0.35364915698360644,0.2,0.5,0.45,0.2,0.5,0.05,equal,0.4,0.35000000000000003,COMPLETE
3867,0.18236951960108216,0.175,0.4,0.4,0.2,0.3,0.05,equal,0.3,0.4,COMPLETE
3868,0.5324845549385897,0.2,0.45000000000000007,0.45,0.175,0.47500000000000003,0.07500000000000001,equal,0.25,0.325,COMPLETE
3869,0.48880535148613324,0.22500000000000003,0.47500000000000003,0.425,0.175,0.5,0.05,equal,0.35000000000000003,0.425,COMPLETE
3870,0.2480506198336554,0.22500000000000003,0.525,0.425,0.22500000000000003,0.5,0.07500000000000001,equal,0.3,0.375,COMPLETE
3871,0.5263865284454595,0.175,0.45000000000000007,0.4,0.2,0.47500000000000003,0.05,equal,0.325,0.325,COMPLETE
3872,0.56214360210695,0.25,0.42500000000000004,0.45,0.15000000000000002,0.5,0.05,equal,0.275,0.35000000000000003,COMPLETE
3873,0.4153658382516877,0.2,0.5,0.4,0.175,0.47500000000000003,0.07500000000000001,equal,0.3,0.375,COMPLETE
3874,0.35832387729707804,0.275,0.47500000000000003,0.425,0.15000000000000002,0.47500000000000003,0.05,equal,0.275,0.325,COMPLETE
3875,0.6409572857839799,0.22500000000000003,0.45000000000000007,0.45,0.2,0.47500000000000003,0.05,equal,0.3,0.4,COMPLETE
3876,0.2588802544980137,0.175,0.47500000000000003,0.4,0.22500000000000003,0.5,0.07500000000000001,equal,0.325,0.35000000000000003,COMPLETE
3877,0.28849421353518556,0.2,0.7000000000000001,0.45,0.175,0.5,0.05,equal,0.375,0.375,COMPLETE
3878,0.3742268549002525,0.25,0.42500000000000004,0.425,0.175,0.5,0.05,linear,0.275,0.325,COMPLETE
3879,0.5260054103748681,0.22500000000000003,0.45000000000000007,0.425,0.2,0.47500000000000003,0.05,equal,0.35000000000000003,0.375,COMPLETE
3880,0.5068109669230413,0.2,0.5,0.45,0.15000000000000002,0.47500000000000003,0.05,equal,0.3,0.35000000000000003,COMPLETE
3881,0.4360371733194324,0.175,0.42500000000000004,0.4,0.175,0.5,0.05,equal,0.325,0.4,COMPLETE
3882,0.5525855803479753,0.22500000000000003,0.4,0.425,0.175,0.47500000000000003,0.07500000000000001,equal,0.325,0.425,COMPLETE
3883,0.36111149588284097,0.2,0.47500000000000003,0.45,0.22500000000000003,0.5,0.07500000000000001,equal,0.3,0.375,COMPLETE
3884,0.5030653769263557,0.175,0.45000000000000007,0.4,0.2,0.47500000000000003,0.05,equal,0.275,0.325,COMPLETE
3885,0.41087536864739976,0.25,0.47500000000000003,0.425,0.2,0.375,0.05,equal,0.3,0.375,COMPLETE
3886,0.6544393809331743,0.2,0.45000000000000007,0.45,0.175,0.5,0.05,equal,0.375,0.35000000000000003,COMPLETE
3887,0.30449946258513605,0.15000000000000002,0.45000000000000007,0.375,0.15000000000000002,0.47500000000000003,0.05,equal,0.375,0.35000000000000003,COMPLETE
3888,0.2660067602976016,0.22500000000000003,0.5,0.425,0.22500000000000003,0.5,0.07500000000000001,equal,0.275,0.35000000000000003,COMPLETE
3889,0.6142841133051125,0.22500000000000003,0.42500000000000004,0.425,0.2,0.47500000000000003,0.05,equal,0.4,0.35000000000000003,COMPLETE
3890,0.23301960795430562,0.15000000000000002,0.47500000000000003,0.375,0.22500000000000003,0.5,0.07500000000000001,equal,0.375,0.35000000000000003,COMPLETE
3891,0.3948605479095596,0.2,0.525,0.45,0.2,0.47500000000000003,0.05,equal,0.275,0.35000000000000003,COMPLETE
3892,0.4550475111060046,0.25,0.42500000000000004,0.425,0.175,0.5,0.05,equal,0.375,0.35000000000000003,COMPLETE
3893,0.239107959552046,0.175,0.45000000000000007,0.4,0.15000000000000002,0.47500000000000003,0.05,equal,0.125,0.35000000000000003,COMPLETE
3894,0.41536583825168827,0.22500000000000003,0.5,0.425,0.175,0.47500000000000003,0.07500000000000001,equal,0.4,0.325,COMPLETE
3895,0.6221599743990214,0.2,0.45000000000000007,0.45,0.175,0.5,0.05,equal,0.4,0.35000000000000003,COMPLETE
3896,0.5019703674716831,0.22500000000000003,0.47500000000000003,0.45,0.22500000000000003,0.5,0.07500000000000001,equal,0.375,0.325,COMPLETE
3897,0.06155720371913931,0.25,0.47500000000000003,0.425,0.2,0.22500000000000003,0.05,equal,0.375,0.35000000000000003,COMPLETE
3898,0.5775346980292286,0.2,0.42500000000000004,0.45,0.2,0.47500000000000003,0.05,linear,0.4,0.325,COMPLETE
3899,0.4724786370789642,0.175,0.4,0.4,0.175,0.5,0.05,equal,0.375,0.35000000000000003,COMPLETE
3900,0.6346078663938722,0.275,0.45000000000000007,0.425,0.2,0.47500000000000003,0.05,equal,0.375,0.325,COMPLETE
3901,0.3003044552569023,0.2,0.5,0.45,0.175,0.5,0.15000000000000002,equal,0.3,0.35000000000000003,COMPLETE
3902,0.4772324404725562,0.175,0.4,0.4,0.22500000000000003,0.47500000000000003,0.07500000000000001,equal,0.375,0.325,COMPLETE
3903,-0.005525402185236221,0.22500000000000003,0.5,0.425,0.2,0.05,0.05,equal,0.4,0.325,COMPLETE
3904,-0.10604544145639959,0.15000000000000002,0.45000000000000007,0.47500000000000003,0.05,0.5,0.4,equal,0.375,0.35000000000000003,COMPLETE
3905,0.5851660751418166,0.2,0.42500000000000004,0.45,0.15000000000000002,0.47500000000000003,0.05,equal,0.375,0.35000000000000003,COMPLETE
3906,0.5374299877030273,0.22500000000000003,0.47500000000000003,0.425,0.175,0.47500000000000003,0.07500000000000001,equal,0.4,0.325,COMPLETE
3907,0.4735574587331808,0.22500000000000003,0.47500000000000003,0.425,0.22500000000000003,0.5,0.05,equal,0.4,0.325,COMPLETE
3908,0.44868323829873413,0.175,0.42500000000000004,0.4,0.2,0.47500000000000003,0.05,equal,0.375,0.35000000000000003,COMPLETE
3909,0.501970367471683,0.25,0.45000000000000007,0.45,0.22500000000000003,0.5,0.07500000000000001,equal,0.375,0.325,COMPLETE
3910,0.43577109558440186,0.2,0.47500000000000003,0.45,0.175,0.5,0.05,equal,0.4,0.35000000000000003,COMPLETE
3911,0.24805061983365495,0.22500000000000003,0.525,0.425,0.175,0.5,0.05,equal,0.375,0.35000000000000003,COMPLETE
3912,0.34394105876567915,0.25,0.4,0.425,0.175,0.47500000000000003,0.175,equal,0.375,0.325,COMPLETE
3913,0.49191763469156036,0.175,0.45000000000000007,0.4,0.22500000000000003,0.47500000000000003,0.07500000000000001,equal,0.4,0.325,COMPLETE
3914,0.488805351486133,0.2,0.45000000000000007,0.45,0.22500000000000003,0.5,0.05,equal,0.3,0.325,COMPLETE
3915,0.17299701908418103,0.2,0.5,0.4,0.15000000000000002,0.5,0.05,equal,0.07500000000000001,0.35000000000000003,COMPLETE
3916,0.2907545670896805,0.22500000000000003,0.225,0.425,0.2,0.47500000000000003,0.05,equal,0.375,0.35000000000000003,COMPLETE
3917,0.6262730764699654,0.2,0.42500000000000004,0.45,0.2,0.47500000000000003,0.05,equal,0.375,0.35000000000000003,COMPLETE
3918,0.20608391606324888,0.125,0.47500000000000003,0.35000000000000003,0.22500000000000003,0.5,0.07500000000000001,equal,0.375,0.325,COMPLETE
3919,0.39657502331084993,0.175,0.525,0.4,0.2,0.325,0.05,linear,0.375,0.325,COMPLETE
3920,-0.0816467353670392,0.15000000000000002,0.45000000000000007,0.375,0.175,0.47500000000000003,0.07500000000000001,equal,0.4,0.125,COMPLETE
3921,0.05167011993043323,0.7500000000000001,0.5,0.175,0.22500000000000003,0.5,0.05,equal,0.3,0.35000000000000003,COMPLETE
3922,0.5777148101684926,0.22500000000000003,0.42500000000000004,0.425,0.15000000000000002,0.47500000000000003,0.05,equal,0.4,0.325,COMPLETE
3923,0.4711736955383654,0.275,0.47500000000000003,0.425,0.22500000000000003,0.5,0.05,equal,0.3,0.35000000000000003,COMPLETE
3924,0.6544393809331743,0.22500000000000003,0.45000000000000007,0.45,0.2,0.47500000000000003,0.05,equal,0.375,0.35000000000000003,COMPLETE
3925,0.30769214195588607,0.25,0.55,0.425,0.175,0.47500000000000003,0.07500000000000001,equal,0.375,0.325,COMPLETE
3926,0.4550475111060044,0.25,0.42500000000000004,0.45,0.175,0.5,0.05,equal,0.375,0.35000000000000003,COMPLETE
3927,-0.0028219893810619567,0.275,0.47500000000000003,0.425,0.4,0.5,0.07500000000000001,equal,0.375,0.325,COMPLETE
3928,0.4833926990146572,0.25,0.45000000000000007,0.45,0.22500000000000003,0.47500000000000003,0.07500000000000001,equal,0.375,0.35000000000000003,COMPLETE
3929,0.38433486269925465,0.275,0.4,0.425,0.15000000000000002,0.47500000000000003,0.05,equal,0.375,0.325,COMPLETE
3930,0.4657996110956104,0.3,0.47500000000000003,0.425,0.2,0.47500000000000003,0.05,equal,0.375,0.35000000000000003,COMPLETE
3931,-0.005730517182566009,0.25,0.42500000000000004,0.45,0.2,0.125,0.05,equal,0.375,0.325,COMPLETE
3932,0.4552292233816545,0.275,0.47500000000000003,0.425,0.175,0.5,0.05,equal,0.4,0.35000000000000003,COMPLETE
3933,0.40020788408414576,0.25,0.5,0.45,0.22500000000000003,0.5,0.05,equal,0.375,0.325,COMPLETE
3934,-0.01792130860361709,0.25,0.45000000000000007,0.425,0.2,0.175,0.07500000000000001,equal,0.4,0.35000000000000003,COMPLETE
3935,0.5116897704700882,0.25,0.42500000000000004,0.45,0.15000000000000002,0.47500000000000003,0.05,equal,0.4,0.325,COMPLETE
3936,0.368727014089392,0.25,0.47500000000000003,0.425,0.22500000000000003,0.5,0.07500000000000001,equal,0.375,0.325,COMPLETE
3937,0.4833926990146578,0.25,0.45000000000000007,0.45,0.175,0.5,0.05,equal,0.375,0.425,COMPLETE
3938,0.48130386313398155,0.275,0.4,0.425,0.2,0.47500000000000003,0.05,equal,0.375,0.35000000000000003,COMPLETE
3939,0.3646879298152224,0.3,0.5,0.425,0.2,0.47500000000000003,0.05,equal,0.375,0.325,COMPLETE
3940,0.4645106324239059,0.25,0.45000000000000007,0.45,0.22500000000000003,0.5,0.05,linear,0.375,0.35000000000000003,COMPLETE
3941,0.02779482122059878,0.22500000000000003,0.9,0.45,0.22500000000000003,0.5,0.07500000000000001,equal,0.375,0.325,COMPLETE
3942,0.5184882620131641,0.22500000000000003,0.47500000000000003,0.425,0.15000000000000002,0.47500000000000003,0.05,equal,0.4,0.35000000000000003,COMPLETE
3943,0.5005309948142411,0.22500000000000003,0.5,0.45,0.2,0.47500000000000003,0.05,equal,0.4,0.325,COMPLETE
3944,0.6271896955157115,0.22500000000000003,0.42500000000000004,0.425,0.175,0.5,0.05,equal,0.375,0.35000000000000003,COMPLETE
3945,0.12049155421411374,0.22500000000000003,0.8500000000000001,0.425,0.22500000000000003,0.5,0.07500000000000001,equal,0.375,0.325,COMPLETE
3946,0.45489160761546393,0.275,0.45000000000000007,0.325,0.175,0.47500000000000003,0.07500000000000001,equal,0.375,0.35000000000000003,COMPLETE
3947,0.43847386084917905,0.25,0.525,0.45,0.175,0.5,0.05,equal,0.375,0.5,COMPLETE
3948,0.27901978008870937,0.22500000000000003,0.6000000000000001,0.425,0.2,0.47500000000000003,0.05,equal,0.35000000000000003,0.325,COMPLETE
3949,-0.01552179863914399,0.22500000000000003,0.07500000000000001,0.45,0.22500000000000003,0.5,0.07500000000000001,equal,0.375,0.35000000000000003,COMPLETE
3950,0.5116897704700882,0.25,0.42500000000000004,0.45,0.15000000000000002,0.47500000000000003,0.05,equal,0.375,0.325,COMPLETE
3951,0.5590158464883748,0.22500000000000003,0.47500000000000003,0.4,0.2,0.47500000000000003,0.05,equal,0.375,0.35000000000000003,COMPLETE
3952,-0.031132888781688642,0.25,0.45000000000000007,0.425,0.175,0.5,0.3,equal,0.4,0.325,COMPLETE
3953,0.2660067602976019,0.22500000000000003,0.47500000000000003,0.425,0.22500000000000003,0.5,0.07500000000000001,equal,0.4,0.35000000000000003,COMPLETE
3954,0.540054987816403,0.22500000000000003,0.45000000000000007,0.4,0.2,0.47500000000000003,0.05,equal,0.375,0.325,COMPLETE
3955,0.3768374383395167,0.25,0.5,0.425,0.15000000000000002,0.47500000000000003,0.05,equal,0.375,0.35000000000000003,COMPLETE
3956,0.4552292233816543,0.22500000000000003,0.42500000000000004,0.45,0.22500000000000003,0.5,0.05,equal,0.4,0.425,COMPLETE
3957,0.5916330302239737,0.275,0.4,0.425,0.175,0.47500000000000003,0.07500000000000001,equal,0.375,0.325,COMPLETE
3958,-0.0708109823553178,0.22500000000000003,0.47500000000000003,0.45,0.05,0.5,0.45,equal,0.375,0.375,COMPLETE
3959,0.12822658047687788,0.425,0.45000000000000007,0.425,0.2,0.47500000000000003,0.05,equal,0.4,0.35000000000000003,COMPLETE
3960,0.2588802544980143,0.2,0.47500000000000003,0.4,0.22500000000000003,0.5,0.07500000000000001,equal,0.375,0.4,COMPLETE
3961,0.438917185240735,0.25,0.45000000000000007,0.45,0.175,0.5,0.05,linear,0.4,0.325,COMPLETE
3962,0.5082691706458724,0.22500000000000003,0.4,0.4,0.2,0.47500000000000003,0.05,equal,0.375,0.35000000000000003,COMPLETE
3963,0.3625426361181995,0.275,0.5,0.425,0.2,0.47500000000000003,0.05,equal,0.35000000000000003,0.375,COMPLETE
3964,0.33738980572513044,0.05,0.42500000000000004,0.375,0.2,0.25,0.05,equal,0.4,0.4,COMPLETE
3965,0.4757874546787978,0.22500000000000003,0.5,0.45,0.15000000000000002,0.47500000000000003,0.05,equal,0.4,0.375,COMPLETE
3966,0.545118328989346,0.2,0.45000000000000007,0.4,0.175,0.5,0.05,equal,0.35000000000000003,0.375,COMPLETE
3967,0.3096436983591039,0.22500000000000003,0.47500000000000003,0.45,0.22500000000000003,0.5,0.07500000000000001,equal,0.175,0.325,COMPLETE
3968,0.5851660751418166,0.2,0.42500000000000004,0.47500000000000003,0.15000000000000002,0.47500000000000003,0.05,equal,0.375,0.35000000000000003,COMPLETE
3969,0.2480506198336554,0.2,0.525,0.4,0.22500000000000003,0.5,0.07500000000000001,equal,0.375,0.325,COMPLETE
3970,0.5400549878164034,0.25,0.45000000000000007,0.425,0.2,0.47500000000000003,0.05,equal,0.375,0.375,COMPLETE
3971,0.6178023927042292,0.22500000000000003,0.47500000000000003,0.425,0.2,0.47500000000000003,0.05,equal,0.35000000000000003,0.35000000000000003,COMPLETE
3972,0.6140766273833023,0.22500000000000003,0.42500000000000004,0.45,0.175,0.5,0.05,equal,0.35000000000000003,0.4,COMPLETE
3973,0.46537867234066216,0.2,0.45000000000000007,0.47500000000000003,0.22500000000000003,0.5,0.07500000000000001,equal,0.4,0.375,COMPLETE
3974,0.46326331304828516,0.25,0.5,0.45,0.175,0.5,0.05,equal,0.375,0.325,COMPLETE
3975,0.6409572857839799,0.25,0.47500000000000003,0.425,0.2,0.47500000000000003,0.05,equal,0.35000000000000003,0.35000000000000003,COMPLETE
3976,0.4934411703914466,0.22500000000000003,0.45000000000000007,0.425,0.22500000000000003,0.47500000000000003,0.07500000000000001,equal,0.375,0.375,COMPLETE
3977,0.347668669821555,0.2,0.4,0.4,0.22500000000000003,0.5,0.07500000000000001,equal,0.375,0.425,COMPLETE
3978,0.4354907728234944,0.22500000000000003,0.47500000000000003,0.45,0.15000000000000002,0.47500000000000003,0.05,equal,0.35000000000000003,0.15000000000000002,COMPLETE
3979,0.06208201105107568,0.45,0.42500000000000004,0.15000000000000002,0.175,0.5,0.2,equal,0.375,0.325,COMPLETE
3980,0.6030162949851462,0.275,0.45000000000000007,0.425,0.2,0.47500000000000003,0.05,equal,0.4,0.425,COMPLETE
3981,0.3875631695064455,0.2,0.47500000000000003,0.4,0.175,0.5,0.05,equal,0.375,0.35000000000000003,COMPLETE
3982,0.22803435033205416,0.22500000000000003,0.525,0.45,0.22500000000000003,0.5,0.07500000000000001,linear,0.35000000000000003,0.325,COMPLETE
3983,-0.10565869288642094,0.2,0.42500000000000004,0.4,0.125,0.47500000000000003,0.375,equal,0.375,0.4,COMPLETE
3984,0.36254263611819904,0.25,0.5,0.45,0.2,0.47500000000000003,0.05,equal,0.35000000000000003,0.375,COMPLETE
3985,0.5082691706458724,0.22500000000000003,0.4,0.425,0.15000000000000002,0.47500000000000003,0.05,equal,0.4,0.35000000000000003,COMPLETE
3986,0.06799512489291534,0.2,0.45000000000000007,0.47500000000000003,0.2,0.2,0.05,equal,0.4,0.4,COMPLETE
3987,0.34065045033948366,0.22500000000000003,0.7500000000000001,0.425,0.175,0.47500000000000003,0.07500000000000001,equal,0.35000000000000003,0.325,COMPLETE
3988,0.0076315544091309084,0.5750000000000001,0.42500000000000004,0.3,0.22500000000000003,0.5,0.05,equal,0.375,0.375,COMPLETE
3989,0.3732689027745657,0.2,0.47500000000000003,0.4,0.2,0.275,0.05,equal,0.375,0.47500000000000003,COMPLETE
3990,0.05761601509927487,0.175,0.45000000000000007,0.4,0.22500000000000003,0.5,0.25,equal,0.35000000000000003,0.35000000000000003,COMPLETE
3991,0.05271155735469815,0.25,0.47500000000000003,0.6000000000000001,0.22500000000000003,0.5,0.07500000000000001,equal,0.15000000000000002,0.325,COMPLETE
3992,0.48106519175251083,0.2,0.45000000000000007,0.4,0.15000000000000002,0.47500000000000003,0.05,equal,0.375,0.375,COMPLETE
3993,0.24975199562798056,0.275,0.5,0.425,0.22500000000000003,0.5,0.07500000000000001,equal,0.4,0.4,COMPLETE
3994,0.46987331656635456,0.22500000000000003,0.4,0.45,0.2,0.47500000000000003,0.05,equal,0.35000000000000003,0.35000000000000003,COMPLETE
3995,0.39680372788629115,0.2,0.5,0.47500000000000003,0.175,0.5,0.05,equal,0.25,0.325,COMPLETE
3996,0.5991697496493731,0.175,0.45000000000000007,0.47500000000000003,0.2,0.47500000000000003,0.05,equal,0.35000000000000003,0.375,COMPLETE
3997,0.4833926990146572,0.25,0.47500000000000003,0.45,0.175,0.5,0.05,equal,0.375,0.35000000000000003,COMPLETE
3998,0.4865317600627189,0.22500000000000003,0.42500000000000004,0.425,0.175,0.47500000000000003,0.07500000000000001,equal,0.375,0.325,COMPLETE
3999,0.2669972238753751,0.325,0.42500000000000004,0.5750000000000001,0.22500000000000003,0.5,0.05,equal,0.35000000000000003,0.4,COMPLETE
4000,0.5184882620131641,0.2,0.47500000000000003,0.4,0.15000000000000002,0.47500000000000003,0.05,equal,0.375,0.375,COMPLETE
4001,0.5813863673023744,0.175,0.45000000000000007,0.47500000000000003,0.2,0.47500000000000003,0.05,equal,0.4,0.35000000000000003,COMPLETE
4002,0.2480506198336554,0.22500000000000003,0.525,0.45,0.22500000000000003,0.47500000000000003,0.07500000000000001,equal,0.4,0.325,COMPLETE
4003,0.4904368971520059,0.2,0.42500000000000004,0.4,0.175,0.5,0.05,linear,0.35000000000000003,0.4,COMPLETE
4004,0.49344117039144675,0.2,0.47500000000000003,0.47500000000000003,0.22500000000000003,0.5,0.07500000000000001,equal,0.375,0.35000000000000003,COMPLETE
4005,0.4833926990146578,0.25,0.45000000000000007,0.425,0.175,0.5,0.05,equal,0.375,0.45,COMPLETE
4006,0.24805061983365495,0.22500000000000003,0.55,0.45,0.2,0.47500000000000003,0.05,equal,0.35000000000000003,0.375,COMPLETE
4007,0.5019703674716833,0.175,0.47500000000000003,0.47500000000000003,0.22500000000000003,0.5,0.05,equal,0.375,0.325,COMPLETE
4008,0.4201554617234135,0.2,0.5,0.4,0.2,0.47500000000000003,0.05,equal,0.25,0.375,COMPLETE
4009,0.4315981749928191,0.25,0.4,0.425,0.22500000000000003,0.5,0.07500000000000001,equal,0.35000000000000003,0.325,COMPLETE
4010,-0.07370503831287378,0.22500000000000003,0.42500000000000004,0.425,0.45,0.47500000000000003,0.05,equal,0.4,0.35000000000000003,COMPLETE
4011,0.09542752604869283,0.175,0.45000000000000007,0.7250000000000001,0.22500000000000003,0.5,0.07500000000000001,equal,0.375,0.375,COMPLETE
4012,0.48057533765981564,0.2,0.47500000000000003,0.4,0.15000000000000002,0.47500000000000003,0.05,equal,0.275,0.4,COMPLETE
4013,0.4502373295808427,0.22500000000000003,0.5,0.45,0.175,0.5,0.05,equal,0.35000000000000003,0.35000000000000003,COMPLETE
4014,-0.03043436782952921,0.15000000000000002,0.42500000000000004,0.375,0.22500000000000003,0.47500000000000003,0.15000000000000002,equal,0.3,0.325,COMPLETE
4015,0.4702110117134355,0.25,0.45000000000000007,0.45,0.175,0.5,0.05,equal,0.35000000000000003,0.375,COMPLETE
4016,0.2636266831766248,0.22500000000000003,0.47500000000000003,0.425,0.2,0.47500000000000003,0.05,equal,0.375,0.05,COMPLETE
4017,0.4153658382516877,0.2,0.5,0.4,0.175,0.47500000000000003,0.07500000000000001,equal,0.275,0.325,COMPLETE
4018,0.15846442943734657,0.3,0.45000000000000007,0.6250000000000001,0.175,0.5,0.05,equal,0.4,0.4,COMPLETE
4019,0.4281303432385472,0.275,0.42500000000000004,0.425,0.22500000000000003,0.5,0.05,equal,0.275,0.35000000000000003,COMPLETE
4020,0.5035593379328687,0.175,0.4,0.47500000000000003,0.22500000000000003,0.47500000000000003,0.07500000000000001,equal,0.35000000000000003,0.375,COMPLETE
4021,0.4702110117134355,0.22500000000000003,0.45000000000000007,0.45,0.175,0.5,0.05,equal,0.325,0.325,COMPLETE
4022,0.4153658382516887,0.2,0.5,0.4,0.2,0.47500000000000003,0.05,equal,0.375,0.35000000000000003,COMPLETE
4023,-0.11007797960356487,0.22500000000000003,0.47500000000000003,0.425,0.075,0.5,0.425,linear,0.3,0.4,COMPLETE
