number,value,params_fund_net_buying,params_institutional_weight,params_number_fund_holdings,params_pe,params_revenue_growth,params_roe,params_stock_weight_option,params_take_profit,params_trailing_stop_loss,state
2529,0.3357043545940863,0.275,0.5,0.425,0.22500000000000003,0.47500000000000003,0.05,equal,0.47500000000000003,0.275,COMPLETE
2530,0.4945739955863566,0.175,0.42500000000000004,0.375,0.25,0.47500000000000003,0.07500000000000001,equal,0.45,0.275,COMPLETE
2531,0.475787454678798,0.22500000000000003,0.47500000000000003,0.45,0.2,0.45,0.05,equal,0.47500000000000003,0.3,COMPLETE
2532,-0.08486127689296039,0.2,0.45000000000000007,0.47500000000000003,0.07500000000000001,0.45,0.45,equal,0.5,0.22500000000000003,COMPLETE
2533,0.3343348908010547,0.22500000000000003,0.4,0.45,0.25,0.47500000000000003,0.07500000000000001,softmax,0.47500000000000003,0.3,COMPLETE
2534,0.38091795582164073,0.25,0.5,0.425,0.22500000000000003,0.47500000000000003,0.05,equal,0.45,0.275,COMPLETE
2535,0.3724313931539709,0.175,0.45000000000000007,0.375,0.25,0.45,0.1,equal,0.47500000000000003,0.3,COMPLETE
2536,0.269889047781631,0.2,0.47500000000000003,0.4,0.25,0.5,0.05,equal,0.5,0.25,COMPLETE
2537,0.1748326885097456,0.22500000000000003,0.42500000000000004,0.45,0.275,0.375,0.07500000000000001,equal,0.425,0.275,COMPLETE
2538,0.07272759911783616,0.25,0.4,0.425,0.275,0.275,0.05,softmax,0.47500000000000003,0.3,COMPLETE
2539,0.36318546548519687,0.2,0.47500000000000003,0.47500000000000003,0.25,0.47500000000000003,0.07500000000000001,equal,0.5,0.25,COMPLETE
2540,0.35215803316270466,0.175,0.45000000000000007,0.375,0.2,0.45,0.05,equal,0.47500000000000003,0.2,COMPLETE
2541,0.44185439477077654,0.22500000000000003,0.45000000000000007,0.45,0.25,0.47500000000000003,0.07500000000000001,equal,0.5,0.275,COMPLETE
2542,0.28274856291388173,0.275,0.42500000000000004,0.425,0.375,0.425,0.05,equal,0.425,0.3,COMPLETE
2543,0.4879374543029245,0.22500000000000003,0.47500000000000003,0.45,0.25,0.5,0.05,softmax,0.45,0.22500000000000003,COMPLETE
2544,0.49987014765620225,0.2,0.4,0.4,0.22500000000000003,0.45,0.07500000000000001,equal,0.5,0.3,COMPLETE
2545,0.3876733242368896,0.2,0.5,0.4,0.22500000000000003,0.47500000000000003,0.05,equal,0.47500000000000003,0.25,COMPLETE
2546,0.507640390787344,0.25,0.42500000000000004,0.425,0.25,0.45,0.1,equal,0.47500000000000003,0.275,COMPLETE
2547,0.4386031804433617,0.15000000000000002,0.45000000000000007,0.375,0.22500000000000003,0.47500000000000003,0.05,equal,0.5,0.3,COMPLETE
2548,0.3631054093491277,0.22500000000000003,0.47500000000000003,0.45,0.25,0.47500000000000003,0.07500000000000001,softmax,0.45,0.275,COMPLETE
2549,0.38175893448248804,0.15000000000000002,0.42500000000000004,0.35000000000000003,0.275,0.425,0.05,equal,0.47500000000000003,0.5,COMPLETE
2550,0.27901978008870937,0.2,0.525,0.45,0.25,0.5,0.05,equal,0.5,0.3,COMPLETE
2551,0.5118723179709881,0.22500000000000003,0.45000000000000007,0.425,0.22500000000000003,0.45,0.07500000000000001,equal,0.45,0.275,COMPLETE
2552,0.38623101854755953,0.175,0.5,0.47500000000000003,0.22500000000000003,0.45,0.07500000000000001,equal,0.4,0.25,COMPLETE
2553,0.3171373234746394,0.25,0.5750000000000001,0.425,0.25,0.47500000000000003,0.1,equal,0.275,0.275,COMPLETE
2554,0.5886627223042763,0.175,0.47500000000000003,0.5,0.22500000000000003,0.47500000000000003,0.05,softmax,0.47500000000000003,0.3,COMPLETE
2555,0.5015797626641589,0.2,0.45000000000000007,0.4,0.2,0.45,0.05,equal,0.5,0.22500000000000003,COMPLETE
2556,0.3126563954800639,0.22500000000000003,0.4,0.425,0.25,0.5,0.07500000000000001,equal,0.47500000000000003,0.3,COMPLETE
2557,0.5169134067688719,0.22500000000000003,0.42500000000000004,0.45,0.275,0.45,0.05,equal,0.5,0.25,COMPLETE
2558,0.2401820538892346,0.25,0.47500000000000003,0.45,0.275,0.4,0.07500000000000001,equal,0.45,0.275,COMPLETE
2559,0.07649017992855879,0.2,0.45000000000000007,0.47500000000000003,0.2,0.2,0.05,softmax,0.47500000000000003,0.25,COMPLETE
2560,0.3948605479095605,0.2,0.5,0.4,0.2,0.425,0.07500000000000001,equal,0.47500000000000003,0.3,COMPLETE
2561,0.4575013620128508,0.25,0.45000000000000007,0.45,0.25,0.5,0.05,equal,0.5,0.275,COMPLETE
2562,0.23832211599745384,0.275,0.37500000000000006,0.425,0.25,0.47500000000000003,0.07500000000000001,equal,0.35000000000000003,0.3,COMPLETE
2563,0.009034598122795261,0.22500000000000003,0.1,0.6250000000000001,0.22500000000000003,0.47500000000000003,0.05,equal,0.45,0.25,COMPLETE
2564,0.4683228418174183,0.175,0.42500000000000004,0.375,0.22500000000000003,0.45,0.07500000000000001,softmax,0.3,0.275,COMPLETE
2565,0.4054499428791837,0.22500000000000003,0.4,0.425,0.22500000000000003,0.425,0.1,equal,0.47500000000000003,0.22500000000000003,COMPLETE
2566,0.08858030852852503,0.2,0.47500000000000003,0.4,0.22500000000000003,0.47500000000000003,0.05,equal,0.5,0.05,COMPLETE
2567,0.47594553862564115,0.2,0.45000000000000007,0.47500000000000003,0.25,0.5,0.05,equal,0.47500000000000003,0.3,COMPLETE
2568,0.45858672746388346,0.3,0.42500000000000004,0.425,0.275,0.45,0.05,equal,0.5,0.275,COMPLETE
2569,0.31534174630827994,0.175,0.47500000000000003,0.5,0.25,0.47500000000000003,0.07500000000000001,softmax,0.45,0.25,COMPLETE
2570,0.277555368223483,0.22500000000000003,0.5,0.45,0.25,0.47500000000000003,0.07500000000000001,equal,0.47500000000000003,0.275,COMPLETE
2571,0.468790590874879,0.25,0.45000000000000007,0.45,0.275,0.45,0.05,equal,0.425,0.3,COMPLETE
2572,0.49457399558635684,0.15000000000000002,0.42500000000000004,0.375,0.25,0.47500000000000003,0.07500000000000001,equal,0.5,0.375,COMPLETE
2573,0.23990338557364643,0.175,0.525,0.47500000000000003,0.275,0.325,0.05,equal,0.175,0.275,COMPLETE
2574,0.3866406381590719,0.22500000000000003,0.45000000000000007,0.425,0.25,0.45,0.1,softmax,0.47500000000000003,0.3,COMPLETE
2575,0.3107365848086626,0.2,0.4,0.4,0.25,0.5,0.07500000000000001,equal,0.47500000000000003,0.25,COMPLETE
2576,0.018192007483422878,0.8,0.7250000000000001,0.05,0.22500000000000003,0.47500000000000003,0.05,equal,0.45,0.3,COMPLETE
2577,0.34493601969530463,0.25,0.47500000000000003,0.45,0.275,0.425,0.05,equal,0.5,0.275,COMPLETE
2578,0.4026898737074063,0.2,0.42500000000000004,0.47500000000000003,0.25,0.5,0.07500000000000001,equal,0.22500000000000003,0.275,COMPLETE
2579,0.6021780566265794,0.175,0.47500000000000003,0.47500000000000003,0.22500000000000003,0.47500000000000003,0.05,equal,0.5,0.22500000000000003,COMPLETE
2580,0.401159855982663,0.22500000000000003,0.525,0.425,0.22500000000000003,0.45,0.07500000000000001,softmax,0.45,0.3,COMPLETE
2581,0.1305130285977383,0.4,0.55,0.425,0.3,0.45,0.05,equal,0.47500000000000003,0.25,COMPLETE
2582,0.30743970666926657,0.22500000000000003,0.45000000000000007,0.425,0.25,0.47500000000000003,0.1,equal,0.47500000000000003,0.3,COMPLETE
2583,0.6246360197681787,0.2,0.42500000000000004,0.45,0.22500000000000003,0.47500000000000003,0.05,equal,0.5,0.275,COMPLETE
2584,0.16843539387167547,0.525,0.47500000000000003,0.22500000000000003,0.2,0.35000000000000003,0.05,equal,0.47500000000000003,0.22500000000000003,COMPLETE
2585,-0.041221671731188535,0.6000000000000001,0.5,0.15000000000000002,0.15000000000000002,0.45,0.07500000000000001,softmax,0.5,0.275,COMPLETE
2586,-0.1627219420978482,0.25,0.45000000000000007,0.45,0.07500000000000001,0.5,0.4,equal,0.05,0.3,COMPLETE
2587,0.50014399931125,0.2,0.4,0.4,0.2,0.45,0.05,equal,0.45,0.275,COMPLETE
2588,0.22823347322725948,0.275,0.37500000000000006,0.425,0.25,0.47500000000000003,0.07500000000000001,equal,0.5,0.25,COMPLETE
2589,0.4612226398212145,0.22500000000000003,0.45000000000000007,0.425,0.275,0.425,0.05,equal,0.47500000000000003,0.3,COMPLETE
2590,0.4877897932760551,0.25,0.47500000000000003,0.45,0.22500000000000003,0.45,0.07500000000000001,softmax,0.45,0.25,COMPLETE
2591,0.535398913989829,0.2,0.42500000000000004,0.4,0.22500000000000003,0.47500000000000003,0.05,equal,0.425,0.3,COMPLETE
2592,0.4575013620128508,0.22500000000000003,0.45000000000000007,0.45,0.25,0.5,0.05,equal,0.47500000000000003,0.275,COMPLETE
2593,0.48816348914485647,0.175,0.4,0.47500000000000003,0.22500000000000003,0.45,0.07500000000000001,equal,0.5,0.25,COMPLETE
2594,0.5005309948142406,0.175,0.5,0.47500000000000003,0.22500000000000003,0.47500000000000003,0.05,equal,0.47500000000000003,0.3,COMPLETE
2595,0.3776746697789941,0.25,0.47500000000000003,0.425,0.25,0.45,0.07500000000000001,softmax,0.5,0.3,COMPLETE
2596,0.29653363831981855,0.22500000000000003,0.42500000000000004,0.5750000000000001,0.25,0.5,0.05,equal,0.45,0.275,COMPLETE
2597,0.3361110002441683,0.15000000000000002,0.45000000000000007,0.35000000000000003,0.2,0.45,0.05,equal,0.47500000000000003,0.25,COMPLETE
2598,0.24225404379209764,0.22500000000000003,0.42500000000000004,0.425,0.25,0.47500000000000003,0.1,equal,0.47500000000000003,0.275,COMPLETE
2599,0.1787000508472757,0.175,0.25,0.4,0.275,0.425,0.07500000000000001,equal,0.325,0.3,COMPLETE
2600,0.24919202849266248,0.2,0.5,0.45,0.275,0.3,0.07500000000000001,softmax,0.5,0.22500000000000003,COMPLETE
2601,0.4392588750658678,0.275,0.45000000000000007,0.425,0.22500000000000003,0.47500000000000003,0.05,equal,0.45,0.275,COMPLETE
2602,0.5307954049525634,0.2,0.47500000000000003,0.4,0.22500000000000003,0.47500000000000003,0.05,equal,0.47500000000000003,0.275,COMPLETE
2603,0.3984657209487949,0.22500000000000003,0.4,0.45,0.22500000000000003,0.45,0.07500000000000001,equal,0.5,0.2,COMPLETE
2604,0.3557119441207932,0.25,0.5,0.45,0.25,0.5,0.05,equal,0.5,0.3,COMPLETE
2605,0.3074948739936228,0.2,0.47500000000000003,0.4,0.25,0.45,0.1,equal,0.47500000000000003,0.175,COMPLETE
2606,0.6107987739752978,0.22500000000000003,0.45000000000000007,0.425,0.22500000000000003,0.47500000000000003,0.05,softmax,0.45,0.25,COMPLETE
2607,0.3490860027240515,0.2,0.42500000000000004,0.47500000000000003,0.25,0.47500000000000003,0.07500000000000001,equal,0.47500000000000003,0.275,COMPLETE
2608,0.4328476490063638,0.25,0.45000000000000007,0.425,0.25,0.47500000000000003,0.07500000000000001,equal,0.5,0.275,COMPLETE
2609,0.47869999262843776,0.22500000000000003,0.42500000000000004,0.45,0.275,0.425,0.05,equal,0.47500000000000003,0.3,COMPLETE
2610,0.4407645160375513,0.175,0.47500000000000003,0.5,0.22500000000000003,0.45,0.07500000000000001,equal,0.47500000000000003,0.22500000000000003,COMPLETE
2611,0.3795843350736619,0.2,0.4,0.4,0.25,0.5,0.05,softmax,0.45,0.3,COMPLETE
2612,0.3948605479095605,0.22500000000000003,0.47500000000000003,0.425,0.22500000000000003,0.45,0.07500000000000001,equal,0.5,0.275,COMPLETE
2613,0.3357043545940863,0.275,0.5,0.425,0.22500000000000003,0.47500000000000003,0.05,equal,0.5,0.25,COMPLETE
2614,0.3792888827951747,0.175,0.37500000000000006,0.375,0.25,0.425,0.1,equal,0.47500000000000003,0.25,COMPLETE
2615,0.48135057869143705,0.2,0.42500000000000004,0.47500000000000003,0.2,0.45,0.05,equal,0.4,0.3,COMPLETE
2616,0.005349743402186783,0.22500000000000003,0.45000000000000007,0.45,0.275,0.125,0.05,softmax,0.25,0.3,COMPLETE
2617,0.3631854654851971,0.15000000000000002,0.47500000000000003,0.5,0.25,0.5,0.07500000000000001,equal,0.45,0.275,COMPLETE
2618,0.5146797748870207,0.25,0.42500000000000004,0.45,0.22500000000000003,0.47500000000000003,0.05,equal,0.5,0.25,COMPLETE
2619,0.35075736649025063,0.2,0.45000000000000007,0.4,0.25,0.47500000000000003,0.07500000000000001,equal,0.47500000000000003,0.3,COMPLETE
2620,0.3948605479095596,0.22500000000000003,0.525,0.425,0.2,0.45,0.05,equal,0.425,0.25,COMPLETE
2621,0.3050257114009356,0.2,0.4,0.4,0.25,0.5,0.07500000000000001,softmax,0.47500000000000003,0.275,COMPLETE
2622,-0.043703572091285975,0.25,0.45000000000000007,0.45,0.25,0.45,0.2,equal,0.45,0.175,COMPLETE
2623,0.06686486041113537,0.175,0.5,0.47500000000000003,0.125,0.47500000000000003,0.325,equal,0.5,0.275,COMPLETE
2624,0.6732981449451316,0.22500000000000003,0.47500000000000003,0.425,0.22500000000000003,0.47500000000000003,0.05,equal,0.375,0.3,COMPLETE
2625,0.09833410066985318,0.275,0.525,0.425,0.275,0.45,0.05,equal,0.35000000000000003,0.22500000000000003,COMPLETE
2626,0.35214575644078777,0.275,0.5,0.425,0.25,0.5,0.05,equal,0.275,0.3,COMPLETE
2627,0.2657787285254982,0.25,0.55,0.425,0.22500000000000003,0.47500000000000003,0.05,softmax,0.325,0.275,COMPLETE
2628,0.43605246991593605,0.275,0.525,0.425,0.2,0.425,0.05,equal,0.375,0.25,COMPLETE
2629,0.20663575436866138,0.25,0.5,0.425,0.275,0.45,0.05,equal,0.375,0.3,COMPLETE
2630,0.27755536822348237,0.25,0.525,0.425,0.22500000000000003,0.47500000000000003,0.05,equal,0.325,0.275,COMPLETE
2631,0.3768374383395165,0.3,0.5,0.425,0.15000000000000002,0.45,0.05,equal,0.375,0.3,COMPLETE
2632,0.3462059593065894,0.25,0.47500000000000003,0.425,0.25,0.47500000000000003,0.05,softmax,0.325,0.275,COMPLETE
2633,0.0975942476640429,0.22500000000000003,0.5,0.4,0.25,0.45,0.275,equal,0.375,0.25,COMPLETE
2634,0.3187889865277847,0.25,0.5,0.4,0.25,0.4,0.175,equal,0.375,0.3,COMPLETE
2635,0.46996310735204133,0.25,0.47500000000000003,0.425,0.25,0.5,0.05,equal,0.325,0.25,COMPLETE
2636,0.11203287604242448,0.22500000000000003,0.775,0.4,0.22500000000000003,0.47500000000000003,0.05,equal,0.4,0.22500000000000003,COMPLETE
2637,0.26569316250896147,0.22500000000000003,0.525,0.4,0.22500000000000003,0.47500000000000003,0.05,softmax,0.325,0.275,COMPLETE
2638,0.31983486840769304,0.25,0.47500000000000003,0.425,0.3,0.425,0.05,equal,0.3,0.3,COMPLETE
2639,-0.017921308603617243,0.22500000000000003,0.47500000000000003,0.4,0.2,0.05,0.05,equal,0.3,0.3,COMPLETE
2640,0.2775553682234829,0.22500000000000003,0.5,0.4,0.22500000000000003,0.47500000000000003,0.05,equal,0.375,0.275,COMPLETE
2641,0.35872147575948876,0.275,0.47500000000000003,0.425,0.2,0.45,0.05,equal,0.375,0.375,COMPLETE
2642,-0.01811382154865944,0.22500000000000003,0.47500000000000003,0.4,0.4,0.5,0.05,equal,0.325,0.275,COMPLETE
2643,0.06614139252328996,0.25,0.5,0.425,0.325,0.47500000000000003,0.05,softmax,0.35000000000000003,0.275,COMPLETE
2644,0.3902089543187305,0.22500000000000003,0.47500000000000003,0.425,0.275,0.45,0.05,equal,0.325,0.25,COMPLETE
2645,0.4098385943201953,0.25,0.5,0.425,0.22500000000000003,0.47500000000000003,0.05,equal,0.35000000000000003,0.3,COMPLETE
2646,0.3938566260041254,0.22500000000000003,0.45000000000000007,0.4,0.275,0.425,0.05,equal,0.375,0.25,COMPLETE
2647,0.11084384362916266,0.22500000000000003,0.47500000000000003,0.425,0.22500000000000003,0.5,0.25,equal,0.4,0.275,COMPLETE
2648,0.15229469087890157,0.47500000000000003,0.45000000000000007,0.425,0.275,0.45,0.05,softmax,0.325,0.325,COMPLETE
2649,0.43605246991593594,0.25,0.55,0.45,0.2,0.45,0.05,equal,0.375,0.3,COMPLETE
2650,0.173850942078922,0.25,0.47500000000000003,0.425,0.3,0.45,0.05,equal,0.4,0.22500000000000003,COMPLETE
2651,0.2321510568752077,0.275,0.525,0.425,0.25,0.47500000000000003,0.05,equal,0.35000000000000003,0.3,COMPLETE
2652,0.43049378221700085,0.22500000000000003,0.45000000000000007,0.4,0.25,0.5,0.05,equal,0.4,0.275,COMPLETE
2653,-0.13639621150419864,0.6500000000000001,0.47500000000000003,0.325,0.25,0.47500000000000003,0.05,softmax,0.35000000000000003,0.325,COMPLETE
2654,0.41839647054414664,0.2,0.5,0.375,0.275,0.45,0.05,equal,0.3,0.3,COMPLETE
2655,0.46805559007839703,0.22500000000000003,0.45000000000000007,0.4,0.2,0.425,0.05,equal,0.4,0.2,COMPLETE
2656,0.5186039954596487,0.2,0.42500000000000004,0.4,0.22500000000000003,0.47500000000000003,0.05,equal,0.35000000000000003,0.25,COMPLETE
2657,0.484694701820659,0.22500000000000003,0.47500000000000003,0.45,0.25,0.47500000000000003,0.05,equal,0.5,0.275,COMPLETE
2658,0.3130358543280951,0.25,0.5,0.45,0.275,0.45,0.05,equal,0.4,0.3,COMPLETE
2659,0.4530475263308851,0.22500000000000003,0.45000000000000007,0.45,0.25,0.47500000000000003,0.05,softmax,0.375,0.22500000000000003,COMPLETE
2660,0.3994627005516794,0.2,0.42500000000000004,0.4,0.25,0.5,0.05,equal,0.375,0.25,COMPLETE
2661,0.40179387991626164,0.25,0.47500000000000003,0.425,0.275,0.45,0.05,equal,0.35000000000000003,0.275,COMPLETE
2662,0.44617118692891755,0.22500000000000003,0.45000000000000007,0.425,0.25,0.5,0.05,equal,0.35000000000000003,0.325,COMPLETE
2663,0.22098249092178862,0.275,0.525,0.425,0.22500000000000003,0.47500000000000003,0.05,softmax,0.5,0.3,COMPLETE
2664,-0.015479094685331103,0.7500000000000001,0.42500000000000004,0.125,0.22500000000000003,0.47500000000000003,0.05,equal,0.4,0.15000000000000002,COMPLETE
2665,0.48089852693722146,0.2,0.37500000000000006,0.4,0.2,0.45,0.05,equal,0.3,0.275,COMPLETE
2666,0.45146981845582257,0.22500000000000003,0.45000000000000007,0.45,0.25,0.47500000000000003,0.05,equal,0.35000000000000003,0.275,COMPLETE
2667,0.06453293476411184,0.2,0.47500000000000003,0.375,0.275,0.175,0.05,equal,0.35000000000000003,0.25,COMPLETE
2668,0.4562803229590916,0.22500000000000003,0.4,0.45,0.275,0.425,0.05,equal,0.5,0.325,COMPLETE
2669,0.46677330733463707,0.3,0.42500000000000004,0.425,0.22500000000000003,0.45,0.05,softmax,0.35000000000000003,0.3,COMPLETE
2670,0.2660067602976019,0.25,0.5,0.45,0.25,0.5,0.07500000000000001,equal,0.5,0.3,COMPLETE
2671,0.3493851684085263,0.2,0.45000000000000007,0.4,0.25,0.47500000000000003,0.07500000000000001,equal,0.5,0.25,COMPLETE
2672,0.04626205052683608,0.2,0.47500000000000003,0.4,0.25,0.45,0.22500000000000003,equal,0.4,0.275,COMPLETE
2673,0.3920942834237207,0.275,0.42500000000000004,0.425,0.2,0.45,0.05,equal,0.5,0.275,COMPLETE
2674,0.3697638423739319,0.25,0.5,0.425,0.22500000000000003,0.47500000000000003,0.05,softmax,0.5,0.3,COMPLETE
2675,0.29595092477823115,0.22500000000000003,0.4,0.45,0.25,0.5,0.07500000000000001,equal,0.375,0.25,COMPLETE
2676,0.37196656556578506,0.2,0.45000000000000007,0.375,0.15000000000000002,0.45,0.05,equal,0.47500000000000003,0.325,COMPLETE
2677,0.512729918411351,0.2,0.47500000000000003,0.4,0.22500000000000003,0.47500000000000003,0.05,equal,0.325,0.22500000000000003,COMPLETE
2678,0.37102823142798647,0.22500000000000003,0.45000000000000007,0.425,0.275,0.425,0.07500000000000001,equal,0.35000000000000003,0.375,COMPLETE
2679,0.5771878314770038,0.22500000000000003,0.42500000000000004,0.45,0.22500000000000003,0.47500000000000003,0.05,softmax,0.275,0.3,COMPLETE
2680,0.41839647054414664,0.25,0.5,0.425,0.25,0.45,0.07500000000000001,equal,0.5,0.275,COMPLETE
2681,0.0491845937291576,0.175,0.47500000000000003,0.7250000000000001,0.25,0.5,0.07500000000000001,equal,0.5,0.2,COMPLETE
2682,0.5353989139898288,0.175,0.45000000000000007,0.375,0.22500000000000003,0.47500000000000003,0.05,equal,0.47500000000000003,0.3,COMPLETE
2683,0.4393468618113383,0.25,0.4,0.45,0.2,0.45,0.05,equal,0.3,0.275,COMPLETE
2684,0.47641870992615243,0.2,0.42500000000000004,0.4,0.275,0.425,0.07500000000000001,softmax,0.5,0.325,COMPLETE
2685,0.6246360197681785,0.22500000000000003,0.45000000000000007,0.425,0.22500000000000003,0.47500000000000003,0.05,equal,0.47500000000000003,0.25,COMPLETE
2686,0.17253335329083927,0.375,0.47500000000000003,0.275,0.25,0.47500000000000003,0.05,equal,0.3,0.275,COMPLETE
2687,0.40982396755878314,0.175,0.525,0.4,0.25,0.45,0.07500000000000001,equal,0.5,0.25,COMPLETE
2688,-0.08313028302838782,0.2,0.45000000000000007,0.4,0.05,0.5,0.425,equal,0.47500000000000003,0.3,COMPLETE
2689,0.30543790083805267,0.325,0.42500000000000004,0.425,0.25,0.47500000000000003,0.05,softmax,0.47500000000000003,0.3,COMPLETE
2690,0.45643086703144264,0.22500000000000003,0.37500000000000006,0.45,0.2,0.45,0.05,equal,0.5,0.275,COMPLETE
2691,0.48222381390891916,0.275,0.47500000000000003,0.425,0.22500000000000003,0.45,0.07500000000000001,equal,0.47500000000000003,0.325,COMPLETE
2692,0.41839647054414597,0.175,0.5,0.375,0.275,0.425,0.05,equal,0.5,0.275,COMPLETE
2693,0.1254449376540209,0.7250000000000001,0.4,0.25,0.22500000000000003,0.47500000000000003,0.05,equal,0.47500000000000003,0.25,COMPLETE
2694,0.45368112748611655,0.22500000000000003,0.45000000000000007,0.45,0.25,0.5,0.07500000000000001,softmax,0.47500000000000003,0.3,COMPLETE
2695,0.5236671143685783,0.2,0.42500000000000004,0.4,0.22500000000000003,0.45,0.05,equal,0.5,0.275,COMPLETE
2696,0.33078752244668075,0.25,0.47500000000000003,0.45,0.25,0.47500000000000003,0.07500000000000001,equal,0.47500000000000003,0.4,COMPLETE
2697,0.01368180256116126,0.2,0.45000000000000007,0.47500000000000003,0.125,0.47500000000000003,0.3,equal,0.5,0.3,COMPLETE
2698,0.20507179075143683,0.25,0.5,0.425,0.275,0.45,0.05,equal,0.4,0.25,COMPLETE
2699,0.4254050218213211,0.22500000000000003,0.42500000000000004,0.45,0.25,0.5,0.07500000000000001,equal,0.47500000000000003,0.22500000000000003,COMPLETE
2700,0.4141948808837855,0.2,0.47500000000000003,0.4,0.22500000000000003,0.45,0.05,softmax,0.47500000000000003,0.47500000000000003,COMPLETE
2701,0.44185439477077654,0.22500000000000003,0.45000000000000007,0.45,0.25,0.47500000000000003,0.07500000000000001,equal,0.5,0.22500000000000003,COMPLETE
2702,0.36826583710432714,0.22500000000000003,0.4,0.425,0.2,0.425,0.05,equal,0.47500000000000003,0.35000000000000003,COMPLETE
2703,0.5342181630118251,0.2,0.42500000000000004,0.47500000000000003,0.22500000000000003,0.47500000000000003,0.05,equal,0.5,0.3,COMPLETE
2704,0.26449205938421283,0.25,0.5,0.425,0.25,0.5,0.07500000000000001,equal,0.47500000000000003,0.275,COMPLETE
2705,0.24332078073125535,0.15000000000000002,0.6250000000000001,0.375,0.275,0.45,0.05,softmax,0.5,0.325,COMPLETE
2706,0.5307954049525634,0.2,0.47500000000000003,0.4,0.22500000000000003,0.47500000000000003,0.05,equal,0.47500000000000003,0.3,COMPLETE
2707,0.019107464984590237,0.22500000000000003,0.45000000000000007,0.45,0.275,0.07500000000000001,0.07500000000000001,equal,0.5,0.25,COMPLETE
2708,0.2599053807468983,0.275,0.55,0.425,0.22500000000000003,0.45,0.05,equal,0.5,0.3,COMPLETE
2709,0.25214045975357446,0.2,0.525,0.4,0.25,0.47500000000000003,0.05,equal,0.35000000000000003,0.275,COMPLETE
2710,0.33807324478271106,0.175,0.42500000000000004,0.375,0.25,0.5,0.07500000000000001,softmax,0.47500000000000003,0.325,COMPLETE
2711,0.2993273773431687,0.25,0.47500000000000003,0.45,0.2,0.425,0.05,equal,0.47500000000000003,0.25,COMPLETE
2712,0.634291357863731,0.22500000000000003,0.45000000000000007,0.425,0.25,0.45,0.07500000000000001,equal,0.5,0.275,COMPLETE
2713,0.4205657714732931,0.2,0.4,0.47500000000000003,0.25,0.47500000000000003,0.07500000000000001,equal,0.5,0.3,COMPLETE
