number,value,params_fund_net_buying,params_institutional_weight,params_number_fund_holdings,params_pe,params_revenue_growth,params_roe,params_stock_weight_option,params_take_profit,params_trailing_stop_loss,state
1807,0.46198961157548507,0.2,0.45000000000000007,0.45,0.25,0.5,0.05,softmax,0.47500000000000003,0.35000000000000003,COMPLETE
1808,0.4481188123480498,0.22500000000000003,0.4,0.45,0.25,0.47500000000000003,0.05,equal,0.47500000000000003,0.325,COMPLETE
1809,0.2713798651056758,0.22500000000000003,0.47500000000000003,0.425,0.25,0.47500000000000003,0.07500000000000001,equal,0.5,0.3,COMPLETE
1810,0.20241015787185734,0.175,0.5,0.47500000000000003,0.275,0.275,0.05,equal,0.47500000000000003,0.325,COMPLETE
1811,0.019107464984590237,0.2,0.45000000000000007,0.425,0.275,0.05,0.1,equal,0.5,0.3,COMPLETE
1812,0.4320946561708828,0.25,0.37500000000000006,0.45,0.275,0.45,0.05,linear,0.47500000000000003,0.3,COMPLETE
1813,0.27901978008870937,0.2,0.525,0.45,0.25,0.5,0.05,equal,0.5,0.3,COMPLETE
1814,0.348042246067878,0.25,0.42500000000000004,0.45,0.25,0.47500000000000003,0.07500000000000001,softmax,0.375,0.325,COMPLETE
1815,0.5279610128682569,0.175,0.47500000000000003,0.47500000000000003,0.275,0.45,0.05,equal,0.47500000000000003,0.3,COMPLETE
1816,0.44308694209790783,0.22500000000000003,0.45000000000000007,0.425,0.25,0.47500000000000003,0.07500000000000001,equal,0.5,0.3,COMPLETE
1817,0.4235387059227427,0.2,0.4,0.425,0.25,0.5,0.07500000000000001,equal,0.47500000000000003,0.3,COMPLETE
1818,0.5653190101716724,0.22500000000000003,0.42500000000000004,0.425,0.275,0.45,0.05,equal,0.5,0.325,COMPLETE
1819,0.6246360197681787,0.2,0.45000000000000007,0.45,0.22500000000000003,0.47500000000000003,0.05,equal,0.47500000000000003,0.3,COMPLETE
1820,0.22817904515598345,0.175,0.5,0.47500000000000003,0.25,0.47500000000000003,0.07500000000000001,softmax,0.5,0.3,COMPLETE
1821,0.4980314397489921,0.175,0.42500000000000004,0.47500000000000003,0.22500000000000003,0.425,0.05,equal,0.47500000000000003,0.3,COMPLETE
1822,0.22097364371031256,0.175,0.47500000000000003,0.47500000000000003,0.25,0.5,0.05,equal,0.1,0.3,COMPLETE
1823,0.6021780566265794,0.175,0.47500000000000003,0.47500000000000003,0.22500000000000003,0.47500000000000003,0.05,equal,0.47500000000000003,0.325,COMPLETE
1824,0.09757842090601232,0.2,0.45000000000000007,0.45,0.25,0.47500000000000003,0.1,equal,0.5,0.1,COMPLETE
1825,0.16985492096227317,0.2,0.42500000000000004,0.45,0.22500000000000003,0.22500000000000003,0.07500000000000001,equal,0.5,0.3,COMPLETE
1826,0.5979669287804563,0.175,0.45000000000000007,0.47500000000000003,0.275,0.45,0.05,linear,0.47500000000000003,0.3,COMPLETE
1827,0.37295460014684784,0.175,0.5,0.47500000000000003,0.22500000000000003,0.45,0.07500000000000001,softmax,0.275,0.3,COMPLETE
1828,0.34296622418817435,0.2,0.4,0.45,0.25,0.47500000000000003,0.07500000000000001,equal,0.15000000000000002,0.325,COMPLETE
1829,0.4673330673694606,0.15000000000000002,0.45000000000000007,0.5,0.22500000000000003,0.425,0.1,equal,0.5,0.3,COMPLETE
1830,0.5039884164991115,0.2,0.47500000000000003,0.45,0.25,0.5,0.05,equal,0.47500000000000003,0.3,COMPLETE
1831,0.4606470862597094,0.2,0.37500000000000006,0.45,0.22500000000000003,0.47500000000000003,0.05,equal,0.4,0.325,COMPLETE
1832,0.1870362101351376,0.2,0.42500000000000004,0.45,0.45,0.45,0.07500000000000001,equal,0.5,0.3,COMPLETE
1833,0.6246360197681787,0.175,0.45000000000000007,0.47500000000000003,0.22500000000000003,0.47500000000000003,0.05,equal,0.47500000000000003,0.325,COMPLETE
1834,0.3295787428951033,0.2,0.4,0.45,0.25,0.5,0.05,softmax,0.5,0.3,COMPLETE
1835,0.42622768668706906,0.22500000000000003,0.42500000000000004,0.45,0.25,0.47500000000000003,0.07500000000000001,equal,0.47500000000000003,0.3,COMPLETE
1836,0.35169600676325813,0.15000000000000002,0.5,0.47500000000000003,0.25,0.45,0.1,equal,0.47500000000000003,0.3,COMPLETE
1837,0.5262516419212856,0.2,0.47500000000000003,0.45,0.275,0.45,0.05,equal,0.25,0.35000000000000003,COMPLETE
1838,0.6037031815387999,0.175,0.45000000000000007,0.47500000000000003,0.22500000000000003,0.47500000000000003,0.05,linear,0.5,0.3,COMPLETE
1839,-0.015487656349657365,0.7500000000000001,0.925,0.1,0.25,0.47500000000000003,0.07500000000000001,equal,0.47500000000000003,0.325,COMPLETE
1840,0.5039884164991115,0.2,0.47500000000000003,0.45,0.25,0.5,0.05,equal,0.5,0.3,COMPLETE
1841,0.36553242117612234,0.22500000000000003,0.42500000000000004,0.45,0.2,0.425,0.07500000000000001,softmax,0.47500000000000003,0.325,COMPLETE
1842,0.6192139352563232,0.175,0.45000000000000007,0.47500000000000003,0.275,0.45,0.05,equal,0.47500000000000003,0.3,COMPLETE
1843,0.052246896120665326,0.7750000000000001,0.4,0.2,0.22500000000000003,0.47500000000000003,0.07500000000000001,equal,0.5,0.3,COMPLETE
1844,0.5210527709871448,0.22500000000000003,0.47500000000000003,0.425,0.2,0.45,0.05,equal,0.47500000000000003,0.3,COMPLETE
1845,-0.10150818560724567,0.2,0.42500000000000004,0.45,0.125,0.5,0.375,equal,0.5,0.325,COMPLETE
1846,0.279019780088709,0.22500000000000003,0.5,0.425,0.22500000000000003,0.47500000000000003,0.05,equal,0.47500000000000003,0.3,COMPLETE
1847,0.23420202301725415,0.2,0.55,0.45,0.25,0.5,0.07500000000000001,softmax,0.5,0.325,COMPLETE
1848,0.3862310185475603,0.175,0.525,0.47500000000000003,0.22500000000000003,0.45,0.07500000000000001,equal,0.5,0.3,COMPLETE
1849,0.6246360197681787,0.175,0.45000000000000007,0.47500000000000003,0.22500000000000003,0.47500000000000003,0.05,equal,0.47500000000000003,0.275,COMPLETE
1850,0.6054729525697832,0.22500000000000003,0.42500000000000004,0.425,0.22500000000000003,0.47500000000000003,0.05,equal,0.5,0.325,COMPLETE
1851,0.2923037163249823,0.25,0.47500000000000003,0.45,0.3,0.45,0.05,linear,0.47500000000000003,0.3,COMPLETE
1852,0.5560603016875985,0.2,0.37500000000000006,0.425,0.25,0.47500000000000003,0.07500000000000001,equal,0.5,0.3,COMPLETE
1853,-0.34450299404402984,0.22500000000000003,0.4,0.45,0.2,0.45,0.35000000000000003,equal,0.47500000000000003,0.275,COMPLETE
1854,0.19304483589263316,0.22500000000000003,0.45000000000000007,0.425,0.25,0.5,0.1,softmax,0.5,0.3,COMPLETE
1855,0.10095431478734684,0.15000000000000002,0.47500000000000003,0.5,0.275,0.125,0.05,equal,0.5,0.275,COMPLETE
1856,0.6246360197681784,0.2,0.42500000000000004,0.425,0.22500000000000003,0.47500000000000003,0.05,equal,0.47500000000000003,0.325,COMPLETE
1857,0.47615964984930487,0.25,0.45000000000000007,0.45,0.22500000000000003,0.45,0.07500000000000001,equal,0.22500000000000003,0.35000000000000003,COMPLETE
1858,0.4803580387742496,0.2,0.45000000000000007,0.45,0.25,0.5,0.07500000000000001,equal,0.325,0.3,COMPLETE
1859,0.43049545040909654,0.175,0.4,0.47500000000000003,0.22500000000000003,0.47500000000000003,0.05,equal,0.47500000000000003,0.275,COMPLETE
1860,0.4666925347406231,0.22500000000000003,0.42500000000000004,0.45,0.3,0.425,0.05,softmax,0.5,0.275,COMPLETE
1861,0.41536583825168877,0.175,0.525,0.4,0.2,0.45,0.05,equal,0.47500000000000003,0.3,COMPLETE
1862,0.3791255212678882,0.22500000000000003,0.47500000000000003,0.425,0.22500000000000003,0.425,0.1,equal,0.5,0.275,COMPLETE
1863,0.41625427788665936,0.25,0.45000000000000007,0.45,0.25,0.47500000000000003,0.07500000000000001,linear,0.47500000000000003,0.3,COMPLETE
1864,0.4153658382516887,0.2,0.5,0.425,0.22500000000000003,0.47500000000000003,0.05,equal,0.5,0.275,COMPLETE
1865,0.03417336814305914,0.2,0.42500000000000004,0.425,0.275,0.15000000000000002,0.07500000000000001,equal,0.47500000000000003,0.325,COMPLETE
1866,-0.1554154695690598,0.25,0.4,0.45,0.05,0.5,0.45,equal,0.5,0.3,COMPLETE
1867,0.11535662802461073,0.4,0.6000000000000001,0.45,0.25,0.47500000000000003,0.05,softmax,0.47500000000000003,0.3,COMPLETE
1868,0.15588485942535568,0.15000000000000002,0.47500000000000003,0.825,0.375,0.45,0.07500000000000001,equal,0.5,0.275,COMPLETE
1869,0.43408960004487834,0.22500000000000003,0.45000000000000007,0.425,0.25,0.5,0.05,equal,0.47500000000000003,0.325,COMPLETE
1870,0.6021780566265794,0.175,0.47500000000000003,0.47500000000000003,0.22500000000000003,0.47500000000000003,0.05,equal,0.5,0.3,COMPLETE
1871,0.507185638121809,0.2,0.42500000000000004,0.425,0.22500000000000003,0.45,0.07500000000000001,equal,0.47500000000000003,0.275,COMPLETE
1872,0.15677011941317354,0.3,0.125,0.45,0.25,0.47500000000000003,0.05,equal,0.47500000000000003,0.275,COMPLETE
1873,0.18236951960108239,0.2,0.37500000000000006,0.425,0.2,0.35000000000000003,0.05,equal,0.5,0.325,COMPLETE
1874,0.4010596931570828,0.22500000000000003,0.5,0.425,0.22500000000000003,0.45,0.07500000000000001,softmax,0.47500000000000003,0.3,COMPLETE
1875,0.6675551103529338,0.2,0.45000000000000007,0.47500000000000003,0.25,0.47500000000000003,0.05,equal,0.3,0.275,COMPLETE
1876,0.332129289778094,0.25,0.42500000000000004,0.47500000000000003,0.25,0.47500000000000003,0.1,linear,0.325,0.275,COMPLETE
1877,0.02967309301705716,0.47500000000000003,0.45000000000000007,0.325,0.25,0.5,0.07500000000000001,equal,0.25,0.275,COMPLETE
1878,0.20215716072141207,0.22500000000000003,0.47500000000000003,0.47500000000000003,0.275,0.45,0.05,equal,0.07500000000000001,0.275,COMPLETE
1879,0.45079746252613007,0.175,0.42500000000000004,0.5,0.25,0.47500000000000003,0.05,equal,0.22500000000000003,0.275,COMPLETE
1880,0.35270581742792084,0.175,0.5,0.5,0.25,0.5,0.07500000000000001,equal,0.3,0.275,COMPLETE
1881,0.37653565882915996,0.22500000000000003,0.4,0.47500000000000003,0.25,0.45,0.05,softmax,0.2,0.275,COMPLETE
1882,0.14468556126160811,0.2,0.45000000000000007,0.5,0.25,0.47500000000000003,0.07500000000000001,equal,0.125,0.275,COMPLETE
1883,-0.0329800378226012,0.25,0.47500000000000003,0.45,0.25,0.425,0.22500000000000003,equal,0.125,0.275,COMPLETE
1884,0.21010262027865276,0.22500000000000003,0.45000000000000007,0.47500000000000003,0.3,0.45,0.05,equal,0.15000000000000002,0.275,COMPLETE
1885,0.1474722528528512,0.2,0.42500000000000004,0.47500000000000003,0.25,0.5,0.175,equal,0.35000000000000003,0.275,COMPLETE
1886,0.4628368545336169,0.22500000000000003,0.4,0.45,0.25,0.45,0.05,equal,0.275,0.275,COMPLETE
1887,0.4342114207131461,0.15000000000000002,0.47500000000000003,0.5,0.25,0.47500000000000003,0.07500000000000001,softmax,0.2,0.275,COMPLETE
1888,0.5444969007500586,0.2,0.45000000000000007,0.47500000000000003,0.275,0.425,0.05,linear,0.325,0.275,COMPLETE
1889,0.1957759728516704,0.25,0.5,0.45,0.275,0.45,0.07500000000000001,equal,0.22500000000000003,0.275,COMPLETE
1890,0.2004166474711499,0.275,0.42500000000000004,0.45,0.25,0.47500000000000003,0.1,equal,0.2,0.275,COMPLETE
1891,0.3921104686371021,0.2,0.4,0.47500000000000003,0.275,0.47500000000000003,0.05,equal,0.325,0.275,COMPLETE
1892,0.39007177290156936,0.175,0.525,0.5,0.25,0.47500000000000003,0.05,equal,0.375,0.275,COMPLETE
1893,0.4368532343290458,0.22500000000000003,0.42500000000000004,0.425,0.25,0.5,0.07500000000000001,equal,0.3,0.275,COMPLETE
1894,0.49403186475133604,0.15000000000000002,0.45000000000000007,0.5,0.275,0.45,0.05,softmax,0.4,0.275,COMPLETE
1895,-0.1813576776625434,0.25,0.37500000000000006,0.45,0.05,0.47500000000000003,0.47500000000000003,equal,0.25,0.275,COMPLETE
1896,0.3911031168232388,0.2,0.47500000000000003,0.47500000000000003,0.25,0.47500000000000003,0.07500000000000001,equal,0.375,0.275,COMPLETE
1897,0.39180779758676976,0.175,0.42500000000000004,0.4,0.25,0.5,0.05,equal,0.425,0.275,COMPLETE
1898,0.05956221043359621,0.22500000000000003,0.45000000000000007,0.425,0.15000000000000002,0.45,0.325,equal,0.35000000000000003,0.3,COMPLETE
1899,0.37581448895025377,0.2,0.47500000000000003,0.47500000000000003,0.275,0.47500000000000003,0.05,equal,0.425,0.47500000000000003,COMPLETE
1900,0.39955895742257613,0.22500000000000003,0.5,0.45,0.25,0.45,0.07500000000000001,linear,0.275,0.275,COMPLETE
1901,0.274766889227383,0.25,0.4,0.45,0.25,0.5,0.05,softmax,0.5,0.275,COMPLETE
1902,0.007999637153976821,0.2,0.8500000000000001,0.4,0.275,0.425,0.05,equal,0.1,0.35000000000000003,COMPLETE
1903,0.4238970295093999,0.22500000000000003,0.42500000000000004,0.425,0.25,0.47500000000000003,0.07500000000000001,equal,0.4,0.3,COMPLETE
1904,0.45092353680339464,0.2,0.45000000000000007,0.47500000000000003,0.25,0.45,0.1,equal,0.4,0.275,COMPLETE
1905,0.2713798651056756,0.175,0.47500000000000003,0.4,0.275,0.47500000000000003,0.05,equal,0.35000000000000003,0.3,COMPLETE
1906,0.4587160048116588,0.25,0.45000000000000007,0.45,0.25,0.5,0.05,equal,0.5,0.3,COMPLETE
1907,0.3133408574944482,0.15000000000000002,0.5,0.5,0.25,0.47500000000000003,0.07500000000000001,softmax,0.5,0.3,COMPLETE
1908,0.5051166139624259,0.22500000000000003,0.42500000000000004,0.425,0.25,0.45,0.07500000000000001,equal,0.4,0.275,COMPLETE
1909,0.5534369770871259,0.175,0.45000000000000007,0.47500000000000003,0.25,0.47500000000000003,0.05,equal,0.275,0.3,COMPLETE
1910,0.1368584437218531,0.7250000000000001,0.47500000000000003,0.1,0.275,0.45,0.05,equal,0.3,0.35000000000000003,COMPLETE
1911,0.24225404379209764,0.22500000000000003,0.42500000000000004,0.425,0.25,0.47500000000000003,0.1,equal,0.425,0.275,COMPLETE
1912,0.31285233723369826,0.2,0.4,0.47500000000000003,0.25,0.5,0.07500000000000001,equal,0.5,0.275,COMPLETE
1913,0.5197190178850898,0.175,0.45000000000000007,0.5,0.275,0.45,0.05,linear,0.5,0.375,COMPLETE
1914,0.10671056948899747,0.22500000000000003,0.47500000000000003,0.425,0.25,0.425,0.2,equal,0.5,0.325,COMPLETE
1915,0.24177950697402992,0.55,0.37500000000000006,0.4,0.25,0.47500000000000003,0.07500000000000001,softmax,0.5,0.3,COMPLETE
1916,0.2956266197070444,0.2,0.5,0.45,0.25,0.5,0.05,equal,0.425,0.275,COMPLETE
1917,0.25363013956463,0.5,0.4,0.45,0.22500000000000003,0.47500000000000003,0.05,equal,0.5,0.3,COMPLETE
1918,0.5146797748870202,0.275,0.42500000000000004,0.45,0.22500000000000003,0.47500000000000003,0.05,equal,0.5,0.275,COMPLETE
1919,0.634291357863731,0.22500000000000003,0.45000000000000007,0.425,0.25,0.45,0.07500000000000001,equal,0.5,0.3,COMPLETE
1920,0.3343678593097836,0.275,0.525,0.425,0.275,0.425,0.1,equal,0.5,0.325,COMPLETE
1921,0.369016281562281,0.25,0.47500000000000003,0.425,0.25,0.45,0.1,softmax,0.5,0.325,COMPLETE
1922,0.25954253380916387,0.25,0.47500000000000003,0.425,0.275,0.425,0.1,equal,0.5,0.3,COMPLETE
1923,0.37102823142798647,0.25,0.5,0.425,0.275,0.425,0.1,equal,0.47500000000000003,0.325,COMPLETE
1924,0.3343678593097833,0.25,0.47500000000000003,0.425,0.275,0.425,0.07500000000000001,equal,0.3,0.3,COMPLETE
1925,0.33014891820242676,0.275,0.45000000000000007,0.425,0.25,0.45,0.1,linear,0.175,0.325,COMPLETE
1926,0.41839647054414664,0.22500000000000003,0.5,0.4,0.25,0.45,0.07500000000000001,equal,0.5,0.3,COMPLETE
1927,0.1529906540362077,0.25,0.47500000000000003,0.425,0.425,0.425,0.07500000000000001,equal,0.47500000000000003,0.3,COMPLETE
1928,0.3397991996731145,0.22500000000000003,0.45000000000000007,0.4,0.25,0.45,0.07500000000000001,softmax,0.425,0.325,COMPLETE
1929,0.024675476227894844,0.25,0.9,0.425,0.25,0.45,0.1,equal,0.47500000000000003,0.3,COMPLETE
1930,0.41839647054414597,0.22500000000000003,0.525,0.4,0.275,0.425,0.07500000000000001,equal,0.5,0.3,COMPLETE
1931,0.20189994270526992,0.22500000000000003,0.45000000000000007,0.425,0.275,0.375,0.07500000000000001,equal,0.47500000000000003,0.325,COMPLETE
1932,0.39020895431873037,0.25,0.47500000000000003,0.425,0.25,0.45,0.07500000000000001,equal,0.5,0.3,COMPLETE
1933,0.21290377134553284,0.425,0.47500000000000003,0.425,0.25,0.45,0.1,equal,0.45,0.325,COMPLETE
1934,0.32588116557345237,0.3,0.45000000000000007,0.45,0.25,0.45,0.07500000000000001,softmax,0.47500000000000003,0.3,COMPLETE
1935,0.16185125150245327,0.35000000000000003,0.45000000000000007,0.45,0.25,0.45,0.07500000000000001,equal,0.5,0.3,COMPLETE
1936,0.4346573988201753,0.275,0.47500000000000003,0.45,0.25,0.45,0.07500000000000001,equal,0.325,0.3,COMPLETE
1937,0.03579355486765113,0.22500000000000003,0.5,0.4,0.275,0.425,0.07500000000000001,equal,0.05,0.325,COMPLETE
1938,0.6128019524689904,0.22500000000000003,0.45000000000000007,0.425,0.25,0.45,0.07500000000000001,linear,0.45,0.3,COMPLETE
1939,0.30515169069172243,0.25,0.5,0.425,0.25,0.45,0.1,equal,0.47500000000000003,0.3,COMPLETE
1940,0.2974107129492355,0.22500000000000003,0.45000000000000007,0.4,0.275,0.425,0.07500000000000001,equal,0.5,0.3,COMPLETE
1941,0.3659108829102368,0.2,0.47500000000000003,0.4,0.25,0.45,0.1,softmax,0.47500000000000003,0.325,COMPLETE
1942,0.30662857203873284,0.2,0.45000000000000007,0.4,0.25,0.45,0.07500000000000001,equal,0.175,0.35000000000000003,COMPLETE
1943,0.25363833099998745,0.22500000000000003,0.55,0.425,0.25,0.45,0.07500000000000001,equal,0.45,0.3,COMPLETE
1944,0.38340665310271305,0.275,0.42500000000000004,0.45,0.25,0.45,0.07500000000000001,equal,0.22500000000000003,0.325,COMPLETE
1945,0.37937335467446764,0.25,0.5,0.45,0.275,0.425,0.07500000000000001,equal,0.5,0.3,COMPLETE
1946,0.4098239675587839,0.22500000000000003,0.47500000000000003,0.425,0.25,0.45,0.07500000000000001,equal,0.375,0.3,COMPLETE
1947,0.388586461487336,0.2,0.45000000000000007,0.375,0.25,0.45,0.07500000000000001,softmax,0.47500000000000003,0.325,COMPLETE
1948,0.41175050502257154,0.2,0.42500000000000004,0.4,0.275,0.45,0.07500000000000001,equal,0.5,0.3,COMPLETE
1949,0.3791255212678885,0.22500000000000003,0.47500000000000003,0.425,0.25,0.45,0.1,equal,0.45,0.3,COMPLETE
1950,0.11422569524991576,0.25,0.45000000000000007,0.675,0.3,0.425,0.07500000000000001,equal,0.25,0.15000000000000002,COMPLETE
1951,0.552884765407481,0.2,0.42500000000000004,0.4,0.25,0.45,0.07500000000000001,equal,0.47500000000000003,0.325,COMPLETE
1952,0.10445647954402656,0.22500000000000003,0.8,0.425,0.25,0.47500000000000003,0.05,linear,0.5,0.3,COMPLETE
1953,0.4183964705441459,0.175,0.47500000000000003,0.375,0.275,0.45,0.05,equal,0.5,0.3,COMPLETE
1954,0.40982396755878303,0.22500000000000003,0.525,0.45,0.25,0.425,0.1,equal,0.47500000000000003,0.3,COMPLETE
1955,-0.014629312127972308,0.5750000000000001,0.45000000000000007,0.175,0.25,0.47500000000000003,0.05,softmax,0.425,0.35000000000000003,COMPLETE
1956,0.425543811008415,0.25,0.5,0.45,0.25,0.45,0.07500000000000001,equal,0.47500000000000003,0.3,COMPLETE
1957,0.4945739955863566,0.175,0.42500000000000004,0.375,0.25,0.47500000000000003,0.07500000000000001,equal,0.45,0.325,COMPLETE
1958,0.5575829987046873,0.2,0.45000000000000007,0.4,0.25,0.47500000000000003,0.05,equal,0.5,0.275,COMPLETE
1959,0.05933992261791637,0.9,0.42500000000000004,0.075,0.275,0.4,0.05,equal,0.5,0.3,COMPLETE
1960,0.16985492096227328,0.22500000000000003,0.47500000000000003,0.425,0.275,0.22500000000000003,0.07500000000000001,equal,0.47500000000000003,0.275,COMPLETE
1961,0.5071384874648538,0.2,0.45000000000000007,0.4,0.275,0.45,0.05,softmax,0.47500000000000003,0.3,COMPLETE
1962,0.216270628051296,0.275,0.47500000000000003,0.45,0.25,0.5,0.1,equal,0.45,0.275,COMPLETE
1963,0.3280087427678111,0.2,0.42500000000000004,0.47500000000000003,0.45,0.45,0.05,linear,0.5,0.325,COMPLETE
1964,0.2970856350702906,0.25,0.5,0.45,0.25,0.47500000000000003,0.07500000000000001,equal,0.47500000000000003,0.3,COMPLETE
1965,0.43284764900636385,0.22500000000000003,0.45000000000000007,0.425,0.25,0.47500000000000003,0.05,equal,0.45,0.275,COMPLETE
1966,0.49987014765620225,0.2,0.4,0.4,0.22500000000000003,0.45,0.07500000000000001,equal,0.5,0.325,COMPLETE
1967,-0.22010494406800746,0.25,0.42500000000000004,0.45,0.1,0.5,0.4,equal,0.47500000000000003,0.275,COMPLETE
1968,0.49484261427080006,0.175,0.47500000000000003,0.4,0.22500000000000003,0.47500000000000003,0.05,softmax,0.5,0.275,COMPLETE
1969,0.4612226398212145,0.22500000000000003,0.45000000000000007,0.425,0.275,0.425,0.05,equal,0.47500000000000003,0.3,COMPLETE
1970,0.34283487590443745,0.175,0.42500000000000004,0.35000000000000003,0.25,0.47500000000000003,0.07500000000000001,equal,0.45,0.3,COMPLETE
1971,0.3791255212678885,0.22500000000000003,0.47500000000000003,0.425,0.25,0.45,0.1,equal,0.5,0.325,COMPLETE
1972,0.32196255199046875,0.15000000000000002,0.4,0.375,0.25,0.5,0.05,equal,0.47500000000000003,0.3,COMPLETE
1973,0.5005309948142407,0.2,0.5,0.47500000000000003,0.22500000000000003,0.47500000000000003,0.05,equal,0.47500000000000003,0.275,COMPLETE
1974,0.6362200505031762,0.22500000000000003,0.45000000000000007,0.425,0.25,0.45,0.07500000000000001,softmax,0.35000000000000003,0.3,COMPLETE
1975,0.313619581228907,0.275,0.4,0.425,0.275,0.425,0.1,softmax,0.35000000000000003,0.275,COMPLETE
1976,0.22980997030956604,0.25,0.45000000000000007,0.425,0.275,0.425,0.1,softmax,0.325,0.3,COMPLETE
1977,0.34608471502639804,0.25,0.42500000000000004,0.425,0.275,0.425,0.07500000000000001,softmax,0.3,0.275,COMPLETE
1978,0.35339306949715277,0.275,0.47500000000000003,0.425,0.25,0.425,0.1,softmax,0.25,0.3,COMPLETE
1979,0.2879788258887437,0.25,0.5,0.4,0.25,0.45,0.1,linear,0.35000000000000003,0.325,COMPLETE
1980,0.3776746697789941,0.25,0.47500000000000003,0.425,0.25,0.45,0.07500000000000001,softmax,0.3,0.275,COMPLETE
1981,0.05576141453062953,0.325,0.525,0.425,0.275,0.425,0.07500000000000001,softmax,0.325,0.275,COMPLETE
1982,0.2482062411457184,0.22500000000000003,0.42500000000000004,0.7250000000000001,0.25,0.45,0.07500000000000001,softmax,0.275,0.35000000000000003,COMPLETE
1983,0.3574444395617287,0.22500000000000003,0.45000000000000007,0.4,0.25,0.45,0.1,softmax,0.275,0.3,COMPLETE
1984,0.21917108664491824,0.3,0.45000000000000007,0.425,0.275,0.4,0.1,softmax,0.5,0.325,COMPLETE
1985,0.4945616198926386,0.25,0.42500000000000004,0.4,0.25,0.45,0.07500000000000001,softmax,0.5,0.275,COMPLETE
1986,0.3584647414110059,0.22500000000000003,0.47500000000000003,0.4,0.275,0.425,0.07500000000000001,softmax,0.375,0.3,COMPLETE
1987,0.49832366368023606,0.25,0.45000000000000007,0.45,0.25,0.45,0.07500000000000001,softmax,0.5,0.275,COMPLETE
1988,0.05770108897682777,0.275,0.42500000000000004,0.425,0.25,0.45,0.22500000000000003,softmax,0.3,0.3,COMPLETE
1989,0.47745985806290453,0.22500000000000003,0.4,0.4,0.25,0.45,0.07500000000000001,softmax,0.3,0.325,COMPLETE
1990,0.3973036558979118,0.22500000000000003,0.47500000000000003,0.4,0.25,0.45,0.07500000000000001,softmax,0.35000000000000003,0.3,COMPLETE
1991,0.6043767450054035,0.25,0.45000000000000007,0.425,0.25,0.45,0.07500000000000001,softmax,0.375,0.275,COMPLETE
