number,value,params_fund_net_buying,params_institutional_weight,params_number_fund_holdings,params_pe,params_revenue_growth,params_roe,params_stock_weight_option,params_take_profit,params_trailing_stop_loss,state
4574,0.5997514435684572,0.22500000000000003,0.47500000000000003,0.45,0.2,0.47500000000000003,0.05,equal,0.4,0.35000000000000003,COMPLETE
4575,0.06859006893128833,0.2,0.5,0.4,0.175,0.47500000000000003,0.275,equal,0.47500000000000003,0.4,COMPLETE
4576,0.24944009208782097,0.47500000000000003,0.45000000000000007,0.425,0.22500000000000003,0.5,0.05,equal,0.3,0.3,COMPLETE
4577,0.5125098056381763,0.15000000000000002,0.47500000000000003,0.5,0.2,0.47500000000000003,0.05,equal,0.5,0.325,COMPLETE
4578,-0.05862483956262274,0.675,0.42500000000000004,0.275,0.175,0.47500000000000003,0.07500000000000001,equal,0.47500000000000003,0.375,COMPLETE
4579,0.3278883858400222,0.175,0.4,0.47500000000000003,0.22500000000000003,0.5,0.05,equal,0.5,0.35000000000000003,COMPLETE
4580,0.4332868242676442,0.22500000000000003,0.45000000000000007,0.45,0.175,0.5,0.05,equal,0.375,0.175,COMPLETE
4581,0.2588802544980143,0.2,0.47500000000000003,0.4,0.22500000000000003,0.5,0.07500000000000001,equal,0.3,0.3,COMPLETE
4582,0.5143184472204515,0.25,0.42500000000000004,0.45,0.15000000000000002,0.47500000000000003,0.05,equal,0.5,0.375,COMPLETE
4583,0.42377397646667486,0.2,0.5,0.4,0.15000000000000002,0.47500000000000003,0.05,equal,0.325,0.3,COMPLETE
4584,0.1922853792703756,0.175,0.45000000000000007,0.47500000000000003,0.22500000000000003,0.5,0.07500000000000001,equal,0.1,0.4,COMPLETE
4585,0.362410476896978,0.22500000000000003,0.47500000000000003,0.425,0.2,0.47500000000000003,0.05,equal,0.425,0.125,COMPLETE
4586,0.4208883666896134,0.175,0.42500000000000004,0.47500000000000003,0.22500000000000003,0.5,0.07500000000000001,linear,0.47500000000000003,0.45,COMPLETE
4587,0.07939102702425921,0.22500000000000003,0.525,0.45,0.125,0.1,0.05,equal,0.5,0.35000000000000003,COMPLETE
4588,0.4501356497949594,0.1,0.45000000000000007,0.5,0.175,0.5,0.05,equal,0.275,0.425,COMPLETE
4589,0.40001902191022365,0.125,0.47500000000000003,0.375,0.2,0.47500000000000003,0.05,equal,0.325,0.325,COMPLETE
4590,0.5002428732864296,0.2,0.4,0.4,0.175,0.47500000000000003,0.07500000000000001,equal,0.4,0.375,COMPLETE
4591,0.3721798415827059,0.25,0.32500000000000007,0.425,0.175,0.5,0.05,equal,0.3,0.4,COMPLETE
4592,0.2774142121851535,0.175,0.37500000000000006,0.47500000000000003,0.22500000000000003,0.5,0.05,equal,0.35000000000000003,0.325,COMPLETE
4593,0.3929366838055673,0.25,0.5,0.45,0.175,0.47500000000000003,0.07500000000000001,equal,0.47500000000000003,0.3,COMPLETE
4594,0.4759455386256408,0.2,0.45000000000000007,0.45,0.22500000000000003,0.5,0.05,equal,0.5,0.35000000000000003,COMPLETE
4595,0.5851660751418166,0.2,0.42500000000000004,0.45,0.15000000000000002,0.47500000000000003,0.05,equal,0.375,0.375,COMPLETE
4596,0.48880535148613324,0.22500000000000003,0.47500000000000003,0.425,0.175,0.5,0.05,equal,0.3,0.325,COMPLETE
4597,0.22441641419845715,0.275,0.45000000000000007,0.425,0.47500000000000003,0.07500000000000001,0.15000000000000002,equal,0.47500000000000003,0.4,COMPLETE
4598,0.6369681708934293,0.22500000000000003,0.42500000000000004,0.425,0.22500000000000003,0.47500000000000003,0.07500000000000001,equal,0.375,0.3,COMPLETE
4599,0.43811099064286657,0.175,0.5,0.47500000000000003,0.175,0.5,0.05,equal,0.5,0.375,COMPLETE
4600,0.4153658382516877,0.2,0.5,0.4,0.175,0.47500000000000003,0.07500000000000001,equal,0.5,0.35000000000000003,COMPLETE
4601,0.37085701144634015,0.125,0.47500000000000003,0.5,0.22500000000000003,0.5,0.05,equal,0.47500000000000003,0.375,COMPLETE
4602,0.5027160912080834,0.22500000000000003,0.45000000000000007,0.425,0.2,0.47500000000000003,0.05,equal,0.275,0.3,COMPLETE
4603,0.4724786370789642,0.2,0.4,0.4,0.175,0.5,0.05,equal,0.4,0.425,COMPLETE
4604,0.29142528554923824,0.15000000000000002,0.225,0.375,0.2,0.47500000000000003,0.05,equal,0.47500000000000003,0.325,COMPLETE
4605,0.4666189330029874,0.25,0.47500000000000003,0.45,0.22500000000000003,0.5,0.07500000000000001,linear,0.325,0.325,COMPLETE
4606,0.5722516084793845,0.2,0.42500000000000004,0.45,0.15000000000000002,0.47500000000000003,0.05,equal,0.3,0.375,COMPLETE
4607,0.4759455386256409,0.22500000000000003,0.45000000000000007,0.425,0.22500000000000003,0.5,0.05,equal,0.5,0.4,COMPLETE
4608,0.5960402179346465,0.175,0.47500000000000003,0.47500000000000003,0.175,0.47500000000000003,0.07500000000000001,equal,0.375,0.425,COMPLETE
4609,0.6166838131030885,0.22500000000000003,0.42500000000000004,0.425,0.2,0.47500000000000003,0.05,equal,0.47500000000000003,0.35000000000000003,COMPLETE
4610,0.545118328989346,0.2,0.45000000000000007,0.4,0.175,0.5,0.05,equal,0.35000000000000003,0.22500000000000003,COMPLETE
4611,0.38349299793420116,0.275,0.47500000000000003,0.425,0.22500000000000003,0.47500000000000003,0.07500000000000001,equal,0.3,0.3,COMPLETE
4612,0.33509650686447257,0.25,0.5,0.45,0.2,0.47500000000000003,0.05,equal,0.5,0.3,COMPLETE
4613,0.5979190446471301,0.2,0.42500000000000004,0.45,0.175,0.5,0.05,equal,0.47500000000000003,0.375,COMPLETE
4614,0.4759455386256409,0.22500000000000003,0.45000000000000007,0.425,0.22500000000000003,0.5,0.05,equal,0.5,0.325,COMPLETE
4615,0.4677386629993295,0.175,0.45000000000000007,0.47500000000000003,0.22500000000000003,0.5,0.07500000000000001,equal,0.425,0.35000000000000003,COMPLETE
4616,0.2790197800887084,0.22500000000000003,0.525,0.425,0.22500000000000003,0.47500000000000003,0.05,equal,0.3,0.4,COMPLETE
4617,0.3698416420073778,0.15000000000000002,0.4,0.5,0.175,0.5,0.05,equal,0.275,0.35000000000000003,COMPLETE
4618,0.3989520636314937,0.25,0.47500000000000003,0.45,0.175,0.47500000000000003,0.07500000000000001,equal,0.325,0.3,COMPLETE
4619,0.3734703386477225,0.2,0.47500000000000003,0.4,0.175,0.5,0.05,equal,0.35000000000000003,0.425,COMPLETE
4620,-0.04705456475624108,0.175,0.5,0.47500000000000003,0.425,0.47500000000000003,0.05,equal,0.5,0.4,COMPLETE
4621,0.4150044969947686,0.2,0.42500000000000004,0.4,0.22500000000000003,0.5,0.05,equal,0.4,0.325,COMPLETE
4622,0.4934411703914466,0.22500000000000003,0.45000000000000007,0.425,0.22500000000000003,0.47500000000000003,0.07500000000000001,equal,0.375,0.375,COMPLETE
4623,0.6178023927042292,0.175,0.47500000000000003,0.47500000000000003,0.175,0.5,0.05,equal,0.3,0.3,COMPLETE
4624,0.5024961194882838,0.2,0.4,0.4,0.175,0.47500000000000003,0.07500000000000001,equal,0.47500000000000003,0.35000000000000003,COMPLETE
4625,0.37202469510180686,0.22500000000000003,0.5,0.45,0.22500000000000003,0.5,0.05,equal,0.5,0.325,COMPLETE
4626,0.30449946258513605,0.15000000000000002,0.45000000000000007,0.375,0.15000000000000002,0.47500000000000003,0.05,equal,0.275,0.35000000000000003,COMPLETE
4627,0.4409358330675484,0.25,0.42500000000000004,0.425,0.2,0.5,0.05,linear,0.5,0.325,COMPLETE
4628,0.19191645396949222,0.22500000000000003,0.45000000000000007,0.45,0.175,0.47500000000000003,0.175,equal,0.47500000000000003,0.375,COMPLETE
4629,0.2480506198336554,0.175,0.525,0.4,0.22500000000000003,0.5,0.05,equal,0.3,0.3,COMPLETE
4630,0.30769214195588585,0.2,0.55,0.45,0.175,0.47500000000000003,0.07500000000000001,equal,0.375,0.4,COMPLETE
4631,0.17831877011182357,0.275,0.47500000000000003,0.6000000000000001,0.22500000000000003,0.5,0.05,equal,0.5,0.22500000000000003,COMPLETE
4632,0.48880535148613324,0.25,0.45000000000000007,0.425,0.22500000000000003,0.47500000000000003,0.07500000000000001,equal,0.325,0.375,COMPLETE
4633,0.5979190446471301,0.2,0.42500000000000004,0.45,0.175,0.5,0.05,equal,0.47500000000000003,0.325,COMPLETE
4634,0.40020788408414576,0.25,0.5,0.425,0.2,0.5,0.05,equal,0.3,0.35000000000000003,COMPLETE
4635,0.5198541111163298,0.2,0.4,0.45,0.175,0.47500000000000003,0.07500000000000001,equal,0.4,0.3,COMPLETE
4636,0.37889361581412334,0.175,0.45000000000000007,0.47500000000000003,0.22500000000000003,0.5,0.05,equal,0.275,0.375,COMPLETE
4637,0.6310795334192677,0.22500000000000003,0.47500000000000003,0.425,0.2,0.47500000000000003,0.05,equal,0.375,0.4,COMPLETE
4638,0.13967987719742914,0.45,0.42500000000000004,0.425,0.15000000000000002,0.5,0.05,equal,0.5,0.325,COMPLETE
4639,0.5437829619998661,0.22500000000000003,0.37500000000000006,0.425,0.2,0.47500000000000003,0.05,equal,0.35000000000000003,0.3,COMPLETE
4640,0.05676724196852372,0.175,0.5,0.4,0.35000000000000003,0.47500000000000003,0.07500000000000001,equal,0.47500000000000003,0.35000000000000003,COMPLETE
4641,0.45761747012649034,0.22500000000000003,0.45000000000000007,0.45,0.175,0.5,0.05,equal,0.47500000000000003,0.375,COMPLETE
4642,0.5039372685270612,0.2,0.47500000000000003,0.4,0.15000000000000002,0.47500000000000003,0.05,equal,0.325,0.3,COMPLETE
4643,0.3101299691082722,0.2,0.6000000000000001,0.45,0.22500000000000003,0.5,0.07500000000000001,equal,0.25,0.25,COMPLETE
4644,0.6246360197681787,0.25,0.47500000000000003,0.425,0.2,0.47500000000000003,0.05,equal,0.5,0.35000000000000003,COMPLETE
4645,0.3974393631227741,0.175,0.42500000000000004,0.375,0.2,0.3,0.07500000000000001,equal,0.35000000000000003,0.4,COMPLETE
4646,0.21217510154537714,0.22500000000000003,0.5,0.425,0.2,0.25,0.05,equal,0.5,0.375,COMPLETE
4647,0.5019703674716833,0.2,0.45000000000000007,0.45,0.22500000000000003,0.5,0.05,equal,0.375,0.325,COMPLETE
4648,0.2480506198336554,0.22500000000000003,0.525,0.425,0.22500000000000003,0.5,0.07500000000000001,equal,0.3,0.35000000000000003,COMPLETE
4649,-0.1838513541109319,0.175,0.47500000000000003,0.47500000000000003,0.45,0.47500000000000003,0.05,linear,0.47500000000000003,0.3,COMPLETE
4650,0.4538248164068305,0.15000000000000002,0.45000000000000007,0.375,0.175,0.5,0.05,equal,0.325,0.325,COMPLETE
4651,0.5024961194882838,0.2,0.4,0.4,0.175,0.47500000000000003,0.07500000000000001,equal,0.5,0.375,COMPLETE
4652,0.0369035594033878,0.275,0.42500000000000004,0.425,0.4,0.5,0.05,equal,0.47500000000000003,0.5,COMPLETE
4653,0.18265487398636698,0.25,0.47500000000000003,0.45,0.175,0.47500000000000003,0.22500000000000003,equal,0.5,0.4,COMPLETE
4654,0.488805351486133,0.2,0.45000000000000007,0.45,0.22500000000000003,0.5,0.05,equal,0.3,0.3,COMPLETE
4655,-0.15251438583802562,0.22500000000000003,0.37500000000000006,0.425,0.075,0.47500000000000003,0.45,equal,0.3,0.35000000000000003,COMPLETE
4656,0.5960402179346465,0.175,0.47500000000000003,0.47500000000000003,0.175,0.47500000000000003,0.07500000000000001,equal,0.375,0.22500000000000003,COMPLETE
4657,0.21217510154537744,0.22500000000000003,0.5,0.45,0.2,0.2,0.05,equal,0.275,0.375,COMPLETE
4658,0.5255678314486353,0.2,0.45000000000000007,0.4,0.15000000000000002,0.5,0.05,equal,0.47500000000000003,0.325,COMPLETE
4659,0.5143184472204515,0.25,0.42500000000000004,0.425,0.15000000000000002,0.47500000000000003,0.05,equal,0.5,0.3,COMPLETE
4660,0.06286823284569769,0.8250000000000001,0.4,0.15,0.22500000000000003,0.5,0.07500000000000001,equal,0.325,0.25,COMPLETE
4661,0.561455843241641,0.2,0.45000000000000007,0.4,0.175,0.5,0.05,equal,0.47500000000000003,0.325,COMPLETE
4662,0.5955070138891416,0.2,0.42500000000000004,0.45,0.2,0.47500000000000003,0.05,equal,0.4,0.4,COMPLETE
4663,0.47594553862564115,0.22500000000000003,0.47500000000000003,0.425,0.22500000000000003,0.5,0.05,equal,0.5,0.35000000000000003,COMPLETE
4664,-0.5171160527595909,0.15000000000000002,0.5,0.5,0.07500000000000001,0.47500000000000003,0.425,equal,0.5,0.05,COMPLETE
4665,0.5960402179346463,0.175,0.45000000000000007,0.47500000000000003,0.175,0.47500000000000003,0.07500000000000001,equal,0.375,0.375,COMPLETE
4666,0.2588802544980143,0.2,0.47500000000000003,0.4,0.22500000000000003,0.5,0.07500000000000001,equal,0.3,0.325,COMPLETE
4667,0.16193480769121626,0.22500000000000003,0.525,0.425,0.2,0.47500000000000003,0.05,equal,0.175,0.4,COMPLETE
4668,0.18931912929556768,0.25,0.42500000000000004,0.45,0.175,0.5,0.05,linear,0.125,0.25,COMPLETE
4669,0.4562116835226787,0.3,0.47500000000000003,0.425,0.22500000000000003,0.5,0.05,equal,0.5,0.425,COMPLETE
4670,0.5005309948142411,0.22500000000000003,0.5,0.45,0.2,0.47500000000000003,0.05,equal,0.47500000000000003,0.325,COMPLETE
4671,0.5779780130622139,0.175,0.45000000000000007,0.47500000000000003,0.15000000000000002,0.47500000000000003,0.05,equal,0.47500000000000003,0.3,COMPLETE
4672,0.5851286821176751,0.25,0.4,0.425,0.175,0.5,0.05,equal,0.35000000000000003,0.375,COMPLETE
4673,0.48035803877424954,0.2,0.42500000000000004,0.45,0.22500000000000003,0.5,0.07500000000000001,equal,0.3,0.35000000000000003,COMPLETE
4674,0.5031627382863417,0.22500000000000003,0.45000000000000007,0.425,0.15000000000000002,0.47500000000000003,0.05,equal,0.425,0.3,COMPLETE
4675,0.3404717546210444,0.2,0.47500000000000003,0.4,0.22500000000000003,0.5,0.05,equal,0.275,0.25,COMPLETE
4676,0.567556815547331,0.175,0.45000000000000007,0.47500000000000003,0.175,0.47500000000000003,0.07500000000000001,equal,0.5,0.375,COMPLETE
4677,0.3784011614676116,0.22500000000000003,0.5,0.425,0.175,0.5,0.05,equal,0.325,0.35000000000000003,COMPLETE
4678,0.6308900817843959,0.2,0.42500000000000004,0.45,0.22500000000000003,0.47500000000000003,0.07500000000000001,equal,0.3,0.3,COMPLETE
4679,0.31028318394362864,0.15000000000000002,0.47500000000000003,0.5,0.2,0.5,0.05,equal,0.25,0.22500000000000003,COMPLETE
4680,0.4404955848818286,0.275,0.47500000000000003,0.425,0.2,0.47500000000000003,0.05,equal,0.47500000000000003,0.4,COMPLETE
4681,0.4735574587331807,0.25,0.45000000000000007,0.45,0.22500000000000003,0.5,0.07500000000000001,equal,0.4,0.375,COMPLETE
4682,0.11318641073124466,0.22500000000000003,0.525,0.425,0.05,0.47500000000000003,0.4,equal,0.375,0.325,COMPLETE
4683,0.24805061983365523,0.175,0.5,0.4,0.175,0.5,0.05,equal,0.5,0.35000000000000003,COMPLETE
4684,0.4826669228264977,0.2,0.42500000000000004,0.4,0.2,0.47500000000000003,0.05,equal,0.275,0.425,COMPLETE
4685,0.4759455386256412,0.22500000000000003,0.47500000000000003,0.425,0.175,0.5,0.05,equal,0.5,0.3,COMPLETE
4686,0.5153887675820873,0.05,0.42500000000000004,0.5,0.22500000000000003,0.5,0.05,equal,0.3,0.4,COMPLETE
4687,0.5851660751418166,0.2,0.45000000000000007,0.45,0.15000000000000002,0.47500000000000003,0.05,equal,0.375,0.325,COMPLETE
4688,0.2943461468527415,0.25,0.37500000000000006,0.45,0.22500000000000003,0.5,0.07500000000000001,equal,0.47500000000000003,0.375,COMPLETE
4689,-0.018147915991279667,0.175,0.07500000000000001,0.47500000000000003,0.175,0.47500000000000003,0.07500000000000001,equal,0.35000000000000003,0.35000000000000003,COMPLETE
4690,0.5063455326446673,0.22500000000000003,0.45000000000000007,0.425,0.2,0.47500000000000003,0.05,linear,0.325,0.25,COMPLETE
4691,0.4746102739039285,0.2,0.4,0.4,0.175,0.5,0.05,equal,0.5,0.3,COMPLETE
4692,0.2480506198336554,0.22500000000000003,0.5,0.425,0.22500000000000003,0.47500000000000003,0.07500000000000001,equal,0.47500000000000003,0.325,COMPLETE
4693,0.35415405944422024,0.125,0.47500000000000003,0.35000000000000003,0.175,0.5,0.05,equal,0.275,0.4,COMPLETE
4694,0.2564121193568244,0.375,0.42500000000000004,0.425,0.22500000000000003,0.5,0.05,equal,0.5,0.375,COMPLETE
4695,0.5425044014830845,0.275,0.45000000000000007,0.425,0.175,0.47500000000000003,0.07500000000000001,equal,0.425,0.3,COMPLETE
4696,0.6178023927042294,0.25,0.47500000000000003,0.45,0.2,0.47500000000000003,0.05,equal,0.3,0.35000000000000003,COMPLETE
4697,0.6221535571249034,0.175,0.45000000000000007,0.47500000000000003,0.175,0.5,0.05,equal,0.325,0.3,COMPLETE
4698,0.3197082561992373,0.175,0.4,0.375,0.22500000000000003,0.5,0.05,equal,0.375,0.325,COMPLETE
4699,0.4365661680291387,0.22500000000000003,0.5,0.45,0.2,0.47500000000000003,0.05,equal,0.2,0.25,COMPLETE
4700,0.3571102889210767,0.2,0.42500000000000004,0.4,0.22500000000000003,0.5,0.07500000000000001,equal,0.47500000000000003,0.375,COMPLETE
4701,0.45761747012649034,0.22500000000000003,0.47500000000000003,0.45,0.175,0.5,0.05,equal,0.5,0.325,COMPLETE
4702,0.5896802452268488,0.175,0.45000000000000007,0.47500000000000003,0.22500000000000003,0.47500000000000003,0.07500000000000001,equal,0.47500000000000003,0.35000000000000003,COMPLETE
4703,0.14758655895642425,0.525,0.55,0.425,0.2,0.375,0.05,equal,0.35000000000000003,0.4,COMPLETE
4704,0.5039372685270612,0.2,0.47500000000000003,0.4,0.15000000000000002,0.47500000000000003,0.05,equal,0.3,0.425,COMPLETE
4705,0.37762199794787754,0.15000000000000002,0.42500000000000004,0.375,0.175,0.5,0.05,equal,0.5,0.35000000000000003,COMPLETE
4706,0.5083477353823329,0.25,0.5,0.45,0.15000000000000002,0.47500000000000003,0.05,equal,0.3,0.3,COMPLETE
4707,0.5213506906568274,0.2,0.45000000000000007,0.4,0.22500000000000003,0.47500000000000003,0.07500000000000001,equal,0.47500000000000003,0.375,COMPLETE
4708,0.5965006572114375,0.22500000000000003,0.42500000000000004,0.45,0.175,0.5,0.05,equal,0.4,0.3,COMPLETE
4709,0.38391671908528674,0.2,0.47500000000000003,0.4,0.2,0.5,0.05,equal,0.5,0.375,COMPLETE
4710,0.5236704822185729,0.22500000000000003,0.45000000000000007,0.425,0.2,0.47500000000000003,0.05,linear,0.47500000000000003,0.25,COMPLETE
4711,0.3792292154844436,0.125,0.525,0.5,0.22500000000000003,0.47500000000000003,0.07500000000000001,equal,0.35000000000000003,0.325,COMPLETE
4712,0.5143574218744384,0.2,0.4,0.45,0.175,0.5,0.05,equal,0.375,0.4,COMPLETE
4713,0.3396848440660343,0.25,0.47500000000000003,0.425,0.22500000000000003,0.5,0.07500000000000001,equal,0.5,0.35000000000000003,COMPLETE
4714,-0.12376614016633436,0.15000000000000002,0.45000000000000007,0.5,0.125,0.47500000000000003,0.35000000000000003,equal,0.3,0.325,COMPLETE
4715,0.5997514435684571,0.175,0.47500000000000003,0.47500000000000003,0.175,0.5,0.05,equal,0.4,0.4,COMPLETE
4716,0.21217510154537714,0.22500000000000003,0.5,0.425,0.2,0.275,0.05,equal,0.375,0.3,COMPLETE
4717,0.19593664097833263,0.425,0.4,0.425,0.22500000000000003,0.47500000000000003,0.07500000000000001,equal,0.275,0.25,COMPLETE
4718,0.5979190446471301,0.2,0.42500000000000004,0.45,0.175,0.5,0.05,equal,0.5,0.35000000000000003,COMPLETE
4719,0.25047539142069697,0.175,0.45000000000000007,0.47500000000000003,0.2,0.325,0.05,equal,0.47500000000000003,0.375,COMPLETE
4720,-0.0395327875116936,0.55,0.47500000000000003,0.325,0.22500000000000003,0.47500000000000003,0.07500000000000001,equal,0.5,0.325,COMPLETE
4721,0.4308102675515004,0.275,0.35000000000000003,0.425,0.175,0.5,0.05,equal,0.325,0.375,COMPLETE
4722,0.037902955608169815,0.22500000000000003,0.5,0.45,0.2,0.15000000000000002,0.05,equal,0.47500000000000003,0.3,COMPLETE
4723,0.5235102298214622,0.2,0.42500000000000004,0.4,0.15000000000000002,0.47500000000000003,0.05,equal,0.35000000000000003,0.35000000000000003,COMPLETE
4724,0.4677386629993295,0.22500000000000003,0.45000000000000007,0.45,0.22500000000000003,0.5,0.07500000000000001,equal,0.5,0.325,COMPLETE
4725,0.41536583825168827,0.2,0.525,0.4,0.15000000000000002,0.47500000000000003,0.05,equal,0.325,0.4,COMPLETE
4726,0.10706952022335887,0.35000000000000003,0.45000000000000007,0.425,0.2,0.35000000000000003,0.05,equal,0.3,0.22500000000000003,COMPLETE
4727,0.4830455552988418,0.25,0.42500000000000004,0.425,0.22500000000000003,0.5,0.07500000000000001,equal,0.375,0.25,COMPLETE
4728,0.11259479424608701,0.175,0.47500000000000003,0.375,0.175,0.47500000000000003,0.3,equal,0.47500000000000003,0.3,COMPLETE
4729,0.4686353038907793,0.2,0.5,0.45,0.175,0.5,0.05,equal,0.3,0.35000000000000003,COMPLETE
4730,-0.1259645220613374,0.25,0.45000000000000007,0.425,0.125,0.47500000000000003,0.375,linear,0.5,0.375,COMPLETE
4731,0.3343185041990382,0.22500000000000003,0.42500000000000004,0.45,0.175,0.5,0.05,equal,0.4,0.1,COMPLETE
4732,0.626567456675054,0.175,0.47500000000000003,0.47500000000000003,0.22500000000000003,0.47500000000000003,0.07500000000000001,equal,0.3,0.325,COMPLETE
4733,0.5590158464883752,0.2,0.45000000000000007,0.4,0.175,0.5,0.05,equal,0.375,0.3,COMPLETE
4734,0.1683523566436435,0.15000000000000002,0.4,0.5,0.22500000000000003,0.5,0.05,equal,0.275,0.425,COMPLETE
4735,0.06155720371913931,0.25,0.47500000000000003,0.425,0.2,0.22500000000000003,0.05,equal,0.5,0.375,COMPLETE
4736,0.49228915390870925,0.22500000000000003,0.45000000000000007,0.45,0.15000000000000002,0.47500000000000003,0.05,equal,0.47500000000000003,0.35000000000000003,COMPLETE
4737,0.2660067602976016,0.2,0.5,0.4,0.22500000000000003,0.5,0.07500000000000001,equal,0.35000000000000003,0.375,COMPLETE
4738,0.1985651552581959,0.175,0.525,0.47500000000000003,0.175,0.47500000000000003,0.2,equal,0.325,0.4,COMPLETE
4739,0.6166838131030885,0.22500000000000003,0.42500000000000004,0.425,0.2,0.47500000000000003,0.05,equal,0.5,0.325,COMPLETE
4740,0.36285501156893585,0.275,0.47500000000000003,0.425,0.15000000000000002,0.47500000000000003,0.05,equal,0.25,0.25,COMPLETE
4741,0.4130598144661479,0.3,0.45000000000000007,0.425,0.175,0.5,0.05,equal,0.47500000000000003,0.3,COMPLETE
4742,0.2480506198336554,0.2,0.5750000000000001,0.4,0.22500000000000003,0.5,0.07500000000000001,equal,0.47500000000000003,0.325,COMPLETE
4743,0.44582503368644,0.22500000000000003,0.37500000000000006,0.45,0.2,0.47500000000000003,0.05,equal,0.5,0.4,COMPLETE
4744,0.45761747012649034,0.25,0.47500000000000003,0.45,0.175,0.5,0.05,equal,0.425,0.325,COMPLETE
4745,0.5092825825248228,0.2,0.42500000000000004,0.4,0.22500000000000003,0.47500000000000003,0.07500000000000001,equal,0.3,0.22500000000000003,COMPLETE
4746,0.2660067602976019,0.2,0.5,0.45,0.22500000000000003,0.5,0.07500000000000001,equal,0.375,0.35000000000000003,COMPLETE
4747,0.5482453775763679,0.22500000000000003,0.4,0.425,0.2,0.47500000000000003,0.05,equal,0.47500000000000003,0.45,COMPLETE
4748,0.5991697496493731,0.175,0.45000000000000007,0.47500000000000003,0.2,0.47500000000000003,0.05,equal,0.3,0.3,COMPLETE
4749,0.3391714439613494,0.15000000000000002,0.42500000000000004,0.375,0.175,0.5,0.05,equal,0.275,0.425,COMPLETE
4750,0.5827025892697925,0.175,0.47500000000000003,0.47500000000000003,0.175,0.47500000000000003,0.07500000000000001,equal,0.325,0.375,COMPLETE
4751,0.4534085537234956,0.22500000000000003,0.45000000000000007,0.45,0.22500000000000003,0.5,0.05,linear,0.4,0.375,COMPLETE
4752,0.45761747012649034,0.25,0.47500000000000003,0.45,0.175,0.5,0.05,equal,0.5,0.35000000000000003,COMPLETE
