number,value,params_fund_net_buying,params_institutional_weight,params_number_fund_holdings,params_pe,params_revenue_growth,params_roe,params_stock_weight_option,params_take_profit,params_trailing_stop_loss,state
3252,0.28839052335354454,0.15000000000000002,0.45000000000000007,0.35000000000000003,0.22500000000000003,0.47500000000000003,0.05,equal,0.375,0.35000000000000003,COMPLETE
3253,0.6310795334192677,0.175,0.47500000000000003,0.47500000000000003,0.22500000000000003,0.47500000000000003,0.05,equal,0.375,0.35000000000000003,COMPLETE
3254,0.488805351486133,0.2,0.45000000000000007,0.45,0.22500000000000003,0.5,0.05,equal,0.35000000000000003,0.325,COMPLETE
3255,0.5182147418559979,0.2,0.5,0.45,0.2,0.47500000000000003,0.05,softmax,0.35000000000000003,0.325,COMPLETE
3256,0.4704019769732421,0.175,0.42500000000000004,0.5,0.22500000000000003,0.47500000000000003,0.05,equal,0.375,0.325,COMPLETE
3257,0.2774142121851535,0.175,0.37500000000000006,0.47500000000000003,0.22500000000000003,0.5,0.05,equal,0.325,0.325,COMPLETE
3258,0.5316497004832006,0.2,0.5,0.45,0.2,0.47500000000000003,0.05,equal,0.325,0.325,COMPLETE
3259,0.6178023927042294,0.2,0.47500000000000003,0.47500000000000003,0.22500000000000003,0.47500000000000003,0.05,equal,0.325,0.325,COMPLETE
3260,0.6409572857839799,0.2,0.45000000000000007,0.45,0.22500000000000003,0.47500000000000003,0.05,equal,0.325,0.375,COMPLETE
3261,0.3708833247620354,0.15000000000000002,0.45000000000000007,0.5,0.22500000000000003,0.5,0.05,softmax,0.325,0.4,COMPLETE
3262,0.3829780150074713,0.15000000000000002,0.42500000000000004,0.5,0.22500000000000003,0.5,0.05,equal,0.325,0.375,COMPLETE
3263,0.27901978008870937,0.15000000000000002,0.675,0.5,0.22500000000000003,0.5,0.05,equal,0.325,0.375,COMPLETE
3264,0.4293106679604955,0.175,0.45000000000000007,0.47500000000000003,0.22500000000000003,0.5,0.05,equal,0.325,0.35000000000000003,COMPLETE
3265,0.33840567591316595,0.175,0.4,0.47500000000000003,0.22500000000000003,0.5,0.05,equal,0.325,0.4,COMPLETE
3266,0.5316497004832007,0.175,0.5,0.5,0.2,0.47500000000000003,0.05,equal,0.35000000000000003,0.4,COMPLETE
3267,0.4378286136845352,0.175,0.4,0.47500000000000003,0.2,0.47500000000000003,0.05,softmax,0.3,0.35000000000000003,COMPLETE
3268,0.6178023927042292,0.175,0.47500000000000003,0.47500000000000003,0.2,0.47500000000000003,0.05,equal,0.325,0.35000000000000003,COMPLETE
3269,0.3829780150074713,0.15000000000000002,0.42500000000000004,0.5,0.22500000000000003,0.5,0.05,equal,0.325,0.35000000000000003,COMPLETE
3270,0.6178023927042292,0.175,0.47500000000000003,0.47500000000000003,0.2,0.47500000000000003,0.05,equal,0.325,0.4,COMPLETE
3271,0.6178023927042292,0.2,0.45000000000000007,0.47500000000000003,0.2,0.47500000000000003,0.05,equal,0.3,0.4,COMPLETE
3272,0.2889544470683231,0.4,0.275,0.55,0.22500000000000003,0.5,0.05,softmax,0.35000000000000003,0.375,COMPLETE
3273,0.6409572857839799,0.2,0.45000000000000007,0.45,0.2,0.47500000000000003,0.05,equal,0.3,0.35000000000000003,COMPLETE
3274,0.5316497004832007,0.15000000000000002,0.525,0.525,0.175,0.5,0.05,equal,0.3,0.375,COMPLETE
3275,0.13600207722699326,0.5,0.45000000000000007,0.45,0.2,0.5,0.05,equal,0.3,0.4,COMPLETE
3276,0.5192464776348628,0.125,0.47500000000000003,0.525,0.175,0.47500000000000003,0.05,equal,0.325,0.4,COMPLETE
3277,0.5483219364242679,0.15000000000000002,0.42500000000000004,0.47500000000000003,0.2,0.5,0.05,equal,0.3,0.375,COMPLETE
3278,0.5352696065950319,0.175,0.42500000000000004,0.47500000000000003,0.2,0.47500000000000003,0.05,softmax,0.3,0.375,COMPLETE
3279,0.5991697496493731,0.175,0.45000000000000007,0.47500000000000003,0.15000000000000002,0.5,0.05,equal,0.325,0.375,COMPLETE
3280,0.6178023927042295,0.175,0.5,0.47500000000000003,0.175,0.47500000000000003,0.05,equal,0.3,0.375,COMPLETE
3281,0.44477812987054444,0.175,0.4,0.47500000000000003,0.2,0.47500000000000003,0.05,equal,0.3,0.375,COMPLETE
3282,0.5919434025084293,0.15000000000000002,0.47500000000000003,0.5,0.175,0.47500000000000003,0.05,equal,0.3,0.4,COMPLETE
3283,0.5346170430511319,0.15000000000000002,0.45000000000000007,0.5,0.2,0.5,0.05,softmax,0.3,0.375,COMPLETE
3284,0.6178023927042295,0.175,0.5,0.47500000000000003,0.175,0.47500000000000003,0.05,equal,0.3,0.4,COMPLETE
3285,0.5173352486363572,0.175,0.42500000000000004,0.47500000000000003,0.175,0.47500000000000003,0.05,equal,0.3,0.375,COMPLETE
3286,0.4675593232702767,0.2,0.47500000000000003,0.45,0.2,0.5,0.05,linear,0.325,0.375,COMPLETE
3287,0.4579832047970842,0.2,0.37500000000000006,0.47500000000000003,0.175,0.47500000000000003,0.05,equal,0.3,0.375,COMPLETE
3288,0.6221535571249034,0.175,0.45000000000000007,0.47500000000000003,0.175,0.5,0.05,equal,0.325,0.325,COMPLETE
3289,0.5835939746846562,0.2,0.42500000000000004,0.45,0.175,0.47500000000000003,0.05,softmax,0.325,0.375,COMPLETE
3290,0.5316497004832007,0.175,0.525,0.5,0.2,0.47500000000000003,0.05,equal,0.3,0.375,COMPLETE
3291,0.4367595902554935,0.2,0.47500000000000003,0.45,0.2,0.5,0.05,equal,0.275,0.4,COMPLETE
3292,0.5483219364242679,0.175,0.42500000000000004,0.47500000000000003,0.2,0.47500000000000003,0.05,equal,0.325,0.375,COMPLETE
3293,-0.02631089871073264,0.15000000000000002,0.05,0.5,0.2,0.5,0.05,equal,0.35000000000000003,0.4,COMPLETE
3294,0.4613432975369476,0.125,0.4,0.5,0.175,0.47500000000000003,0.05,softmax,0.3,0.35000000000000003,COMPLETE
3295,0.6178023927042292,0.2,0.47500000000000003,0.45,0.175,0.47500000000000003,0.05,equal,0.35000000000000003,0.35000000000000003,COMPLETE
3296,0.5316497004832006,0.2,0.5,0.45,0.2,0.47500000000000003,0.05,equal,0.325,0.4,COMPLETE
3297,0.5991697496493731,0.175,0.45000000000000007,0.47500000000000003,0.175,0.47500000000000003,0.05,equal,0.3,0.375,COMPLETE
3298,0.5483219364242679,0.175,0.42500000000000004,0.47500000000000003,0.175,0.5,0.05,equal,0.3,0.375,COMPLETE
3299,0.5543280537710815,0.2,0.47500000000000003,0.45,0.2,0.47500000000000003,0.05,softmax,0.275,0.35000000000000003,COMPLETE
3300,0.6409572857839799,0.2,0.45000000000000007,0.45,0.175,0.5,0.05,equal,0.35000000000000003,0.375,COMPLETE
3301,0.526555993118065,0.15000000000000002,0.45000000000000007,0.47500000000000003,0.175,0.5,0.05,equal,0.35000000000000003,0.4,COMPLETE
3302,0.5024800386153757,0.175,0.4,0.47500000000000003,0.175,0.5,0.05,equal,0.35000000000000003,0.375,COMPLETE
3303,0.5316497004832006,0.15000000000000002,0.55,0.5,0.15000000000000002,0.5,0.05,equal,0.325,0.375,COMPLETE
3304,0.526555993118065,0.125,0.5,0.525,0.175,0.5,0.05,equal,0.35000000000000003,0.375,COMPLETE
3305,-0.11177681836793846,0.175,0.525,0.47500000000000003,0.05,0.5,0.425,softmax,0.35000000000000003,0.35000000000000003,COMPLETE
3306,0.6221535571249034,0.175,0.45000000000000007,0.47500000000000003,0.175,0.5,0.05,equal,0.35000000000000003,0.375,COMPLETE
3307,0.43862024721357845,0.15000000000000002,0.37500000000000006,0.5,0.175,0.5,0.05,equal,0.35000000000000003,0.375,COMPLETE
3308,0.5979453200812663,0.175,0.47500000000000003,0.47500000000000003,0.175,0.5,0.05,linear,0.325,0.375,COMPLETE
3309,0.6221535571249034,0.175,0.45000000000000007,0.47500000000000003,0.175,0.5,0.05,equal,0.325,0.375,COMPLETE
3310,0.6131078359831612,0.2,0.42500000000000004,0.45,0.175,0.5,0.05,equal,0.325,0.4,COMPLETE
3311,0.3934021019847516,0.175,0.35000000000000003,0.47500000000000003,0.175,0.5,0.05,equal,0.35000000000000003,0.375,COMPLETE
3312,0.4381364795437199,0.2,0.47500000000000003,0.45,0.175,0.5,0.05,softmax,0.35000000000000003,0.375,COMPLETE
3313,0.5216629174304596,0.175,0.42500000000000004,0.47500000000000003,0.15000000000000002,0.5,0.05,equal,0.35000000000000003,0.4,COMPLETE
3314,0.5613962809270421,0.2,0.4,0.45,0.15000000000000002,0.5,0.05,equal,0.35000000000000003,0.375,COMPLETE
3315,0.526555993118065,0.15000000000000002,0.45000000000000007,0.47500000000000003,0.175,0.5,0.05,equal,0.325,0.375,COMPLETE
3316,0.450237329580842,0.2,0.47500000000000003,0.45,0.175,0.5,0.05,equal,0.35000000000000003,0.4,COMPLETE
3317,0.4377093191190712,0.175,0.5,0.47500000000000003,0.175,0.5,0.05,softmax,0.35000000000000003,0.375,COMPLETE
3318,0.6221535571249034,0.175,0.45000000000000007,0.47500000000000003,0.175,0.5,0.05,equal,0.325,0.375,COMPLETE
3319,0.6131078359831612,0.2,0.42500000000000004,0.45,0.175,0.5,0.05,equal,0.35000000000000003,0.375,COMPLETE
3320,0.450237329580842,0.2,0.47500000000000003,0.45,0.175,0.5,0.05,equal,0.35000000000000003,0.375,COMPLETE
3321,0.420663009233765,0.15000000000000002,0.4,0.5,0.175,0.5,0.05,equal,0.35000000000000003,0.375,COMPLETE
3322,0.5929822905369428,0.2,0.45000000000000007,0.45,0.15000000000000002,0.5,0.05,softmax,0.325,0.4,COMPLETE
3323,0.4686353038907793,0.2,0.5,0.45,0.175,0.5,0.05,equal,0.35000000000000003,0.4,COMPLETE
3324,0.6042558778458771,0.2,0.45000000000000007,0.45,0.15000000000000002,0.5,0.05,equal,0.35000000000000003,0.375,COMPLETE
3325,0.3812708332045353,0.2,0.525,0.45,0.175,0.5,0.05,equal,0.35000000000000003,0.375,COMPLETE
3326,0.5616299729147134,0.175,0.42500000000000004,0.47500000000000003,0.175,0.5,0.05,equal,0.375,0.4,COMPLETE
3327,0.474385700081148,0.2,0.47500000000000003,0.45,0.2,0.5,0.05,softmax,0.325,0.375,COMPLETE
3328,0.5483219364242679,0.175,0.42500000000000004,0.47500000000000003,0.175,0.5,0.05,equal,0.325,0.35000000000000003,COMPLETE
3329,0.45581744171820787,0.15000000000000002,0.4,0.5,0.15000000000000002,0.5,0.05,equal,0.35000000000000003,0.375,COMPLETE
3330,0.44548159426524003,0.2,0.47500000000000003,0.45,0.175,0.5,0.05,linear,0.375,0.4,COMPLETE
3331,0.6042558778458771,0.2,0.45000000000000007,0.45,0.15000000000000002,0.5,0.05,equal,0.35000000000000003,0.375,COMPLETE
3332,0.6221535571249034,0.175,0.45000000000000007,0.47500000000000003,0.175,0.5,0.05,equal,0.325,0.4,COMPLETE
3333,0.4377093191190712,0.175,0.5,0.47500000000000003,0.175,0.5,0.05,softmax,0.35000000000000003,0.35000000000000003,COMPLETE
3334,0.5032479503012194,0.2,0.5,0.45,0.15000000000000002,0.5,0.05,equal,0.3,0.35000000000000003,COMPLETE
3335,0.5616299729147134,0.15000000000000002,0.42500000000000004,0.47500000000000003,0.175,0.5,0.05,equal,0.375,0.35000000000000003,COMPLETE
3336,-0.02449946850851983,0.675,0.47500000000000003,0.25,0.175,0.5,0.05,equal,0.275,0.375,COMPLETE
3337,0.450237329580842,0.2,0.47500000000000003,0.45,0.175,0.5,0.05,equal,0.325,0.375,COMPLETE
3338,0.6004389417660373,0.2,0.42500000000000004,0.45,0.2,0.47500000000000003,0.05,softmax,0.325,0.375,COMPLETE
3339,0.4579832047970841,0.175,0.37500000000000006,0.47500000000000003,0.2,0.47500000000000003,0.05,equal,0.35000000000000003,0.375,COMPLETE
3340,0.5265559931180647,0.125,0.45000000000000007,0.5,0.175,0.5,0.05,equal,0.3,0.375,COMPLETE
3341,0.5534896987806653,0.2,0.45000000000000007,0.45,0.15000000000000002,0.5,0.05,equal,0.275,0.35000000000000003,COMPLETE
3342,0.4816855689472004,0.2,0.4,0.45,0.2,0.47500000000000003,0.05,equal,0.35000000000000003,0.35000000000000003,COMPLETE
3343,0.6178023927042292,0.175,0.47500000000000003,0.47500000000000003,0.2,0.47500000000000003,0.05,equal,0.325,0.4,COMPLETE
3344,0.46724016760555126,0.2,0.5,0.45,0.175,0.5,0.05,softmax,0.375,0.375,COMPLETE
3345,0.5483219364242679,0.175,0.42500000000000004,0.47500000000000003,0.2,0.47500000000000003,0.05,equal,0.35000000000000003,0.35000000000000003,COMPLETE
3346,0.4240832794994375,0.15000000000000002,0.45000000000000007,0.525,0.2,0.47500000000000003,0.05,equal,0.325,0.375,COMPLETE
3347,0.450237329580842,0.2,0.47500000000000003,0.45,0.175,0.5,0.05,equal,0.3,0.35000000000000003,COMPLETE
3348,0.6131078359831613,0.2,0.42500000000000004,0.45,0.2,0.47500000000000003,0.05,equal,0.35000000000000003,0.4,COMPLETE
3349,0.4377093191190712,0.175,0.5,0.47500000000000003,0.175,0.5,0.05,softmax,0.325,0.35000000000000003,COMPLETE
3350,0.3948605479095596,0.2,0.525,0.45,0.2,0.47500000000000003,0.05,equal,0.3,0.375,COMPLETE
3351,0.6124948216838828,0.175,0.45000000000000007,0.47500000000000003,0.2,0.47500000000000003,0.05,equal,0.375,0.375,COMPLETE
3352,0.48661774873359864,0.2,0.4,0.45,0.15000000000000002,0.47500000000000003,0.05,linear,0.275,0.4,COMPLETE
3353,0.6409572857839799,0.2,0.45000000000000007,0.45,0.175,0.5,0.05,equal,0.325,0.35000000000000003,COMPLETE
3354,0.526555993118065,0.15000000000000002,0.47500000000000003,0.5,0.175,0.5,0.05,equal,0.325,0.35000000000000003,COMPLETE
3355,0.5483219364242679,0.15000000000000002,0.42500000000000004,0.5,0.175,0.5,0.05,equal,0.325,0.35000000000000003,COMPLETE
3356,0.5136304211238605,0.15000000000000002,0.45000000000000007,0.5,0.175,0.5,0.05,softmax,0.325,0.35000000000000003,COMPLETE
3357,0.6221535571249034,0.175,0.45000000000000007,0.47500000000000003,0.175,0.5,0.05,equal,0.3,0.35000000000000003,COMPLETE
3358,0.6178023927042294,0.175,0.5,0.47500000000000003,0.15000000000000002,0.5,0.05,equal,0.325,0.35000000000000003,COMPLETE
3359,0.6178023927042292,0.175,0.47500000000000003,0.47500000000000003,0.175,0.5,0.05,equal,0.325,0.35000000000000003,COMPLETE
3360,0.5024800386153757,0.175,0.4,0.47500000000000003,0.175,0.5,0.05,equal,0.3,0.35000000000000003,COMPLETE
3361,0.48449565812717676,0.15000000000000002,0.42500000000000004,0.5,0.15000000000000002,0.5,0.05,softmax,0.325,0.35000000000000003,COMPLETE
3362,0.6178023927042292,0.175,0.47500000000000003,0.47500000000000003,0.175,0.5,0.05,equal,0.3,0.35000000000000003,COMPLETE
3363,0.6221535571249034,0.175,0.45000000000000007,0.47500000000000003,0.175,0.5,0.05,equal,0.3,0.35000000000000003,COMPLETE
3364,0.14866778501419295,0.125,0.42500000000000004,0.85,0.175,0.5,0.05,equal,0.35000000000000003,0.35000000000000003,COMPLETE
3365,0.6178023927042292,0.2,0.47500000000000003,0.45,0.15000000000000002,0.5,0.05,equal,0.325,0.375,COMPLETE
3366,0.4377093191190712,0.175,0.5,0.47500000000000003,0.175,0.5,0.05,softmax,0.35000000000000003,0.35000000000000003,COMPLETE
3367,0.5439794453684809,0.2,0.37500000000000006,0.45,0.175,0.5,0.05,equal,0.325,0.375,COMPLETE
3368,0.6409572857839799,0.2,0.45000000000000007,0.45,0.175,0.5,0.05,equal,0.35000000000000003,0.35000000000000003,COMPLETE
3369,0.450237329580842,0.2,0.47500000000000003,0.45,0.175,0.5,0.05,equal,0.35000000000000003,0.35000000000000003,COMPLETE
3370,0.3812708332045351,0.175,0.525,0.47500000000000003,0.175,0.5,0.05,equal,0.35000000000000003,0.35000000000000003,COMPLETE
3371,0.4686353038907793,0.2,0.5,0.45,0.175,0.5,0.05,equal,0.35000000000000003,0.35000000000000003,COMPLETE
3372,0.6039583556163969,0.175,0.47500000000000003,0.47500000000000003,0.175,0.5,0.05,softmax,0.35000000000000003,0.35000000000000003,COMPLETE
3373,0.35404831880503473,0.2,0.47500000000000003,0.6000000000000001,0.15000000000000002,0.5,0.05,equal,0.35000000000000003,0.35000000000000003,COMPLETE
3374,0.5316497004832007,0.15000000000000002,0.525,0.5,0.15000000000000002,0.5,0.05,equal,0.35000000000000003,0.35000000000000003,COMPLETE
3375,0.4479961737614533,0.2,0.5,0.45,0.175,0.5,0.05,linear,0.35000000000000003,0.35000000000000003,COMPLETE
3376,0.46326331304828533,0.2,0.47500000000000003,0.45,0.175,0.5,0.05,equal,0.375,0.35000000000000003,COMPLETE
3377,0.17702526960323361,0.175,0.17500000000000002,0.47500000000000003,0.175,0.5,0.05,equal,0.375,0.375,COMPLETE
3378,0.6040975449306764,0.2,0.47500000000000003,0.45,0.15000000000000002,0.5,0.05,softmax,0.35000000000000003,0.35000000000000003,COMPLETE
3379,0.45023732958084206,0.175,0.5,0.47500000000000003,0.175,0.5,0.05,equal,0.35000000000000003,0.35000000000000003,COMPLETE
3380,0.526555993118065,0.15000000000000002,0.45000000000000007,0.5,0.175,0.5,0.05,equal,0.35000000000000003,0.375,COMPLETE
3381,0.6042558778458771,0.2,0.45000000000000007,0.45,0.15000000000000002,0.5,0.05,equal,0.35000000000000003,0.35000000000000003,COMPLETE
3382,0.3447198435268572,0.375,0.47500000000000003,0.45,0.2,0.5,0.05,equal,0.325,0.375,COMPLETE
3383,0.6268335274841477,0.2,0.45000000000000007,0.45,0.175,0.5,0.05,softmax,0.35000000000000003,0.35000000000000003,COMPLETE
3384,0.48164583778753395,0.2,0.5,0.45,0.175,0.5,0.05,equal,0.375,0.35000000000000003,COMPLETE
3385,0.6178023927042292,0.175,0.47500000000000003,0.47500000000000003,0.175,0.5,0.05,equal,0.35000000000000003,0.375,COMPLETE
3386,0.5991697496493731,0.175,0.47500000000000003,0.47500000000000003,0.15000000000000002,0.5,0.05,equal,0.35000000000000003,0.35000000000000003,COMPLETE
3387,0.12457547749198641,0.8,0.55,0.125,0.175,0.5,0.05,equal,0.325,0.35000000000000003,COMPLETE
3388,0.6544393809331743,0.2,0.45000000000000007,0.45,0.175,0.5,0.05,equal,0.375,0.375,COMPLETE
3389,0.598935273844901,0.15000000000000002,0.5,0.5,0.175,0.5,0.05,softmax,0.375,0.375,COMPLETE
3390,0.48164583778753395,0.2,0.5,0.45,0.175,0.5,0.05,equal,0.375,0.375,COMPLETE
3391,0.46326331304828533,0.2,0.47500000000000003,0.45,0.175,0.5,0.05,equal,0.375,0.375,COMPLETE
3392,0.6310795334192677,0.2,0.47500000000000003,0.45,0.15000000000000002,0.5,0.05,equal,0.375,0.375,COMPLETE
3393,0.4632633130482854,0.175,0.5,0.47500000000000003,0.175,0.5,0.05,equal,0.375,0.375,COMPLETE
3394,0.6310795334192677,0.175,0.47500000000000003,0.47500000000000003,0.175,0.5,0.05,equal,0.375,0.375,COMPLETE
3395,0.4509865723488694,0.2,0.47500000000000003,0.45,0.175,0.5,0.05,softmax,0.375,0.375,COMPLETE
3396,0.3812708332045353,0.2,0.525,0.45,0.175,0.5,0.05,equal,0.375,0.375,COMPLETE
3397,0.6177592110983625,0.2,0.45000000000000007,0.45,0.15000000000000002,0.5,0.05,equal,0.375,0.375,COMPLETE
3398,-0.0694452595458423,0.6250000000000001,0.45000000000000007,0.325,0.175,0.5,0.05,linear,0.375,0.375,COMPLETE
3399,0.37840116146761144,0.175,0.5,0.45,0.175,0.5,0.05,equal,0.35000000000000003,0.375,COMPLETE
3400,0.6124948216838828,0.175,0.47500000000000003,0.47500000000000003,0.15000000000000002,0.5,0.05,equal,0.375,0.375,COMPLETE
3401,0.458524936207165,0.22500000000000003,0.45000000000000007,0.45,0.175,0.5,0.05,softmax,0.35000000000000003,0.375,COMPLETE
3402,0.4702110117134355,0.22500000000000003,0.47500000000000003,0.45,0.175,0.5,0.05,equal,0.35000000000000003,0.375,COMPLETE
3403,0.450237329580842,0.2,0.47500000000000003,0.45,0.175,0.5,0.05,equal,0.35000000000000003,0.4,COMPLETE
3404,0.6124948216838828,0.15000000000000002,0.5,0.5,0.15000000000000002,0.5,0.05,equal,0.375,0.4,COMPLETE
3405,0.6409572857839799,0.2,0.45000000000000007,0.45,0.175,0.5,0.05,equal,0.35000000000000003,0.375,COMPLETE
3406,0.6221535571249034,0.175,0.45000000000000007,0.47500000000000003,0.175,0.5,0.05,equal,0.325,0.4,COMPLETE
3407,0.6178023927042292,0.175,0.47500000000000003,0.47500000000000003,0.175,0.5,0.05,equal,0.35000000000000003,0.4,COMPLETE
3408,0.526555993118065,0.15000000000000002,0.45000000000000007,0.47500000000000003,0.175,0.5,0.05,equal,0.325,0.375,COMPLETE
3409,0.5316497004832006,0.15000000000000002,0.525,0.47500000000000003,0.15000000000000002,0.5,0.05,equal,0.35000000000000003,0.375,COMPLETE
3410,0.45023732958084206,0.175,0.5,0.47500000000000003,0.175,0.5,0.05,equal,0.35000000000000003,0.375,COMPLETE
3411,0.6356363846529747,0.175,0.45000000000000007,0.47500000000000003,0.175,0.5,0.05,equal,0.375,0.4,COMPLETE
3412,0.6310795334192677,0.175,0.47500000000000003,0.47500000000000003,0.175,0.5,0.05,equal,0.375,0.375,COMPLETE
3413,0.49202629260087594,0.125,0.45000000000000007,0.525,0.15000000000000002,0.5,0.05,equal,0.325,0.375,COMPLETE
3414,0.5991697496493731,0.15000000000000002,0.5,0.5,0.175,0.5,0.05,equal,0.35000000000000003,0.4,COMPLETE
3415,0.6178023927042292,0.175,0.47500000000000003,0.47500000000000003,0.175,0.5,0.05,equal,0.325,0.375,COMPLETE
3416,0.6042558778458771,0.2,0.45000000000000007,0.45,0.15000000000000002,0.5,0.05,equal,0.35000000000000003,0.375,COMPLETE
3417,0.3812708332045351,0.175,0.525,0.47500000000000003,0.175,0.5,0.05,equal,0.325,0.375,COMPLETE
3418,0.450237329580842,0.2,0.47500000000000003,0.45,0.175,0.5,0.05,equal,0.35000000000000003,0.375,COMPLETE
3419,0.5395335114380664,0.15000000000000002,0.45000000000000007,0.47500000000000003,0.175,0.5,0.05,equal,0.375,0.4,COMPLETE
3420,0.15598426816059863,0.47500000000000003,0.47500000000000003,0.45,0.175,0.5,0.05,equal,0.325,0.375,COMPLETE
3421,0.6177592110983625,0.2,0.45000000000000007,0.45,0.15000000000000002,0.5,0.05,equal,0.375,0.4,COMPLETE
3422,0.4686353038907793,0.2,0.5,0.45,0.175,0.5,0.05,equal,0.35000000000000003,0.375,COMPLETE
3423,0.6221535571249034,0.175,0.45000000000000007,0.47500000000000003,0.175,0.5,0.05,equal,0.35000000000000003,0.375,COMPLETE
3424,0.48164583778753395,0.2,0.5,0.45,0.175,0.5,0.05,equal,0.375,0.375,COMPLETE
3425,0.5991697496493731,0.175,0.45000000000000007,0.47500000000000003,0.15000000000000002,0.5,0.05,equal,0.325,0.375,COMPLETE
3426,0.5991697496493731,0.15000000000000002,0.47500000000000003,0.47500000000000003,0.15000000000000002,0.5,0.05,equal,0.325,0.35000000000000003,COMPLETE
3427,0.450237329580842,0.2,0.47500000000000003,0.45,0.175,0.5,0.05,equal,0.35000000000000003,0.4,COMPLETE
3428,0.6221535571249034,0.175,0.45000000000000007,0.5,0.175,0.5,0.05,equal,0.35000000000000003,0.4,COMPLETE
3429,0.4686353038907793,0.2,0.5,0.45,0.175,0.5,0.05,equal,0.3,0.375,COMPLETE
3430,0.6409572857839799,0.2,0.45000000000000007,0.45,0.175,0.5,0.05,equal,0.325,0.35000000000000003,COMPLETE
3431,0.34065045033948366,0.175,0.8,0.45,0.175,0.5,0.05,equal,0.3,0.35000000000000003,COMPLETE
3432,0.6409572857839799,0.2,0.45000000000000007,0.45,0.175,0.5,0.05,equal,0.325,0.35000000000000003,COMPLETE
3433,0.4686353038907793,0.2,0.5,0.45,0.175,0.5,0.05,equal,0.325,0.35000000000000003,COMPLETE
3434,0.6178023927042292,0.2,0.47500000000000003,0.45,0.15000000000000002,0.5,0.05,equal,0.325,0.35000000000000003,COMPLETE
3435,0.6364178817607221,0.175,0.47500000000000003,0.45,0.175,0.5,0.05,equal,0.325,0.35000000000000003,COMPLETE
3436,0.12049155421411374,0.15000000000000002,0.9,0.45,0.175,0.5,0.05,equal,0.325,0.35000000000000003,COMPLETE
3437,0.22748564452713996,0.2,0.5,0.7500000000000001,0.15000000000000002,0.5,0.05,equal,0.325,0.35000000000000003,COMPLETE
3438,0.526555993118065,0.125,0.47500000000000003,0.5,0.175,0.5,0.05,equal,0.325,0.35000000000000003,COMPLETE
3439,0.6364178817607221,0.175,0.47500000000000003,0.45,0.175,0.5,0.05,equal,0.325,0.35000000000000003,COMPLETE
3440,0.4409252794557972,0.125,0.525,0.5,0.175,0.5,0.05,equal,0.325,0.35000000000000003,COMPLETE
