number,value,params_fund_net_buying,params_institutional_weight,params_number_fund_holdings,params_pe,params_revenue_growth,params_roe,params_stock_weight_option,params_take_profit,params_trailing_stop_loss,state
2351,0.055380463253408105,0.47500000000000003,0.55,0.2,0.275,0.425,0.05,linear,0.325,0.35000000000000003,COMPLETE
2352,0.3410899960211134,0.275,0.47500000000000003,0.45,0.25,0.47500000000000003,0.05,equal,0.45,0.3,COMPLETE
2353,0.10789851243664855,0.2,0.45000000000000007,0.4,0.325,0.45,0.07500000000000001,equal,0.45,0.3,COMPLETE
2354,0.35832814534818225,0.175,0.47500000000000003,0.375,0.22500000000000003,0.45,0.05,equal,0.47500000000000003,0.375,COMPLETE
2355,0.08147357863374279,0.7250000000000001,0.42500000000000004,0.07500000000000001,0.25,0.47500000000000003,0.05,softmax,0.47500000000000003,0.35000000000000003,COMPLETE
2356,0.35571194412079304,0.25,0.47500000000000003,0.45,0.25,0.5,0.07500000000000001,equal,0.47500000000000003,0.325,COMPLETE
2357,0.4370683142369284,0.22500000000000003,0.4,0.425,0.25,0.47500000000000003,0.07500000000000001,equal,0.45,0.375,COMPLETE
2358,0.6021780566265795,0.2,0.45000000000000007,0.45,0.22500000000000003,0.45,0.05,equal,0.47500000000000003,0.375,COMPLETE
2359,0.38767332423688966,0.15000000000000002,0.525,0.35000000000000003,0.22500000000000003,0.47500000000000003,0.05,equal,0.425,0.3,COMPLETE
2360,0.25252683466860043,0.25,0.5,0.425,0.25,0.5,0.07500000000000001,softmax,0.47500000000000003,0.3,COMPLETE
2361,0.4905892399897375,0.175,0.42500000000000004,0.375,0.275,0.425,0.05,equal,0.47500000000000003,0.325,COMPLETE
2362,0.37213173241055925,0.2,0.45000000000000007,0.4,0.22500000000000003,0.4,0.07500000000000001,equal,0.3,0.3,COMPLETE
2363,0.3700286637272349,0.22500000000000003,0.47500000000000003,0.425,0.275,0.45,0.05,linear,0.45,0.35000000000000003,COMPLETE
2364,0.5984515005622841,0.22500000000000003,0.42500000000000004,0.425,0.25,0.47500000000000003,0.05,equal,0.47500000000000003,0.3,COMPLETE
2365,0.48816348914485663,0.2,0.4,0.45,0.22500000000000003,0.45,0.07500000000000001,equal,0.47500000000000003,0.3,COMPLETE
2366,0.4230507639358624,0.22500000000000003,0.45000000000000007,0.425,0.25,0.47500000000000003,0.05,softmax,0.45,0.325,COMPLETE
2367,0.16330752627776754,0.375,0.37500000000000006,0.425,0.25,0.5,0.07500000000000001,equal,0.275,0.3,COMPLETE
2368,0.439258875065868,0.275,0.47500000000000003,0.45,0.22500000000000003,0.47500000000000003,0.05,equal,0.47500000000000003,0.275,COMPLETE
2369,0.43605246991593605,0.25,0.5,0.45,0.22500000000000003,0.425,0.07500000000000001,equal,0.47500000000000003,0.325,COMPLETE
2370,-0.07360131871552666,0.2,0.45000000000000007,0.4,0.25,0.45,0.275,equal,0.47500000000000003,0.22500000000000003,COMPLETE
2371,0.5800721866895003,0.175,0.42500000000000004,0.47500000000000003,0.25,0.47500000000000003,0.05,softmax,0.45,0.275,COMPLETE
2372,0.01124083562717268,0.15000000000000002,0.45000000000000007,0.825,0.25,0.5,0.05,equal,0.4,0.3,COMPLETE
2373,0.4952721129575176,0.25,0.42500000000000004,0.45,0.22500000000000003,0.45,0.07500000000000001,equal,0.47500000000000003,0.3,COMPLETE
2374,0.4163256168988323,0.22500000000000003,0.47500000000000003,0.425,0.25,0.47500000000000003,0.05,equal,0.45,0.275,COMPLETE
2375,0.11598741075693134,0.2,0.9,0.4,0.22500000000000003,0.45,0.05,linear,0.425,0.275,COMPLETE
2376,0.31614614769298605,0.22500000000000003,0.4,0.45,0.275,0.4,0.07500000000000001,equal,0.47500000000000003,0.325,COMPLETE
2377,0.5170880219263545,0.175,0.45000000000000007,0.5,0.25,0.47500000000000003,0.07500000000000001,softmax,0.47500000000000003,0.25,COMPLETE
2378,0.11203287604242448,0.2,0.8,0.47500000000000003,0.25,0.5,0.05,equal,0.47500000000000003,0.22500000000000003,COMPLETE
2379,0.2389191853497053,0.175,0.8250000000000001,0.4,0.275,0.175,0.05,equal,0.425,0.325,COMPLETE
2380,0.2223629806736252,0.25,0.47500000000000003,0.425,0.25,0.47500000000000003,0.07500000000000001,equal,0.45,0.25,COMPLETE
2381,0.524121274342744,0.22500000000000003,0.42500000000000004,0.425,0.22500000000000003,0.45,0.05,equal,0.47500000000000003,0.35000000000000003,COMPLETE
2382,0.3818097087990572,0.2,0.5,0.45,0.22500000000000003,0.45,0.07500000000000001,softmax,0.45,0.3,COMPLETE
2383,0.41839647054414597,0.22500000000000003,0.525,0.425,0.275,0.425,0.05,equal,0.5,0.3,COMPLETE
2384,0.5146797748870202,0.275,0.42500000000000004,0.45,0.22500000000000003,0.47500000000000003,0.05,equal,0.47500000000000003,0.275,COMPLETE
2385,-0.031753029859965955,0.5,0.45000000000000007,0.275,0.25,0.47500000000000003,0.07500000000000001,equal,0.47500000000000003,0.25,COMPLETE
2386,0.38124387192715276,0.175,0.4,0.47500000000000003,0.25,0.5,0.05,equal,0.5,0.3,COMPLETE
2387,0.36671490050136724,0.2,0.47500000000000003,0.4,0.22500000000000003,0.45,0.07500000000000001,softmax,0.45,0.275,COMPLETE
2388,-0.18200238856740253,0.22500000000000003,0.45000000000000007,0.425,0.025,0.47500000000000003,0.5,linear,0.47500000000000003,0.47500000000000003,COMPLETE
2389,0.45871600481165875,0.25,0.47500000000000003,0.45,0.25,0.5,0.05,equal,0.5,0.325,COMPLETE
2390,0.5241115289609822,0.2,0.42500000000000004,0.47500000000000003,0.275,0.45,0.05,equal,0.5,0.25,COMPLETE
2391,0.35169600676325813,0.15000000000000002,0.5,0.375,0.22500000000000003,0.425,0.07500000000000001,equal,0.47500000000000003,0.3,COMPLETE
2392,0.4638950289948677,0.22500000000000003,0.37500000000000006,0.425,0.25,0.47500000000000003,0.05,equal,0.375,0.275,COMPLETE
2393,0.4895731594242807,0.175,0.45000000000000007,0.4,0.25,0.47500000000000003,0.05,softmax,0.45,0.3,COMPLETE
2394,0.5342181630118251,0.25,0.45000000000000007,0.45,0.22500000000000003,0.45,0.07500000000000001,equal,0.5,0.275,COMPLETE
2395,-0.03969702833247667,0.2,0.4,0.45,0.125,0.5,0.3,equal,0.47500000000000003,0.25,COMPLETE
2396,0.417603062281051,0.22500000000000003,0.47500000000000003,0.425,0.25,0.47500000000000003,0.05,equal,0.47500000000000003,0.3,COMPLETE
2397,0.1420664417189068,0.2,0.42500000000000004,0.4,0.4,0.45,0.05,equal,0.5,0.325,COMPLETE
2398,0.2585691507752802,0.22500000000000003,0.47500000000000003,0.425,0.25,0.47500000000000003,0.07500000000000001,softmax,0.3,0.275,COMPLETE
2399,0.5342181630118251,0.2,0.42500000000000004,0.47500000000000003,0.22500000000000003,0.47500000000000003,0.05,equal,0.47500000000000003,0.375,COMPLETE
2400,0.5279610128682566,0.25,0.5,0.45,0.22500000000000003,0.45,0.07500000000000001,equal,0.4,0.35000000000000003,COMPLETE
2401,-0.1830283356286241,0.175,0.45000000000000007,0.5,0.05,0.47500000000000003,0.47500000000000003,linear,0.45,0.3,COMPLETE
2402,-0.1112433141108856,0.22500000000000003,0.45000000000000007,0.425,0.05,0.5,0.4,equal,0.5,0.275,COMPLETE
2403,0.26564571570773376,0.2,0.37500000000000006,0.7000000000000001,0.25,0.45,0.07500000000000001,equal,0.47500000000000003,0.22500000000000003,COMPLETE
2404,0.4131517742979859,0.22500000000000003,0.55,0.45,0.275,0.425,0.05,softmax,0.47500000000000003,0.25,COMPLETE
2405,0.2970856350702906,0.25,0.5,0.45,0.25,0.47500000000000003,0.07500000000000001,equal,0.45,0.325,COMPLETE
2406,0.3899327503698231,0.15000000000000002,0.4,0.375,0.3,0.45,0.05,equal,0.5,0.3,COMPLETE
2407,0.4280896192442749,0.175,0.42500000000000004,0.47500000000000003,0.25,0.5,0.05,equal,0.35000000000000003,0.275,COMPLETE
2408,0.25363833099998745,0.2,0.525,0.4,0.25,0.47500000000000003,0.07500000000000001,equal,0.47500000000000003,0.3,COMPLETE
2409,0.20562068226505317,0.275,0.47500000000000003,0.425,0.275,0.45,0.05,softmax,0.275,0.25,COMPLETE
2410,0.6078636465947452,0.175,0.45000000000000007,0.47500000000000003,0.25,0.47500000000000003,0.07500000000000001,equal,0.425,0.3,COMPLETE
2411,0.5039884164991113,0.22500000000000003,0.47500000000000003,0.425,0.25,0.5,0.05,equal,0.5,0.325,COMPLETE
2412,0.24014155833125478,0.55,0.42500000000000004,0.325,0.425,0.47500000000000003,0.05,equal,0.45,0.275,COMPLETE
2413,0.46135007198096534,0.25,0.45000000000000007,0.45,0.275,0.45,0.05,linear,0.5,0.25,COMPLETE
2414,0.5333478649537176,0.22500000000000003,0.42500000000000004,0.425,0.22500000000000003,0.45,0.07500000000000001,equal,0.47500000000000003,0.275,COMPLETE
2415,0.27760576933874503,0.175,0.5,0.4,0.1,0.425,0.35000000000000003,softmax,0.425,0.3,COMPLETE
2416,0.2403434531638806,0.2,0.47500000000000003,0.45,0.22500000000000003,0.47500000000000003,0.05,equal,0.47500000000000003,0.07500000000000001,COMPLETE
2417,0.4665351075252505,0.2,0.45000000000000007,0.45,0.25,0.5,0.07500000000000001,equal,0.5,0.22500000000000003,COMPLETE
2418,0.4583089763880938,0.25,0.4,0.425,0.275,0.45,0.05,equal,0.45,0.325,COMPLETE
2419,0.11963131152995439,0.22500000000000003,0.15,0.425,0.22500000000000003,0.425,0.07500000000000001,equal,0.47500000000000003,0.275,COMPLETE
2420,0.220929626511943,0.3,0.6000000000000001,0.425,0.25,0.47500000000000003,0.1,softmax,0.5,0.25,COMPLETE
2421,0.02451954126259097,0.425,0.9500000000000001,0.425,0.22500000000000003,0.45,0.05,equal,0.45,0.3,COMPLETE
2422,0.13327768556780173,0.22500000000000003,0.45000000000000007,0.45,0.25,0.47500000000000003,0.175,equal,0.25,0.35000000000000003,COMPLETE
2423,0.13083260428488402,0.2,0.4,0.4,0.25,0.5,0.07500000000000001,equal,0.47500000000000003,0.125,COMPLETE
2424,0.33772898442449406,0.15000000000000002,0.47500000000000003,0.35000000000000003,0.22500000000000003,0.45,0.05,equal,0.5,0.325,COMPLETE
2425,0.3200327801104144,0.25,0.42500000000000004,0.45,0.25,0.47500000000000003,0.07500000000000001,linear,0.47500000000000003,0.275,COMPLETE
2426,0.5148570140642894,0.2,0.5,0.47500000000000003,0.275,0.45,0.05,softmax,0.47500000000000003,0.275,COMPLETE
2427,0.6246360197681787,0.175,0.45000000000000007,0.47500000000000003,0.22500000000000003,0.47500000000000003,0.05,equal,0.5,0.3,COMPLETE
2428,0.26988904778163125,0.22500000000000003,0.47500000000000003,0.425,0.25,0.47500000000000003,0.07500000000000001,equal,0.45,0.25,COMPLETE
2429,0.37698700305478755,0.2,0.42500000000000004,0.4,0.25,0.5,0.05,equal,0.5,0.3,COMPLETE
2430,0.40581276866515525,0.22500000000000003,0.45000000000000007,0.45,0.275,0.425,0.07500000000000001,equal,0.325,0.275,COMPLETE
2431,0.24511493307788623,0.25,0.4,0.45,0.3,0.45,0.05,softmax,0.2,0.325,COMPLETE
2432,0.32525683683128176,0.175,0.47500000000000003,0.5,0.25,0.47500000000000003,0.1,equal,0.47500000000000003,0.275,COMPLETE
2433,0.44248563631596866,0.275,0.42500000000000004,0.425,0.25,0.5,0.05,equal,0.47500000000000003,0.3,COMPLETE
2434,0.2775553682234829,0.22500000000000003,0.5,0.425,0.22500000000000003,0.47500000000000003,0.05,equal,0.45,0.25,COMPLETE
2435,0.35005184605850226,0.2,0.45000000000000007,0.4,0.22500000000000003,0.45,0.07500000000000001,equal,0.5,0.3,COMPLETE
2436,0.4141948808837855,0.2,0.47500000000000003,0.4,0.22500000000000003,0.45,0.05,softmax,0.45,0.325,COMPLETE
2437,0.044833465258139936,0.22500000000000003,0.42500000000000004,0.45,0.125,0.5,0.325,equal,0.47500000000000003,0.25,COMPLETE
2438,0.41823019303470277,0.2,0.37500000000000006,0.47500000000000003,0.25,0.47500000000000003,0.07500000000000001,linear,0.47500000000000003,0.275,COMPLETE
2439,0.34241194404750075,0.25,0.45000000000000007,0.45,0.22500000000000003,0.425,0.05,equal,0.5,0.275,COMPLETE
2440,0.41839647054414597,0.175,0.5,0.375,0.275,0.45,0.05,equal,0.47500000000000003,0.3,COMPLETE
2441,0.10821489275264079,0.7750000000000001,0.525,0.125,0.25,0.47500000000000003,0.1,equal,0.5,0.22500000000000003,COMPLETE
2442,0.38576839463087104,0.22500000000000003,0.45000000000000007,0.425,0.25,0.47500000000000003,0.07500000000000001,softmax,0.5,0.15000000000000002,COMPLETE
2443,0.4881634891448562,0.15000000000000002,0.4,0.5,0.22500000000000003,0.45,0.07500000000000001,equal,0.47500000000000003,0.3,COMPLETE
2444,0.2529782004718242,0.2,0.47500000000000003,0.45,0.25,0.45,0.1,equal,0.15000000000000002,0.325,COMPLETE
2445,0.39180779758676976,0.175,0.42500000000000004,0.4,0.25,0.5,0.05,equal,0.45,0.25,COMPLETE
2446,0.037293455194026104,0.25,0.45000000000000007,0.425,0.25,0.47500000000000003,0.25,equal,0.425,0.275,COMPLETE
2447,0.05644221262916045,0.275,0.47500000000000003,0.425,0.25,0.47500000000000003,0.07500000000000001,softmax,0.07500000000000001,0.275,COMPLETE
2448,0.4006437333985226,0.22500000000000003,0.5,0.45,0.25,0.5,0.05,equal,0.47500000000000003,0.3,COMPLETE
2449,0.5241115289609822,0.2,0.42500000000000004,0.47500000000000003,0.275,0.45,0.05,equal,0.5,0.325,COMPLETE
2450,0.36337596204155614,0.2,0.4,0.47500000000000003,0.22500000000000003,0.47500000000000003,0.05,linear,0.325,0.3,COMPLETE
2451,0.5118723179709881,0.22500000000000003,0.45000000000000007,0.425,0.22500000000000003,0.45,0.07500000000000001,equal,0.47500000000000003,0.275,COMPLETE
2452,0.39743936312277417,0.175,0.42500000000000004,0.4,0.2,0.375,0.05,equal,0.5,0.25,COMPLETE
2453,0.3426019629753348,0.25,0.47500000000000003,0.45,0.25,0.5,0.07500000000000001,softmax,0.45,0.35000000000000003,COMPLETE
2454,0.0950492875006109,0.22500000000000003,0.45000000000000007,0.425,0.45,0.47500000000000003,0.05,equal,0.47500000000000003,0.3,COMPLETE
2455,0.5279610128682568,0.175,0.525,0.5,0.275,0.425,0.05,equal,0.5,0.275,COMPLETE
2456,0.39291321399614343,0.2,0.37500000000000006,0.4,0.25,0.47500000000000003,0.07500000000000001,equal,0.45,0.3,COMPLETE
2457,0.32940834004971103,0.25,0.47500000000000003,0.45,0.22500000000000003,0.425,0.07500000000000001,equal,0.47500000000000003,0.325,COMPLETE
2458,0.1098952102301807,0.22500000000000003,0.8750000000000001,0.425,0.22500000000000003,0.45,0.05,softmax,0.375,0.22500000000000003,COMPLETE
2459,0.6246360197681787,0.2,0.42500000000000004,0.45,0.22500000000000003,0.47500000000000003,0.05,equal,0.5,0.3,COMPLETE
2460,0.5054933983031485,0.15000000000000002,0.45000000000000007,0.375,0.275,0.45,0.05,equal,0.3,0.25,COMPLETE
2461,0.3435345058328817,0.2,0.47500000000000003,0.47500000000000003,0.25,0.47500000000000003,0.1,equal,0.47500000000000003,0.275,COMPLETE
2462,0.20474695852447075,0.25,0.4,0.45,0.25,0.5,0.07500000000000001,linear,0.22500000000000003,0.275,COMPLETE
2463,0.505202451186877,0.275,0.42500000000000004,0.425,0.22500000000000003,0.45,0.07500000000000001,equal,0.5,0.25,COMPLETE
2464,0.4867481688778543,0.175,0.5,0.47500000000000003,0.22500000000000003,0.47500000000000003,0.05,softmax,0.47500000000000003,0.35000000000000003,COMPLETE
2465,0.342742616234922,0.35000000000000003,0.45000000000000007,0.425,0.275,0.45,0.05,equal,0.45,0.375,COMPLETE
2466,0.4340896000448783,0.22500000000000003,0.42500000000000004,0.425,0.25,0.5,0.05,equal,0.5,0.3,COMPLETE
2467,0.012413951758074304,0.22500000000000003,0.47500000000000003,0.45,0.35000000000000003,0.47500000000000003,0.07500000000000001,equal,0.45,0.275,COMPLETE
2468,0.4940836115441892,0.175,0.45000000000000007,0.4,0.22500000000000003,0.47500000000000003,0.05,equal,0.25,0.375,COMPLETE
2469,0.23606093578939671,0.2,0.525,0.45,0.22500000000000003,0.47500000000000003,0.05,softmax,0.47500000000000003,0.325,COMPLETE
2470,0.5812588376929125,0.22500000000000003,0.4,0.425,0.22500000000000003,0.45,0.07500000000000001,equal,0.47500000000000003,0.3,COMPLETE
2471,0.35104025888846946,0.2,0.5,0.47500000000000003,0.25,0.5,0.07500000000000001,equal,0.5,0.275,COMPLETE
2472,-0.005730517182566009,0.25,0.42500000000000004,0.45,0.2,0.1,0.05,equal,0.47500000000000003,0.25,COMPLETE
2473,0.634291357863731,0.22500000000000003,0.45000000000000007,0.425,0.25,0.45,0.07500000000000001,equal,0.5,0.22500000000000003,COMPLETE
2474,0.31346002052037714,0.275,0.47500000000000003,0.425,0.22500000000000003,0.425,0.1,equal,0.45,0.2,COMPLETE
2475,0.30643338160241645,0.25,0.47500000000000003,0.425,0.25,0.425,0.1,equal,0.425,0.2,COMPLETE
2476,0.3611665077772733,0.275,0.5,0.425,0.25,0.425,0.1,equal,0.4,0.22500000000000003,COMPLETE
2477,0.3315498432779316,0.25,0.47500000000000003,0.425,0.22500000000000003,0.425,0.1,equal,0.5,0.2,COMPLETE
2478,0.22749192226221593,0.325,0.47500000000000003,0.425,0.25,0.425,0.1,equal,0.47500000000000003,0.22500000000000003,COMPLETE
2479,0.314542473083326,0.25,0.5,0.4,0.25,0.45,0.07500000000000001,equal,0.47500000000000003,0.175,COMPLETE
2480,0.3505095870293476,0.275,0.45000000000000007,0.425,0.22500000000000003,0.425,0.1,equal,0.45,0.25,COMPLETE
2481,0.3816435352028217,0.25,0.47500000000000003,0.425,0.25,0.45,0.1,equal,0.5,0.22500000000000003,COMPLETE
2482,0.3876733242368893,0.22500000000000003,0.5,0.4,0.22500000000000003,0.45,0.07500000000000001,equal,0.47500000000000003,0.22500000000000003,COMPLETE
2483,0.30164137918388023,0.25,0.45000000000000007,0.425,0.22500000000000003,0.425,0.1,equal,0.275,0.2,COMPLETE
2484,0.29669737132832197,0.22500000000000003,0.45000000000000007,0.4,0.25,0.45,0.07500000000000001,equal,0.5,0.2,COMPLETE
2485,0.1318865681270405,0.3,0.47500000000000003,0.425,0.25,0.45,0.07500000000000001,equal,0.45,0.2,COMPLETE
2486,0.4760994691320246,0.22500000000000003,0.45000000000000007,0.4,0.22500000000000003,0.45,0.07500000000000001,equal,0.47500000000000003,0.2,COMPLETE
2487,0.25214045975357446,0.25,0.525,0.425,0.25,0.45,0.07500000000000001,equal,0.5,0.22500000000000003,COMPLETE
2488,0.40982396755878314,0.22500000000000003,0.47500000000000003,0.4,0.25,0.425,0.1,equal,0.47500000000000003,0.22500000000000003,COMPLETE
2489,0.37653106440828343,0.275,0.5,0.425,0.22500000000000003,0.45,0.07500000000000001,equal,0.5,0.22500000000000003,COMPLETE
2490,0.4760994691320246,0.22500000000000003,0.45000000000000007,0.4,0.22500000000000003,0.45,0.07500000000000001,equal,0.47500000000000003,0.2,COMPLETE
2491,0.36116650777727255,0.25,0.47500000000000003,0.425,0.25,0.425,0.1,equal,0.47500000000000003,0.22500000000000003,COMPLETE
2492,0.35237419612296905,0.22500000000000003,0.45000000000000007,0.4,0.25,0.45,0.07500000000000001,equal,0.45,0.25,COMPLETE
2493,0.14706146686783972,0.22500000000000003,0.5,0.4,0.325,0.4,0.07500000000000001,equal,0.5,0.22500000000000003,COMPLETE
2494,-0.041078374591749414,0.5750000000000001,0.45000000000000007,0.175,0.25,0.45,0.07500000000000001,equal,0.35000000000000003,0.2,COMPLETE
2495,0.037907277018265406,0.45,0.47500000000000003,0.425,0.22500000000000003,0.45,0.07500000000000001,equal,0.5,0.2,COMPLETE
2496,0.30980704515387564,0.25,0.47500000000000003,0.425,0.25,0.45,0.1,equal,0.47500000000000003,0.175,COMPLETE
2497,0.48542524816622,0.22500000000000003,0.45000000000000007,0.4,0.2,0.425,0.07500000000000001,equal,0.47500000000000003,0.22500000000000003,COMPLETE
2498,0.3721851496580151,0.25,0.5,0.425,0.22500000000000003,0.45,0.07500000000000001,equal,0.45,0.2,COMPLETE
2499,0.46159035827271333,0.22500000000000003,0.45000000000000007,0.4,0.22500000000000003,0.45,0.07500000000000001,equal,0.5,0.175,COMPLETE
2500,0.48222381390891916,0.25,0.47500000000000003,0.45,0.25,0.45,0.07500000000000001,equal,0.45,0.22500000000000003,COMPLETE
2501,0.2392569229170126,0.275,0.55,0.425,0.25,0.45,0.1,equal,0.47500000000000003,0.2,COMPLETE
2502,0.23138145084437436,0.22500000000000003,0.45000000000000007,0.4,0.3,0.425,0.07500000000000001,equal,0.5,0.22500000000000003,COMPLETE
2503,0.39486054790956016,0.22500000000000003,0.525,0.45,0.22500000000000003,0.45,0.07500000000000001,equal,0.47500000000000003,0.22500000000000003,COMPLETE
2504,0.16985492096227328,0.2,0.42500000000000004,0.4,0.275,0.25,0.07500000000000001,equal,0.5,0.22500000000000003,COMPLETE
2505,-0.03266147354081083,0.2,0.025,0.4,0.25,0.45,0.1,equal,0.375,0.22500000000000003,COMPLETE
2506,0.40982396755878264,0.2,0.5,0.375,0.275,0.425,0.07500000000000001,equal,0.47500000000000003,0.22500000000000003,COMPLETE
2507,0.507659484195755,0.25,0.45000000000000007,0.425,0.15000000000000002,0.45,0.07500000000000001,equal,0.425,0.22500000000000003,COMPLETE
2508,0.500530994814241,0.22500000000000003,0.47500000000000003,0.45,0.22500000000000003,0.45,0.07500000000000001,equal,0.45,0.22500000000000003,COMPLETE
2509,0.552884765407481,0.2,0.42500000000000004,0.4,0.25,0.45,0.07500000000000001,equal,0.5,0.22500000000000003,COMPLETE
2510,0.032970741952902755,0.25,0.47500000000000003,0.45,0.25,0.425,0.22500000000000003,equal,0.47500000000000003,0.22500000000000003,COMPLETE
2511,0.40008373376695316,0.2,0.45000000000000007,0.4,0.25,0.45,0.1,equal,0.47500000000000003,0.25,COMPLETE
2512,0.5333478649537176,0.22500000000000003,0.42500000000000004,0.425,0.22500000000000003,0.45,0.07500000000000001,equal,0.5,0.25,COMPLETE
2513,0.5118723179709881,0.22500000000000003,0.45000000000000007,0.425,0.22500000000000003,0.45,0.07500000000000001,equal,0.45,0.25,COMPLETE
2514,0.4098239675587839,0.22500000000000003,0.47500000000000003,0.425,0.25,0.45,0.07500000000000001,equal,0.47500000000000003,0.22500000000000003,COMPLETE
2515,0.3611665077772733,0.275,0.5,0.425,0.25,0.425,0.1,equal,0.5,0.25,COMPLETE
2516,0.06161855348658295,0.25,0.42500000000000004,0.45,0.2,0.22500000000000003,0.07500000000000001,equal,0.47500000000000003,0.25,COMPLETE
2517,0.3294643314316506,0.2,0.45000000000000007,0.4,0.275,0.4,0.07500000000000001,softmax,0.5,0.25,COMPLETE
2518,0.5083477353823327,0.22500000000000003,0.47500000000000003,0.45,0.2,0.45,0.05,equal,0.325,0.25,COMPLETE
2519,0.5260600310921522,0.2,0.42500000000000004,0.375,0.275,0.45,0.05,equal,0.425,0.22500000000000003,COMPLETE
2520,0.41536583825168844,0.22500000000000003,0.5,0.425,0.22500000000000003,0.45,0.07500000000000001,equal,0.45,0.275,COMPLETE
2521,0.3811403887470532,0.175,0.45000000000000007,0.375,0.275,0.425,0.05,equal,0.3,0.275,COMPLETE
2522,0.29126551784869237,0.25,0.47500000000000003,0.45,0.25,0.47500000000000003,0.1,equal,0.5,0.275,COMPLETE
2523,-0.18802302854227051,0.3,0.42500000000000004,0.425,0.05,0.45,0.47500000000000003,softmax,0.47500000000000003,0.25,COMPLETE
2524,0.35075736649025063,0.2,0.45000000000000007,0.4,0.25,0.47500000000000003,0.07500000000000001,equal,0.47500000000000003,0.4,COMPLETE
2525,0.3558011856280166,0.25,0.47500000000000003,0.45,0.275,0.45,0.05,equal,0.5,0.3,COMPLETE
2526,-0.11781422195901092,0.2,0.525,0.4,0.15,0.47500000000000003,0.375,equal,0.45,0.25,COMPLETE
2527,0.18239294492084163,0.22500000000000003,0.42500000000000004,0.425,0.25,0.45,0.2,equal,0.47500000000000003,0.275,COMPLETE
2528,0.4712434954871117,0.2,0.45000000000000007,0.4,0.2,0.425,0.07500000000000001,softmax,0.5,0.25,COMPLETE
