number,value,params_fund_net_buying,params_institutional_weight,params_number_fund_holdings,params_pe,params_revenue_growth,params_roe,params_stock_weight_option,params_take_profit,params_trailing_stop_loss,state
4753,0.26600676029760195,0.2,0.5,0.4,0.22500000000000003,0.5,0.05,equal,0.47500000000000003,0.3,COMPLETE
4754,0.5581733710979727,0.175,0.42500000000000004,0.47500000000000003,0.15000000000000002,0.47500000000000003,0.05,equal,0.5,0.4,COMPLETE
4755,0.5042503116956142,0.25,0.4,0.425,0.175,0.47500000000000003,0.07500000000000001,equal,0.275,0.25,COMPLETE
4756,0.5019703674716836,0.2,0.45000000000000007,0.4,0.22500000000000003,0.5,0.05,equal,0.375,0.325,COMPLETE
4757,0.5398599123097149,0.22500000000000003,0.47500000000000003,0.425,0.175,0.47500000000000003,0.07500000000000001,equal,0.47500000000000003,0.375,COMPLETE
4758,-0.22617384206576965,0.2,0.15,0.45,0.2,0.5,0.05,equal,0.5,0.07500000000000001,COMPLETE
4759,0.24805061983365495,0.22500000000000003,0.525,0.425,0.22500000000000003,0.5,0.05,equal,0.325,0.35000000000000003,COMPLETE
4760,0.20146776004854344,0.2,0.5,0.4,0.22500000000000003,0.47500000000000003,0.15000000000000002,equal,0.22500000000000003,0.22500000000000003,COMPLETE
4761,0.21533645608251234,0.22500000000000003,0.45000000000000007,0.425,0.47500000000000003,0.1,0.07500000000000001,equal,0.3,0.3,COMPLETE
4762,0.3499934014212858,0.175,0.47500000000000003,0.375,0.175,0.47500000000000003,0.07500000000000001,equal,0.47500000000000003,0.4,COMPLETE
4763,0.04192664474180823,0.25,0.42500000000000004,0.45,0.175,0.5,0.25,equal,0.35000000000000003,0.325,COMPLETE
4764,0.04958239917870674,0.175,0.45000000000000007,0.375,0.2,0.5,0.05,equal,0.07500000000000001,0.375,COMPLETE
4765,0.3949660303860146,0.15000000000000002,0.5,0.375,0.2,0.47500000000000003,0.05,equal,0.4,0.3,COMPLETE
4766,-0.005730517182566009,0.22500000000000003,0.45000000000000007,0.425,0.2,0.05,0.05,equal,0.5,0.35000000000000003,COMPLETE
4767,0.5220780220208965,0.2,0.47500000000000003,0.45,0.15000000000000002,0.47500000000000003,0.05,equal,0.375,0.25,COMPLETE
4768,0.488805351486133,0.22500000000000003,0.42500000000000004,0.425,0.22500000000000003,0.5,0.05,equal,0.3,0.325,COMPLETE
4769,0.3869476195492845,0.275,0.4,0.425,0.15000000000000002,0.47500000000000003,0.05,equal,0.47500000000000003,0.35000000000000003,COMPLETE
4770,0.47594553862564115,0.22500000000000003,0.47500000000000003,0.45,0.22500000000000003,0.5,0.07500000000000001,equal,0.5,0.3,COMPLETE
4771,0.5333907794303057,0.175,0.42500000000000004,0.47500000000000003,0.175,0.5,0.05,equal,0.425,0.25,COMPLETE
4772,0.5798127225808586,0.25,0.45000000000000007,0.45,0.175,0.47500000000000003,0.07500000000000001,equal,0.275,0.375,COMPLETE
4773,0.22903657312815334,0.2,0.525,0.4,0.22500000000000003,0.5,0.05,linear,0.3,0.4,COMPLETE
4774,0.4153658382516887,0.2,0.5,0.4,0.2,0.47500000000000003,0.05,equal,0.5,0.325,COMPLETE
4775,0.27945032925667745,0.15000000000000002,0.45000000000000007,0.375,0.22500000000000003,0.5,0.07500000000000001,equal,0.25,0.375,COMPLETE
4776,0.6131078359831612,0.2,0.42500000000000004,0.45,0.175,0.5,0.05,equal,0.35000000000000003,0.35000000000000003,COMPLETE
4777,0.5210527709871448,0.22500000000000003,0.47500000000000003,0.425,0.15000000000000002,0.47500000000000003,0.05,equal,0.47500000000000003,0.3,COMPLETE
4778,0.45023732958084206,0.175,0.5,0.47500000000000003,0.175,0.5,0.05,equal,0.3,0.4,COMPLETE
4779,0.2660067602976019,0.22500000000000003,0.47500000000000003,0.425,0.22500000000000003,0.47500000000000003,0.07500000000000001,equal,0.325,0.325,COMPLETE
4780,0.26183112330682656,0.25,0.675,0.425,0.2,0.47500000000000003,0.05,equal,0.5,0.15000000000000002,COMPLETE
4781,0.5133831622479527,0.2,0.45000000000000007,0.4,0.175,0.5,0.05,equal,0.5,0.175,COMPLETE
4782,0.46581167389081307,0.175,0.37500000000000006,0.47500000000000003,0.22500000000000003,0.47500000000000003,0.07500000000000001,equal,0.47500000000000003,0.375,COMPLETE
4783,0.4833926990146578,0.25,0.45000000000000007,0.425,0.175,0.5,0.05,equal,0.375,0.3,COMPLETE
4784,0.24805061983365495,0.22500000000000003,0.55,0.45,0.2,0.47500000000000003,0.05,equal,0.4,0.325,COMPLETE
4785,0.47976578924831204,0.275,0.42500000000000004,0.425,0.22500000000000003,0.5,0.05,equal,0.325,0.35000000000000003,COMPLETE
4786,0.36111149588284097,0.2,0.47500000000000003,0.45,0.22500000000000003,0.5,0.07500000000000001,equal,0.3,0.425,COMPLETE
4787,0.16174048851749517,0.2,0.4,0.4,0.5,0.175,0.05,equal,0.47500000000000003,0.375,COMPLETE
4788,0.5812588376929121,0.2,0.42500000000000004,0.45,0.175,0.47500000000000003,0.07500000000000001,equal,0.5,0.4,COMPLETE
4789,-0.06821866486174462,0.6500000000000001,0.975,0.25,0.2,0.5,0.05,equal,0.3,0.35000000000000003,COMPLETE
4790,0.4859987060892376,0.22500000000000003,0.45000000000000007,0.425,0.15000000000000002,0.47500000000000003,0.05,equal,0.35000000000000003,0.3,COMPLETE
4791,0.4124633009785659,0.25,0.5,0.425,0.175,0.5,0.05,equal,0.5,0.25,COMPLETE
4792,0.2699824287477435,0.15000000000000002,0.47500000000000003,0.525,0.175,0.375,0.325,linear,0.47500000000000003,0.3,COMPLETE
4793,0.4749700045976119,0.22500000000000003,0.45000000000000007,0.45,0.22500000000000003,0.47500000000000003,0.07500000000000001,equal,0.375,0.325,COMPLETE
4794,0.06859006893128847,0.175,0.47500000000000003,0.47500000000000003,0.175,0.47500000000000003,0.275,equal,0.275,0.35000000000000003,COMPLETE
4795,0.39002809492313145,0.2,0.42500000000000004,0.4,0.2,0.5,0.05,equal,0.5,0.375,COMPLETE
4796,0.5260054103748681,0.22500000000000003,0.45000000000000007,0.425,0.2,0.47500000000000003,0.05,equal,0.3,0.4,COMPLETE
4797,0.26600676029760195,0.2,0.5,0.4,0.22500000000000003,0.5,0.05,equal,0.47500000000000003,0.325,COMPLETE
4798,0.4453263310179059,0.175,0.4,0.47500000000000003,0.22500000000000003,0.47500000000000003,0.07500000000000001,equal,0.275,0.22500000000000003,COMPLETE
4799,0.5065540691669667,0.15000000000000002,0.45000000000000007,0.525,0.175,0.5,0.05,equal,0.5,0.25,COMPLETE
4800,0.35364915698360666,0.22500000000000003,0.525,0.45,0.2,0.5,0.05,equal,0.47500000000000003,0.3,COMPLETE
4801,0.5121791548701946,0.275,0.42500000000000004,0.425,0.15000000000000002,0.47500000000000003,0.07500000000000001,equal,0.35000000000000003,0.375,COMPLETE
4802,0.6244388365501419,0.25,0.47500000000000003,0.45,0.15000000000000002,0.47500000000000003,0.05,equal,0.375,0.25,COMPLETE
4803,0.4759455386256408,0.175,0.47500000000000003,0.47500000000000003,0.22500000000000003,0.5,0.05,equal,0.5,0.35000000000000003,COMPLETE
4804,0.5451183289893459,0.2,0.45000000000000007,0.4,0.2,0.47500000000000003,0.05,equal,0.3,0.325,COMPLETE
4805,0.37202469510180686,0.2,0.5,0.45,0.22500000000000003,0.5,0.05,equal,0.4,0.4,COMPLETE
4806,0.2660067602976019,0.22500000000000003,0.47500000000000003,0.425,0.22500000000000003,0.5,0.07500000000000001,equal,0.47500000000000003,0.3,COMPLETE
4807,0.3038185184958569,0.325,0.42500000000000004,0.6000000000000001,0.2,0.47500000000000003,0.05,equal,0.5,0.35000000000000003,COMPLETE
4808,0.3822752074098975,0.22500000000000003,0.35000000000000003,0.425,0.22500000000000003,0.5,0.07500000000000001,equal,0.325,0.375,COMPLETE
4809,0.6544393809331743,0.25,0.45000000000000007,0.45,0.2,0.47500000000000003,0.05,equal,0.375,0.325,COMPLETE
4810,0.3548273968156388,0.275,0.4,0.425,0.175,0.5,0.05,equal,0.22500000000000003,0.3,COMPLETE
4811,0.1619348076912157,0.25,0.525,0.425,0.2,0.47500000000000003,0.05,equal,0.175,0.375,COMPLETE
4812,0.4833926990146572,0.275,0.45000000000000007,0.425,0.175,0.5,0.05,equal,0.375,0.4,COMPLETE
4813,0.3761482268375148,0.275,0.5,0.425,0.175,0.47500000000000003,0.07500000000000001,linear,0.47500000000000003,0.425,COMPLETE
4814,0.4550475111060044,0.25,0.42500000000000004,0.45,0.175,0.5,0.05,equal,0.375,0.325,COMPLETE
4815,0.3009904402489586,0.3,0.47500000000000003,0.425,0.2,0.47500000000000003,0.07500000000000001,equal,0.2,0.3,COMPLETE
4816,0.3327031283567534,0.25,0.45000000000000007,0.45,0.175,0.5,0.05,equal,0.2,0.35000000000000003,COMPLETE
4817,0.1581238784543045,0.25,0.47500000000000003,0.6250000000000001,0.175,0.47500000000000003,0.07500000000000001,equal,0.375,0.25,COMPLETE
4818,0.2526150152028499,0.3,0.4,0.425,0.2,0.47500000000000003,0.05,equal,0.15000000000000002,0.35000000000000003,COMPLETE
4819,0.6073839768216442,0.275,0.42500000000000004,0.425,0.2,0.47500000000000003,0.05,equal,0.375,0.325,COMPLETE
4820,0.45729553175113224,0.25,0.5,0.45,0.175,0.5,0.07500000000000001,equal,0.375,0.4,COMPLETE
4821,0.45761747012649034,0.25,0.47500000000000003,0.45,0.175,0.5,0.05,equal,0.425,0.375,COMPLETE
4822,0.4833926990146572,0.25,0.45000000000000007,0.45,0.2,0.5,0.05,equal,0.375,0.325,COMPLETE
4823,0.5116897704700882,0.25,0.42500000000000004,0.45,0.15000000000000002,0.47500000000000003,0.05,equal,0.375,0.375,COMPLETE
4824,0.4172675501499645,0.275,0.47500000000000003,0.425,0.175,0.47500000000000003,0.07500000000000001,equal,0.375,0.35000000000000003,COMPLETE
4825,0.4833926990146578,0.25,0.45000000000000007,0.45,0.175,0.5,0.05,equal,0.375,0.3,COMPLETE
4826,0.3249360452175603,0.25,0.5,0.425,0.175,0.5,0.07500000000000001,equal,0.47500000000000003,0.22500000000000003,COMPLETE
4827,0.48959426252222416,0.25,0.45000000000000007,0.425,0.2,0.47500000000000003,0.05,equal,0.22500000000000003,0.325,COMPLETE
4828,0.4834758685761484,0.22500000000000003,0.4,0.45,0.2,0.47500000000000003,0.05,equal,0.375,0.3,COMPLETE
4829,0.445825033686439,0.22500000000000003,0.37500000000000006,0.45,0.175,0.5,0.05,equal,0.47500000000000003,0.25,COMPLETE
4830,0.4576174701264903,0.275,0.45000000000000007,0.425,0.175,0.5,0.05,equal,0.425,0.425,COMPLETE
4831,0.10493859530361019,0.25,0.775,0.425,0.2,0.47500000000000003,0.07500000000000001,equal,0.375,0.4,COMPLETE
4832,0.2900025953191908,0.25,0.47500000000000003,0.45,0.175,0.5,0.05,equal,0.175,0.375,COMPLETE
4833,0.025523102177868087,0.7000000000000001,0.42500000000000004,0.175,0.15000000000000002,0.5,0.05,equal,0.5,0.4,COMPLETE
4834,0.45731119350250826,0.22500000000000003,0.5,0.45,0.15000000000000002,0.47500000000000003,0.05,linear,0.47500000000000003,0.3,COMPLETE
4835,0.3061449404170253,0.22500000000000003,0.525,0.4,0.175,0.47500000000000003,0.07500000000000001,equal,0.5,0.25,COMPLETE
4836,0.35216706804083586,0.22500000000000003,0.47500000000000003,0.425,0.2,0.5,0.05,equal,0.2,0.325,COMPLETE
4837,0.5077799728173664,0.25,0.45000000000000007,0.45,0.175,0.5,0.07500000000000001,equal,0.4,0.35000000000000003,COMPLETE
4838,0.5425044014830845,0.22500000000000003,0.42500000000000004,0.4,0.2,0.47500000000000003,0.05,equal,0.47500000000000003,0.375,COMPLETE
4839,0.5031627382863417,0.22500000000000003,0.45000000000000007,0.425,0.15000000000000002,0.47500000000000003,0.05,equal,0.5,0.3,COMPLETE
4840,-0.018810922735782238,0.275,0.47500000000000003,0.425,0.2,0.25,0.05,equal,0.175,0.35000000000000003,COMPLETE
4841,0.4550475111060044,0.25,0.42500000000000004,0.45,0.175,0.5,0.05,equal,0.375,0.325,COMPLETE
4842,0.4153658382516877,0.22500000000000003,0.5,0.4,0.175,0.47500000000000003,0.07500000000000001,equal,0.47500000000000003,0.375,COMPLETE
4843,0.47355745873318056,0.25,0.45000000000000007,0.425,0.2,0.5,0.05,equal,0.4,0.3,COMPLETE
4844,0.45643086703144237,0.22500000000000003,0.4,0.45,0.2,0.47500000000000003,0.05,equal,0.5,0.375,COMPLETE
4845,0.5274961058530833,0.22500000000000003,0.47500000000000003,0.425,0.175,0.5,0.07500000000000001,equal,0.5,0.4,COMPLETE
4846,0.5425044014830847,0.22500000000000003,0.45000000000000007,0.4,0.2,0.47500000000000003,0.05,equal,0.47500000000000003,0.35000000000000003,COMPLETE
4847,0.598902323494321,0.22500000000000003,0.42500000000000004,0.425,0.175,0.5,0.05,equal,0.425,0.325,COMPLETE
4848,0.36998031392903563,0.25,0.47500000000000003,0.45,0.175,0.47500000000000003,0.07500000000000001,equal,0.5,0.3,COMPLETE
4849,-0.01370995814630284,0.275,0.5,0.425,0.175,0.5,0.05,equal,0.05,0.25,COMPLETE
4850,0.5482453775763679,0.22500000000000003,0.4,0.45,0.15000000000000002,0.5,0.05,equal,0.47500000000000003,0.35000000000000003,COMPLETE
4851,0.24805061983365495,0.22500000000000003,0.55,0.425,0.2,0.47500000000000003,0.05,equal,0.5,0.375,COMPLETE
4852,0.5989023234943217,0.25,0.42500000000000004,0.45,0.175,0.47500000000000003,0.07500000000000001,equal,0.47500000000000003,0.325,COMPLETE
4853,0.24805061983365495,0.22500000000000003,0.525,0.4,0.2,0.5,0.05,equal,0.375,0.4,COMPLETE
4854,0.5274961058530828,0.25,0.45000000000000007,0.425,0.175,0.5,0.07500000000000001,equal,0.5,0.325,COMPLETE
4855,0.5015332855784671,0.2,0.47500000000000003,0.4,0.15000000000000002,0.47500000000000003,0.05,linear,0.5,0.22500000000000003,COMPLETE
4856,0.046419857535242894,0.22500000000000003,0.5,0.45,0.35000000000000003,0.5,0.07500000000000001,equal,0.47500000000000003,0.3,COMPLETE
4857,0.3324858983519673,0.275,0.45000000000000007,0.425,0.2,0.47500000000000003,0.05,equal,0.1,0.35000000000000003,COMPLETE
4858,0.6310795334192674,0.25,0.47500000000000003,0.45,0.2,0.47500000000000003,0.05,equal,0.375,0.375,COMPLETE
4859,0.6271896955157115,0.22500000000000003,0.42500000000000004,0.425,0.175,0.5,0.05,equal,0.375,0.4,COMPLETE
4860,0.18383606608141687,0.5,0.37500000000000006,0.2,0.15000000000000002,0.47500000000000003,0.05,equal,0.5,0.325,COMPLETE
4861,0.26011803224078667,0.2,0.45000000000000007,0.47500000000000003,0.175,0.5,0.07500000000000001,equal,0.125,0.35000000000000003,COMPLETE
4862,0.4404955848818285,0.3,0.47500000000000003,0.425,0.2,0.47500000000000003,0.05,equal,0.47500000000000003,0.375,COMPLETE
4863,0.2907322888033781,0.2,0.42500000000000004,0.4,0.2,0.3,0.05,equal,0.4,0.425,COMPLETE
4864,0.38721531560987693,0.22500000000000003,0.5,0.45,0.175,0.5,0.07500000000000001,equal,0.22500000000000003,0.25,COMPLETE
4865,0.5031627382863417,0.22500000000000003,0.45000000000000007,0.4,0.15000000000000002,0.47500000000000003,0.05,equal,0.5,0.3,COMPLETE
4866,0.3929122766876221,0.2,0.4,0.47500000000000003,0.2,0.47500000000000003,0.05,equal,0.47500000000000003,0.3,COMPLETE
4867,0.2835820384500205,0.4,0.47500000000000003,0.325,0.175,0.5,0.07500000000000001,equal,0.375,0.4,COMPLETE
4868,0.5255678314486353,0.2,0.42500000000000004,0.4,0.175,0.5,0.05,equal,0.47500000000000003,0.325,COMPLETE
4869,0.6021780566265795,0.25,0.47500000000000003,0.45,0.2,0.47500000000000003,0.05,equal,0.5,0.35000000000000003,COMPLETE
4870,0.45400315302497896,0.22500000000000003,0.45000000000000007,0.425,0.175,0.5,0.05,equal,0.4,0.25,COMPLETE
4871,0.05138176290043427,0.2,0.5,0.47500000000000003,0.2,0.07500000000000001,0.05,equal,0.425,0.375,COMPLETE
4872,0.2350481545531608,0.22500000000000003,0.45000000000000007,0.45,0.175,0.5,0.22500000000000003,equal,0.5,0.375,COMPLETE
4873,0.30769214195588607,0.22500000000000003,0.65,0.425,0.15000000000000002,0.47500000000000003,0.07500000000000001,equal,0.47500000000000003,0.3,COMPLETE
4874,0.45643086703144264,0.25,0.4,0.45,0.15000000000000002,0.47500000000000003,0.05,equal,0.5,0.35000000000000003,COMPLETE
4875,0.2480506198336555,0.2,0.525,0.4,0.175,0.5,0.05,equal,0.375,0.4,COMPLETE
4876,0.5399497245756588,0.2,0.45000000000000007,0.4,0.2,0.47500000000000003,0.05,linear,0.47500000000000003,0.325,COMPLETE
4877,0.34065045033948366,0.22500000000000003,0.7250000000000001,0.425,0.175,0.5,0.07500000000000001,equal,0.5,0.3,COMPLETE
4878,0.3018069485851135,0.25,0.47500000000000003,0.45,0.175,0.5,0.07500000000000001,equal,0.15000000000000002,0.25,COMPLETE
4879,0.28420852831700494,0.2,0.45000000000000007,0.47500000000000003,0.175,0.47500000000000003,0.175,equal,0.47500000000000003,0.375,COMPLETE
4880,0.6021780566265795,0.22500000000000003,0.47500000000000003,0.425,0.2,0.47500000000000003,0.05,equal,0.5,0.35000000000000003,COMPLETE
4881,0.026159070960393736,0.2,0.42500000000000004,0.4,0.2,0.15000000000000002,0.05,equal,0.47500000000000003,0.325,COMPLETE
4882,0.5259707957287139,0.25,0.42500000000000004,0.45,0.175,0.5,0.07500000000000001,equal,0.375,0.4,COMPLETE
4883,0.5005309948142407,0.2,0.5,0.47500000000000003,0.2,0.47500000000000003,0.05,equal,0.4,0.425,COMPLETE
4884,0.2775889044982329,0.325,0.45000000000000007,0.325,0.15000000000000002,0.5,0.05,equal,0.5,0.25,COMPLETE
4885,0.3946688575784774,0.22500000000000003,0.5,0.425,0.175,0.5,0.05,equal,0.47500000000000003,0.3,COMPLETE
4886,0.3860218429422872,0.2,0.47500000000000003,0.4,0.175,0.47500000000000003,0.07500000000000001,equal,0.5,0.35000000000000003,COMPLETE
4887,0.4550475111060044,0.25,0.42500000000000004,0.45,0.175,0.5,0.05,equal,0.375,0.3,COMPLETE
4888,0.46553959991361005,0.22500000000000003,0.4,0.45,0.2,0.47500000000000003,0.07500000000000001,equal,0.5,0.22500000000000003,COMPLETE
4889,0.39065972465186416,0.22500000000000003,0.47500000000000003,0.425,0.2,0.35000000000000003,0.05,equal,0.47500000000000003,0.325,COMPLETE
4890,0.5606559452809573,0.2,0.45000000000000007,0.47500000000000003,0.15000000000000002,0.47500000000000003,0.05,equal,0.47500000000000003,0.375,COMPLETE
4891,0.239523744940995,0.275,0.5,0.425,0.2,0.325,0.05,equal,0.3,0.3,COMPLETE
4892,0.45761747012649034,0.22500000000000003,0.47500000000000003,0.45,0.175,0.5,0.05,equal,0.5,0.325,COMPLETE
4893,0.07624924308306943,0.175,0.42500000000000004,0.375,0.175,0.5,0.25,equal,0.375,0.375,COMPLETE
4894,0.524217284919067,0.2,0.45000000000000007,0.4,0.175,0.47500000000000003,0.07500000000000001,equal,0.4,0.4,COMPLETE
4895,0.4759455386256412,0.22500000000000003,0.47500000000000003,0.425,0.175,0.5,0.05,equal,0.5,0.35000000000000003,COMPLETE
4896,0.26600676029760195,0.275,0.525,0.425,0.2,0.5,0.05,equal,0.425,0.375,COMPLETE
4897,0.614292528379084,0.25,0.42500000000000004,0.425,0.15000000000000002,0.47500000000000003,0.07500000000000001,equal,0.47500000000000003,0.3,COMPLETE
4898,0.5739937462793596,0.175,0.45000000000000007,0.47500000000000003,0.15000000000000002,0.47500000000000003,0.05,linear,0.3,0.325,COMPLETE
4899,0.4746102739039285,0.2,0.4,0.4,0.175,0.5,0.05,equal,0.5,0.25,COMPLETE
4900,0.6544393809331743,0.2,0.45000000000000007,0.47500000000000003,0.175,0.5,0.05,equal,0.375,0.4,COMPLETE
4901,0.40664188484414354,0.22500000000000003,0.5,0.5,0.2,0.47500000000000003,0.05,equal,0.375,0.425,COMPLETE
4902,-0.12283262643286366,0.425,0.47500000000000003,0.425,0.0,0.5,0.5,equal,0.375,0.425,COMPLETE
4903,0.609442983463879,0.175,0.42500000000000004,0.47500000000000003,0.175,0.47500000000000003,0.07500000000000001,equal,0.375,0.425,COMPLETE
4904,-0.08574977229174195,0.2,0.37500000000000006,0.5,0.175,0.5,0.3,equal,0.375,0.4,COMPLETE
4905,0.5574614227316802,0.25,0.45000000000000007,0.5,0.2,0.47500000000000003,0.05,equal,0.375,0.425,COMPLETE
4906,0.374997127956628,0.22500000000000003,0.45000000000000007,0.5,0.175,0.5,0.05,equal,0.375,0.425,COMPLETE
4907,0.5316497004832006,0.2,0.5,0.5,0.2,0.47500000000000003,0.07500000000000001,equal,0.375,0.4,COMPLETE
4908,0.3545848773220301,0.22500000000000003,0.47500000000000003,0.5,0.175,0.5,0.05,equal,0.375,0.4,COMPLETE
4909,0.41033829417115675,0.2,0.525,0.525,0.15000000000000002,0.47500000000000003,0.05,equal,0.375,0.4,COMPLETE
4910,0.276000183471356,0.175,0.42500000000000004,0.5,0.22500000000000003,0.5,0.07500000000000001,equal,0.4,0.4,COMPLETE
4911,0.5574614227316802,0.25,0.45000000000000007,0.47500000000000003,0.2,0.47500000000000003,0.05,equal,0.375,0.4,COMPLETE
4912,0.36858112715026203,0.2,0.47500000000000003,0.5,0.175,0.5,0.2,equal,0.375,0.425,COMPLETE
4913,0.3843531944860299,0.175,0.4,0.5,0.2,0.47500000000000003,0.05,equal,0.375,0.425,COMPLETE
4914,0.5019703674716831,0.22500000000000003,0.47500000000000003,0.47500000000000003,0.22500000000000003,0.5,0.07500000000000001,equal,0.375,0.4,COMPLETE
4915,0.4757874546787978,0.25,0.5,0.47500000000000003,0.15000000000000002,0.47500000000000003,0.05,equal,0.4,0.4,COMPLETE
4916,0.48339269901465787,0.22500000000000003,0.45000000000000007,0.47500000000000003,0.175,0.5,0.05,equal,0.375,0.4,COMPLETE
4917,0.2894947861396082,0.275,0.42500000000000004,0.47500000000000003,0.175,0.5,0.05,equal,0.375,0.4,COMPLETE
4918,0.5241280088836195,0.2,0.45000000000000007,0.5,0.2,0.47500000000000003,0.05,linear,0.375,0.4,COMPLETE
4919,0.22285753814176856,0.175,0.47500000000000003,0.525,0.175,0.5,0.275,equal,0.4,0.4,COMPLETE
4920,0.5442679746457223,0.22500000000000003,0.42500000000000004,0.47500000000000003,0.2,0.47500000000000003,0.07500000000000001,equal,0.375,0.425,COMPLETE
4921,0.3536491569836071,0.2,0.5,0.5,0.22500000000000003,0.5,0.07500000000000001,equal,0.4,0.4,COMPLETE
4922,0.5754923461729985,0.175,0.45000000000000007,0.47500000000000003,0.15000000000000002,0.47500000000000003,0.05,equal,0.4,0.4,COMPLETE
4923,0.15362392465055685,0.25,0.45000000000000007,0.47500000000000003,0.425,0.5,0.05,equal,0.375,0.425,COMPLETE
4924,0.5334496280699192,0.2,0.47500000000000003,0.5,0.2,0.47500000000000003,0.05,equal,0.375,0.4,COMPLETE
4925,0.16841689121549866,0.2,0.55,0.7000000000000001,0.175,0.5,0.05,equal,0.375,0.4,COMPLETE
4926,0.4422933703037001,0.22500000000000003,0.4,0.47500000000000003,0.15000000000000002,0.47500000000000003,0.05,equal,0.4,0.45,COMPLETE
4927,0.5179713213000263,0.22500000000000003,0.42500000000000004,0.47500000000000003,0.175,0.47500000000000003,0.07500000000000001,equal,0.375,0.4,COMPLETE
4928,0.41033829417115664,0.2,0.5,0.525,0.2,0.47500000000000003,0.05,equal,0.375,0.425,COMPLETE
4929,0.43501100519839253,0.1,0.47500000000000003,0.525,0.22500000000000003,0.5,0.07500000000000001,equal,0.35000000000000003,0.4,COMPLETE
4930,0.4149260131730061,0.375,0.45000000000000007,0.425,0.175,0.5,0.05,equal,0.4,0.4,COMPLETE
4931,0.41514264189714095,0.275,0.47500000000000003,0.47500000000000003,0.175,0.47500000000000003,0.07500000000000001,equal,0.375,0.4,COMPLETE
4932,0.42075803972171444,0.25,0.525,0.47500000000000003,0.175,0.5,0.05,equal,0.375,0.4,COMPLETE
4933,0.27361634453143746,0.22500000000000003,0.37500000000000006,0.47500000000000003,0.2,0.5,0.05,equal,0.375,0.425,COMPLETE
4934,0.49396850482477395,0.175,0.42500000000000004,0.5,0.15000000000000002,0.47500000000000003,0.05,equal,0.375,0.4,COMPLETE
4935,0.44006455879295087,0.15000000000000002,0.45000000000000007,0.5,0.22500000000000003,0.5,0.07500000000000001,equal,0.4,0.425,COMPLETE
