number,value,params_fund_net_buying,params_institutional_weight,params_number_fund_holdings,params_pe,params_revenue_growth,params_roe,params_stock_weight_option,params_take_profit,params_trailing_stop_loss,state
190,0.487765955708485,0.125,0.45000000000000007,0.525,0.3,0.4,0.05,softmax,0.4,0.425,COMPLETE
191,0.3494767058082411,0.125,0.775,0.525,0.3,0.4,0.05,softmax,0.4,0.425,COMPLETE
192,0.2761546748803546,0.15000000000000002,0.45000000000000007,0.7500000000000001,0.3,0.4,0.05,softmax,0.4,0.425,COMPLETE
193,0.37487600681582933,0.07500000000000001,0.45000000000000007,0.5,0.275,0.375,0.05,softmax,0.375,0.4,COMPLETE
194,0.4399817445107784,0.1,0.4,0.525,0.3,0.425,0.07500000000000001,softmax,0.4,0.45,COMPLETE
195,0.4672126181113485,0.1,0.42500000000000004,0.525,0.3,0.425,0.07500000000000001,softmax,0.4,0.45,COMPLETE
196,0.31313678604046125,0.1,0.4,0.5750000000000001,0.325,0.425,0.07500000000000001,softmax,0.45,0.45,COMPLETE
197,0.38217756656742197,0.05,0.4,0.525,0.3,0.45,0.07500000000000001,softmax,0.375,0.425,COMPLETE
198,0.053444622659282896,0.07500000000000001,0.37500000000000006,0.9,0.3,0.425,0.07500000000000001,softmax,0.35000000000000003,0.45,COMPLETE
199,0.49629765431509754,0.1,0.42500000000000004,0.525,0.275,0.45,0.05,softmax,0.425,0.425,COMPLETE
200,0.2760539891735676,0.1,0.42500000000000004,0.8,0.3,0.45,0.05,softmax,0.45,0.425,COMPLETE
201,0.47879438135483177,0.1,0.5,0.525,0.275,0.45,0.05,softmax,0.425,0.45,COMPLETE
202,0.38722911719351355,0.1,0.5,0.55,0.275,0.45,0.05,softmax,0.425,0.425,COMPLETE
203,0.4241878109960263,0.07500000000000001,0.47500000000000003,0.525,0.275,0.47500000000000003,0.07500000000000001,softmax,0.425,0.45,COMPLETE
204,0.43364306478779513,0.07500000000000001,0.47500000000000003,0.525,0.275,0.45,0.07500000000000001,softmax,0.425,0.45,COMPLETE
205,0.3288557900205124,0.05,0.45000000000000007,0.5750000000000001,0.275,0.47500000000000003,0.07500000000000001,softmax,0.425,0.45,COMPLETE
206,0.4497620347693574,0.07500000000000001,0.47500000000000003,0.525,0.25,0.47500000000000003,0.07500000000000001,softmax,0.425,0.45,COMPLETE
207,0.4497620347693574,0.07500000000000001,0.47500000000000003,0.525,0.25,0.47500000000000003,0.07500000000000001,softmax,0.425,0.45,COMPLETE
208,0.5516812206989942,0.07500000000000001,0.47500000000000003,0.525,0.22500000000000003,0.47500000000000003,0.07500000000000001,softmax,0.47500000000000003,0.45,COMPLETE
209,0.4084968253828906,0.07500000000000001,0.5,0.5750000000000001,0.22500000000000003,0.47500000000000003,0.1,softmax,0.47500000000000003,0.425,COMPLETE
210,0.5516812206989942,0.07500000000000001,0.47500000000000003,0.525,0.22500000000000003,0.47500000000000003,0.07500000000000001,softmax,0.45,0.45,COMPLETE
211,0.3392287553399002,0.05,0.47500000000000003,0.525,0.22500000000000003,0.47500000000000003,0.07500000000000001,softmax,0.47500000000000003,0.45,COMPLETE
212,0.28598789283173304,0.07500000000000001,0.5,0.55,0.22500000000000003,0.5,0.07500000000000001,softmax,0.45,0.45,COMPLETE
213,0.3759031885004742,0.05,0.42500000000000004,0.525,0.22500000000000003,0.47500000000000003,0.1,softmax,0.425,0.45,COMPLETE
214,0.44989261977711936,0.07500000000000001,0.47500000000000003,0.525,0.25,0.45,0.07500000000000001,softmax,0.45,0.425,COMPLETE
215,0.43082042377620255,0.07500000000000001,0.525,0.55,0.25,0.45,0.07500000000000001,softmax,0.45,0.425,COMPLETE
216,0.34579553493515536,0.07500000000000001,0.525,0.6000000000000001,0.2,0.45,0.07500000000000001,softmax,0.45,0.4,COMPLETE
217,0.34716470147601197,0.05,0.42500000000000004,0.55,0.25,0.45,0.07500000000000001,softmax,0.47500000000000003,0.425,COMPLETE
218,0.5524819340543083,0.1,0.45000000000000007,0.525,0.22500000000000003,0.45,0.1,softmax,0.45,0.425,COMPLETE
219,0.5465661529352883,0.1,0.45000000000000007,0.525,0.2,0.45,0.1,softmax,0.5,0.425,COMPLETE
220,0.4108824485965146,0.07500000000000001,0.45000000000000007,0.55,0.2,0.45,0.1,softmax,0.5,0.4,COMPLETE
221,0.42974250970832295,0.1,0.47500000000000003,0.525,0.2,0.425,0.1,softmax,0.45,0.425,COMPLETE
222,0.44079542332006905,0.1,0.5,0.525,0.175,0.45,0.07500000000000001,softmax,0.45,0.425,COMPLETE
223,0.4545340555523857,0.1,0.525,0.55,0.175,0.45,0.1,softmax,0.45,0.425,COMPLETE
224,0.3618954599415022,0.07500000000000001,0.525,0.5750000000000001,0.15000000000000002,0.45,0.1,softmax,0.47500000000000003,0.425,COMPLETE
225,0.445498677518939,0.1,0.5,0.55,0.175,0.45,0.125,softmax,0.45,0.425,COMPLETE
226,0.2272453999527235,0.07500000000000001,0.5,0.55,0.175,0.47500000000000003,0.125,softmax,0.45,0.425,COMPLETE
227,0.30676569884262866,0.1,0.47500000000000003,0.55,0.22500000000000003,0.45,0.125,softmax,0.47500000000000003,0.375,COMPLETE
228,0.35838470057102884,0.05,0.45000000000000007,0.525,0.175,0.5,0.1,softmax,0.45,0.4,COMPLETE
229,0.45439415763976154,0.1,0.525,0.55,0.15000000000000002,0.45,0.1,softmax,0.45,0.425,COMPLETE
230,0.37216911199217645,0.07500000000000001,0.525,0.55,0.15000000000000002,0.45,0.1,softmax,0.45,0.425,COMPLETE
231,0.478374940865207,0.1,0.47500000000000003,0.525,0.125,0.47500000000000003,0.1,softmax,0.5,0.425,COMPLETE
232,0.478374940865207,0.1,0.47500000000000003,0.525,0.125,0.47500000000000003,0.1,softmax,0.5,0.425,COMPLETE
233,0.478374940865207,0.1,0.47500000000000003,0.525,0.125,0.47500000000000003,0.1,softmax,0.5,0.4,COMPLETE
234,0.2279466594774909,0.1,0.47500000000000003,0.525,0.125,0.47500000000000003,0.125,softmax,0.5,0.4,COMPLETE
235,0.24509409713505143,0.1,0.42500000000000004,0.5750000000000001,0.125,0.47500000000000003,0.1,softmax,0.47500000000000003,0.425,COMPLETE
236,0.4789202062739324,0.1,0.47500000000000003,0.525,0.125,0.5,0.1,softmax,0.5,0.425,COMPLETE
237,0.4787841225531402,0.1,0.47500000000000003,0.525,0.1,0.5,0.1,softmax,0.5,0.4,COMPLETE
238,0.4789202062739324,0.1,0.47500000000000003,0.525,0.125,0.5,0.1,softmax,0.5,0.4,COMPLETE
239,0.4787841225531402,0.1,0.47500000000000003,0.525,0.1,0.5,0.1,softmax,0.5,0.4,COMPLETE
240,0.49385546351277976,0.1,0.5,0.525,0.1,0.5,0.1,equal,0.5,0.375,COMPLETE
241,0.49385546351277976,0.1,0.5,0.525,0.1,0.5,0.1,equal,0.5,0.375,COMPLETE
242,0.2534384912587423,0.1,0.5,0.525,0.1,0.5,0.125,equal,0.5,0.35000000000000003,COMPLETE
243,0.363010250540515,0.1,0.5,0.5750000000000001,0.1,0.5,0.1,softmax,0.5,0.375,COMPLETE
244,0.4634932493250646,0.1,0.45000000000000007,0.55,0.07500000000000001,0.5,0.1,softmax,0.5,0.4,COMPLETE
245,0.3374744896340849,0.07500000000000001,0.45000000000000007,0.55,0.07500000000000001,0.5,0.1,equal,0.5,0.4,COMPLETE
246,0.4938554635127794,0.1,0.45000000000000007,0.55,0.125,0.5,0.1,equal,0.5,0.375,COMPLETE
247,0.2691507338949577,0.07500000000000001,0.45000000000000007,0.6000000000000001,0.125,0.5,0.1,equal,0.5,0.375,COMPLETE
248,0.23673841693687953,0.05,0.55,0.55,0.07500000000000001,0.5,0.1,equal,0.5,0.35000000000000003,COMPLETE
249,0.49385546351277976,0.1,0.47500000000000003,0.525,0.125,0.47500000000000003,0.1,equal,0.5,0.375,COMPLETE
250,0.4997821910461063,0.1,0.45000000000000007,0.5,0.125,0.5,0.1,equal,0.5,0.4,COMPLETE
251,0.24852863785093776,0.1,0.45000000000000007,0.5,0.125,0.5,0.125,equal,0.5,0.375,COMPLETE
252,0.28680369605743355,0.1,0.42500000000000004,0.5750000000000001,0.1,0.5,0.1,equal,0.5,0.375,COMPLETE
253,0.4997821910461063,0.1,0.47500000000000003,0.5,0.125,0.5,0.1,equal,0.5,0.4,COMPLETE
254,0.24852863785093776,0.1,0.45000000000000007,0.5,0.125,0.5,0.125,equal,0.5,0.4,COMPLETE
255,0.4711796972617992,0.1,0.42500000000000004,0.55,0.125,0.5,0.1,equal,0.5,0.4,COMPLETE
256,0.475125509861215,0.125,0.42500000000000004,0.5,0.125,0.5,0.1,equal,0.5,0.4,COMPLETE
257,0.475125509861215,0.125,0.42500000000000004,0.5,0.125,0.5,0.1,equal,0.5,0.375,COMPLETE
258,0.45595387595614006,0.125,0.37500000000000006,0.5,0.125,0.5,0.1,equal,0.47500000000000003,0.375,COMPLETE
259,0.2544683001475141,0.125,0.42500000000000004,0.5,0.125,0.5,0.15000000000000002,equal,0.5,0.4,COMPLETE
260,0.4774438344806404,0.125,0.42500000000000004,0.525,0.1,0.47500000000000003,0.1,equal,0.5,0.375,COMPLETE
261,0.37793041218645806,0.125,0.47500000000000003,0.5,0.1,0.47500000000000003,0.1,equal,0.5,0.375,COMPLETE
262,0.3351645121960718,0.125,0.4,0.525,0.125,0.47500000000000003,0.125,equal,0.47500000000000003,0.375,COMPLETE
263,0.3875148816954275,0.125,0.45000000000000007,0.5,0.125,0.5,0.1,equal,0.5,0.35000000000000003,COMPLETE
264,0.2363101902610082,0.1,0.47500000000000003,0.525,0.1,0.47500000000000003,0.125,equal,0.5,0.4,COMPLETE
265,0.45595387595614006,0.125,0.37500000000000006,0.5,0.1,0.5,0.1,equal,0.47500000000000003,0.375,COMPLETE
266,0.45474949578075113,0.1,0.42500000000000004,0.525,0.125,0.47500000000000003,0.1,equal,0.5,0.35000000000000003,COMPLETE
267,0.3514638539994697,0.07500000000000001,0.47500000000000003,0.5,0.15000000000000002,0.5,0.1,equal,0.5,0.4,COMPLETE
268,0.4774438344806404,0.125,0.42500000000000004,0.525,0.1,0.47500000000000003,0.1,equal,0.47500000000000003,0.4,COMPLETE
269,0.40188306302277943,0.125,0.5,0.525,0.1,0.47500000000000003,0.125,equal,0.47500000000000003,0.375,COMPLETE
270,0.360486861948134,0.125,0.45000000000000007,0.525,0.1,0.47500000000000003,0.1,equal,0.47500000000000003,0.4,COMPLETE
271,0.26933138909007864,0.05,0.47500000000000003,0.5,0.125,0.47500000000000003,0.1,equal,0.5,0.4,COMPLETE
272,0.24852863785093784,0.07500000000000001,0.45000000000000007,0.5,0.125,0.5,0.125,equal,0.5,0.4,COMPLETE
273,0.38889574375181707,0.125,0.4,0.525,0.1,0.47500000000000003,0.1,equal,0.47500000000000003,0.375,COMPLETE
274,0.4711796972617992,0.1,0.42500000000000004,0.55,0.125,0.5,0.1,equal,0.5,0.375,COMPLETE
275,0.08094404358296213,0.7750000000000001,0.5,0.2,0.1,0.47500000000000003,0.1,equal,0.47500000000000003,0.4,COMPLETE
276,0.24852863785093748,0.07500000000000001,0.45000000000000007,0.5,0.125,0.5,0.15000000000000002,equal,0.5,0.4,COMPLETE
277,0.21204244100916508,0.1,0.47500000000000003,0.525,0.15000000000000002,0.47500000000000003,0.125,equal,0.5,0.375,COMPLETE
278,-0.08313028302838768,0.125,0.42500000000000004,0.5,0.07500000000000001,0.5,0.4,equal,0.47500000000000003,0.4,COMPLETE
279,0.2363101902610082,0.07500000000000001,0.47500000000000003,0.55,0.1,0.47500000000000003,0.1,equal,0.5,0.375,COMPLETE
280,0.4938554635127798,0.125,0.45000000000000007,0.525,0.1,0.5,0.1,equal,0.5,0.35000000000000003,COMPLETE
281,0.2534384912587423,0.1,0.5,0.525,0.1,0.5,0.125,equal,0.47500000000000003,0.35000000000000003,COMPLETE
282,0.09903481777887654,0.5,0.45000000000000007,0.475,0.1,0.47500000000000003,0.125,equal,0.5,0.325,COMPLETE
283,0.3779304121864583,0.1,0.47500000000000003,0.5750000000000001,0.1,0.5,0.1,equal,0.5,0.4,COMPLETE
284,0.29741955750204113,0.07500000000000001,0.4,0.55,0.15000000000000002,0.47500000000000003,0.1,equal,0.47500000000000003,0.4,COMPLETE
285,0.1426238641620821,0.05,0.5,0.525,0.125,0.5,0.125,equal,0.5,0.4,COMPLETE
286,0.4938554635127798,0.125,0.45000000000000007,0.525,0.1,0.5,0.1,equal,0.5,0.35000000000000003,COMPLETE
287,0.15295056742482876,0.1,0.45000000000000007,0.5750000000000001,0.1,0.47500000000000003,0.125,equal,0.47500000000000003,0.35000000000000003,COMPLETE
288,0.2920501888447401,0.07500000000000001,0.55,0.525,0.1,0.5,0.1,equal,0.5,0.325,COMPLETE
289,-0.015581656213030629,0.6000000000000001,0.47500000000000003,0.175,0.07500000000000001,0.47500000000000003,0.1,equal,0.5,0.35000000000000003,COMPLETE
290,0.3779304121864583,0.1,0.5,0.55,0.07500000000000001,0.5,0.1,equal,0.47500000000000003,0.375,COMPLETE
291,-0.0030982550829759953,0.4,0.45000000000000007,0.525,0.1,0.47500000000000003,0.3,equal,0.5,0.4,COMPLETE
292,0.1920442331847611,0.125,0.525,0.55,0.05,0.5,0.1,equal,0.125,0.375,COMPLETE
293,0.37793041218645806,0.1,0.47500000000000003,0.525,0.1,0.47500000000000003,0.1,equal,0.5,0.4,COMPLETE
294,0.2518879202149985,0.07500000000000001,0.45000000000000007,0.55,0.125,0.5,0.125,equal,0.47500000000000003,0.375,COMPLETE
295,0.37793041218645806,0.125,0.5,0.525,0.1,0.47500000000000003,0.1,equal,0.5,0.35000000000000003,COMPLETE
296,0.36664508972355353,0.07500000000000001,0.47500000000000003,0.5,0.125,0.5,0.1,equal,0.5,0.35000000000000003,COMPLETE
297,0.3547481080933268,0.1,0.45000000000000007,0.525,0.15000000000000002,0.47500000000000003,0.125,equal,0.47500000000000003,0.3,COMPLETE
298,0.30947687724677503,0.125,0.4,0.55,0.1,0.5,0.1,equal,0.5,0.4,COMPLETE
299,0.107524188893333,0.05,0.5,0.5750000000000001,0.125,0.5,0.125,softmax,0.5,0.375,COMPLETE
300,0.39215580713129894,0.1,0.47500000000000003,0.5,0.07500000000000001,0.47500000000000003,0.1,softmax,0.47500000000000003,0.425,COMPLETE
301,0.47744383448064004,0.125,0.42500000000000004,0.525,0.1,0.5,0.1,equal,0.5,0.25,COMPLETE
302,0.27613003828959415,0.07500000000000001,0.525,0.5,0.15000000000000002,0.45,0.1,softmax,0.5,0.4,COMPLETE
303,0.4786457738275893,0.1,0.45000000000000007,0.525,0.125,0.47500000000000003,0.1,softmax,0.47500000000000003,0.4,COMPLETE
304,0.37161069041314226,0.05,0.45000000000000007,0.55,0.125,0.5,0.1,softmax,0.5,0.375,COMPLETE
305,0.2148140404231487,0.1,0.47500000000000003,0.5,0.125,0.47500000000000003,0.125,softmax,0.5,0.425,COMPLETE
306,0.34057316066986887,0.07500000000000001,0.5,0.6000000000000001,0.125,0.5,0.1,softmax,0.47500000000000003,0.4,COMPLETE
307,0.2672827702589724,0.1,0.45000000000000007,0.55,0.15000000000000002,0.45,0.1,softmax,0.5,0.425,COMPLETE
308,-0.08718130354832128,0.07500000000000001,0.47500000000000003,0.525,0.15000000000000002,0.425,0.07500000000000001,softmax,0.47500000000000003,0.07500000000000001,COMPLETE
309,0.3627108199296487,0.1,0.5,0.5750000000000001,0.125,0.47500000000000003,0.125,softmax,0.5,0.375,COMPLETE
310,0.37474806232907854,0.15000000000000002,0.45000000000000007,0.525,0.125,0.5,0.1,softmax,0.5,0.425,COMPLETE
311,0.29915993533359025,0.125,0.47500000000000003,0.55,0.22500000000000003,0.5,0.07500000000000001,softmax,0.47500000000000003,0.35000000000000003,COMPLETE
312,-0.006854185579366297,0.05,0.525,0.5,0.125,0.47500000000000003,0.25,softmax,0.5,0.325,COMPLETE
313,0.208504594609031,0.07500000000000001,0.45000000000000007,0.5750000000000001,0.2,0.45,0.125,softmax,0.5,0.4,COMPLETE
314,0.10014076046747575,0.15000000000000002,0.42500000000000004,0.525,0.07500000000000001,0.47500000000000003,0.07500000000000001,softmax,0.07500000000000001,0.375,COMPLETE
315,0.4849556453113557,0.1,0.47500000000000003,0.5,0.1,0.5,0.1,softmax,0.47500000000000003,0.425,COMPLETE
316,-0.10428493472488835,0.1,0.5,0.5,0.05,0.5,0.45,softmax,0.47500000000000003,0.425,COMPLETE
317,0.24003487426116682,0.07500000000000001,0.47500000000000003,0.5,0.125,0.5,0.125,softmax,0.47500000000000003,0.425,COMPLETE
318,0.4072642984872389,0.1,0.47500000000000003,0.5,0.22500000000000003,0.5,0.07500000000000001,softmax,0.5,0.425,COMPLETE
319,0.34052769955020096,0.07500000000000001,0.5,0.55,0.1,0.5,0.1,softmax,0.47500000000000003,0.275,COMPLETE
320,0.14211362289522528,0.05,0.55,0.525,0.125,0.5,0.1,softmax,0.47500000000000003,0.4,COMPLETE
321,0.34586081435248844,0.1,0.45000000000000007,0.55,0.1,0.45,0.1,softmax,0.5,0.425,COMPLETE
322,0.3829699349655667,0.1,0.525,0.525,0.125,0.5,0.07500000000000001,softmax,0.5,0.425,COMPLETE
323,0.3865878471953388,0.125,0.47500000000000003,0.525,0.1,0.47500000000000003,0.15000000000000002,softmax,0.47500000000000003,0.4,COMPLETE
324,0.3436448597977195,0.07500000000000001,0.45000000000000007,0.5,0.125,0.47500000000000003,0.1,softmax,0.5,0.4,COMPLETE
325,0.36309098433403697,0.1,0.5,0.55,0.1,0.5,0.1,softmax,0.5,0.425,COMPLETE
326,0.46656409122622944,0.07500000000000001,0.47500000000000003,0.5,0.2,0.5,0.07500000000000001,softmax,0.47500000000000003,0.4,COMPLETE
327,0.03976014595807985,0.1,0.4,0.525,0.125,0.45,0.2,softmax,0.5,0.425,COMPLETE
328,0.16867843211746136,0.35000000000000003,0.45000000000000007,0.525,0.1,0.47500000000000003,0.125,softmax,0.47500000000000003,0.425,COMPLETE
329,0.34899038866848014,0.125,0.525,0.55,0.15000000000000002,0.5,0.1,softmax,0.5,0.4,COMPLETE
330,0.16450707871415626,0.15000000000000002,0.47500000000000003,0.5,0.125,0.425,0.275,softmax,0.5,0.4,COMPLETE
331,0.3328998257715296,0.1,0.45000000000000007,0.55,0.22500000000000003,0.5,0.125,softmax,0.47500000000000003,0.22500000000000003,COMPLETE
332,0.01865053017158569,0.7000000000000001,0.42500000000000004,0.2,0.07500000000000001,0.47500000000000003,0.07500000000000001,softmax,0.45,0.4,COMPLETE
333,0.26362412180934003,0.125,0.5,0.525,0.1,0.5,0.1,softmax,0.5,0.425,COMPLETE
334,0.08321259798334639,0.05,0.47500000000000003,0.5750000000000001,0.45,0.45,0.07500000000000001,equal,0.47500000000000003,0.425,COMPLETE
335,0.3385635951604116,0.07500000000000001,0.5,0.5,0.22500000000000003,0.47500000000000003,0.1,softmax,0.5,0.375,COMPLETE
336,0.3743883935273889,0.125,0.47500000000000003,0.525,0.125,0.5,0.1,softmax,0.5,0.325,COMPLETE
337,0.11905216707940047,0.1,0.45000000000000007,0.7000000000000001,0.15000000000000002,0.47500000000000003,0.07500000000000001,equal,0.47500000000000003,0.35000000000000003,COMPLETE
338,0.17743975058270353,0.07500000000000001,0.42500000000000004,0.5,0.125,0.5,0.125,softmax,0.5,0.175,COMPLETE
339,0.2629090472648699,0.1,0.55,0.525,0.1,0.47500000000000003,0.1,softmax,0.5,0.4,COMPLETE
340,0.24332991929133913,0.125,0.47500000000000003,0.55,0.125,0.45,0.35000000000000003,equal,0.45,0.425,COMPLETE
341,0.21468593112409923,0.07500000000000001,0.4,0.5750000000000001,0.1,0.5,0.1,softmax,0.47500000000000003,0.425,COMPLETE
342,0.3921730276223645,0.15000000000000002,0.45000000000000007,0.525,0.07500000000000001,0.47500000000000003,0.07500000000000001,softmax,0.5,0.375,COMPLETE
343,0.24306335808378715,0.1,0.525,0.5,0.125,0.425,0.22500000000000003,equal,0.47500000000000003,0.4,COMPLETE
344,0.22732220564718508,0.05,0.47500000000000003,0.6000000000000001,0.1,0.5,0.1,softmax,0.5,0.4,COMPLETE
345,0.3779304121864583,0.125,0.5,0.55,0.125,0.47500000000000003,0.125,equal,0.5,0.375,COMPLETE
346,0.47982364414156825,0.07500000000000001,0.42500000000000004,0.5,0.15000000000000002,0.5,0.07500000000000001,softmax,0.425,0.425,COMPLETE
347,0.36285556267680213,0.05,0.37500000000000006,0.5,0.15000000000000002,0.5,0.07500000000000001,softmax,0.425,0.425,COMPLETE
348,0.48718141201582915,0.07500000000000001,0.42500000000000004,0.5,0.22500000000000003,0.5,0.07500000000000001,softmax,0.425,0.425,COMPLETE
349,0.5177742167735213,0.07500000000000001,0.4,0.5,0.22500000000000003,0.5,0.07500000000000001,equal,0.425,0.425,COMPLETE
350,0.4452460043031582,0.07500000000000001,0.37500000000000006,0.47500000000000003,0.22500000000000003,0.5,0.07500000000000001,equal,0.425,0.425,COMPLETE
351,0.12191648456910252,0.05,0.35000000000000003,0.47500000000000003,0.22500000000000003,0.5,0.175,equal,0.425,0.425,COMPLETE
352,0.5177742167735213,0.07500000000000001,0.4,0.5,0.22500000000000003,0.5,0.07500000000000001,equal,0.425,0.425,COMPLETE
353,0.5011692519406747,0.07500000000000001,0.4,0.47500000000000003,0.22500000000000003,0.5,0.07500000000000001,equal,0.425,0.425,COMPLETE
354,0.5177742167735213,0.07500000000000001,0.4,0.47500000000000003,0.2,0.5,0.07500000000000001,equal,0.425,0.425,COMPLETE
355,0.4223642855826938,0.05,0.37500000000000006,0.45,0.22500000000000003,0.5,0.07500000000000001,equal,0.425,0.425,COMPLETE
356,0.4043164284237359,0.05,0.4,0.47500000000000003,0.2,0.5,0.07500000000000001,equal,0.425,0.425,COMPLETE
357,0.4027252323918659,0.07500000000000001,0.35000000000000003,0.47500000000000003,0.22500000000000003,0.5,0.07500000000000001,equal,0.425,0.425,COMPLETE
358,0.4043164284237359,0.05,0.4,0.47500000000000003,0.2,0.5,0.07500000000000001,equal,0.425,0.425,COMPLETE
359,0.4449796333515975,0.07500000000000001,0.37500000000000006,0.45,0.22500000000000003,0.5,0.07500000000000001,equal,0.425,0.425,COMPLETE
360,0.5177742167735213,0.07500000000000001,0.4,0.5,0.22500000000000003,0.5,0.07500000000000001,equal,0.45,0.425,COMPLETE
361,0.3869228340770187,0.05,0.4,0.47500000000000003,0.22500000000000003,0.5,0.07500000000000001,equal,0.45,0.425,COMPLETE
362,0.4027252323918659,0.07500000000000001,0.35000000000000003,0.5,0.22500000000000003,0.5,0.07500000000000001,equal,0.45,0.425,COMPLETE
363,0.2759826989296508,0.07500000000000001,0.32500000000000007,0.45,0.2,0.5,0.07500000000000001,equal,0.45,0.425,COMPLETE
364,0.4043164284237358,0.05,0.4,0.5,0.22500000000000003,0.5,0.07500000000000001,equal,0.425,0.425,COMPLETE
365,0.5011692519406743,0.07500000000000001,0.42500000000000004,0.47500000000000003,0.2,0.5,0.07500000000000001,equal,0.425,0.425,COMPLETE
366,0.5177742167735213,0.07500000000000001,0.4,0.47500000000000003,0.2,0.5,0.07500000000000001,equal,0.425,0.425,COMPLETE
367,0.4223642855826938,0.05,0.37500000000000006,0.45,0.22500000000000003,0.5,0.07500000000000001,equal,0.425,0.35000000000000003,COMPLETE
368,0.5177742167735213,0.07500000000000001,0.4,0.47500000000000003,0.2,0.5,0.07500000000000001,equal,0.425,0.425,COMPLETE
369,0.4043164284237359,0.05,0.4,0.47500000000000003,0.2,0.5,0.07500000000000001,equal,0.45,0.425,COMPLETE
370,0.5011692519406747,0.07500000000000001,0.4,0.45,0.2,0.5,0.07500000000000001,equal,0.425,0.425,COMPLETE
371,0.4449796333515975,0.07500000000000001,0.37500000000000006,0.45,0.2,0.5,0.07500000000000001,equal,0.425,0.425,COMPLETE
372,0.33369036846041544,0.05,0.4,0.45,0.2,0.5,0.07500000000000001,equal,0.425,0.45,COMPLETE
373,0.4449796333515975,0.07500000000000001,0.37500000000000006,0.45,0.2,0.5,0.07500000000000001,equal,0.425,0.425,COMPLETE
374,0.5177742167735213,0.07500000000000001,0.4,0.47500000000000003,0.2,0.5,0.07500000000000001,equal,0.425,0.3,COMPLETE
375,0.4043164284237359,0.05,0.4,0.47500000000000003,0.2,0.5,0.07500000000000001,equal,0.45,0.325,COMPLETE
376,0.14233870377542282,0.07500000000000001,0.32500000000000007,0.45,0.2,0.5,0.07500000000000001,equal,0.15000000000000002,0.3,COMPLETE
377,0.3346286087504887,0.07500000000000001,0.35000000000000003,0.47500000000000003,0.2,0.47500000000000003,0.07500000000000001,equal,0.425,0.275,COMPLETE
378,0.4043164284237359,0.05,0.4,0.47500000000000003,0.2,0.5,0.07500000000000001,equal,0.45,0.35000000000000003,COMPLETE
379,0.4449796333515973,0.07500000000000001,0.37500000000000006,0.47500000000000003,0.2,0.5,0.07500000000000001,equal,0.425,0.25,COMPLETE
