number,value,params_fund_net_buying,params_institutional_weight,params_number_fund_holdings,params_pe,params_revenue_growth,params_roe,params_stock_weight_option,params_take_profit,params_trailing_stop_loss,state
380,0.379320200075108,0.07500000000000001,0.42500000000000004,0.45,0.175,0.47500000000000003,0.07500000000000001,equal,0.45,0.35000000000000003,COMPLETE
381,0.2701093011245346,0.05,0.4,0.425,0.2,0.5,0.07500000000000001,equal,0.425,0.45,COMPLETE
382,0.45484055534019774,0.07500000000000001,0.4,0.47500000000000003,0.175,0.47500000000000003,0.07500000000000001,equal,0.45,0.425,COMPLETE
383,0.29435965453260243,0.05,0.42500000000000004,0.45,0.22500000000000003,0.5,0.07500000000000001,equal,0.425,0.3,COMPLETE
384,0.49887492504101566,0.07500000000000001,0.42500000000000004,0.47500000000000003,0.2,0.5,0.07500000000000001,equal,0.4,0.325,COMPLETE
385,0.5011692519406743,0.07500000000000001,0.42500000000000004,0.47500000000000003,0.2,0.5,0.07500000000000001,equal,0.425,0.325,COMPLETE
386,0.35305870428633035,0.07500000000000001,0.35000000000000003,0.45,0.2,0.5,0.07500000000000001,equal,0.425,0.3,COMPLETE
387,0.3869228340770189,0.05,0.42500000000000004,0.47500000000000003,0.2,0.5,0.07500000000000001,equal,0.425,0.325,COMPLETE
388,0.3526461034229784,0.07500000000000001,0.37500000000000006,0.45,0.175,0.5,0.07500000000000001,equal,0.425,0.325,COMPLETE
389,0.5177742167735213,0.07500000000000001,0.4,0.47500000000000003,0.2,0.5,0.07500000000000001,equal,0.45,0.3,COMPLETE
390,0.22065684325466126,0.6500000000000001,0.4,0.325,0.0,0.5,0.5,equal,0.45,0.3,COMPLETE
391,0.36889688414636407,0.05,0.37500000000000006,0.425,0.2,0.5,0.07500000000000001,equal,0.45,0.3,COMPLETE
392,0.14962653468220186,0.9,0.4,0.05,0.2,0.47500000000000003,0.07500000000000001,equal,0.45,0.35000000000000003,COMPLETE
393,0.4633563820084339,0.07500000000000001,0.42500000000000004,0.47500000000000003,0.175,0.47500000000000003,0.07500000000000001,equal,0.45,0.325,COMPLETE
394,0.3869228340770189,0.05,0.42500000000000004,0.47500000000000003,0.2,0.5,0.07500000000000001,equal,0.425,0.275,COMPLETE
395,0.4449796333515975,0.07500000000000001,0.37500000000000006,0.45,0.2,0.5,0.07500000000000001,equal,0.425,0.3,COMPLETE
396,0.5845887134817768,0.07500000000000001,0.4,0.47500000000000003,0.22500000000000003,0.47500000000000003,0.07500000000000001,equal,0.425,0.3,COMPLETE
397,0.173914572137093,0.45,0.35000000000000003,0.47500000000000003,0.22500000000000003,0.5,0.07500000000000001,equal,0.425,0.325,COMPLETE
398,0.384517784753202,0.05,0.4,0.45,0.22500000000000003,0.5,0.07500000000000001,equal,0.4,0.3,COMPLETE
399,0.45484055534019774,0.07500000000000001,0.4,0.47500000000000003,0.175,0.47500000000000003,0.07500000000000001,equal,0.425,0.3,COMPLETE
400,0.4138125742045981,0.07500000000000001,0.42500000000000004,0.425,0.2,0.5,0.07500000000000001,equal,0.45,0.275,COMPLETE
401,0.26553392879693366,0.05,0.37500000000000006,0.45,0.22500000000000003,0.47500000000000003,0.07500000000000001,equal,0.45,0.3,COMPLETE
402,0.5011692519406747,0.07500000000000001,0.4,0.47500000000000003,0.22500000000000003,0.5,0.07500000000000001,equal,0.425,0.325,COMPLETE
403,0.4027252323918659,0.07500000000000001,0.32500000000000007,0.47500000000000003,0.22500000000000003,0.5,0.07500000000000001,equal,0.425,0.325,COMPLETE
404,0.3635564527421144,0.05,0.4,0.47500000000000003,0.2,0.47500000000000003,0.07500000000000001,equal,0.4,0.325,COMPLETE
405,-0.12410414358521704,0.07500000000000001,0.37500000000000006,0.425,0.2,0.5,0.275,equal,0.425,0.325,COMPLETE
406,0.3869228340770189,0.05,0.42500000000000004,0.47500000000000003,0.22500000000000003,0.5,0.07500000000000001,equal,0.45,0.3,COMPLETE
407,0.5566744046452154,0.07500000000000001,0.4,0.45,0.22500000000000003,0.47500000000000003,0.07500000000000001,equal,0.4,0.325,COMPLETE
408,0.5566744046452154,0.07500000000000001,0.4,0.45,0.22500000000000003,0.47500000000000003,0.07500000000000001,equal,0.4,0.325,COMPLETE
409,0.2834613553352885,0.05,0.37500000000000006,0.425,0.22500000000000003,0.47500000000000003,0.07500000000000001,equal,0.4,0.325,COMPLETE
410,0.4731577800756824,0.07500000000000001,0.4,0.425,0.22500000000000003,0.47500000000000003,0.07500000000000001,equal,0.4,0.325,COMPLETE
411,0.46951365053260175,0.07500000000000001,0.35000000000000003,0.45,0.22500000000000003,0.47500000000000003,0.05,equal,0.4,0.3,COMPLETE
412,0.2795549717161502,0.05,0.4,0.45,0.175,0.45,0.07500000000000001,equal,0.4,0.325,COMPLETE
413,0.559143900053872,0.07500000000000001,0.4,0.45,0.22500000000000003,0.47500000000000003,0.07500000000000001,equal,0.425,0.275,COMPLETE
414,0.385642904477874,0.05,0.37500000000000006,0.45,0.22500000000000003,0.47500000000000003,0.05,equal,0.425,0.275,COMPLETE
415,0.4757543322368946,0.07500000000000001,0.4,0.425,0.22500000000000003,0.47500000000000003,0.07500000000000001,equal,0.425,0.275,COMPLETE
416,0.379320200075108,0.07500000000000001,0.42500000000000004,0.45,0.2,0.45,0.07500000000000001,equal,0.425,0.25,COMPLETE
417,0.42625272456550656,0.05,0.35000000000000003,0.47500000000000003,0.22500000000000003,0.47500000000000003,0.05,equal,0.4,0.275,COMPLETE
418,0.47575433223689484,0.07500000000000001,0.4,0.45,0.25,0.45,0.07500000000000001,equal,0.425,0.275,COMPLETE
419,0.39776119020412704,0.05,0.37500000000000006,0.425,0.22500000000000003,0.47500000000000003,0.05,equal,0.4,0.3,COMPLETE
420,0.4633563820084339,0.07500000000000001,0.42500000000000004,0.47500000000000003,0.2,0.47500000000000003,0.07500000000000001,equal,0.425,0.325,COMPLETE
421,0.2857843255524256,0.07500000000000001,0.37500000000000006,0.45,0.22500000000000003,0.47500000000000003,0.07500000000000001,equal,0.45,0.3,COMPLETE
422,0.49991755436343693,0.07500000000000001,0.4,0.47500000000000003,0.2,0.47500000000000003,0.05,equal,0.425,0.325,COMPLETE
423,0.3658404802685127,0.05,0.4,0.47500000000000003,0.2,0.47500000000000003,0.07500000000000001,equal,0.425,0.325,COMPLETE
424,0.31246379773313926,0.07500000000000001,0.35000000000000003,0.425,0.2,0.47500000000000003,0.07500000000000001,equal,0.4,0.325,COMPLETE
425,0.4548405553401975,0.07500000000000001,0.4,0.47500000000000003,0.175,0.47500000000000003,0.05,equal,0.45,0.325,COMPLETE
426,0.26553392879693366,0.05,0.37500000000000006,0.45,0.22500000000000003,0.47500000000000003,0.07500000000000001,equal,0.425,0.3,COMPLETE
427,0.5011692519406743,0.07500000000000001,0.42500000000000004,0.47500000000000003,0.22500000000000003,0.5,0.07500000000000001,equal,0.425,0.3,COMPLETE
428,0.5103434269359404,0.07500000000000001,0.4,0.45,0.22500000000000003,0.47500000000000003,0.05,equal,0.425,0.275,COMPLETE
429,0.0972737930945215,0.55,0.4,0.4,0.22500000000000003,0.47500000000000003,0.05,equal,0.425,0.275,COMPLETE
430,0.385642904477874,0.05,0.37500000000000006,0.45,0.22500000000000003,0.47500000000000003,0.05,equal,0.45,0.25,COMPLETE
431,0.49144967228070835,0.07500000000000001,0.32500000000000007,0.425,0.25,0.47500000000000003,0.05,equal,0.425,0.275,COMPLETE
432,0.44378712094180384,0.05,0.4,0.45,0.22500000000000003,0.47500000000000003,0.05,equal,0.425,0.15000000000000002,COMPLETE
433,0.5058847679262433,0.07500000000000001,0.42500000000000004,0.45,0.25,0.45,0.05,equal,0.425,0.3,COMPLETE
434,0.4831928692811435,0.05,0.42500000000000004,0.45,0.25,0.45,0.05,equal,0.425,0.3,COMPLETE
435,0.49115936230185375,0.07500000000000001,0.35000000000000003,0.425,0.25,0.45,0.05,equal,0.45,0.3,COMPLETE
436,0.01088884308458389,0.07500000000000001,0.4,0.4,0.2,0.45,0.325,equal,0.425,0.275,COMPLETE
437,0.36709410775700535,0.05,0.37500000000000006,0.45,0.22500000000000003,0.45,0.05,equal,0.425,0.3,COMPLETE
438,0.5058847679262433,0.07500000000000001,0.42500000000000004,0.45,0.25,0.45,0.05,equal,0.45,0.25,COMPLETE
439,0.39977222579743976,0.05,0.42500000000000004,0.425,0.25,0.45,0.05,equal,0.45,0.25,COMPLETE
440,0.036204424307894834,0.8,0.42500000000000004,0.125,0.22500000000000003,0.425,0.05,equal,0.45,0.25,COMPLETE
441,0.44873245477980184,0.07500000000000001,0.42500000000000004,0.45,0.25,0.45,0.07500000000000001,equal,0.45,0.275,COMPLETE
442,0.3475672789187877,0.07500000000000001,0.37500000000000006,0.45,0.22500000000000003,0.45,0.07500000000000001,equal,0.45,0.275,COMPLETE
443,0.13594391377475773,0.05,0.975,0.425,0.22500000000000003,0.45,0.05,equal,0.425,0.25,COMPLETE
444,0.5896802452268486,0.1,0.4,0.47500000000000003,0.22500000000000003,0.47500000000000003,0.07500000000000001,equal,0.45,0.275,COMPLETE
445,0.5265867125008927,0.1,0.4,0.47500000000000003,0.25,0.47500000000000003,0.05,equal,0.45,0.275,COMPLETE
446,0.5056399883282365,0.1,0.35000000000000003,0.45,0.25,0.45,0.05,equal,0.45,0.2,COMPLETE
447,0.48945230029310305,0.1,0.32500000000000007,0.425,0.25,0.45,0.05,equal,0.45,0.22500000000000003,COMPLETE
448,0.3320965200745188,0.1,0.275,0.45,0.25,0.45,0.05,equal,0.45,0.22500000000000003,COMPLETE
449,0.31085193196271044,0.1,0.35000000000000003,0.45,0.25,0.425,0.05,equal,0.45,0.15000000000000002,COMPLETE
450,0.567329620972682,0.1,0.35000000000000003,0.425,0.25,0.425,0.05,equal,0.45,0.275,COMPLETE
451,0.567329620972682,0.1,0.35000000000000003,0.425,0.25,0.425,0.05,equal,0.45,0.275,COMPLETE
452,0.41622519564324467,0.1,0.30000000000000004,0.425,0.25,0.425,0.05,equal,0.45,0.275,COMPLETE
453,0.41622519564324467,0.1,0.30000000000000004,0.4,0.25,0.425,0.05,equal,0.45,0.275,COMPLETE
454,0.4075386351141619,0.325,0.32500000000000007,0.47500000000000003,0.25,0.425,0.05,equal,0.45,0.275,COMPLETE
455,0.44992733683923847,0.1,0.35000000000000003,0.4,0.25,0.45,0.05,equal,0.45,0.175,COMPLETE
456,0.5240630314473972,0.1,0.35000000000000003,0.425,0.25,0.425,0.05,equal,0.45,0.2,COMPLETE
457,0.33042976813987557,0.1,0.30000000000000004,0.4,0.25,0.425,0.05,equal,0.45,0.2,COMPLETE
458,0.5177304043333696,0.1,0.35000000000000003,0.4,0.25,0.425,0.05,equal,0.45,0.2,COMPLETE
459,0.5026204617317875,0.1,0.35000000000000003,0.375,0.25,0.4,0.05,equal,0.45,0.25,COMPLETE
460,0.15069666940455728,0.1,0.15,0.425,0.25,0.425,0.05,equal,0.45,0.275,COMPLETE
461,0.4790771628896225,0.125,0.35000000000000003,0.425,0.25,0.425,0.05,equal,0.45,0.275,COMPLETE
462,0.1864384042200417,0.525,0.32500000000000007,0.22500000000000003,0.25,0.425,0.05,equal,0.45,0.2,COMPLETE
463,0.3174832516162972,0.1,0.32500000000000007,0.425,0.22500000000000003,0.425,0.05,equal,0.45,0.175,COMPLETE
464,0.44605724497308175,0.1,0.37500000000000006,0.4,0.22500000000000003,0.4,0.05,equal,0.45,0.2,COMPLETE
465,0.41364260777520534,0.1,0.275,0.4,0.25,0.425,0.05,equal,0.45,0.275,COMPLETE
466,-0.3366281460823912,0.125,0.37500000000000006,0.375,0.15,0.45,0.4,equal,0.45,0.25,COMPLETE
467,0.4351141696938218,0.1,0.37500000000000006,0.425,0.22500000000000003,0.425,0.05,equal,0.45,0.2,COMPLETE
468,0.5295239517781047,0.125,0.35000000000000003,0.4,0.25,0.45,0.05,equal,0.45,0.275,COMPLETE
469,0.4912337469103233,0.125,0.32500000000000007,0.375,0.22500000000000003,0.4,0.05,equal,0.45,0.275,COMPLETE
470,0.4200100612956176,0.4,0.30000000000000004,0.47500000000000003,0.25,0.45,0.05,equal,0.45,0.275,COMPLETE
471,0.5040658639241897,0.125,0.35000000000000003,0.375,0.22500000000000003,0.425,0.05,equal,0.45,0.275,COMPLETE
472,0.4746102739039283,0.1,0.35000000000000003,0.4,0.22500000000000003,0.45,0.05,equal,0.45,0.275,COMPLETE
473,0.2891558725797426,0.1,0.37500000000000006,0.4,0.25,0.45,0.05,equal,0.45,0.1,COMPLETE
474,0.46590988449358406,0.1,0.35000000000000003,0.4,0.22500000000000003,0.4,0.05,equal,0.425,0.3,COMPLETE
475,0.46356956644325875,0.125,0.37500000000000006,0.425,0.22500000000000003,0.425,0.05,equal,0.4,0.275,COMPLETE
476,0.48945230029310305,0.07500000000000001,0.32500000000000007,0.4,0.25,0.45,0.05,equal,0.45,0.3,COMPLETE
477,0.038577549672874724,0.05,0.37500000000000006,0.425,0.22500000000000003,0.47500000000000003,0.175,equal,0.425,0.22500000000000003,COMPLETE
478,0.3211693651067618,0.07500000000000001,0.37500000000000006,0.4,0.25,0.45,0.07500000000000001,equal,0.45,0.275,COMPLETE
479,0.4819392155846713,0.1,0.35000000000000003,0.425,0.22500000000000003,0.47500000000000003,0.05,equal,0.425,0.25,COMPLETE
480,0.5265867125008928,0.125,0.4,0.45,0.25,0.47500000000000003,0.05,equal,0.45,0.3,COMPLETE
481,0.3072573268169873,0.125,0.35000000000000003,0.425,0.22500000000000003,0.47500000000000003,0.07500000000000001,equal,0.45,0.125,COMPLETE
482,0.3823688480466513,0.125,0.30000000000000004,0.5,0.2,0.47500000000000003,0.05,equal,0.45,0.275,COMPLETE
483,0.5411225386994896,0.1,0.37500000000000006,0.5,0.22500000000000003,0.47500000000000003,0.07500000000000001,equal,0.45,0.3,COMPLETE
484,0.42854865046673524,0.15000000000000002,0.37500000000000006,0.5,0.22500000000000003,0.47500000000000003,0.07500000000000001,equal,0.47500000000000003,0.3,COMPLETE
485,0.47053150788679377,0.125,0.32500000000000007,0.5,0.25,0.47500000000000003,0.07500000000000001,equal,0.45,0.3,COMPLETE
486,0.0018899688849364025,0.15000000000000002,0.37500000000000006,0.5,0.2,0.25,0.07500000000000001,equal,0.45,0.2,COMPLETE
487,0.3718898623412169,0.1,0.35000000000000003,0.5,0.22500000000000003,0.47500000000000003,0.07500000000000001,equal,0.47500000000000003,0.3,COMPLETE
488,0.6065603030417075,0.125,0.4,0.5,0.22500000000000003,0.47500000000000003,0.07500000000000001,equal,0.45,0.3,COMPLETE
489,0.4982113749092352,0.15000000000000002,0.4,0.5,0.22500000000000003,0.47500000000000003,0.07500000000000001,equal,0.47500000000000003,0.3,COMPLETE
490,0.6065603030417075,0.125,0.4,0.5,0.22500000000000003,0.47500000000000003,0.07500000000000001,equal,0.45,0.3,COMPLETE
491,-0.31169948922787016,0.15000000000000002,0.37500000000000006,0.5,0.175,0.47500000000000003,0.35000000000000003,equal,0.45,0.3,COMPLETE
492,0.4982113749092352,0.15000000000000002,0.4,0.5,0.22500000000000003,0.47500000000000003,0.07500000000000001,equal,0.45,0.3,COMPLETE
493,0.1615450461335487,0.125,0.4,0.5,0.22500000000000003,0.47500000000000003,0.22500000000000003,equal,0.47500000000000003,0.275,COMPLETE
494,0.5561933915843678,0.125,0.37500000000000006,0.47500000000000003,0.22500000000000003,0.47500000000000003,0.07500000000000001,equal,0.45,0.25,COMPLETE
495,0.44715122881329783,0.125,0.37500000000000006,0.5,0.22500000000000003,0.45,0.07500000000000001,equal,0.45,0.25,COMPLETE
496,0.5561933915843678,0.125,0.37500000000000006,0.47500000000000003,0.22500000000000003,0.47500000000000003,0.07500000000000001,equal,0.45,0.25,COMPLETE
497,0.4447850749231884,0.15000000000000002,0.35000000000000003,0.47500000000000003,0.22500000000000003,0.47500000000000003,0.07500000000000001,equal,0.47500000000000003,0.25,COMPLETE
498,0.4098255296871585,0.15000000000000002,0.37500000000000006,0.5,0.25,0.45,0.07500000000000001,equal,0.45,0.25,COMPLETE
499,0.4278156429064252,0.125,0.32500000000000007,0.47500000000000003,0.22500000000000003,0.47500000000000003,0.07500000000000001,equal,0.45,0.22500000000000003,COMPLETE
500,0.44715122881329783,0.125,0.37500000000000006,0.5,0.22500000000000003,0.45,0.07500000000000001,equal,0.45,0.22500000000000003,COMPLETE
501,0.5798407050521527,0.125,0.35000000000000003,0.45,0.22500000000000003,0.47500000000000003,0.07500000000000001,equal,0.47500000000000003,0.25,COMPLETE
502,0.42781564290642554,0.15000000000000002,0.32500000000000007,0.45,0.22500000000000003,0.47500000000000003,0.07500000000000001,equal,0.47500000000000003,0.25,COMPLETE
503,0.5798407050521527,0.125,0.35000000000000003,0.45,0.22500000000000003,0.47500000000000003,0.07500000000000001,equal,0.47500000000000003,0.25,COMPLETE
504,-0.346833948622607,0.15000000000000002,0.30000000000000004,0.45,0.225,0.47500000000000003,0.3,equal,0.47500000000000003,0.25,COMPLETE
505,0.48468928687164,0.125,0.35000000000000003,0.45,0.25,0.45,0.07500000000000001,equal,0.47500000000000003,0.22500000000000003,COMPLETE
506,-0.02209445249281465,0.15000000000000002,0.32500000000000007,0.425,0.22500000000000003,0.47500000000000003,0.25,equal,0.47500000000000003,0.25,COMPLETE
507,0.48468928687164,0.125,0.35000000000000003,0.45,0.25,0.45,0.07500000000000001,equal,0.47500000000000003,0.25,COMPLETE
508,0.5215345008461092,0.125,0.35000000000000003,0.425,0.22500000000000003,0.47500000000000003,0.07500000000000001,equal,0.47500000000000003,0.275,COMPLETE
509,0.5316564123178302,0.15000000000000002,0.35000000000000003,0.425,0.22500000000000003,0.47500000000000003,0.05,equal,0.47500000000000003,0.275,COMPLETE
510,0.34366006319725834,0.15000000000000002,0.275,0.425,0.25,0.45,0.05,equal,0.47500000000000003,0.275,COMPLETE
511,0.3781582682678153,0.15000000000000002,0.32500000000000007,0.425,0.25,0.47500000000000003,0.05,equal,0.47500000000000003,0.275,COMPLETE
512,0.4749353785335225,0.125,0.32500000000000007,0.4,0.22500000000000003,0.47500000000000003,0.05,equal,0.47500000000000003,0.25,COMPLETE
513,0.4955854644880163,0.15000000000000002,0.35000000000000003,0.425,0.22500000000000003,0.45,0.05,equal,0.47500000000000003,0.275,COMPLETE
514,-0.017570841703189777,0.125,0.025,0.425,0.22500000000000003,0.47500000000000003,0.05,equal,0.47500000000000003,0.275,COMPLETE
515,0.38291739298404576,0.125,0.30000000000000004,0.4,0.25,0.45,0.05,equal,0.47500000000000003,0.25,COMPLETE
516,0.4006696228422534,0.175,0.35000000000000003,0.45,0.25,0.47500000000000003,0.05,equal,0.47500000000000003,0.275,COMPLETE
517,0.5120489254568116,0.125,0.32500000000000007,0.425,0.22500000000000003,0.45,0.07500000000000001,equal,0.47500000000000003,0.25,COMPLETE
518,0.5798407050521528,0.15000000000000002,0.35000000000000003,0.45,0.22500000000000003,0.47500000000000003,0.07500000000000001,equal,0.47500000000000003,0.22500000000000003,COMPLETE
519,-0.0989348466952269,0.15000000000000002,0.35000000000000003,0.425,0.05,0.47500000000000003,0.47500000000000003,equal,0.47500000000000003,0.22500000000000003,COMPLETE
520,0.4006696228422543,0.15000000000000002,0.32500000000000007,0.45,0.25,0.47500000000000003,0.05,equal,0.47500000000000003,0.22500000000000003,COMPLETE
521,0.28539041820478517,0.175,0.35000000000000003,0.45,0.22500000000000003,0.47500000000000003,0.07500000000000001,equal,0.175,0.22500000000000003,COMPLETE
522,0.4746102739039285,0.15000000000000002,0.35000000000000003,0.4,0.22500000000000003,0.47500000000000003,0.05,equal,0.47500000000000003,0.25,COMPLETE
523,0.2351483507940211,0.125,0.30000000000000004,0.425,0.22500000000000003,0.47500000000000003,0.07500000000000001,equal,0.47500000000000003,0.275,COMPLETE
524,0.4284781236310481,0.125,0.32500000000000007,0.45,0.25,0.45,0.05,equal,0.47500000000000003,0.25,COMPLETE
525,-0.3100596784847467,0.175,0.35000000000000003,0.45,0.2,0.47500000000000003,0.325,equal,0.45,0.275,COMPLETE
526,0.46160987605938586,0.125,0.37500000000000006,0.425,0.25,0.45,0.07500000000000001,equal,0.47500000000000003,0.25,COMPLETE
527,0.20696412151162355,0.15000000000000002,0.35000000000000003,0.4,0.22500000000000003,0.47500000000000003,0.07500000000000001,equal,0.05,0.22500000000000003,COMPLETE
528,0.5472537803341906,0.15000000000000002,0.37500000000000006,0.425,0.22500000000000003,0.47500000000000003,0.05,equal,0.47500000000000003,0.275,COMPLETE
529,0.3969396227899799,0.175,0.37500000000000006,0.45,0.25,0.45,0.05,equal,0.45,0.275,COMPLETE
530,0.5047561343836723,0.15000000000000002,0.37500000000000006,0.375,0.22500000000000003,0.47500000000000003,0.05,equal,0.45,0.25,COMPLETE
531,0.5259034177306476,0.15000000000000002,0.37500000000000006,0.425,0.25,0.45,0.05,equal,0.45,0.275,COMPLETE
532,0.3971415066859337,0.175,0.37500000000000006,0.45,0.22500000000000003,0.45,0.05,equal,0.47500000000000003,0.275,COMPLETE
533,0.3969396227899799,0.175,0.37500000000000006,0.45,0.25,0.45,0.05,equal,0.45,0.275,COMPLETE
534,0.11782463568617128,0.15000000000000002,0.37500000000000006,0.425,0.22500000000000003,0.47500000000000003,0.15000000000000002,equal,0.45,0.275,COMPLETE
535,0.46298797893413524,0.2,0.37500000000000006,0.45,0.22500000000000003,0.47500000000000003,0.05,equal,0.47500000000000003,0.3,COMPLETE
536,0.14976941964170964,0.15000000000000002,0.32500000000000007,0.4,0.425,0.45,0.05,equal,0.45,0.275,COMPLETE
537,0.5472537803341906,0.15000000000000002,0.37500000000000006,0.425,0.22500000000000003,0.47500000000000003,0.05,equal,0.47500000000000003,0.25,COMPLETE
538,0.4746102739039283,0.125,0.35000000000000003,0.375,0.22500000000000003,0.47500000000000003,0.05,equal,0.47500000000000003,0.25,COMPLETE
539,0.46553959991360955,0.15000000000000002,0.37500000000000006,0.47500000000000003,0.22500000000000003,0.47500000000000003,0.07500000000000001,equal,0.47500000000000003,0.25,COMPLETE
540,0.5316564123178302,0.125,0.35000000000000003,0.425,0.22500000000000003,0.47500000000000003,0.05,equal,0.47500000000000003,0.25,COMPLETE
541,0.333947348446401,0.175,0.30000000000000004,0.4,0.22500000000000003,0.47500000000000003,0.07500000000000001,equal,0.47500000000000003,0.22500000000000003,COMPLETE
542,0.5197089677216751,0.125,0.35000000000000003,0.375,0.22500000000000003,0.47500000000000003,0.07500000000000001,equal,0.47500000000000003,0.25,COMPLETE
543,0.4746102739039285,0.15000000000000002,0.35000000000000003,0.4,0.22500000000000003,0.47500000000000003,0.05,equal,0.47500000000000003,0.25,COMPLETE
544,0.4213483649918027,0.175,0.32500000000000007,0.425,0.22500000000000003,0.47500000000000003,0.07500000000000001,equal,0.47500000000000003,0.25,COMPLETE
545,0.5732276821135259,0.125,0.37500000000000006,0.425,0.22500000000000003,0.47500000000000003,0.07500000000000001,equal,0.47500000000000003,0.22500000000000003,COMPLETE
546,0.40762151052228973,0.275,0.32500000000000007,0.425,0.22500000000000003,0.47500000000000003,0.07500000000000001,equal,0.47500000000000003,0.22500000000000003,COMPLETE
547,0.5197089677216751,0.125,0.35000000000000003,0.4,0.22500000000000003,0.47500000000000003,0.07500000000000001,equal,0.47500000000000003,0.22500000000000003,COMPLETE
548,0.3076319633027689,0.6000000000000001,0.32500000000000007,0.35000000000000003,0.22500000000000003,0.45,0.07500000000000001,equal,0.47500000000000003,0.22500000000000003,COMPLETE
549,0.1544973701825217,0.125,0.925,0.425,0.22500000000000003,0.47500000000000003,0.07500000000000001,equal,0.47500000000000003,0.25,COMPLETE
