number,value,params_fund_net_buying,params_institutional_weight,params_number_fund_holdings,params_pe,params_revenue_growth,params_roe,params_stock_weight_option,params_take_profit,params_trailing_stop_loss,state
1623,0.3543669154077911,0.25,0.47500000000000003,0.45,0.25,0.5,0.07500000000000001,equal,0.5,0.25,COMPLETE
1624,0.3562046470609066,0.2,0.4,0.47500000000000003,0.22500000000000003,0.47500000000000003,0.05,equal,0.47500000000000003,0.275,COMPLETE
1625,0.481250495247723,0.2,0.42500000000000004,0.47500000000000003,0.22500000000000003,0.45,0.07500000000000001,softmax,0.5,0.3,COMPLETE
1626,0.36044489290050236,0.25,0.5,0.425,0.275,0.425,0.07500000000000001,linear,0.47500000000000003,0.325,COMPLETE
1627,0.04840687064270641,0.175,0.9500000000000001,0.4,0.25,0.47500000000000003,0.05,equal,0.45,0.275,COMPLETE
1628,0.6074641265057518,0.22500000000000003,0.45000000000000007,0.425,0.275,0.45,0.05,equal,0.5,0.3,COMPLETE
1629,0.43284764900636385,0.22500000000000003,0.45000000000000007,0.425,0.25,0.5,0.05,equal,0.47500000000000003,0.25,COMPLETE
1630,0.36623527400131883,0.375,0.42500000000000004,0.425,0.22500000000000003,0.45,0.07500000000000001,equal,0.45,0.25,COMPLETE
1631,0.5307954049525634,0.2,0.47500000000000003,0.4,0.22500000000000003,0.47500000000000003,0.05,equal,0.47500000000000003,0.3,COMPLETE
1632,0.43024845750760343,0.22500000000000003,0.45000000000000007,0.45,0.25,0.47500000000000003,0.07500000000000001,softmax,0.5,0.275,COMPLETE
1633,-0.20618382838963875,0.275,0.4,0.45,0.225,0.5,0.275,equal,0.47500000000000003,0.22500000000000003,COMPLETE
1634,0.21095843577272655,0.175,0.8250000000000001,0.375,0.275,0.45,0.05,equal,0.5,0.325,COMPLETE
1635,-0.005730517182566009,0.25,0.47500000000000003,0.45,0.22500000000000003,0.125,0.07500000000000001,equal,0.45,0.275,COMPLETE
1636,0.4163256168988323,0.22500000000000003,0.47500000000000003,0.425,0.25,0.47500000000000003,0.05,equal,0.5,0.25,COMPLETE
1637,0.5005309948142409,0.2,0.5,0.47500000000000003,0.22500000000000003,0.45,0.07500000000000001,equal,0.45,0.3,COMPLETE
1638,0.5353989139898288,0.2,0.45000000000000007,0.4,0.22500000000000003,0.47500000000000003,0.05,equal,0.47500000000000003,0.25,COMPLETE
1639,0.42127669610158835,0.22500000000000003,0.42500000000000004,0.425,0.25,0.5,0.05,softmax,0.47500000000000003,0.275,COMPLETE
1640,0.33972150627826037,0.25,0.42500000000000004,0.45,0.25,0.47500000000000003,0.05,equal,0.5,0.275,COMPLETE
1641,0.4916306302672532,0.2,0.47500000000000003,0.47500000000000003,0.22500000000000003,0.45,0.07500000000000001,equal,0.47500000000000003,0.25,COMPLETE
1642,0.41839647054414597,0.22500000000000003,0.525,0.425,0.275,0.425,0.07500000000000001,equal,0.47500000000000003,0.3,COMPLETE
1643,0.49658946173019736,0.175,0.45000000000000007,0.4,0.25,0.47500000000000003,0.05,equal,0.45,0.22500000000000003,COMPLETE
1644,0.5146797748870207,0.25,0.42500000000000004,0.45,0.22500000000000003,0.47500000000000003,0.05,equal,0.5,0.275,COMPLETE
1645,0.2578475914685784,0.175,0.5,0.375,0.25,0.5,0.05,softmax,0.47500000000000003,0.25,COMPLETE
1646,0.48816348914485647,0.2,0.4,0.47500000000000003,0.22500000000000003,0.45,0.07500000000000001,equal,0.47500000000000003,0.3,COMPLETE
1647,0.28369122673913955,0.22500000000000003,0.675,0.425,0.25,0.47500000000000003,0.05,equal,0.5,0.325,COMPLETE
1648,0.35436691540779125,0.275,0.47500000000000003,0.45,0.25,0.47500000000000003,0.07500000000000001,equal,0.45,0.25,COMPLETE
1649,0.22442658098932,0.2,0.45000000000000007,0.4,0.5,0.45,0.05,linear,0.45,0.275,COMPLETE
1650,0.0856577676314869,0.25,0.42500000000000004,0.6250000000000001,0.22500000000000003,0.47500000000000003,0.07500000000000001,equal,0.47500000000000003,0.3,COMPLETE
1651,0.4349072643307499,0.175,0.45000000000000007,0.35000000000000003,0.22500000000000003,0.425,0.05,equal,0.5,0.275,COMPLETE
1652,0.22774066480013916,0.22500000000000003,0.47500000000000003,0.425,0.25,0.5,0.07500000000000001,softmax,0.47500000000000003,0.3,COMPLETE
1653,0.05061799179250778,0.2,0.5,0.4,0.275,0.45,0.05,equal,0.5,0.05,COMPLETE
1654,0.15473102126380556,0.25,0.65,0.45,0.25,0.5,0.22500000000000003,equal,0.47500000000000003,0.25,COMPLETE
1655,0.40982552968715913,0.2,0.4,0.47500000000000003,0.22500000000000003,0.47500000000000003,0.07500000000000001,equal,0.45,0.25,COMPLETE
1656,0.21229745421655485,0.22500000000000003,0.45000000000000007,0.425,0.47500000000000003,0.45,0.05,equal,0.5,0.22500000000000003,COMPLETE
1657,0.5945631391190089,0.275,0.42500000000000004,0.425,0.22500000000000003,0.47500000000000003,0.05,equal,0.45,0.275,COMPLETE
1658,0.15697409160692094,0.22500000000000003,0.45000000000000007,0.425,0.425,0.45,0.07500000000000001,equal,0.45,0.275,COMPLETE
1659,0.4891179749370306,0.2,0.47500000000000003,0.47500000000000003,0.25,0.5,0.05,softmax,0.47500000000000003,0.3,COMPLETE
1660,0.38767332423688905,0.175,0.5,0.375,0.22500000000000003,0.47500000000000003,0.05,equal,0.5,0.325,COMPLETE
1661,0.1748326885097456,0.25,0.42500000000000004,0.45,0.275,0.325,0.07500000000000001,equal,0.47500000000000003,0.275,COMPLETE
1662,0.43049545040909665,0.175,0.4,0.47500000000000003,0.22500000000000003,0.45,0.05,equal,0.5,0.3,COMPLETE
1663,-0.05438206360515546,0.22500000000000003,0.47500000000000003,0.45,0.07500000000000001,0.47500000000000003,0.4,equal,0.4,0.22500000000000003,COMPLETE
1664,0.31437778624379686,0.22500000000000003,0.45000000000000007,0.6000000000000001,0.22500000000000003,0.425,0.07500000000000001,equal,0.45,0.25,COMPLETE
1665,0.5451642220648188,0.2,0.45000000000000007,0.4,0.25,0.47500000000000003,0.05,softmax,0.47500000000000003,0.275,COMPLETE
1666,0.3757279228779003,0.2,0.42500000000000004,0.4,0.25,0.5,0.05,equal,0.47500000000000003,0.25,COMPLETE
1667,0.41536583825168844,0.22500000000000003,0.5,0.425,0.22500000000000003,0.45,0.07500000000000001,equal,0.45,0.3,COMPLETE
1668,0.33972150627826037,0.25,0.45000000000000007,0.45,0.25,0.47500000000000003,0.05,equal,0.47500000000000003,0.25,COMPLETE
1669,0.5110464068821691,0.2,0.47500000000000003,0.45,0.22500000000000003,0.47500000000000003,0.07500000000000001,equal,0.5,0.325,COMPLETE
1670,0.2364380173761117,0.3,0.4,0.425,0.25,0.5,0.05,equal,0.47500000000000003,0.275,COMPLETE
1671,-0.21395854224449723,0.25,0.42500000000000004,0.45,0.225,0.45,0.325,linear,0.5,0.275,COMPLETE
1672,0.25363833099998745,0.22500000000000003,0.525,0.425,0.25,0.47500000000000003,0.07500000000000001,equal,0.47500000000000003,0.3,COMPLETE
1673,0.3214081536668773,0.175,0.47500000000000003,0.375,0.275,0.25,0.05,softmax,0.47500000000000003,0.35000000000000003,COMPLETE
1674,0.47474592631266715,0.2,0.45000000000000007,0.47500000000000003,0.25,0.5,0.05,equal,0.5,0.275,COMPLETE
1675,0.5155554939639312,0.22500000000000003,0.42500000000000004,0.45,0.22500000000000003,0.45,0.07500000000000001,equal,0.45,0.25,COMPLETE
1676,0.18171555719124347,0.175,0.225,0.4,0.22500000000000003,0.425,0.05,equal,0.47500000000000003,0.22500000000000003,COMPLETE
1677,0.2223629806736252,0.275,0.5,0.425,0.25,0.47500000000000003,0.07500000000000001,equal,0.5,0.25,COMPLETE
1678,0.6246360197681787,0.2,0.45000000000000007,0.45,0.22500000000000003,0.47500000000000003,0.05,equal,0.45,0.3,COMPLETE
1679,0.36735875662276474,0.22500000000000003,0.4,0.425,0.3,0.45,0.05,softmax,0.47500000000000003,0.325,COMPLETE
1680,0.2427629029045003,0.325,0.42500000000000004,0.425,0.22500000000000003,0.5,0.05,equal,0.5,0.3,COMPLETE
1681,-0.08603930169085139,0.25,0.42500000000000004,0.45,0.15000000000000002,0.47500000000000003,0.35000000000000003,equal,0.45,0.3,COMPLETE
1682,0.13526846239896706,0.175,0.4,0.8,0.3,0.45,0.05,equal,0.45,0.3,COMPLETE
1683,0.6246360197681785,0.22500000000000003,0.45000000000000007,0.425,0.22500000000000003,0.47500000000000003,0.05,equal,0.47500000000000003,0.3,COMPLETE
1684,0.535398913989829,0.2,0.42500000000000004,0.4,0.22500000000000003,0.47500000000000003,0.05,equal,0.5,0.325,COMPLETE
1685,0.2656720407680736,0.2,0.45000000000000007,0.47500000000000003,0.22500000000000003,0.35000000000000003,0.05,equal,0.47500000000000003,0.3,COMPLETE
1686,0.1884157381984522,0.25,0.4,0.45,0.275,0.275,0.05,softmax,0.375,0.3,COMPLETE
1687,0.524121274342744,0.22500000000000003,0.42500000000000004,0.425,0.22500000000000003,0.45,0.05,equal,0.5,0.3,COMPLETE
1688,0.4353450454945822,0.2,0.45000000000000007,0.47500000000000003,0.25,0.5,0.05,equal,0.25,0.325,COMPLETE
1689,0.47521676418665704,0.22500000000000003,0.4,0.45,0.22500000000000003,0.47500000000000003,0.05,equal,0.45,0.3,COMPLETE
1690,0.49181448985014736,0.25,0.45000000000000007,0.45,0.22500000000000003,0.45,0.05,equal,0.47500000000000003,0.325,COMPLETE
1691,0.5168053980009142,0.2,0.42500000000000004,0.4,0.25,0.47500000000000003,0.05,equal,0.5,0.3,COMPLETE
1692,0.4230507639358624,0.22500000000000003,0.45000000000000007,0.425,0.25,0.47500000000000003,0.05,softmax,0.47500000000000003,0.3,COMPLETE
1693,0.37698700305478755,0.2,0.42500000000000004,0.4,0.25,0.5,0.05,equal,0.45,0.325,COMPLETE
1694,0.4825330281201656,0.25,0.45000000000000007,0.45,0.22500000000000003,0.45,0.05,linear,0.47500000000000003,0.3,COMPLETE
1695,0.4025681246971782,0.175,0.4,0.47500000000000003,0.22500000000000003,0.425,0.05,equal,0.45,0.3,COMPLETE
1696,0.43967793815775963,0.175,0.47500000000000003,0.375,0.25,0.47500000000000003,0.05,equal,0.5,0.3,COMPLETE
1697,-0.19833377715521666,0.22500000000000003,0.47500000000000003,0.425,0.025,0.47500000000000003,0.5,equal,0.275,0.325,COMPLETE
1698,0.29132878727887035,0.275,0.42500000000000004,0.45,0.25,0.5,0.05,equal,0.425,0.3,COMPLETE
1699,0.3533122174246928,0.22500000000000003,0.45000000000000007,0.6500000000000001,0.275,0.45,0.05,equal,0.47500000000000003,0.3,COMPLETE
1700,0.5229055583623898,0.2,0.45000000000000007,0.4,0.22500000000000003,0.47500000000000003,0.05,softmax,0.5,0.3,COMPLETE
1701,0.5241212743427435,0.25,0.42500000000000004,0.425,0.22500000000000003,0.45,0.05,equal,0.47500000000000003,0.325,COMPLETE
1702,0.19970740259197117,0.45,0.47500000000000003,0.425,0.25,0.47500000000000003,0.05,equal,0.47500000000000003,0.275,COMPLETE
1703,0.37698700305478755,0.2,0.42500000000000004,0.4,0.25,0.5,0.05,equal,0.45,0.3,COMPLETE
1704,0.5142408901173694,0.175,0.45000000000000007,0.47500000000000003,0.22500000000000003,0.425,0.05,equal,0.5,0.275,COMPLETE
1705,0.5211957555337045,0.2,0.47500000000000003,0.45,0.275,0.45,0.05,equal,0.47500000000000003,0.3,COMPLETE
1706,0.5260561225290573,0.22500000000000003,0.4,0.425,0.22500000000000003,0.45,0.05,softmax,0.47500000000000003,0.325,COMPLETE
1707,0.1379138726530062,0.22500000000000003,0.17500000000000002,0.425,0.25,0.5,0.05,equal,0.5,0.275,COMPLETE
1708,0.45761747012649034,0.25,0.45000000000000007,0.45,0.22500000000000003,0.47500000000000003,0.07500000000000001,equal,0.425,0.3,COMPLETE
1709,0.29371340678195346,0.275,0.42500000000000004,0.425,0.25,0.47500000000000003,0.05,equal,0.45,0.275,COMPLETE
1710,0.46530666869614534,0.175,0.47500000000000003,0.47500000000000003,0.22500000000000003,0.45,0.07500000000000001,equal,0.47500000000000003,0.3,COMPLETE
1711,-0.0030941756788125333,0.2,0.45000000000000007,0.4,0.22500000000000003,0.2,0.05,equal,0.5,0.35000000000000003,COMPLETE
1712,0.41433363827917413,0.22500000000000003,0.42500000000000004,0.45,0.25,0.47500000000000003,0.07500000000000001,softmax,0.47500000000000003,0.275,COMPLETE
1713,0.28011820529950515,0.25,0.4,0.45,0.25,0.5,0.05,equal,0.45,0.325,COMPLETE
1714,0.26988904778163125,0.22500000000000003,0.47500000000000003,0.425,0.25,0.47500000000000003,0.07500000000000001,equal,0.5,0.275,COMPLETE
1715,0.5621537701018904,0.2,0.45000000000000007,0.47500000000000003,0.275,0.45,0.05,equal,0.45,0.3,COMPLETE
1716,0.40011508052302336,0.175,0.42500000000000004,0.375,0.22500000000000003,0.425,0.05,linear,0.47500000000000003,0.3,COMPLETE
1717,-0.023437295579697915,0.6500000000000001,0.47500000000000003,0.275,0.22500000000000003,0.45,0.05,equal,0.5,0.275,COMPLETE
1718,0.3493851684085263,0.2,0.45000000000000007,0.4,0.25,0.47500000000000003,0.07500000000000001,equal,0.47500000000000003,0.275,COMPLETE
1719,0.4210514323909553,0.22500000000000003,0.4,0.45,0.22500000000000003,0.5,0.05,equal,0.425,0.325,COMPLETE
1720,0.31860794681705273,0.25,0.47500000000000003,0.45,0.25,0.47500000000000003,0.07500000000000001,softmax,0.5,0.275,COMPLETE
1721,0.4262276866870688,0.22500000000000003,0.42500000000000004,0.425,0.25,0.47500000000000003,0.07500000000000001,equal,0.45,0.3,COMPLETE
1722,0.5211387698150434,0.2,0.45000000000000007,0.4,0.275,0.45,0.05,equal,0.47500000000000003,0.3,COMPLETE
1723,0.3357043545940863,0.275,0.5,0.45,0.22500000000000003,0.47500000000000003,0.05,equal,0.47500000000000003,0.275,COMPLETE
1724,0.6074641265057518,0.22500000000000003,0.45000000000000007,0.425,0.275,0.45,0.05,equal,0.5,0.275,COMPLETE
1725,0.4665351075252505,0.175,0.42500000000000004,0.47500000000000003,0.25,0.5,0.07500000000000001,equal,0.45,0.275,COMPLETE
1726,-0.005886209961181169,0.2,0.47500000000000003,0.4,0.22500000000000003,0.1,0.05,softmax,0.45,0.325,COMPLETE
1727,0.47521676418665737,0.25,0.4,0.45,0.22500000000000003,0.47500000000000003,0.05,equal,0.5,0.275,COMPLETE
1728,0.25888025449801455,0.175,0.5,0.47500000000000003,0.25,0.5,0.07500000000000001,equal,0.47500000000000003,0.3,COMPLETE
1729,0.5118723179709879,0.22500000000000003,0.45000000000000007,0.425,0.22500000000000003,0.425,0.07500000000000001,equal,0.47500000000000003,0.275,COMPLETE
1730,-0.27310166633330213,0.25,0.25,0.45,0.25,0.45,0.275,equal,0.5,0.3,COMPLETE
1731,0.6054729525697832,0.22500000000000003,0.42500000000000004,0.425,0.22500000000000003,0.47500000000000003,0.05,equal,0.47500000000000003,0.3,COMPLETE
1732,-0.03494137990896274,0.175,0.47500000000000003,0.47500000000000003,0.225,0.47500000000000003,0.3,equal,0.47500000000000003,0.275,COMPLETE
1733,0.3470709770880184,0.2,0.45000000000000007,0.4,0.25,0.5,0.05,softmax,0.45,0.3,COMPLETE
1734,0.6246360197681787,0.2,0.42500000000000004,0.45,0.22500000000000003,0.47500000000000003,0.05,equal,0.5,0.275,COMPLETE
1735,0.4881634891448562,0.175,0.4,0.47500000000000003,0.25,0.45,0.07500000000000001,equal,0.5,0.275,COMPLETE
1736,0.4535691059479645,0.175,0.37500000000000006,0.47500000000000003,0.22500000000000003,0.47500000000000003,0.05,linear,0.5,0.275,COMPLETE
1737,0.4704913780929446,0.2,0.4,0.45,0.275,0.425,0.07500000000000001,equal,0.5,0.3,COMPLETE
1738,0.4881313105205958,0.175,0.4,0.47500000000000003,0.275,0.45,0.05,equal,0.5,0.275,COMPLETE
1739,0.4455101429102134,0.2,0.37500000000000006,0.45,0.25,0.47500000000000003,0.05,equal,0.5,0.275,COMPLETE
1740,0.481250495247723,0.2,0.42500000000000004,0.47500000000000003,0.22500000000000003,0.45,0.07500000000000001,softmax,0.5,0.275,COMPLETE
1741,0.3517257561521808,0.175,0.4,0.47500000000000003,0.25,0.5,0.07500000000000001,equal,0.5,0.3,COMPLETE
1742,0.38541890778797583,0.2,0.42500000000000004,0.45,0.22500000000000003,0.47500000000000003,0.05,equal,0.5,0.125,COMPLETE
1743,0.2813013092097093,0.2,0.4,0.7250000000000001,0.2,0.45,0.05,equal,0.5,0.275,COMPLETE
1744,0.6510936289671385,0.2,0.42500000000000004,0.45,0.25,0.47500000000000003,0.05,equal,0.5,0.3,COMPLETE
1745,0.012631898072374904,0.175,0.37500000000000006,0.47500000000000003,0.25,0.5,0.2,equal,0.5,0.325,COMPLETE
1746,0.17617019487885588,0.175,0.4,0.47500000000000003,0.275,0.3,0.05,softmax,0.5,0.325,COMPLETE
1747,0.4906915218763632,0.175,0.4,0.47500000000000003,0.25,0.47500000000000003,0.07500000000000001,equal,0.5,0.325,COMPLETE
1748,0.45665093455653094,0.175,0.37500000000000006,0.47500000000000003,0.275,0.45,0.05,equal,0.5,0.3,COMPLETE
1749,0.582661956449643,0.175,0.42500000000000004,0.47500000000000003,0.25,0.47500000000000003,0.07500000000000001,equal,0.5,0.325,COMPLETE
1750,0.507439514193575,0.2,0.4,0.45,0.275,0.45,0.05,equal,0.5,0.3,COMPLETE
1751,0.4677386629993295,0.175,0.42500000000000004,0.47500000000000003,0.25,0.5,0.07500000000000001,equal,0.5,0.3,COMPLETE
1752,0.5432908415060125,0.2,0.4,0.45,0.25,0.47500000000000003,0.05,equal,0.5,0.325,COMPLETE
1753,0.5374698779077189,0.2,0.4,0.45,0.25,0.47500000000000003,0.05,softmax,0.5,0.3,COMPLETE
1754,-0.19833377715521702,0.2,0.42500000000000004,0.45,0.05,0.5,0.425,equal,0.5,0.3,COMPLETE
1755,0.4982113749092352,0.175,0.42500000000000004,0.47500000000000003,0.25,0.45,0.07500000000000001,equal,0.5,0.3,COMPLETE
1756,0.4242117969910635,0.2,0.37500000000000006,0.45,0.275,0.425,0.07500000000000001,equal,0.5,0.3,COMPLETE
1757,0.6295552286002744,0.2,0.42500000000000004,0.45,0.25,0.47500000000000003,0.05,linear,0.5,0.325,COMPLETE
1758,0.44997164543681417,0.175,0.37500000000000006,0.47500000000000003,0.275,0.45,0.05,linear,0.5,0.35000000000000003,COMPLETE
1759,0.4945504168358923,0.175,0.4,0.47500000000000003,0.25,0.47500000000000003,0.07500000000000001,linear,0.35000000000000003,0.325,COMPLETE
1760,0.4266314266954307,0.2,0.37500000000000006,0.47500000000000003,0.275,0.425,0.05,linear,0.5,0.35000000000000003,COMPLETE
1761,0.46343699957973733,0.175,0.4,0.47500000000000003,0.25,0.47500000000000003,0.05,softmax,0.5,0.325,COMPLETE
1762,0.42340731281270894,0.2,0.42500000000000004,0.45,0.25,0.5,0.07500000000000001,linear,0.5,0.35000000000000003,COMPLETE
1763,0.5374698779077189,0.2,0.4,0.45,0.25,0.47500000000000003,0.05,softmax,0.5,0.325,COMPLETE
1764,0.544673106610972,0.175,0.42500000000000004,0.47500000000000003,0.275,0.45,0.05,softmax,0.5,0.325,COMPLETE
1765,0.4502739737406027,0.2,0.4,0.45,0.25,0.45,0.07500000000000001,linear,0.5,0.325,COMPLETE
1766,0.5731365015899353,0.175,0.42500000000000004,0.47500000000000003,0.25,0.47500000000000003,0.05,linear,0.5,0.325,COMPLETE
1767,0.274387474230443,0.2,0.37500000000000006,0.45,0.25,0.5,0.07500000000000001,linear,0.5,0.325,COMPLETE
1768,0.28149291827934697,0.2,0.42500000000000004,0.45,0.25,0.47500000000000003,0.175,linear,0.5,0.35000000000000003,COMPLETE
1769,0.5406910675756209,0.175,0.42500000000000004,0.47500000000000003,0.275,0.45,0.05,linear,0.5,0.35000000000000003,COMPLETE
1770,0.48304696576371203,0.175,0.4,0.47500000000000003,0.25,0.47500000000000003,0.07500000000000001,softmax,0.5,0.325,COMPLETE
1771,0.1821970827193593,0.2,0.42500000000000004,0.05,0.25,0.5,0.05,linear,0.5,0.325,COMPLETE
1772,0.6134595439997296,0.2,0.42500000000000004,0.45,0.25,0.45,0.07500000000000001,linear,0.5,0.325,COMPLETE
1773,0.3215741578712916,0.2,0.4,0.45,0.25,0.5,0.05,linear,0.5,0.325,COMPLETE
1774,0.4939768644104342,0.175,0.42500000000000004,0.47500000000000003,0.275,0.425,0.05,linear,0.5,0.325,COMPLETE
1775,0.41556785628352133,0.22500000000000003,0.42500000000000004,0.45,0.25,0.47500000000000003,0.07500000000000001,softmax,0.5,0.35000000000000003,COMPLETE
1776,0.424610760353724,0.22500000000000003,0.37500000000000006,0.45,0.275,0.45,0.05,linear,0.5,0.325,COMPLETE
1777,0.4244982252742717,0.2,0.45000000000000007,0.45,0.25,0.47500000000000003,0.07500000000000001,linear,0.5,0.325,COMPLETE
1778,0.5728189174611231,0.175,0.45000000000000007,0.47500000000000003,0.25,0.47500000000000003,0.05,linear,0.5,0.3,COMPLETE
1779,0.40268244501836636,0.2,0.4,0.45,0.25,0.45,0.05,linear,0.5,0.35000000000000003,COMPLETE
1780,0.16945076812358,0.175,0.42500000000000004,0.47500000000000003,0.47500000000000003,0.175,0.07500000000000001,linear,0.5,0.325,COMPLETE
1781,0.2785871738695218,0.22500000000000003,0.45000000000000007,0.45,0.25,0.5,0.05,linear,0.175,0.3,COMPLETE
1782,0.5054827542239279,0.2,0.42500000000000004,0.45,0.275,0.45,0.05,linear,0.5,0.3,COMPLETE
1783,0.33209743107480416,0.22500000000000003,0.4,0.45,0.25,0.47500000000000003,0.07500000000000001,linear,0.5,0.325,COMPLETE
1784,-0.010783933398034119,0.6000000000000001,0.45000000000000007,0.22500000000000003,0.25,0.47500000000000003,0.05,linear,0.5,0.3,COMPLETE
1785,0.4545528301937102,0.2,0.45000000000000007,0.45,0.25,0.5,0.05,linear,0.5,0.3,COMPLETE
1786,0.07725750269085284,0.175,0.42500000000000004,0.47500000000000003,0.25,0.45,0.07500000000000001,linear,0.05,0.3,COMPLETE
1787,0.42489599639465975,0.22500000000000003,0.45000000000000007,0.45,0.25,0.47500000000000003,0.07500000000000001,linear,0.5,0.325,COMPLETE
1788,0.07801554630268123,0.8250000000000001,0.42500000000000004,0.05,0.275,0.425,0.05,linear,0.5,0.3,COMPLETE
1789,0.49684841092360377,0.2,0.4,0.45,0.275,0.45,0.05,linear,0.5,0.3,COMPLETE
1790,0.4665415683798491,0.22500000000000003,0.47500000000000003,0.45,0.25,0.47500000000000003,0.05,linear,0.5,0.325,COMPLETE
1791,0.5942358029321161,0.175,0.45000000000000007,0.47500000000000003,0.25,0.47500000000000003,0.07500000000000001,softmax,0.5,0.3,COMPLETE
1792,0.25176732239182464,0.2,0.37500000000000006,0.45,0.25,0.5,0.05,linear,0.5,0.3,COMPLETE
1793,0.018831735974492017,0.22500000000000003,0.05,0.425,0.25,0.45,0.07500000000000001,linear,0.5,0.325,COMPLETE
1794,0.3286820224691402,0.22500000000000003,0.47500000000000003,0.425,0.3,0.375,0.05,linear,0.5,0.3,COMPLETE
1795,0.5299805714884116,0.2,0.4,0.45,0.25,0.47500000000000003,0.05,linear,0.5,0.35000000000000003,COMPLETE
1796,0.6078636465947452,0.175,0.45000000000000007,0.47500000000000003,0.25,0.47500000000000003,0.07500000000000001,equal,0.5,0.3,COMPLETE
1797,-0.06091773611373258,0.525,0.42500000000000004,0.3,0.275,0.45,0.05,linear,0.5,0.3,COMPLETE
1798,0.31134797665598113,0.175,0.47500000000000003,0.47500000000000003,0.25,0.5,0.07500000000000001,linear,0.5,0.325,COMPLETE
1799,0.6074641265057511,0.2,0.42500000000000004,0.425,0.275,0.45,0.05,equal,0.5,0.3,COMPLETE
1800,0.44308694209790783,0.22500000000000003,0.45000000000000007,0.425,0.25,0.47500000000000003,0.07500000000000001,equal,0.5,0.3,COMPLETE
1801,0.4426427302255022,0.22500000000000003,0.4,0.45,0.25,0.47500000000000003,0.05,softmax,0.5,0.3,COMPLETE
1802,0.29708563507029034,0.2,0.5,0.425,0.25,0.5,0.05,equal,0.5,0.325,COMPLETE
1803,0.47869999262843776,0.22500000000000003,0.42500000000000004,0.45,0.275,0.425,0.05,equal,0.5,0.325,COMPLETE
1804,0.088110197782521,0.7000000000000001,0.45000000000000007,0.05,0.25,0.45,0.07500000000000001,equal,0.5,0.3,COMPLETE
1805,-0.05235065581968812,0.175,0.47500000000000003,0.47500000000000003,0.25,0.47500000000000003,0.25,equal,0.5,0.3,COMPLETE
1806,0.5528847654074804,0.2,0.42500000000000004,0.425,0.25,0.45,0.07500000000000001,equal,0.5,0.3,COMPLETE
