number,value,params_fund_net_buying,params_institutional_weight,params_number_fund_holdings,params_pe,params_revenue_growth,params_roe,params_stock_weight_option,params_take_profit,params_trailing_stop_loss,state
4393,0.45761747012649034,0.25,0.47500000000000003,0.45,0.175,0.5,0.05,equal,0.5,0.35000000000000003,COMPLETE
4394,0.5590158464883748,0.2,0.45000000000000007,0.4,0.2,0.47500000000000003,0.05,equal,0.375,0.3,COMPLETE
4395,0.4934411703914466,0.22500000000000003,0.42500000000000004,0.425,0.22500000000000003,0.5,0.07500000000000001,equal,0.375,0.375,COMPLETE
4396,-0.18964959858179922,0.175,0.47500000000000003,0.47500000000000003,0.45,0.47500000000000003,0.05,equal,0.2,0.4,COMPLETE
4397,0.5027160912080832,0.22500000000000003,0.45000000000000007,0.425,0.175,0.47500000000000003,0.07500000000000001,equal,0.275,0.3,COMPLETE
4398,0.44009067395590495,0.22500000000000003,0.42500000000000004,0.45,0.22500000000000003,0.5,0.05,linear,0.5,0.325,COMPLETE
4399,0.4686353038907793,0.2,0.5,0.45,0.175,0.5,0.05,equal,0.3,0.4,COMPLETE
4400,0.24473059620990945,0.25,0.47500000000000003,0.425,0.175,0.47500000000000003,0.2,equal,0.5,0.375,COMPLETE
4401,0.24419445385207955,0.175,0.4,0.7500000000000001,0.2,0.47500000000000003,0.05,equal,0.35000000000000003,0.35000000000000003,COMPLETE
4402,0.43675959025549327,0.2,0.45000000000000007,0.4,0.22500000000000003,0.5,0.05,equal,0.275,0.3,COMPLETE
4403,0.13685844372185318,0.8500000000000001,0.525,0.07500000000000001,0.22500000000000003,0.5,0.07500000000000001,equal,0.25,0.325,COMPLETE
4404,0.5184882620131641,0.22500000000000003,0.47500000000000003,0.425,0.15000000000000002,0.47500000000000003,0.05,equal,0.4,0.35000000000000003,COMPLETE
4405,0.5838063644732047,0.15000000000000002,0.5,0.5,0.175,0.5,0.05,equal,0.5,0.4,COMPLETE
4406,0.5991697496493731,0.175,0.45000000000000007,0.47500000000000003,0.2,0.47500000000000003,0.05,equal,0.3,0.425,COMPLETE
4407,0.07707038541078229,0.9,0.42500000000000004,0.05,0.22500000000000003,0.5,0.07500000000000001,equal,0.5,0.375,COMPLETE
4408,-0.005525402185236481,0.25,0.47500000000000003,0.425,0.2,0.175,0.05,equal,0.375,0.325,COMPLETE
4409,0.5451183289893459,0.2,0.45000000000000007,0.4,0.2,0.47500000000000003,0.05,equal,0.3,0.35000000000000003,COMPLETE
4410,0.5005309948142411,0.22500000000000003,0.5,0.45,0.175,0.47500000000000003,0.07500000000000001,equal,0.5,0.325,COMPLETE
4411,0.26101354044241015,0.2,0.42500000000000004,0.45,0.2,0.35000000000000003,0.05,equal,0.375,0.4,COMPLETE
4412,0.33715644091781305,0.175,0.4,0.47500000000000003,0.22500000000000003,0.5,0.05,equal,0.3,0.22500000000000003,COMPLETE
4413,0.30769214195588607,0.22500000000000003,0.55,0.45,0.175,0.47500000000000003,0.07500000000000001,equal,0.5,0.3,COMPLETE
4414,0.48880535148613324,0.22500000000000003,0.47500000000000003,0.425,0.22500000000000003,0.5,0.05,equal,0.3,0.375,COMPLETE
4415,0.4845254684938362,0.25,0.45000000000000007,0.425,0.15000000000000002,0.5,0.05,equal,0.5,0.35000000000000003,COMPLETE
4416,0.4153658382516877,0.2,0.5,0.4,0.175,0.47500000000000003,0.07500000000000001,equal,0.275,0.375,COMPLETE
4417,0.5950337889925932,0.22500000000000003,0.42500000000000004,0.45,0.15000000000000002,0.47500000000000003,0.05,equal,0.35000000000000003,0.3,COMPLETE
4418,0.4629332898357943,0.275,0.47500000000000003,0.425,0.22500000000000003,0.5,0.05,linear,0.375,0.3,COMPLETE
4419,0.545118328989346,0.2,0.45000000000000007,0.4,0.175,0.5,0.05,equal,0.3,0.325,COMPLETE
4420,0.24805061983365567,0.175,0.525,0.47500000000000003,0.22500000000000003,0.47500000000000003,0.07500000000000001,equal,0.5,0.35000000000000003,COMPLETE
4421,0.47060865025783816,0.25,0.4,0.45,0.2,0.47500000000000003,0.05,equal,0.35000000000000003,0.325,COMPLETE
4422,0.4683295840381528,0.15000000000000002,0.45000000000000007,0.375,0.175,0.5,0.05,equal,0.4,0.375,COMPLETE
4423,0.2698598108037045,0.22500000000000003,0.47500000000000003,0.425,0.22500000000000003,0.5,0.07500000000000001,equal,0.25,0.4,COMPLETE
4424,0.5581733710979727,0.2,0.45000000000000007,0.45,0.15000000000000002,0.47500000000000003,0.05,equal,0.5,0.3,COMPLETE
4425,0.5081969201559844,0.2,0.42500000000000004,0.4,0.175,0.5,0.05,equal,0.3,0.35000000000000003,COMPLETE
4426,0.5005309948142407,0.175,0.5,0.47500000000000003,0.2,0.47500000000000003,0.05,equal,0.5,0.325,COMPLETE
4427,0.30769214195588607,0.22500000000000003,0.5750000000000001,0.425,0.22500000000000003,0.5,0.07500000000000001,equal,0.375,0.375,COMPLETE
4428,0.03063848074664394,0.2,0.47500000000000003,0.45,0.1,0.47500000000000003,0.325,equal,0.4,0.375,COMPLETE
4429,0.43002270768228534,0.25,0.42500000000000004,0.425,0.175,0.5,0.05,equal,0.5,0.4,COMPLETE
4430,0.34528197974704744,0.125,0.47500000000000003,0.35000000000000003,0.125,0.325,0.05,equal,0.275,0.325,COMPLETE
4431,-0.20726663083379304,0.175,0.35000000000000003,0.47500000000000003,0.125,0.5,0.35000000000000003,equal,0.375,0.3,COMPLETE
4432,0.3197098543029611,0.2,0.5,0.4,0.2,0.47500000000000003,0.07500000000000001,equal,0.175,0.35000000000000003,COMPLETE
4433,0.5260054103748681,0.22500000000000003,0.45000000000000007,0.425,0.2,0.47500000000000003,0.05,equal,0.35000000000000003,0.3,COMPLETE
4434,0.5581733710979727,0.2,0.42500000000000004,0.45,0.15000000000000002,0.47500000000000003,0.05,equal,0.5,0.35000000000000003,COMPLETE
4435,0.11588697832784192,0.35000000000000003,0.47500000000000003,0.425,0.2,0.25,0.05,equal,0.3,0.375,COMPLETE
4436,0.4711736955383641,0.275,0.45000000000000007,0.425,0.22500000000000003,0.5,0.07500000000000001,equal,0.3,0.425,COMPLETE
4437,0.3363777071831842,0.175,0.4,0.47500000000000003,0.22500000000000003,0.5,0.07500000000000001,equal,0.275,0.325,COMPLETE
4438,0.4563938410068231,0.25,0.47500000000000003,0.45,0.175,0.5,0.05,equal,0.5,0.22500000000000003,COMPLETE
4439,0.6166838131030883,0.22500000000000003,0.42500000000000004,0.45,0.2,0.47500000000000003,0.05,equal,0.5,0.4,COMPLETE
4440,0.37454162509905725,0.15000000000000002,0.5,0.375,0.175,0.5,0.05,linear,0.3,0.3,COMPLETE
4441,0.03925027601370539,0.22500000000000003,0.45000000000000007,0.425,0.22500000000000003,0.47500000000000003,0.07500000000000001,equal,0.05,0.375,COMPLETE
4442,0.3900280949231311,0.2,0.47500000000000003,0.4,0.175,0.5,0.05,equal,0.5,0.4,COMPLETE
4443,0.41156195491355496,0.25,0.42500000000000004,0.425,0.22500000000000003,0.47500000000000003,0.07500000000000001,equal,0.275,0.35000000000000003,COMPLETE
4444,-0.03264759505968923,0.5750000000000001,0.45000000000000007,0.2,0.15000000000000002,0.47500000000000003,0.05,equal,0.375,0.325,COMPLETE
4445,0.4904639560156502,0.175,0.4,0.47500000000000003,0.175,0.5,0.05,equal,0.5,0.3,COMPLETE
4446,0.12139983590170231,0.2,0.8500000000000001,0.45,0.22500000000000003,0.5,0.05,equal,0.4,0.375,COMPLETE
4447,0.36254263611819926,0.22500000000000003,0.525,0.45,0.2,0.47500000000000003,0.05,equal,0.3,0.325,COMPLETE
4448,0.08575960000855483,0.2,0.45000000000000007,0.4,0.175,0.5,0.25,equal,0.375,0.4,COMPLETE
4449,0.41536583825168827,0.22500000000000003,0.5,0.425,0.175,0.47500000000000003,0.07500000000000001,equal,0.5,0.325,COMPLETE
4450,0.48089852693722135,0.2,0.37500000000000006,0.4,0.2,0.47500000000000003,0.05,equal,0.35000000000000003,0.35000000000000003,COMPLETE
4451,0.48880535148613324,0.25,0.47500000000000003,0.45,0.22500000000000003,0.5,0.07500000000000001,equal,0.3,0.3,COMPLETE
4452,0.5065540691669667,0.15000000000000002,0.42500000000000004,0.5,0.2,0.47500000000000003,0.05,equal,0.5,0.375,COMPLETE
4453,0.18590238179424107,0.22500000000000003,0.45000000000000007,0.6500000000000001,0.22500000000000003,0.5,0.05,equal,0.375,0.35000000000000003,COMPLETE
4454,0.2647109771108521,0.175,0.47500000000000003,0.5,0.175,0.5,0.22500000000000003,equal,0.3,0.3,COMPLETE
4455,0.5210527709871448,0.22500000000000003,0.47500000000000003,0.425,0.15000000000000002,0.47500000000000003,0.05,equal,0.5,0.4,COMPLETE
4456,0.23952374494099613,0.275,0.525,0.425,0.2,0.3,0.05,equal,0.4,0.325,COMPLETE
4457,0.35075736649025097,0.175,0.45000000000000007,0.4,0.22500000000000003,0.5,0.07500000000000001,equal,0.5,0.35000000000000003,COMPLETE
4458,0.5608341093446146,0.2,0.42500000000000004,0.45,0.2,0.47500000000000003,0.05,equal,0.275,0.3,COMPLETE
4459,0.24805061983365573,0.2,0.5,0.4,0.175,0.5,0.05,equal,0.35000000000000003,0.375,COMPLETE
4460,0.4635781690628645,0.25,0.4,0.45,0.15000000000000002,0.47500000000000003,0.05,linear,0.3,0.325,COMPLETE
4461,0.2523011423137915,0.5,0.45000000000000007,0.425,0.22500000000000003,0.5,0.07500000000000001,equal,0.5,0.22500000000000003,COMPLETE
4462,0.5374299877030269,0.2,0.47500000000000003,0.4,0.2,0.47500000000000003,0.05,equal,0.375,0.35000000000000003,COMPLETE
4463,0.26523715407853937,0.22500000000000003,0.45000000000000007,0.425,0.2,0.35000000000000003,0.07500000000000001,equal,0.5,0.3,COMPLETE
4464,0.5483219364242679,0.175,0.42500000000000004,0.47500000000000003,0.175,0.5,0.05,equal,0.35000000000000003,0.4,COMPLETE
4465,-0.11593177709223515,0.25,0.47500000000000003,0.45,0.1,0.47500000000000003,0.4,equal,0.3,0.375,COMPLETE
4466,0.037902955608169815,0.22500000000000003,0.5,0.425,0.2,0.125,0.05,equal,0.275,0.325,COMPLETE
4467,0.4677386629993295,0.22500000000000003,0.45000000000000007,0.425,0.22500000000000003,0.5,0.07500000000000001,equal,0.5,0.425,COMPLETE
4468,0.5148685086663594,0.175,0.42500000000000004,0.375,0.15000000000000002,0.47500000000000003,0.05,equal,0.5,0.375,COMPLETE
4469,0.4686353038907793,0.2,0.5,0.45,0.175,0.5,0.05,equal,0.3,0.325,COMPLETE
4470,0.4834758685761484,0.22500000000000003,0.4,0.45,0.2,0.47500000000000003,0.05,equal,0.375,0.3,COMPLETE
4471,-0.03354556717738125,0.125,0.45000000000000007,0.8250000000000001,0.22500000000000003,0.5,0.07500000000000001,equal,0.275,0.375,COMPLETE
4472,0.5374299877030269,0.2,0.47500000000000003,0.4,0.2,0.47500000000000003,0.05,equal,0.4,0.35000000000000003,COMPLETE
4473,0.5143184472204515,0.25,0.42500000000000004,0.45,0.15000000000000002,0.47500000000000003,0.05,equal,0.5,0.4,COMPLETE
4474,0.3096725746276835,0.3,0.5,0.425,0.22500000000000003,0.5,0.07500000000000001,equal,0.3,0.35000000000000003,COMPLETE
4475,0.6060959696909698,0.175,0.45000000000000007,0.47500000000000003,0.175,0.5,0.05,equal,0.5,0.3,COMPLETE
4476,0.5374299877030269,0.2,0.47500000000000003,0.4,0.2,0.47500000000000003,0.05,equal,0.375,0.4,COMPLETE
4477,0.10493859530361034,0.275,0.8,0.425,0.2,0.47500000000000003,0.05,equal,0.275,0.3,COMPLETE
4478,0.48035803877424954,0.22500000000000003,0.45000000000000007,0.45,0.22500000000000003,0.5,0.07500000000000001,equal,0.35000000000000003,0.375,COMPLETE
4479,0.3812708332045353,0.2,0.525,0.45,0.175,0.5,0.05,equal,0.3,0.325,COMPLETE
4480,0.5779780130622139,0.15000000000000002,0.47500000000000003,0.5,0.15000000000000002,0.47500000000000003,0.05,equal,0.5,0.375,COMPLETE
4481,0.33124588288392676,0.325,0.42500000000000004,0.5750000000000001,0.2,0.47500000000000003,0.05,linear,0.375,0.325,COMPLETE
4482,0.37286368601523234,0.175,0.4,0.47500000000000003,0.22500000000000003,0.5,0.07500000000000001,equal,0.4,0.3,COMPLETE
4483,0.4759455386256412,0.22500000000000003,0.47500000000000003,0.425,0.175,0.5,0.05,equal,0.5,0.35000000000000003,COMPLETE
4484,0.5316564123178308,0.2,0.37500000000000006,0.45,0.15000000000000002,0.47500000000000003,0.05,equal,0.5,0.425,COMPLETE
4485,0.23301960795430562,0.15000000000000002,0.5,0.375,0.22500000000000003,0.5,0.07500000000000001,equal,0.35000000000000003,0.375,COMPLETE
4486,0.4702110117134354,0.25,0.45000000000000007,0.425,0.175,0.5,0.05,equal,0.3,0.35000000000000003,COMPLETE
4487,-0.11750421526604496,0.22500000000000003,0.45000000000000007,0.425,0.125,0.47500000000000003,0.375,equal,0.5,0.22500000000000003,COMPLETE
4488,0.49854156157595336,0.175,0.42500000000000004,0.47500000000000003,0.2,0.47500000000000003,0.05,equal,0.25,0.425,COMPLETE
4489,0.2588802544980143,0.2,0.47500000000000003,0.4,0.22500000000000003,0.5,0.07500000000000001,equal,0.3,0.325,COMPLETE
4490,0.598902323494321,0.22500000000000003,0.42500000000000004,0.425,0.175,0.5,0.05,equal,0.5,0.4,COMPLETE
4491,0.6409572857839799,0.2,0.45000000000000007,0.45,0.2,0.47500000000000003,0.05,equal,0.35000000000000003,0.3,COMPLETE
4492,-0.18073888278491876,0.175,0.47500000000000003,0.47500000000000003,0.025,0.47500000000000003,0.5,equal,0.375,0.325,COMPLETE
4493,0.4315981749928191,0.25,0.4,0.425,0.22500000000000003,0.5,0.07500000000000001,equal,0.3,0.4,COMPLETE
4494,0.3875631695064455,0.2,0.47500000000000003,0.4,0.175,0.5,0.05,equal,0.375,0.35000000000000003,COMPLETE
4495,0.121475035434585,0.175,0.5,0.375,0.375,0.47500000000000003,0.05,equal,0.5,0.375,COMPLETE
4496,0.20697732870907962,0.22500000000000003,0.55,0.45,0.175,0.5,0.175,equal,0.5,0.3,COMPLETE
4497,0.47161592412266967,0.275,0.42500000000000004,0.425,0.15000000000000002,0.47500000000000003,0.05,equal,0.275,0.325,COMPLETE
4498,0.31816201874292616,0.2,0.45000000000000007,0.4,0.22500000000000003,0.5,0.07500000000000001,equal,0.22500000000000003,0.22500000000000003,COMPLETE
4499,0.5005309948142411,0.22500000000000003,0.5,0.45,0.2,0.47500000000000003,0.05,equal,0.4,0.375,COMPLETE
4500,0.6246360197681787,0.25,0.47500000000000003,0.425,0.2,0.47500000000000003,0.05,equal,0.5,0.35000000000000003,COMPLETE
4501,0.2278943038680883,0.2,0.525,0.4,0.22500000000000003,0.5,0.07500000000000001,linear,0.3,0.3,COMPLETE
4502,0.41792589777208683,0.22500000000000003,0.45000000000000007,0.45,0.175,0.5,0.05,equal,0.275,0.35000000000000003,COMPLETE
4503,0.5192464776348628,0.15000000000000002,0.45000000000000007,0.47500000000000003,0.15000000000000002,0.47500000000000003,0.05,equal,0.3,0.325,COMPLETE
4504,0.5274805683444349,0.175,0.42500000000000004,0.5,0.175,0.5,0.05,equal,0.5,0.4,COMPLETE
4505,0.19803027262678716,0.22500000000000003,0.47500000000000003,0.45,0.2,0.275,0.07500000000000001,equal,0.375,0.3,COMPLETE
4506,0.5001172884112586,0.2,0.5,0.45,0.2,0.47500000000000003,0.05,equal,0.275,0.375,COMPLETE
4507,-0.18073888278492006,0.25,0.45000000000000007,0.425,0.05,0.47500000000000003,0.47500000000000003,equal,0.35000000000000003,0.375,COMPLETE
4508,0.37762199794787754,0.175,0.42500000000000004,0.375,0.175,0.5,0.05,equal,0.5,0.325,COMPLETE
4509,0.2563963475974471,0.2,0.275,0.4,0.22500000000000003,0.5,0.07500000000000001,equal,0.3,0.35000000000000003,COMPLETE
4510,0.5737923622644825,0.22500000000000003,0.4,0.425,0.2,0.47500000000000003,0.05,equal,0.375,0.3,COMPLETE
4511,0.47355745873318045,0.2,0.45000000000000007,0.4,0.22500000000000003,0.5,0.05,equal,0.4,0.4,COMPLETE
4512,0.41536583825168827,0.22500000000000003,0.5,0.425,0.175,0.47500000000000003,0.07500000000000001,equal,0.5,0.325,COMPLETE
4513,0.5965893494737753,0.25,0.47500000000000003,0.45,0.15000000000000002,0.47500000000000003,0.05,equal,0.5,0.35000000000000003,COMPLETE
4514,0.41106634593299185,0.175,0.42500000000000004,0.47500000000000003,0.22500000000000003,0.5,0.05,equal,0.3,0.3,COMPLETE
4515,0.21603995931974246,0.15000000000000002,0.45000000000000007,0.375,0.325,0.47500000000000003,0.07500000000000001,equal,0.375,0.375,COMPLETE
4516,0.24805061983365495,0.22500000000000003,0.525,0.425,0.175,0.5,0.05,equal,0.5,0.4,COMPLETE
4517,0.0615572037191391,0.25,0.47500000000000003,0.425,0.2,0.2,0.05,equal,0.325,0.325,COMPLETE
4518,0.3668251435920904,0.2,0.47500000000000003,0.4,0.22500000000000003,0.5,0.05,equal,0.3,0.375,COMPLETE
4519,0.40670550197635746,0.175,0.37500000000000006,0.47500000000000003,0.175,0.47500000000000003,0.07500000000000001,equal,0.275,0.35000000000000003,COMPLETE
4520,0.598902323494321,0.22500000000000003,0.42500000000000004,0.425,0.175,0.5,0.05,equal,0.5,0.3,COMPLETE
4521,0.5851660751418166,0.2,0.45000000000000007,0.45,0.15000000000000002,0.47500000000000003,0.05,equal,0.375,0.375,COMPLETE
4522,0.270247594649222,0.175,0.4,0.47500000000000003,0.22500000000000003,0.5,0.05,linear,0.25,0.425,COMPLETE
4523,0.11527573186968738,0.25,0.47500000000000003,0.45,0.175,0.47500000000000003,0.07500000000000001,equal,0.07500000000000001,0.35000000000000003,COMPLETE
4524,0.4735574587331804,0.2,0.45000000000000007,0.45,0.22500000000000003,0.5,0.05,equal,0.4,0.4,COMPLETE
4525,0.623650964481205,0.22500000000000003,0.42500000000000004,0.425,0.22500000000000003,0.47500000000000003,0.07500000000000001,equal,0.35000000000000003,0.325,COMPLETE
4526,0.24805061983365573,0.2,0.5,0.4,0.175,0.5,0.05,equal,0.5,0.3,COMPLETE
4527,0.6178023927042292,0.22500000000000003,0.47500000000000003,0.425,0.2,0.47500000000000003,0.05,equal,0.35000000000000003,0.375,COMPLETE
4528,0.6221535571249034,0.175,0.45000000000000007,0.47500000000000003,0.175,0.5,0.05,equal,0.3,0.22500000000000003,COMPLETE
4529,0.43011349405734745,0.275,0.42500000000000004,0.425,0.22500000000000003,0.47500000000000003,0.07500000000000001,equal,0.5,0.325,COMPLETE
4530,0.16385527485483947,0.2,0.5,0.45,0.175,0.5,0.2,equal,0.325,0.3,COMPLETE
4531,0.5425044014830851,0.22500000000000003,0.45000000000000007,0.425,0.2,0.47500000000000003,0.05,equal,0.5,0.325,COMPLETE
4532,0.20399734346584483,0.15000000000000002,0.2,0.525,0.22500000000000003,0.5,0.05,equal,0.325,0.4,COMPLETE
4533,0.3860218429422872,0.2,0.47500000000000003,0.4,0.175,0.47500000000000003,0.07500000000000001,equal,0.3,0.375,COMPLETE
4534,0.26600676029760195,0.25,0.525,0.425,0.22500000000000003,0.5,0.05,equal,0.375,0.325,COMPLETE
4535,0.5482453775763679,0.22500000000000003,0.4,0.45,0.15000000000000002,0.47500000000000003,0.05,equal,0.5,0.35000000000000003,COMPLETE
4536,0.28849421353518556,0.2,0.6250000000000001,0.4,0.22500000000000003,0.5,0.07500000000000001,equal,0.4,0.35000000000000003,COMPLETE
4537,0.3120287942167749,0.175,0.45000000000000007,0.7750000000000001,0.2,0.47500000000000003,0.05,equal,0.3,0.3,COMPLETE
4538,0.4702110117134355,0.25,0.47500000000000003,0.45,0.175,0.5,0.05,equal,0.3,0.3,COMPLETE
4539,0.03761605976343885,0.8,0.42500000000000004,0.125,0.175,0.47500000000000003,0.07500000000000001,equal,0.5,0.4,COMPLETE
4540,0.42968816121340736,0.275,0.5,0.425,0.175,0.5,0.05,equal,0.5,0.375,COMPLETE
4541,0.1966391587351039,0.175,0.45000000000000007,0.47500000000000003,0.22500000000000003,0.5,0.05,equal,0.15000000000000002,0.325,COMPLETE
4542,0.5220780220208967,0.22500000000000003,0.47500000000000003,0.45,0.15000000000000002,0.47500000000000003,0.05,equal,0.375,0.375,COMPLETE
4543,0.46344578158071337,0.2,0.4,0.4,0.22500000000000003,0.47500000000000003,0.07500000000000001,equal,0.325,0.47500000000000003,COMPLETE
4544,0.5979190446471301,0.2,0.42500000000000004,0.45,0.175,0.5,0.05,equal,0.5,0.35000000000000003,COMPLETE
4545,-0.10706228679107072,0.6000000000000001,0.47500000000000003,0.325,0.175,0.5,0.05,linear,0.275,0.375,COMPLETE
4546,0.5260054103748681,0.22500000000000003,0.45000000000000007,0.425,0.2,0.47500000000000003,0.05,equal,0.35000000000000003,0.4,COMPLETE
4547,0.2411132054876946,0.175,0.5,0.47500000000000003,0.22500000000000003,0.5,0.07500000000000001,equal,0.275,0.35000000000000003,COMPLETE
4548,0.5260054103748681,0.25,0.45000000000000007,0.425,0.2,0.47500000000000003,0.05,equal,0.3,0.3,COMPLETE
4549,0.2480506198336554,0.22500000000000003,0.55,0.45,0.22500000000000003,0.5,0.05,equal,0.375,0.325,COMPLETE
4550,0.3499934014212858,0.175,0.47500000000000003,0.4,0.175,0.47500000000000003,0.07500000000000001,equal,0.4,0.425,COMPLETE
4551,0.181574141104801,0.3,0.525,0.3,0.22500000000000003,0.5,0.05,equal,0.25,0.3,COMPLETE
4552,0.5236671143685783,0.2,0.42500000000000004,0.4,0.2,0.47500000000000003,0.05,equal,0.5,0.35000000000000003,COMPLETE
4553,0.23301960795430562,0.15000000000000002,0.47500000000000003,0.375,0.22500000000000003,0.5,0.07500000000000001,equal,0.3,0.4,COMPLETE
4554,0.06063728030979474,0.7750000000000001,0.45000000000000007,0.2,0.15000000000000002,0.47500000000000003,0.05,equal,0.5,0.3,COMPLETE
4555,0.5613962809270423,0.22500000000000003,0.4,0.425,0.2,0.47500000000000003,0.05,equal,0.325,0.325,COMPLETE
4556,0.36109774724976046,0.2,0.5,0.45,0.2,0.325,0.07500000000000001,equal,0.425,0.325,COMPLETE
4557,0.08544032871174677,0.7500000000000001,0.42500000000000004,0.05,0.175,0.5,0.05,equal,0.375,0.375,COMPLETE
4558,0.4859987060892376,0.22500000000000003,0.45000000000000007,0.425,0.15000000000000002,0.47500000000000003,0.05,equal,0.35000000000000003,0.35000000000000003,COMPLETE
4559,0.4845958746152835,0.2,0.42500000000000004,0.4,0.175,0.5,0.05,equal,0.275,0.22500000000000003,COMPLETE
4560,0.47594553862564104,0.25,0.47500000000000003,0.45,0.22500000000000003,0.5,0.07500000000000001,equal,0.5,0.3,COMPLETE
4561,0.6409572857839799,0.2,0.45000000000000007,0.45,0.2,0.47500000000000003,0.05,equal,0.3,0.4,COMPLETE
4562,0.3870324135838004,0.15000000000000002,0.5,0.375,0.175,0.5,0.05,equal,0.22500000000000003,0.375,COMPLETE
4563,0.567239782160198,0.22500000000000003,0.4,0.425,0.22500000000000003,0.47500000000000003,0.07500000000000001,equal,0.47500000000000003,0.35000000000000003,COMPLETE
4564,0.3703903868372481,0.175,0.37500000000000006,0.5,0.15000000000000002,0.47500000000000003,0.05,equal,0.47500000000000003,0.325,COMPLETE
4565,0.4759455386256415,0.2,0.47500000000000003,0.45,0.22500000000000003,0.5,0.05,equal,0.5,0.4,COMPLETE
4566,0.1909058757535588,0.25,0.42500000000000004,0.425,0.2,0.375,0.07500000000000001,linear,0.325,0.3,COMPLETE
4567,0.41792589777208683,0.22500000000000003,0.45000000000000007,0.425,0.175,0.5,0.05,equal,0.275,0.375,COMPLETE
4568,0.19888434842074348,0.4,0.5,0.425,0.175,0.47500000000000003,0.07500000000000001,equal,0.47500000000000003,0.22500000000000003,COMPLETE
4569,0.3327031283567534,0.25,0.45000000000000007,0.45,0.175,0.5,0.05,equal,0.2,0.3,COMPLETE
4570,0.5374299877030269,0.2,0.47500000000000003,0.4,0.2,0.47500000000000003,0.05,equal,0.375,0.35000000000000003,COMPLETE
4571,0.488805351486133,0.22500000000000003,0.45000000000000007,0.425,0.22500000000000003,0.5,0.05,equal,0.3,0.375,COMPLETE
4572,0.19510431651517007,0.275,0.525,0.425,0.2,0.22500000000000003,0.05,equal,0.5,0.325,COMPLETE
4573,0.4549322093842329,0.175,0.42500000000000004,0.47500000000000003,0.22500000000000003,0.5,0.07500000000000001,equal,0.35000000000000003,0.325,COMPLETE
