number,value,params_fund_net_buying,params_institutional_weight,params_number_fund_holdings,params_pe,params_revenue_growth,params_roe,params_stock_weight_option,params_take_profit,params_trailing_stop_loss,state
0,-0.12219908564721225,0.1,0.17500000000000002,0.7750000000000001,0.05,0.375,0.325,softmax,0.1,0.22500000000000003,COMPLETE
1,0.09611549394642863,0.5,0.30000000000000004,0.22500000000000003,0.1,0.325,0.175,softmax,0.125,0.5,COMPLETE
2,-0.10553272933445423,0.55,0.525,0.05,0.07500000000000001,0.125,0.325,linear,0.125,0.175,COMPLETE
3,0.03688203463738622,0.425,0.675,0.1,0.47500000000000003,0.05,0.275,softmax,0.07500000000000001,0.5,COMPLETE
4,0.02745885887460188,0.8750000000000001,0.2,0.1,0.05,0.47500000000000003,0.47500000000000003,softmax,0.3,0.15000000000000002,COMPLETE
5,0.067263633443674,0.375,0.32500000000000007,0.2,0.125,0.2,0.425,softmax,0.05,0.325,COMPLETE
6,0.059292847892793044,0.2,0.775,0.05,0.175,0.375,0.425,equal,0.5,0.3,COMPLETE
7,0.22810231063734557,0.325,0.6250000000000001,0.07500000000000001,0.375,0.2,0.175,equal,0.45,0.4,COMPLETE
8,0.08593761199170707,0.525,0.7500000000000001,0.375,0.22500000000000003,0.275,0.275,softmax,0.375,0.35000000000000003,COMPLETE
9,0.00427843438370859,0.8250000000000001,0.5,0.07500000000000001,0.125,0.4,0.22500000000000003,linear,0.175,0.05,COMPLETE
10,0.11831707042462583,0.275,0.925,0.6250000000000001,0.4,0.2,0.05,equal,0.5,0.4,COMPLETE
11,0.1174826933516725,0.25,0.9500000000000001,0.675,0.375,0.2,0.05,equal,0.5,0.4,COMPLETE
12,0.056577930562219145,0.275,0.975,0.5,0.35000000000000003,0.175,0.05,equal,0.4,0.425,COMPLETE
13,0.19758568521261816,0.05,0.6250000000000001,0.5750000000000001,0.45,0.1,0.125,equal,0.425,0.425,COMPLETE
14,0.10283325623332586,0.07500000000000001,0.6250000000000001,0.425,0.47500000000000003,0.07500000000000001,0.15000000000000002,equal,0.425,0.45,COMPLETE
15,0.06743621189492666,0.7250000000000001,0.025,0.15000000000000002,0.3,0.125,0.125,equal,0.3,0.35000000000000003,COMPLETE
16,-0.0871313691717061,0.05,0.47500000000000003,0.8750000000000001,0.425,0.275,0.125,equal,0.35000000000000003,0.275,COMPLETE
17,0.0992878438586992,0.6500000000000001,0.8250000000000001,0.15000000000000002,0.325,0.1,0.2,equal,0.22500000000000003,0.45,COMPLETE
18,0.30804862708153113,0.15000000000000002,0.6000000000000001,0.325,0.25,0.15000000000000002,0.1,linear,0.45,0.375,COMPLETE
19,0.10802859316591996,0.175,0.42500000000000004,0.3,0.25,0.25,0.22500000000000003,linear,0.45,0.275,COMPLETE
20,0.17797780595641072,0.375,0.5750000000000001,0.3,0.2,0.15000000000000002,0.1,linear,0.35000000000000003,0.375,COMPLETE
21,0.2934969253074132,0.175,0.675,0.55,0.425,0.05,0.1,linear,0.45,0.45,COMPLETE
22,0.3822214165655387,0.15000000000000002,0.7250000000000001,0.5,0.275,0.05,0.1,linear,0.425,0.5,COMPLETE
23,0.24682881306022159,0.15000000000000002,0.8500000000000001,0.5,0.275,0.05,0.1,linear,0.45,0.5,COMPLETE
24,0.38056030688505343,0.15000000000000002,0.7250000000000001,0.525,0.275,0.05,0.07500000000000001,linear,0.25,0.47500000000000003,COMPLETE
25,0.4057087130202416,0.125,0.7250000000000001,0.4,0.275,0.1,0.07500000000000001,linear,0.25,0.47500000000000003,COMPLETE
26,0.22379755656895875,0.22500000000000003,0.7500000000000001,0.45,0.3,0.1,0.05,linear,0.22500000000000003,0.47500000000000003,COMPLETE
27,0.302841172143252,0.125,0.8500000000000001,0.675,0.2,0.07500000000000001,0.07500000000000001,linear,0.25,0.47500000000000003,COMPLETE
28,0.14950339609516516,0.325,0.7000000000000001,0.4,0.325,0.05,0.175,linear,0.175,0.5,COMPLETE
29,0.21760369031436427,0.1,0.8750000000000001,0.7500000000000001,0.175,0.15000000000000002,0.325,linear,0.275,0.2,COMPLETE
30,0.2303734711436501,0.325,0.4,0.47500000000000003,0.275,0.1,0.375,linear,0.175,0.45,COMPLETE
31,0.29042317979448373,0.125,0.5750000000000001,0.325,0.25,0.15000000000000002,0.07500000000000001,linear,0.325,0.425,COMPLETE
32,0.24272375307588337,0.2,0.7250000000000001,0.35000000000000003,0.25,0.07500000000000001,0.15000000000000002,linear,0.22500000000000003,0.47500000000000003,COMPLETE
33,0.3365016508712522,0.1,0.8,0.25,0.3,0.125,0.07500000000000001,linear,0.275,0.375,COMPLETE
34,0.38127595434459305,0.1,0.8,0.55,0.3,0.07500000000000001,0.07500000000000001,linear,0.275,0.5,COMPLETE
35,0.17123175231258397,0.05,0.8750000000000001,0.55,0.35000000000000003,0.05,0.15000000000000002,linear,0.2,0.5,COMPLETE
36,0.13099749669269972,0.5750000000000001,0.675,0.375,0.325,0.07500000000000001,0.22500000000000003,linear,0.3,0.1,COMPLETE
37,-0.03510253703937063,0.425,0.9,0.45,0.275,0.5,0.07500000000000001,softmax,0.1,0.47500000000000003,COMPLETE
38,0.21776204609695826,0.22500000000000003,0.7500000000000001,0.5750000000000001,0.22500000000000003,0.35000000000000003,0.175,linear,0.25,0.25,COMPLETE
39,0.217021553913829,0.1,0.8,0.6250000000000001,0.15000000000000002,0.22500000000000003,0.125,linear,0.15000000000000002,0.5,COMPLETE
40,0.1719858879531431,0.47500000000000003,0.55,0.425,0.275,0.325,0.3,softmax,0.325,0.47500000000000003,COMPLETE
41,0.3365822363172738,0.1,0.775,0.25,0.3,0.125,0.07500000000000001,linear,0.275,0.425,COMPLETE
42,0.388470295775659,0.15000000000000002,0.675,0.5,0.35000000000000003,0.125,0.07500000000000001,linear,0.275,0.425,COMPLETE
43,0.2232827346631398,0.175,0.675,0.525,0.35000000000000003,0.07500000000000001,0.5,linear,0.325,0.5,COMPLETE
44,0.2145140271602791,0.275,0.7000000000000001,0.5,0.375,0.1,0.05,linear,0.25,0.45,COMPLETE
45,0.2674736743830487,0.25,0.65,0.6000000000000001,0.22500000000000003,0.175,0.1,linear,0.2,0.4,COMPLETE
46,0.2642566529286544,0.15000000000000002,0.7250000000000001,0.675,0.325,0.05,0.05,softmax,0.275,0.47500000000000003,COMPLETE
47,0.20331791562647056,0.2,0.525,0.47500000000000003,0.275,0.425,0.15000000000000002,linear,0.375,0.425,COMPLETE
48,-0.010278627375867993,0.3,0.2,0.525,0.4,0.125,0.125,linear,0.3,0.325,COMPLETE
49,0.22298876631244657,0.07500000000000001,0.8,0.7500000000000001,0.35000000000000003,0.175,0.07500000000000001,linear,0.25,0.15000000000000002,COMPLETE
50,0.04983041012996614,0.22500000000000003,0.9500000000000001,0.6250000000000001,0.2,0.07500000000000001,0.375,softmax,0.2,0.45,COMPLETE
51,0.3362972521325482,0.125,0.775,0.2,0.3,0.125,0.07500000000000001,linear,0.275,0.4,COMPLETE
52,0.39669961824312105,0.07500000000000001,0.8250000000000001,0.425,0.3,0.1,0.1,linear,0.3,0.425,COMPLETE
53,0.3437670956025381,0.05,0.8250000000000001,0.4,0.375,0.1,0.1,linear,0.35000000000000003,0.5,COMPLETE
54,0.14971349372563958,0.9,0.7250000000000001,0.05,0.325,0.07500000000000001,0.05,linear,0.22500000000000003,0.425,COMPLETE
55,0.1168095877618761,0.15000000000000002,0.6250000000000001,0.47500000000000003,0.5,0.05,0.125,linear,0.3,0.47500000000000003,COMPLETE
56,0.3368444604307487,0.07500000000000001,0.925,0.425,0.25,0.1,0.2,linear,0.47500000000000003,0.35000000000000003,COMPLETE
57,0.1653982112749465,0.375,0.8500000000000001,0.45,0.05,0.3,0.1,linear,0.325,0.45,COMPLETE
58,0.07858790161385333,0.7750000000000001,0.775,0.125,0.3,0.05,0.15000000000000002,linear,0.375,0.47500000000000003,COMPLETE
59,0.2969314499782648,0.175,0.65,0.525,0.22500000000000003,0.22500000000000003,0.05,linear,0.25,0.4,COMPLETE
60,0.11983082371157089,0.125,0.47500000000000003,0.6000000000000001,0.4,0.125,0.25,equal,0.4,0.375,COMPLETE
61,0.28549845841612587,0.05,0.8250000000000001,0.375,0.375,0.1,0.1,linear,0.35000000000000003,0.5,COMPLETE
62,0.3059664986986086,0.05,0.8250000000000001,0.4,0.35000000000000003,0.07500000000000001,0.1,linear,0.4,0.5,COMPLETE
63,0.3106612167398888,0.07500000000000001,0.9,0.4,0.4,0.1,0.125,linear,0.35000000000000003,0.45,COMPLETE
64,0.3966421821286295,0.125,0.7000000000000001,0.55,0.3,0.15000000000000002,0.07500000000000001,linear,0.3,0.5,COMPLETE
65,0.287710876936223,0.2,0.7000000000000001,0.55,0.3,0.15000000000000002,0.07500000000000001,linear,0.3,0.47500000000000003,COMPLETE
66,0.19444568850262034,0.125,0.6000000000000001,0.5750000000000001,0.275,0.175,0.05,linear,0.22500000000000003,0.425,COMPLETE
67,0.3979835730202804,0.15000000000000002,0.7250000000000001,0.5,0.325,0.125,0.07500000000000001,linear,0.275,0.5,COMPLETE
68,0.3619253941307534,0.1,0.7500000000000001,0.5,0.325,0.125,0.125,equal,0.275,0.5,COMPLETE
69,0.39704070770563055,0.175,0.65,0.47500000000000003,0.325,0.175,0.07500000000000001,linear,0.325,0.45,COMPLETE
70,0.3356847511536162,0.175,0.6000000000000001,0.45,0.325,0.15000000000000002,0.175,softmax,0.325,0.45,COMPLETE
71,0.39757760645914336,0.2,0.65,0.47500000000000003,0.3,0.175,0.07500000000000001,linear,0.3,0.47500000000000003,COMPLETE
72,0.25477472077419694,0.25,0.65,0.47500000000000003,0.25,0.2,0.05,linear,0.3,0.45,COMPLETE
73,0.25089978489015824,0.2,0.7000000000000001,0.5,0.325,0.2,0.1,linear,0.3,0.47500000000000003,COMPLETE
74,0.3239362822102876,0.15000000000000002,0.5750000000000001,0.35000000000000003,0.35000000000000003,0.22500000000000003,0.07500000000000001,linear,0.375,0.45,COMPLETE
75,0.3572142306842785,0.25,0.65,0.425,0.25,0.175,0.1,linear,0.425,0.425,COMPLETE
76,0.40684670599798783,0.15000000000000002,0.7500000000000001,0.47500000000000003,0.275,0.175,0.05,linear,0.325,0.47500000000000003,COMPLETE
77,0.09389537019667087,0.6250000000000001,0.675,0.325,0.3,0.15000000000000002,0.05,linear,0.325,0.4,COMPLETE
78,0.2180431926175539,0.22500000000000003,0.7500000000000001,0.47500000000000003,0.35000000000000003,0.175,0.07500000000000001,linear,0.35000000000000003,0.47500000000000003,COMPLETE
79,-0.13584838783425743,0.125,0.025,0.45,0.3,0.15000000000000002,0.05,linear,0.325,0.425,COMPLETE
80,0.2941401646924483,0.175,0.6250000000000001,0.525,0.325,0.25,0.125,linear,0.25,0.45,COMPLETE
81,0.40554181736078365,0.15000000000000002,0.7000000000000001,0.425,0.3,0.125,0.07500000000000001,linear,0.3,0.5,COMPLETE
82,0.308193325148063,0.07500000000000001,0.7250000000000001,0.425,0.275,0.125,0.07500000000000001,linear,0.3,0.5,COMPLETE
83,0.40557436270868397,0.2,0.7000000000000001,0.375,0.325,0.2,0.05,linear,0.3,0.47500000000000003,COMPLETE
84,0.40641157647086046,0.2,0.7000000000000001,0.35000000000000003,0.275,0.175,0.05,linear,0.325,0.47500000000000003,COMPLETE
85,0.24581768754959063,0.3,0.7500000000000001,0.35000000000000003,0.25,0.25,0.05,linear,0.325,0.47500000000000003,COMPLETE
86,0.23504959935217323,0.2,0.775,0.375,0.275,0.2,0.05,equal,0.35000000000000003,0.47500000000000003,COMPLETE
87,0.358218585651916,0.22500000000000003,0.55,0.275,0.22500000000000003,0.22500000000000003,0.05,linear,0.3,0.47500000000000003,COMPLETE
88,0.27263148541958215,0.3,0.7000000000000001,0.4,0.325,0.175,0.425,linear,0.325,0.5,COMPLETE
89,0.4091443547133642,0.2,0.65,0.3,0.275,0.2,0.1,softmax,0.275,0.3,COMPLETE
90,0.28392443745125134,0.25,0.65,0.325,0.275,0.2,0.07500000000000001,softmax,0.275,0.22500000000000003,COMPLETE
91,0.36196875626029545,0.2,0.6250000000000001,0.3,0.3,0.175,0.1,softmax,0.25,0.3,COMPLETE
92,0.32788877275928363,0.175,0.675,0.375,0.3,0.2,0.05,softmax,0.275,0.175,COMPLETE
93,-0.16281643228338766,0.15000000000000002,0.7250000000000001,0.35000000000000003,0.25,0.22500000000000003,0.07500000000000001,softmax,0.05,0.05,COMPLETE
94,0.24146524308029882,0.275,0.775,0.3,0.325,0.175,0.1,softmax,0.3,0.47500000000000003,COMPLETE
95,0.3484478959437819,0.1,0.6000000000000001,0.275,0.275,0.15000000000000002,0.07500000000000001,linear,0.325,0.45,COMPLETE
96,0.24546174022405215,0.175,0.8,0.45,0.275,0.2,0.1,linear,0.275,0.275,COMPLETE
97,0.21085759566453385,0.35000000000000003,0.7250000000000001,0.425,0.3,0.125,0.05,linear,0.3,0.45,COMPLETE
98,0.2519491509493728,0.22500000000000003,0.675,0.47500000000000003,0.325,0.15000000000000002,0.125,linear,0.35000000000000003,0.5,COMPLETE
99,0.1605267243726001,0.275,0.35000000000000003,0.375,0.22500000000000003,0.275,0.07500000000000001,linear,0.22500000000000003,0.325,COMPLETE
100,0.23699836200559304,0.125,0.55,0.4,0.25,0.175,0.35000000000000003,softmax,0.275,0.47500000000000003,COMPLETE
101,0.40476837571157254,0.125,0.7000000000000001,0.425,0.3,0.15000000000000002,0.07500000000000001,linear,0.3,0.5,COMPLETE
102,0.409918239142274,0.15000000000000002,0.7500000000000001,0.425,0.3,0.15000000000000002,0.07500000000000001,linear,0.25,0.5,COMPLETE
103,0.39924302805311057,0.175,0.7500000000000001,0.35000000000000003,0.275,0.15000000000000002,0.05,linear,0.25,0.5,COMPLETE
104,0.40991086958279666,0.15000000000000002,0.7000000000000001,0.375,0.275,0.15000000000000002,0.05,linear,0.25,0.5,COMPLETE
105,0.4100080006294311,0.15000000000000002,0.7500000000000001,0.35000000000000003,0.275,0.15000000000000002,0.05,linear,0.25,0.5,COMPLETE
106,0.3527214699405377,0.1,0.7500000000000001,0.35000000000000003,0.275,0.15000000000000002,0.05,linear,0.2,0.5,COMPLETE
107,0.3376067816256566,0.15000000000000002,0.8,0.3,0.25,0.15000000000000002,0.05,linear,0.25,0.5,COMPLETE
108,0.3414756137070531,0.125,0.7000000000000001,0.325,0.275,0.125,0.05,equal,0.22500000000000003,0.5,COMPLETE
109,0.24293521120929684,0.22500000000000003,0.775,0.375,0.25,0.15000000000000002,0.05,linear,0.25,0.5,COMPLETE
110,0.19161362176510593,0.1,0.7500000000000001,0.275,0.275,0.15000000000000002,0.3,linear,0.2,0.47500000000000003,COMPLETE
111,0.4094479755586576,0.15000000000000002,0.7000000000000001,0.4,0.3,0.125,0.07500000000000001,linear,0.25,0.5,COMPLETE
112,0.41033570739967,0.15000000000000002,0.7000000000000001,0.4,0.275,0.125,0.05,linear,0.25,0.5,COMPLETE
113,0.26651067228409814,0.425,0.7000000000000001,0.4,0.3,0.1,0.07500000000000001,linear,0.22500000000000003,0.47500000000000003,COMPLETE
114,0.34034818498331154,0.125,0.675,0.375,0.3,0.125,0.05,linear,0.25,0.5,COMPLETE
115,0.4058030187461711,0.2,0.7250000000000001,0.425,0.25,0.1,0.07500000000000001,linear,0.25,0.5,COMPLETE
116,0.39046576514851644,0.2,0.7250000000000001,0.4,0.22500000000000003,0.1,0.1,linear,0.22500000000000003,0.25,COMPLETE
117,0.247095290197286,0.175,0.8,0.45,0.2,0.1,0.05,linear,0.22500000000000003,0.47500000000000003,COMPLETE
118,0.33744117835999754,0.15000000000000002,0.8500000000000001,0.35000000000000003,0.25,0.125,0.1,linear,0.25,0.5,COMPLETE
119,0.3956458252340953,0.15000000000000002,0.7250000000000001,0.325,0.1,0.425,0.07500000000000001,linear,0.275,0.47500000000000003,COMPLETE
120,0.26258053936525216,0.47500000000000003,0.775,0.4,0.275,0.1,0.05,linear,0.25,0.5,COMPLETE
121,0.40117060545148575,0.2,0.7000000000000001,0.425,0.275,0.125,0.07500000000000001,linear,0.275,0.5,COMPLETE
122,0.3674623179903408,0.125,0.675,0.425,0.3,0.175,0.07500000000000001,linear,0.275,0.47500000000000003,COMPLETE
123,0.2734525570324643,0.07500000000000001,0.7500000000000001,0.25,0.275,0.125,0.05,linear,0.25,0.5,COMPLETE
124,0.3989358846817862,0.15000000000000002,0.7000000000000001,0.375,0.25,0.15000000000000002,0.07500000000000001,linear,0.22500000000000003,0.47500000000000003,COMPLETE
125,0.24459014415240363,0.22500000000000003,0.7500000000000001,0.425,0.3,0.175,0.1,linear,0.275,0.5,COMPLETE
126,0.332821659811932,0.15000000000000002,0.65,0.4,0.25,0.07500000000000001,0.05,linear,0.25,0.47500000000000003,COMPLETE
127,0.1363510073959241,0.175,0.6250000000000001,0.45,0.275,0.125,0.07500000000000001,softmax,0.275,0.125,COMPLETE
128,0.3878014880793594,0.1,0.7250000000000001,0.325,0.3,0.15000000000000002,0.05,linear,0.25,0.45,COMPLETE
129,0.3207523686299788,0.125,0.675,0.35000000000000003,0.275,0.1,0.07500000000000001,equal,0.3,0.5,COMPLETE
130,0.35418989655297134,0.175,0.7000000000000001,0.375,0.22500000000000003,0.175,0.1,linear,0.2,0.47500000000000003,COMPLETE
131,0.40117060545148575,0.2,0.7000000000000001,0.425,0.275,0.125,0.07500000000000001,linear,0.275,0.5,COMPLETE
132,0.24620297340342331,0.2,0.775,0.4,0.25,0.125,0.07500000000000001,linear,0.275,0.5,COMPLETE
133,0.4120170265377644,0.2,0.675,0.425,0.275,0.2,0.05,linear,0.3,0.5,COMPLETE
134,0.4102573543672354,0.125,0.675,0.45,0.3,0.2,0.05,linear,0.325,0.47500000000000003,COMPLETE
135,0.35672186137212286,0.25,0.65,0.45,0.275,0.22500000000000003,0.05,linear,0.325,0.45,COMPLETE
136,0.32309638225616066,0.22500000000000003,0.6250000000000001,0.4,0.325,0.2,0.05,linear,0.325,0.47500000000000003,COMPLETE
137,0.09063855402222562,0.7000000000000001,0.675,0.15000000000000002,0.25,0.2,0.05,linear,0.22500000000000003,0.47500000000000003,COMPLETE
138,0.40975175559901406,0.175,0.7250000000000001,0.45,0.3,0.25,0.05,linear,0.35000000000000003,0.47500000000000003,COMPLETE
139,0.41379557332871036,0.175,0.7250000000000001,0.47500000000000003,0.275,0.3,0.05,softmax,0.375,0.45,COMPLETE
140,0.4139949151640111,0.175,0.7500000000000001,0.47500000000000003,0.275,0.275,0.05,softmax,0.4,0.45,COMPLETE
141,0.4139258702795309,0.175,0.7500000000000001,0.47500000000000003,0.275,0.3,0.05,softmax,0.375,0.45,COMPLETE
142,0.4139258702795309,0.175,0.7500000000000001,0.47500000000000003,0.275,0.3,0.05,softmax,0.375,0.45,COMPLETE
143,0.4139258702795309,0.175,0.7500000000000001,0.47500000000000003,0.275,0.3,0.05,softmax,0.375,0.45,COMPLETE
144,0.4138088460694946,0.175,0.7500000000000001,0.5,0.3,0.3,0.05,softmax,0.375,0.425,COMPLETE
145,0.24850576315580863,0.175,0.8,0.525,0.3,0.3,0.05,softmax,0.375,0.425,COMPLETE
146,0.286593167070848,0.175,0.775,0.5,0.175,0.3,0.47500000000000003,softmax,0.4,0.45,COMPLETE
147,0.43147020443437595,0.175,0.7500000000000001,0.47500000000000003,0.3,0.325,0.05,softmax,0.375,0.45,COMPLETE
148,0.4083826157835951,0.15000000000000002,0.775,0.5,0.3,0.325,0.05,softmax,0.375,0.425,COMPLETE
149,0.43085982626541064,0.15000000000000002,0.7500000000000001,0.47500000000000003,0.3,0.35000000000000003,0.05,softmax,0.4,0.45,COMPLETE
150,0.3865264047677423,0.125,0.8250000000000001,0.47500000000000003,0.275,0.325,0.05,softmax,0.425,0.45,COMPLETE
151,0.43085982626541064,0.15000000000000002,0.7500000000000001,0.47500000000000003,0.3,0.35000000000000003,0.05,softmax,0.4,0.45,COMPLETE
152,0.16892336759517512,0.55,0.7500000000000001,0.425,0.3,0.35000000000000003,0.05,softmax,0.4,0.425,COMPLETE
153,0.43147020443437595,0.175,0.7500000000000001,0.47500000000000003,0.3,0.325,0.05,softmax,0.4,0.45,COMPLETE
154,0.09292600184386016,0.175,0.8,0.5,0.325,0.35000000000000003,0.05,softmax,0.4,0.45,COMPLETE
155,0.4085367347296006,0.15000000000000002,0.7500000000000001,0.47500000000000003,0.275,0.3,0.05,softmax,0.375,0.425,COMPLETE
156,0.4071934155098556,0.1,0.775,0.525,0.3,0.325,0.05,softmax,0.4,0.45,COMPLETE
157,0.1079077160880714,0.22500000000000003,0.8250000000000001,0.47500000000000003,0.275,0.375,0.05,softmax,0.425,0.45,COMPLETE
158,0.3137372841457239,0.125,0.7500000000000001,0.5,0.3,0.3,0.2,softmax,0.375,0.425,COMPLETE
159,0.2572332891511405,0.15000000000000002,0.775,0.525,0.325,0.275,0.05,softmax,0.375,0.4,COMPLETE
160,0.266215367401029,0.175,0.8,0.45,0.275,0.35000000000000003,0.05,softmax,0.425,0.45,COMPLETE
161,0.40766953289791885,0.175,0.7250000000000001,0.45,0.3,0.3,0.05,softmax,0.35000000000000003,0.45,COMPLETE
162,0.41331657809463773,0.15000000000000002,0.7250000000000001,0.47500000000000003,0.3,0.275,0.05,softmax,0.4,0.45,COMPLETE
163,0.43029792714253373,0.125,0.7250000000000001,0.47500000000000003,0.275,0.325,0.05,softmax,0.4,0.425,COMPLETE
164,0.40744616766586883,0.1,0.7250000000000001,0.47500000000000003,0.3,0.275,0.05,softmax,0.4,0.425,COMPLETE
165,0.40779618081736263,0.125,0.7500000000000001,0.5,0.275,0.325,0.07500000000000001,softmax,0.4,0.45,COMPLETE
166,0.23557964642660797,0.15000000000000002,0.8,0.47500000000000003,0.3,0.3,0.05,softmax,0.425,0.425,COMPLETE
167,0.38543553500469774,0.175,0.7250000000000001,0.45,0.325,0.325,0.07500000000000001,softmax,0.375,0.45,COMPLETE
168,0.28750998361620567,0.07500000000000001,0.775,0.5,0.3,0.275,0.25,softmax,0.4,0.425,COMPLETE
169,0.010025483654210516,0.8500000000000001,0.7500000000000001,0.125,0.25,0.35000000000000003,0.05,softmax,0.375,0.4,COMPLETE
170,0.09154069511763085,0.2,0.8500000000000001,0.47500000000000003,0.275,0.325,0.07500000000000001,softmax,0.425,0.45,COMPLETE
171,0.3998010955830752,0.15000000000000002,0.7250000000000001,0.55,0.275,0.3,0.05,softmax,0.4,0.45,COMPLETE
172,0.43027204570999533,0.125,0.7500000000000001,0.47500000000000003,0.275,0.375,0.05,softmax,0.375,0.45,COMPLETE
173,0.43027204570999533,0.125,0.7500000000000001,0.47500000000000003,0.275,0.375,0.05,softmax,0.375,0.45,COMPLETE
174,0.4303284473493896,0.125,0.775,0.47500000000000003,0.25,0.375,0.05,softmax,0.375,0.45,COMPLETE
175,0.4078448055589049,0.125,0.775,0.5,0.25,0.375,0.05,softmax,0.375,0.45,COMPLETE
176,0.4071866306540157,0.1,0.775,0.525,0.25,0.4,0.05,softmax,0.375,0.425,COMPLETE
177,0.43027204570999533,0.125,0.7500000000000001,0.47500000000000003,0.275,0.375,0.05,softmax,0.4,0.425,COMPLETE
178,0.4065371490938623,0.07500000000000001,0.7500000000000001,0.55,0.25,0.375,0.07500000000000001,softmax,0.4,0.4,COMPLETE
179,0.26993971734460287,0.125,0.8250000000000001,0.47500000000000003,0.275,0.4,0.05,softmax,0.375,0.425,COMPLETE
180,0.10760142856527696,0.2,0.8,0.47500000000000003,0.275,0.375,0.07500000000000001,softmax,0.4,0.45,COMPLETE
181,0.40650694185650865,0.125,0.7250000000000001,0.45,0.275,0.35000000000000003,0.05,softmax,0.35000000000000003,0.375,COMPLETE
182,0.43046756751476434,0.1,0.775,0.8500000000000001,0.275,0.4,0.05,softmax,0.375,0.45,COMPLETE
183,0.4073157754979423,0.1,0.775,0.5,0.25,0.35000000000000003,0.05,softmax,0.375,0.45,COMPLETE
184,0.40918558435278407,0.175,0.7500000000000001,0.47500000000000003,0.275,0.375,0.05,softmax,0.4,0.425,COMPLETE
185,0.27846840810813633,0.05,0.25,0.45,0.25,0.425,0.05,softmax,0.375,0.45,COMPLETE
186,0.3968802766408916,0.1,0.8,0.875,0.275,0.4,0.07500000000000001,softmax,0.4,0.4,COMPLETE
187,0.1506369191546955,0.125,0.1,0.47500000000000003,0.275,0.375,0.05,softmax,0.375,0.425,COMPLETE
188,0.31528273994852274,0.175,0.7250000000000001,0.6500000000000001,0.3,0.275,0.07500000000000001,softmax,0.425,0.45,COMPLETE
189,0.48777606227276393,0.15000000000000002,0.45000000000000007,0.5,0.275,0.4,0.05,softmax,0.4,0.425,COMPLETE
