number,value,params_fund_net_buying,params_institutional_weight,params_number_fund_holdings,params_pe,params_revenue_growth,params_roe,params_stock_weight_option,params_take_profit,params_trailing_stop_loss,state
2893,0.4587160048116586,0.25,0.45000000000000007,0.425,0.22500000000000003,0.5,0.05,equal,0.5,0.3,COMPLETE
2894,0.39486054790956016,0.22500000000000003,0.525,0.45,0.22500000000000003,0.45,0.07500000000000001,equal,0.47500000000000003,0.325,COMPLETE
2895,0.23147221353201425,0.2,0.47500000000000003,0.4,0.25,0.47500000000000003,0.07500000000000001,equal,0.35000000000000003,0.275,COMPLETE
2896,0.3557119441207935,0.275,0.5,0.425,0.25,0.5,0.05,equal,0.5,0.3,COMPLETE
2897,0.28414137821588525,0.2,0.42500000000000004,0.4,0.3,0.45,0.05,softmax,0.47500000000000003,0.25,COMPLETE
2898,0.11496423783867551,0.22500000000000003,0.15,0.45,0.175,0.47500000000000003,0.22500000000000003,equal,0.45,0.275,COMPLETE
2899,0.48816348914485647,0.2,0.42500000000000004,0.47500000000000003,0.22500000000000003,0.45,0.07500000000000001,equal,0.425,0.275,COMPLETE
2900,0.6212481556255072,0.25,0.45000000000000007,0.425,0.22500000000000003,0.47500000000000003,0.05,equal,0.3,0.3,COMPLETE
2901,0.27426544638620304,0.22500000000000003,0.4,0.45,0.25,0.5,0.07500000000000001,equal,0.47500000000000003,0.3,COMPLETE
2902,0.5710725038564806,0.175,0.47500000000000003,0.47500000000000003,0.2,0.45,0.05,softmax,0.5,0.275,COMPLETE
2903,0.6246360197681785,0.22500000000000003,0.45000000000000007,0.425,0.22500000000000003,0.47500000000000003,0.05,equal,0.47500000000000003,0.35000000000000003,COMPLETE
2904,0.3754922710769859,0.2,0.275,0.4,0.25,0.47500000000000003,0.07500000000000001,equal,0.45,0.325,COMPLETE
2905,0.19904598366194975,0.15000000000000002,0.8250000000000001,0.375,0.275,0.45,0.05,equal,0.5,0.3,COMPLETE
2906,0.35104025888846946,0.2,0.5,0.47500000000000003,0.25,0.5,0.07500000000000001,equal,0.47500000000000003,0.25,COMPLETE
2907,0.08488653821705361,0.22500000000000003,0.37500000000000006,0.45,0.275,0.275,0.05,softmax,0.5,0.3,COMPLETE
2908,0.5146797748870207,0.25,0.42500000000000004,0.45,0.22500000000000003,0.47500000000000003,0.05,equal,0.45,0.275,COMPLETE
2909,0.4407645160375513,0.175,0.47500000000000003,0.5,0.22500000000000003,0.45,0.07500000000000001,equal,0.4,0.25,COMPLETE
2910,0.4404955848818283,0.275,0.45000000000000007,0.425,0.22500000000000003,0.47500000000000003,0.05,equal,0.5,0.325,COMPLETE
2911,0.33078752244668075,0.25,0.47500000000000003,0.45,0.25,0.47500000000000003,0.07500000000000001,equal,0.47500000000000003,0.3,COMPLETE
2912,0.5015797626641589,0.2,0.42500000000000004,0.4,0.2,0.45,0.05,equal,0.5,0.25,COMPLETE
2913,0.6274351171763257,0.22500000000000003,0.47500000000000003,0.425,0.22500000000000003,0.47500000000000003,0.05,softmax,0.47500000000000003,0.275,COMPLETE
2914,0.2573625386192127,0.175,0.5,0.47500000000000003,0.25,0.5,0.07500000000000001,equal,0.45,0.275,COMPLETE
2915,0.3746188245948272,0.22500000000000003,0.45000000000000007,0.425,0.275,0.45,0.05,equal,0.125,0.325,COMPLETE
2916,0.2788212474387094,0.25,0.4,0.45,0.25,0.5,0.05,equal,0.5,0.275,COMPLETE
2917,0.35075736649025063,0.2,0.45000000000000007,0.4,0.25,0.47500000000000003,0.07500000000000001,equal,0.47500000000000003,0.35000000000000003,COMPLETE
2918,0.5083954082117736,0.22500000000000003,0.5,0.45,0.275,0.45,0.05,softmax,0.47500000000000003,0.3,COMPLETE
2919,0.535398913989829,0.2,0.42500000000000004,0.4,0.22500000000000003,0.47500000000000003,0.05,equal,0.5,0.3,COMPLETE
2920,0.4976574576963162,0.175,0.45000000000000007,0.47500000000000003,0.275,0.425,0.07500000000000001,equal,0.47500000000000003,0.25,COMPLETE
2921,0.1294688872453294,0.275,0.42500000000000004,0.425,0.1,0.45,0.35000000000000003,equal,0.5,0.275,COMPLETE
2922,-0.046378563541115525,0.2,0.47500000000000003,0.4,0.425,0.5,0.05,equal,0.45,0.325,COMPLETE
2923,0.42240892089550736,0.25,0.45000000000000007,0.425,0.25,0.47500000000000003,0.07500000000000001,softmax,0.425,0.3,COMPLETE
2924,0.4307794964797291,0.22500000000000003,0.35000000000000003,0.425,0.275,0.45,0.05,equal,0.47500000000000003,0.375,COMPLETE
2925,0.4980314397489912,0.15000000000000002,0.4,0.5,0.275,0.4,0.05,equal,0.5,0.275,COMPLETE
2926,0.37449740444299506,0.22500000000000003,0.47500000000000003,0.45,0.25,0.47500000000000003,0.07500000000000001,equal,0.47500000000000003,0.25,COMPLETE
2927,0.5005309948142406,0.175,0.5,0.47500000000000003,0.22500000000000003,0.47500000000000003,0.05,equal,0.45,0.325,COMPLETE
2928,0.10559644531475987,0.2,0.525,0.45,0.07500000000000001,0.45,0.4,softmax,0.35000000000000003,0.3,COMPLETE
2929,0.4249828061147667,0.25,0.42500000000000004,0.425,0.25,0.5,0.07500000000000001,equal,0.47500000000000003,0.275,COMPLETE
2930,0.06411689675171335,0.22500000000000003,0.925,0.425,0.025,0.47500000000000003,0.5,equal,0.5,0.3,COMPLETE
2931,0.45376724794781775,0.2,0.37500000000000006,0.4,0.2,0.425,0.05,equal,0.47500000000000003,0.275,COMPLETE
2932,0.5227232040503558,0.2,0.47500000000000003,0.45,0.22500000000000003,0.45,0.07500000000000001,equal,0.375,0.25,COMPLETE
2933,0.6107987739752978,0.22500000000000003,0.45000000000000007,0.425,0.22500000000000003,0.47500000000000003,0.05,softmax,0.45,0.325,COMPLETE
2934,0.19665776641953303,0.3,0.45000000000000007,0.425,0.25,0.45,0.1,equal,0.47500000000000003,0.275,COMPLETE
2935,0.5374914516030354,0.2,0.4,0.45,0.175,0.47500000000000003,0.05,equal,0.5,0.3,COMPLETE
2936,0.35571194412079304,0.25,0.47500000000000003,0.45,0.25,0.5,0.07500000000000001,equal,0.5,0.35000000000000003,COMPLETE
2937,0.2709339034019889,0.22500000000000003,0.42500000000000004,0.45,0.47500000000000003,0.375,0.07500000000000001,equal,0.45,0.3,COMPLETE
2938,0.3831229352275408,0.175,0.525,0.525,0.2,0.45,0.05,softmax,0.47500000000000003,0.275,COMPLETE
2939,0.4558336854575674,0.15000000000000002,0.42500000000000004,0.5,0.22500000000000003,0.47500000000000003,0.05,equal,0.325,0.25,COMPLETE
2940,0.5210527709871448,0.2,0.47500000000000003,0.4,0.2,0.425,0.05,equal,0.5,0.325,COMPLETE
2941,0.2223629806736252,0.275,0.5,0.425,0.25,0.47500000000000003,0.07500000000000001,equal,0.47500000000000003,0.275,COMPLETE
2942,0.277555368223483,0.22500000000000003,0.55,0.45,0.25,0.5,0.05,equal,0.425,0.25,COMPLETE
2943,0.44980296799969127,0.25,0.45000000000000007,0.425,0.15000000000000002,0.45,0.05,equal,0.275,0.3,COMPLETE
2944,0.3401357807628005,0.2,0.42500000000000004,0.4,0.25,0.47500000000000003,0.07500000000000001,softmax,0.5,0.3,COMPLETE
2945,0.5779780130622139,0.175,0.45000000000000007,0.47500000000000003,0.2,0.45,0.05,equal,0.45,0.325,COMPLETE
2946,0.2660067602976019,0.25,0.5,0.425,0.25,0.5,0.07500000000000001,equal,0.47500000000000003,0.3,COMPLETE
2947,0.6246360197681791,0.22500000000000003,0.47500000000000003,0.45,0.22500000000000003,0.47500000000000003,0.05,equal,0.5,0.275,COMPLETE
2948,0.40008373376695316,0.2,0.45000000000000007,0.4,0.25,0.45,0.1,equal,0.45,0.25,COMPLETE
2949,0.24368972120673502,0.375,0.4,0.425,0.22500000000000003,0.47500000000000003,0.05,softmax,0.47500000000000003,0.275,COMPLETE
2950,0.4915555511136357,0.22500000000000003,0.47500000000000003,0.45,0.275,0.425,0.05,equal,0.47500000000000003,0.3,COMPLETE
2951,-0.061717311264029275,0.2,0.07500000000000001,0.47500000000000003,0.25,0.5,0.07500000000000001,equal,0.5,0.25,COMPLETE
2952,0.4684947100202374,0.25,0.42500000000000004,0.425,0.275,0.45,0.05,equal,0.47500000000000003,0.275,COMPLETE
2953,-0.0008781165410668423,0.275,0.45000000000000007,0.425,0.22500000000000003,0.47500000000000003,0.275,equal,0.275,0.35000000000000003,COMPLETE
2954,0.4697529132522474,0.22500000000000003,0.4,0.425,0.25,0.45,0.1,softmax,0.3,0.325,COMPLETE
2955,0.5213506906568275,0.175,0.45000000000000007,0.375,0.25,0.47500000000000003,0.07500000000000001,equal,0.5,0.275,COMPLETE
2956,0.09454982559867069,0.175,0.5,0.47500000000000003,0.22500000000000003,0.5,0.05,equal,0.47500000000000003,0.125,COMPLETE
2957,0.41536583825168805,0.2,0.6000000000000001,0.4,0.2,0.425,0.07500000000000001,equal,0.5,0.325,COMPLETE
2958,0.4752147092797843,0.22500000000000003,0.47500000000000003,0.45,0.275,0.45,0.05,equal,0.47500000000000003,0.3,COMPLETE
2959,0.4391120699866793,0.25,0.42500000000000004,0.425,0.22500000000000003,0.47500000000000003,0.07500000000000001,softmax,0.5,0.3,COMPLETE
2960,0.42847812363104765,0.22500000000000003,0.37500000000000006,0.45,0.22500000000000003,0.47500000000000003,0.05,equal,0.45,0.25,COMPLETE
2961,0.4183964705441465,0.2,0.47500000000000003,0.4,0.275,0.45,0.05,equal,0.47500000000000003,0.3,COMPLETE
2962,0.582661956449643,0.175,0.42500000000000004,0.47500000000000003,0.25,0.47500000000000003,0.07500000000000001,equal,0.5,0.275,COMPLETE
2963,0.27901978008870854,0.22500000000000003,0.525,0.45,0.25,0.5,0.05,equal,0.47500000000000003,0.3,COMPLETE
2964,0.5107128096838688,0.25,0.45000000000000007,0.425,0.22500000000000003,0.45,0.07500000000000001,softmax,0.45,0.25,COMPLETE
2965,0.3876733242368896,0.2,0.5,0.4,0.22500000000000003,0.47500000000000003,0.05,equal,0.4,0.275,COMPLETE
2966,0.4386031804433617,0.15000000000000002,0.45000000000000007,0.375,0.22500000000000003,0.47500000000000003,0.05,equal,0.47500000000000003,0.325,COMPLETE
2967,0.27426544638620304,0.22500000000000003,0.4,0.45,0.25,0.5,0.07500000000000001,equal,0.5,0.375,COMPLETE
2968,0.4098239675587824,0.175,0.47500000000000003,0.47500000000000003,0.275,0.425,0.07500000000000001,equal,0.47500000000000003,0.3,COMPLETE
2969,0.5269374880286899,0.25,0.42500000000000004,0.45,0.25,0.45,0.1,equal,0.375,0.275,COMPLETE
2970,0.18650265797535132,0.47500000000000003,0.7000000000000001,0.425,0.325,0.45,0.05,softmax,0.25,0.25,COMPLETE
2971,0.35872147575948876,0.275,0.47500000000000003,0.425,0.2,0.45,0.05,equal,0.47500000000000003,0.35000000000000003,COMPLETE
2972,0.526657450785744,0.2,0.45000000000000007,0.4,0.175,0.47500000000000003,0.07500000000000001,equal,0.5,0.275,COMPLETE
2973,0.4291695954733854,0.22500000000000003,0.5,0.45,0.25,0.5,0.05,equal,0.325,0.325,COMPLETE
2974,0.03678210803502688,0.7750000000000001,0.4,0.2,0.22500000000000003,0.47500000000000003,0.05,equal,0.45,0.275,COMPLETE
2975,0.4606200816635735,0.15000000000000002,0.42500000000000004,0.525,0.22500000000000003,0.45,0.07500000000000001,softmax,0.45,0.3,COMPLETE
2976,0.6246360197681785,0.22500000000000003,0.45000000000000007,0.425,0.22500000000000003,0.47500000000000003,0.05,equal,0.47500000000000003,0.3,COMPLETE
2977,0.5307954049525634,0.2,0.47500000000000003,0.4,0.22500000000000003,0.47500000000000003,0.05,equal,0.5,0.275,COMPLETE
2978,0.08428366195002035,0.9,0.42500000000000004,0.075,0.2,0.425,0.07500000000000001,equal,0.425,0.25,COMPLETE
2979,0.013794116887581143,0.2,0.5,0.47500000000000003,0.125,0.45,0.325,equal,0.5,0.3,COMPLETE
2980,0.5171881600127732,0.2,0.47500000000000003,0.4,0.22500000000000003,0.47500000000000003,0.05,softmax,0.47500000000000003,0.325,COMPLETE
2981,0.4340896000448781,0.25,0.45000000000000007,0.425,0.25,0.5,0.07500000000000001,equal,0.5,0.35000000000000003,COMPLETE
2982,0.3583107337016985,0.175,0.525,0.375,0.3,0.45,0.05,equal,0.47500000000000003,0.275,COMPLETE
2983,0.4249828061147667,0.22500000000000003,0.42500000000000004,0.45,0.25,0.47500000000000003,0.07500000000000001,equal,0.5,0.25,COMPLETE
2984,0.43408960004487834,0.22500000000000003,0.45000000000000007,0.425,0.25,0.5,0.05,equal,0.45,0.3,COMPLETE
2985,0.39742685608291983,0.25,0.47500000000000003,0.45,0.25,0.45,0.1,softmax,0.47500000000000003,0.3,COMPLETE
2986,0.4455021305064042,0.175,0.37500000000000006,0.47500000000000003,0.175,0.47500000000000003,0.05,equal,0.47500000000000003,0.325,COMPLETE
2987,0.25214045975357446,0.2,0.5,0.4,0.25,0.47500000000000003,0.07500000000000001,equal,0.5,0.275,COMPLETE
2988,0.6050058522998981,0.22500000000000003,0.45000000000000007,0.425,0.275,0.45,0.05,equal,0.4,0.25,COMPLETE
2989,0.27273938514553075,0.25,0.4,0.425,0.25,0.5,0.07500000000000001,equal,0.47500000000000003,0.275,COMPLETE
2990,0.3879019761996597,0.275,0.42500000000000004,0.425,0.2,0.45,0.05,softmax,0.5,0.3,COMPLETE
2991,0.4129155432430159,0.2,0.45000000000000007,0.4,0.2,0.35000000000000003,0.05,equal,0.425,0.25,COMPLETE
2992,0.4098239675587824,0.22500000000000003,0.47500000000000003,0.45,0.275,0.425,0.07500000000000001,equal,0.35000000000000003,0.275,COMPLETE
2993,0.5192082368887772,0.2,0.42500000000000004,0.47500000000000003,0.22500000000000003,0.5,0.1,equal,0.47500000000000003,0.325,COMPLETE
2994,0.4858776278351101,0.25,0.47500000000000003,0.45,0.22500000000000003,0.47500000000000003,0.05,equal,0.45,0.3,COMPLETE
2995,0.5118723179709881,0.22500000000000003,0.45000000000000007,0.425,0.22500000000000003,0.45,0.07500000000000001,equal,0.5,0.275,COMPLETE
2996,0.37500900476133614,0.2,0.4,0.4,0.275,0.425,0.05,softmax,0.47500000000000003,0.25,COMPLETE
2997,0.239253333200273,0.175,0.5,0.5,0.25,0.47500000000000003,0.175,equal,0.45,0.3,COMPLETE
2998,0.6246360197681787,0.22500000000000003,0.45000000000000007,0.45,0.22500000000000003,0.47500000000000003,0.05,equal,0.5,0.3,COMPLETE
2999,0.37912552126788845,0.15000000000000002,0.525,0.375,0.22500000000000003,0.45,0.07500000000000001,equal,0.47500000000000003,0.275,COMPLETE
3000,0.5838063644732047,0.175,0.47500000000000003,0.47500000000000003,0.175,0.47500000000000003,0.05,equal,0.5,0.325,COMPLETE
3001,0.22763966985813705,0.25,0.42500000000000004,0.45,0.2,0.4,0.1,softmax,0.45,0.275,COMPLETE
3002,0.3583276328365267,0.2,0.45000000000000007,0.4,0.25,0.5,0.05,equal,0.47500000000000003,0.35000000000000003,COMPLETE
3003,0.48222381390891916,0.275,0.47500000000000003,0.425,0.22500000000000003,0.45,0.07500000000000001,equal,0.425,0.3,COMPLETE
3004,0.39007177290156936,0.22500000000000003,0.5,0.45,0.22500000000000003,0.47500000000000003,0.05,equal,0.35000000000000003,0.275,COMPLETE
3005,0.233800873543348,0.175,0.37500000000000006,0.7750000000000001,0.22500000000000003,0.47500000000000003,0.05,equal,0.5,0.325,COMPLETE
3006,0.028968580749004342,0.22500000000000003,0.4,0.425,0.275,0.1,0.07500000000000001,softmax,0.47500000000000003,0.3,COMPLETE
3007,0.4087472652183176,0.2,0.42500000000000004,0.4,0.275,0.425,0.05,equal,0.5,0.25,COMPLETE
3008,0.41094174919083504,0.25,0.35000000000000003,0.45,0.22500000000000003,0.45,0.07500000000000001,equal,0.47500000000000003,0.275,COMPLETE
3009,0.08785223419942016,0.2,0.55,0.47500000000000003,0.375,0.5,0.05,equal,0.5,0.3,COMPLETE
3010,0.4418543947707766,0.22500000000000003,0.45000000000000007,0.425,0.25,0.47500000000000003,0.07500000000000001,equal,0.47500000000000003,0.25,COMPLETE
3011,0.4056327508319145,0.2,0.5,0.45,0.275,0.45,0.05,softmax,0.45,0.25,COMPLETE
3012,0.28870572311709075,0.3,0.42500000000000004,0.425,0.25,0.47500000000000003,0.07500000000000001,equal,0.47500000000000003,0.325,COMPLETE
3013,0.4575013620128511,0.25,0.47500000000000003,0.425,0.25,0.5,0.05,equal,0.5,0.275,COMPLETE
3014,-0.07861481124278538,0.525,0.42500000000000004,0.425,0.2,0.45,0.05,equal,0.47500000000000003,0.3,COMPLETE
3015,0.32247017265598976,0.175,0.45000000000000007,0.375,0.22500000000000003,0.45,0.07500000000000001,equal,0.5,0.325,COMPLETE
3016,0.6105898788598851,0.22500000000000003,0.47500000000000003,0.45,0.22500000000000003,0.47500000000000003,0.05,softmax,0.45,0.3,COMPLETE
3017,0.4395770478341705,0.15000000000000002,0.4,0.525,0.25,0.47500000000000003,0.1,equal,0.47500000000000003,0.275,COMPLETE
3018,0.3583276328365267,0.2,0.45000000000000007,0.4,0.25,0.5,0.05,equal,0.45,0.35000000000000003,COMPLETE
3019,0.3265553030110653,0.175,0.47500000000000003,0.5,0.25,0.47500000000000003,0.07500000000000001,equal,0.5,0.275,COMPLETE
3020,0.4725850699290127,0.22500000000000003,0.42500000000000004,0.425,0.2,0.425,0.05,equal,0.47500000000000003,0.25,COMPLETE
3021,0.0025874323521269016,0.6000000000000001,0.525,0.175,0.275,0.45,0.05,softmax,0.5,0.3,COMPLETE
3022,0.318898712016654,0.25,0.5,0.45,0.25,0.47500000000000003,0.1,equal,0.47500000000000003,0.325,COMPLETE
3023,0.47862661936149176,0.22500000000000003,0.45000000000000007,0.45,0.22500000000000003,0.45,0.07500000000000001,equal,0.2,0.3,COMPLETE
3024,0.26567204076807277,0.2,0.47500000000000003,0.47500000000000003,0.2,0.325,0.05,equal,0.3,0.275,COMPLETE
3025,0.4449300491998559,0.275,0.45000000000000007,0.425,0.25,0.47500000000000003,0.07500000000000001,equal,0.325,0.275,COMPLETE
3026,0.33599522686904126,0.2,0.5,0.4,0.15000000000000002,0.22500000000000003,0.05,equal,0.45,0.25,COMPLETE
3027,0.4225152505548522,0.22500000000000003,0.42500000000000004,0.425,0.25,0.5,0.05,softmax,0.5,0.325,COMPLETE
3028,0.46579126960807665,0.25,0.4,0.45,0.275,0.425,0.05,equal,0.47500000000000003,0.275,COMPLETE
3029,0.3645228242185722,0.2,0.47500000000000003,0.47500000000000003,0.25,0.47500000000000003,0.07500000000000001,equal,0.5,0.3,COMPLETE
3030,-0.11376587538635445,0.175,0.45000000000000007,0.47500000000000003,0.15000000000000002,0.45,0.375,equal,0.47500000000000003,0.3,COMPLETE
3031,0.26988904778163125,0.22500000000000003,0.47500000000000003,0.425,0.25,0.47500000000000003,0.07500000000000001,equal,0.47500000000000003,0.275,COMPLETE
3032,0.583983600447179,0.22500000000000003,0.45000000000000007,0.45,0.2,0.45,0.05,softmax,0.45,0.4,COMPLETE
3033,0.02658338374360634,0.175,0.42500000000000004,0.375,0.25,0.5,0.2,equal,0.5,0.25,COMPLETE
3034,0.49527211295751816,0.25,0.4,0.425,0.22500000000000003,0.45,0.07500000000000001,equal,0.5,0.325,COMPLETE
3035,0.25214045975357446,0.2,0.5,0.4,0.25,0.47500000000000003,0.07500000000000001,equal,0.47500000000000003,0.25,COMPLETE
3036,0.41206886419532257,0.22500000000000003,0.42500000000000004,0.45,0.3,0.45,0.05,equal,0.45,0.35000000000000003,COMPLETE
3037,0.44293565715481253,0.275,0.45000000000000007,0.425,0.25,0.5,0.05,softmax,0.47500000000000003,0.3,COMPLETE
3038,0.37912552126788845,0.2,0.47500000000000003,0.4,0.25,0.45,0.1,equal,0.425,0.275,COMPLETE
3039,0.6054729525697827,0.25,0.45000000000000007,0.425,0.22500000000000003,0.47500000000000003,0.05,equal,0.5,0.275,COMPLETE
3040,0.25363833099998745,0.2,0.5,0.4,0.25,0.47500000000000003,0.07500000000000001,equal,0.275,0.3,COMPLETE
3041,0.37987853770133495,0.25,0.47500000000000003,0.45,0.175,0.425,0.05,equal,0.375,0.3,COMPLETE
3042,0.372544481107579,0.175,0.37500000000000006,0.5,0.22500000000000003,0.47500000000000003,0.05,softmax,0.47500000000000003,0.375,COMPLETE
3043,0.4266474307176701,0.22500000000000003,0.42500000000000004,0.45,0.25,0.5,0.07500000000000001,equal,0.5,0.325,COMPLETE
3044,0.17026428128370413,0.15000000000000002,0.45000000000000007,0.35000000000000003,0.275,0.175,0.05,equal,0.45,0.25,COMPLETE
3045,0.268990978396073,0.22500000000000003,0.525,0.45,0.22500000000000003,0.45,0.07500000000000001,equal,0.15000000000000002,0.275,COMPLETE
3046,0.03834754031618391,0.2,0.47500000000000003,0.47500000000000003,0.2,0.15000000000000002,0.05,equal,0.47500000000000003,0.3,COMPLETE
3047,0.5673410057443677,0.22500000000000003,0.4,0.425,0.22500000000000003,0.45,0.07500000000000001,softmax,0.47500000000000003,0.3,COMPLETE
3048,0.535398913989829,0.2,0.42500000000000004,0.4,0.22500000000000003,0.47500000000000003,0.05,equal,0.5,0.275,COMPLETE
3049,0.2540713970744251,0.25,0.5,0.425,0.25,0.5,0.1,equal,0.5,0.25,COMPLETE
3050,0.6246360197681787,0.22500000000000003,0.45000000000000007,0.45,0.22500000000000003,0.47500000000000003,0.05,equal,0.47500000000000003,0.325,COMPLETE
3051,0.5279610128682569,0.175,0.47500000000000003,0.47500000000000003,0.275,0.45,0.05,equal,0.4,0.25,COMPLETE
3052,0.2565173303034566,0.2,0.42500000000000004,0.4,0.25,0.2,0.47500000000000003,equal,0.45,0.5,COMPLETE
3053,0.010688121535242274,0.275,0.4,0.425,0.1,0.425,0.425,softmax,0.47500000000000003,0.275,COMPLETE
3054,0.4553201495805913,0.22500000000000003,0.45000000000000007,0.45,0.25,0.47500000000000003,0.07500000000000001,equal,0.3,0.35000000000000003,COMPLETE
3055,0.43284764900636385,0.22500000000000003,0.45000000000000007,0.425,0.25,0.5,0.05,equal,0.5,0.275,COMPLETE
3056,0.4180276401743642,0.25,0.5,0.425,0.22500000000000003,0.45,0.07500000000000001,equal,0.22500000000000003,0.3,COMPLETE
3057,0.5342181630118251,0.2,0.42500000000000004,0.47500000000000003,0.22500000000000003,0.47500000000000003,0.05,equal,0.47500000000000003,0.325,COMPLETE
3058,0.49614857666387097,0.15000000000000002,0.47500000000000003,0.5,0.25,0.47500000000000003,0.07500000000000001,softmax,0.45,0.3,COMPLETE
3059,0.40563555897444425,0.175,0.525,0.47500000000000003,0.2,0.45,0.05,equal,0.5,0.275,COMPLETE
3060,-0.1698654819081021,0.25,0.975,0.425,0.25,0.5,0.05,equal,0.47500000000000003,0.1,COMPLETE
3061,0.195299333608324,0.175,0.47500000000000003,0.7750000000000001,0.175,0.425,0.1,equal,0.5,0.3,COMPLETE
3062,0.4998701476562028,0.2,0.42500000000000004,0.4,0.22500000000000003,0.45,0.07500000000000001,equal,0.47500000000000003,0.25,COMPLETE
3063,0.17619429890751995,0.22500000000000003,0.45000000000000007,0.45,0.275,0.3,0.05,softmax,0.45,0.275,COMPLETE
3064,0.4798411853019846,0.2,0.37500000000000006,0.4,0.22500000000000003,0.47500000000000003,0.05,equal,0.47500000000000003,0.325,COMPLETE
3065,0.33801739030845634,0.22500000000000003,0.4,0.45,0.25,0.47500000000000003,0.07500000000000001,equal,0.425,0.3,COMPLETE
3066,0.524121274342745,0.25,0.45000000000000007,0.425,0.22500000000000003,0.45,0.07500000000000001,equal,0.5,0.275,COMPLETE
3067,0.27137986510567524,0.175,0.5,0.375,0.25,0.5,0.05,equal,0.5,0.3,COMPLETE
3068,0.2949525934578575,0.3,0.45000000000000007,0.425,0.22500000000000003,0.47500000000000003,0.05,softmax,0.47500000000000003,0.3,COMPLETE
3069,0.5307954049525634,0.2,0.47500000000000003,0.4,0.22500000000000003,0.47500000000000003,0.05,equal,0.45,0.25,COMPLETE
3070,0.25746129907547755,0.35000000000000003,0.525,0.425,0.275,0.325,0.05,equal,0.5,0.325,COMPLETE
3071,0.5179713213000263,0.2,0.42500000000000004,0.47500000000000003,0.22500000000000003,0.45,0.07500000000000001,equal,0.375,0.25,COMPLETE
3072,0.3768374383395165,0.275,0.47500000000000003,0.425,0.2,0.425,0.07500000000000001,equal,0.47500000000000003,0.275,COMPLETE
3073,0.45273548880431297,0.22500000000000003,0.4,0.45,0.175,0.47500000000000003,0.05,softmax,0.47500000000000003,0.3,COMPLETE
