number,value,params_fund_net_buying,params_institutional_weight,params_number_fund_holdings,params_pe,params_revenue_growth,params_roe,params_stock_weight_option,params_take_profit,params_trailing_stop_loss,state
4205,0.5806462900219223,0.22500000000000003,0.42500000000000004,0.425,0.15000000000000002,0.5,0.05,equal,0.375,0.4,COMPLETE
4206,0.5451479049624223,0.175,0.47500000000000003,0.47500000000000003,0.175,0.5,0.05,equal,0.22500000000000003,0.425,COMPLETE
4207,-0.23081154596066972,0.25,0.4,0.45,0.07500000000000001,0.5,0.4,equal,0.375,0.4,COMPLETE
4208,0.009571572676196051,0.6000000000000001,0.525,0.22500000000000003,0.175,0.5,0.05,equal,0.25,0.4,COMPLETE
4209,0.2924814531201047,0.125,0.45000000000000007,0.35000000000000003,0.175,0.5,0.07500000000000001,equal,0.25,0.4,COMPLETE
4210,0.5997514435684574,0.2,0.47500000000000003,0.45,0.15000000000000002,0.5,0.05,equal,0.4,0.4,COMPLETE
4211,0.39224633638856427,0.22500000000000003,0.5,0.425,0.175,0.5,0.05,equal,0.375,0.4,COMPLETE
4212,0.5229612437525977,0.2,0.42500000000000004,0.4,0.175,0.5,0.05,equal,0.4,0.4,COMPLETE
4213,0.33076847857766956,0.22500000000000003,0.45000000000000007,0.45,0.175,0.5,0.175,linear,0.375,0.425,COMPLETE
4214,0.4956470428065395,0.175,0.37500000000000006,0.47500000000000003,0.175,0.5,0.07500000000000001,equal,0.375,0.425,COMPLETE
4215,0.31053994462387113,0.2,0.47500000000000003,0.4,0.175,0.5,0.15000000000000002,equal,0.22500000000000003,0.4,COMPLETE
4216,0.13519769884427146,0.275,0.5,0.425,0.15000000000000002,0.22500000000000003,0.05,equal,0.22500000000000003,0.4,COMPLETE
4217,0.3327031283567532,0.22500000000000003,0.45000000000000007,0.425,0.175,0.5,0.05,equal,0.2,0.4,COMPLETE
4218,0.45938075669621287,0.25,0.4,0.45,0.175,0.5,0.07500000000000001,equal,0.4,0.4,COMPLETE
4219,0.3179977668946127,0.15000000000000002,0.30000000000000004,0.375,0.15000000000000002,0.5,0.05,equal,0.375,0.4,COMPLETE
4220,0.5229612437525977,0.2,0.42500000000000004,0.4,0.175,0.5,0.05,equal,0.375,0.425,COMPLETE
4221,0.46326331304828533,0.2,0.47500000000000003,0.45,0.175,0.5,0.05,equal,0.375,0.4,COMPLETE
4222,0.49262476284657575,0.175,0.45000000000000007,0.47500000000000003,0.175,0.5,0.07500000000000001,equal,0.4,0.4,COMPLETE
4223,0.5806462900219223,0.22500000000000003,0.42500000000000004,0.425,0.15000000000000002,0.5,0.05,equal,0.375,0.4,COMPLETE
4224,0.5590158464883748,0.175,0.47500000000000003,0.4,0.175,0.5,0.05,equal,0.4,0.425,COMPLETE
4225,0.6271896955157107,0.22500000000000003,0.45000000000000007,0.45,0.15000000000000002,0.5,0.05,equal,0.375,0.4,COMPLETE
4226,0.41126371380141924,0.25,0.5,0.425,0.175,0.5,0.05,equal,0.375,0.4,COMPLETE
4227,0.0738503298454249,0.2,0.125,0.45,0.175,0.5,0.07500000000000001,equal,0.4,0.325,COMPLETE
4228,0.48533309728918983,0.15000000000000002,0.42500000000000004,0.375,0.175,0.5,0.07500000000000001,equal,0.25,0.325,COMPLETE
4229,0.4272756677116118,0.25,0.47500000000000003,0.425,0.15000000000000002,0.5,0.05,equal,0.375,0.425,COMPLETE
4230,0.24805061983365495,0.22500000000000003,0.525,0.425,0.175,0.5,0.05,equal,0.4,0.4,COMPLETE
4231,0.39232192055125487,0.2,0.4,0.4,0.175,0.5,0.07500000000000001,linear,0.375,0.4,COMPLETE
4232,0.4632633130482854,0.175,0.5,0.47500000000000003,0.175,0.5,0.05,equal,0.375,0.325,COMPLETE
4233,0.6271896955157111,0.22500000000000003,0.42500000000000004,0.45,0.175,0.5,0.05,equal,0.375,0.45,COMPLETE
4234,0.43738331580210416,0.2,0.45000000000000007,0.4,0.175,0.5,0.07500000000000001,equal,0.4,0.325,COMPLETE
4235,0.6310795334192677,0.2,0.47500000000000003,0.45,0.15000000000000002,0.5,0.05,equal,0.375,0.325,COMPLETE
4236,0.4833926990146578,0.22500000000000003,0.45000000000000007,0.425,0.175,0.5,0.05,equal,0.375,0.4,COMPLETE
4237,0.4795307900896819,0.15000000000000002,0.47500000000000003,0.375,0.15000000000000002,0.5,0.05,equal,0.25,0.425,COMPLETE
4238,0.4296881612134074,0.275,0.5,0.425,0.175,0.5,0.07500000000000001,equal,0.4,0.325,COMPLETE
4239,0.4550475111060046,0.25,0.42500000000000004,0.425,0.175,0.5,0.05,equal,0.375,0.325,COMPLETE
4240,0.5205233237063607,0.175,0.45000000000000007,0.47500000000000003,0.175,0.5,0.07500000000000001,equal,0.375,0.4,COMPLETE
4241,0.3566601504466289,0.22500000000000003,0.4,0.425,0.15000000000000002,0.5,0.05,equal,0.15000000000000002,0.325,COMPLETE
4242,0.2455866101655333,0.2,0.45000000000000007,0.45,0.15000000000000002,0.47500000000000003,0.05,equal,0.4,0.1,COMPLETE
4243,0.3812708332045351,0.175,0.525,0.47500000000000003,0.175,0.5,0.05,equal,0.375,0.4,COMPLETE
4244,0.5247165179991808,0.2,0.47500000000000003,0.45,0.15000000000000002,0.47500000000000003,0.05,equal,0.5,0.325,COMPLETE
4245,0.34509007612355846,0.22500000000000003,0.42500000000000004,0.425,0.175,0.5,0.07500000000000001,equal,0.175,0.325,COMPLETE
4246,0.5083477353823329,0.25,0.5,0.45,0.15000000000000002,0.47500000000000003,0.05,equal,0.375,0.4,COMPLETE
4247,0.5590158464883752,0.2,0.45000000000000007,0.4,0.175,0.5,0.05,equal,0.375,0.325,COMPLETE
4248,0.5006134189216472,0.25,0.47500000000000003,0.425,0.15000000000000002,0.47500000000000003,0.05,equal,0.375,0.4,COMPLETE
4249,0.5309390110576728,0.175,0.42500000000000004,0.47500000000000003,0.2,0.47500000000000003,0.05,equal,0.4,0.425,COMPLETE
4250,0.3990469339408291,0.22500000000000003,0.4,0.45,0.175,0.5,0.07500000000000001,equal,0.25,0.325,COMPLETE
4251,0.5400549878164029,0.22500000000000003,0.45000000000000007,0.425,0.175,0.47500000000000003,0.07500000000000001,equal,0.375,0.4,COMPLETE
4252,0.5376243821800605,0.175,0.47500000000000003,0.4,0.175,0.5,0.05,linear,0.4,0.325,COMPLETE
4253,0.5590158464883752,0.2,0.45000000000000007,0.4,0.175,0.5,0.05,equal,0.375,0.325,COMPLETE
4254,0.5220780220208968,0.2,0.5,0.45,0.15000000000000002,0.47500000000000003,0.05,equal,0.4,0.325,COMPLETE
4255,-0.028235568952686148,0.6500000000000001,0.05,0.275,0.175,0.5,0.07500000000000001,equal,0.4,0.4,COMPLETE
4256,0.6310795334192679,0.22500000000000003,0.47500000000000003,0.45,0.2,0.47500000000000003,0.05,equal,0.375,0.325,COMPLETE
4257,0.4576174701264903,0.275,0.45000000000000007,0.425,0.175,0.5,0.05,equal,0.5,0.4,COMPLETE
4258,0.49982912761370724,0.25,0.37500000000000006,0.425,0.175,0.47500000000000003,0.07500000000000001,equal,0.375,0.35000000000000003,COMPLETE
4259,0.5429237801440987,0.175,0.45000000000000007,0.4,0.175,0.5,0.05,equal,0.5,0.4,COMPLETE
4260,0.4632635917621696,0.125,0.42500000000000004,0.5,0.15000000000000002,0.47500000000000003,0.05,equal,0.5,0.325,COMPLETE
4261,0.30769214195588634,0.2,0.5,0.45,0.175,0.5,0.07500000000000001,equal,0.375,0.35000000000000003,COMPLETE
4262,0.6021780566265795,0.22500000000000003,0.47500000000000003,0.425,0.2,0.47500000000000003,0.05,equal,0.5,0.325,COMPLETE
4263,0.23138903052042434,0.375,0.4,0.425,0.175,0.5,0.05,equal,0.4,0.425,COMPLETE
4264,0.03834754031618391,0.175,0.47500000000000003,0.47500000000000003,0.2,0.125,0.05,equal,0.25,0.45,COMPLETE
4265,0.30769214195588585,0.2,0.55,0.45,0.175,0.47500000000000003,0.07500000000000001,equal,0.5,0.35000000000000003,COMPLETE
4266,0.608194954932091,0.22500000000000003,0.42500000000000004,0.425,0.15000000000000002,0.47500000000000003,0.05,equal,0.375,0.4,COMPLETE
4267,0.37077202831423894,0.15000000000000002,0.45000000000000007,0.375,0.175,0.5,0.07500000000000001,equal,0.5,0.325,COMPLETE
4268,0.4114551506598451,0.25,0.525,0.45,0.175,0.5,0.05,equal,0.5,0.35000000000000003,COMPLETE
4269,0.4129155432430159,0.2,0.45000000000000007,0.4,0.2,0.375,0.05,equal,0.375,0.325,COMPLETE
4270,0.026300739025157078,0.525,0.42500000000000004,0.07500000000000001,0.2,0.47500000000000003,0.05,equal,0.4,0.4,COMPLETE
4271,0.24805061983365573,0.2,0.5,0.4,0.175,0.5,0.05,equal,0.5,0.35000000000000003,COMPLETE
4272,0.1853912442386748,0.22500000000000003,0.675,0.425,0.325,0.47500000000000003,0.07500000000000001,equal,0.5,0.325,COMPLETE
4273,0.56746418374541,0.22500000000000003,0.45000000000000007,0.45,0.2,0.47500000000000003,0.05,equal,0.22500000000000003,0.35000000000000003,COMPLETE
4274,0.582699372472578,0.175,0.47500000000000003,0.47500000000000003,0.175,0.5,0.05,linear,0.5,0.4,COMPLETE
4275,0.5252031338088448,0.2,0.47500000000000003,0.45,0.175,0.5,0.07500000000000001,equal,0.4,0.425,COMPLETE
4276,0.5143184472204515,0.25,0.42500000000000004,0.425,0.15000000000000002,0.47500000000000003,0.05,equal,0.5,0.325,COMPLETE
4277,-0.09769202236401749,0.175,0.525,0.47500000000000003,0.05,0.5,0.45,equal,0.375,0.375,COMPLETE
4278,0.10815847560256492,0.8750000000000001,0.5,0.1,0.175,0.5,0.05,equal,0.5,0.325,COMPLETE
4279,-0.2019192513902775,0.22500000000000003,0.47500000000000003,0.425,0.2,0.25,0.07500000000000001,equal,0.5,0.05,COMPLETE
4280,0.6224518379186535,0.3,0.45000000000000007,0.425,0.2,0.47500000000000003,0.05,equal,0.375,0.35000000000000003,COMPLETE
4281,0.45643086703144264,0.25,0.4,0.45,0.15000000000000002,0.47500000000000003,0.05,equal,0.5,0.35000000000000003,COMPLETE
4282,0.5333907794303057,0.15000000000000002,0.42500000000000004,0.5,0.175,0.5,0.05,equal,0.5,0.375,COMPLETE
4283,0.3876226612235686,0.275,0.47500000000000003,0.425,0.175,0.47500000000000003,0.07500000000000001,equal,0.4,0.375,COMPLETE
4284,0.48339269901465787,0.22500000000000003,0.45000000000000007,0.45,0.175,0.5,0.05,equal,0.375,0.4,COMPLETE
4285,0.49946784357820617,0.2,0.47500000000000003,0.4,0.2,0.47500000000000003,0.05,equal,0.25,0.325,COMPLETE
4286,0.355754374178532,0.2,0.42500000000000004,0.4,0.22500000000000003,0.5,0.07500000000000001,equal,0.5,0.22500000000000003,COMPLETE
4287,0.45644997663679515,0.175,0.5,0.47500000000000003,0.15000000000000002,0.47500000000000003,0.05,equal,0.5,0.4,COMPLETE
4288,0.45761747012649034,0.22500000000000003,0.45000000000000007,0.45,0.175,0.5,0.05,equal,0.5,0.35000000000000003,COMPLETE
4289,0.5018396984240391,0.2,0.37500000000000006,0.4,0.175,0.47500000000000003,0.07500000000000001,equal,0.375,0.375,COMPLETE
4290,0.5899119806344126,0.2,0.45000000000000007,0.45,0.175,0.5,0.05,equal,0.275,0.325,COMPLETE
4291,0.06859006893128833,0.22500000000000003,0.47500000000000003,0.425,0.175,0.47500000000000003,0.275,equal,0.5,0.35000000000000003,COMPLETE
4292,0.4833926990146578,0.25,0.42500000000000004,0.425,0.2,0.5,0.05,equal,0.375,0.375,COMPLETE
4293,0.3197098543029611,0.2,0.5,0.4,0.2,0.47500000000000003,0.07500000000000001,equal,0.175,0.325,COMPLETE
4294,0.32460784054524117,0.175,0.45000000000000007,0.47500000000000003,0.175,0.5,0.05,linear,0.125,0.4,COMPLETE
4295,0.2886575961090148,0.15000000000000002,0.4,0.5,0.15000000000000002,0.47500000000000003,0.05,equal,0.275,0.4,COMPLETE
4296,0.2881088850454715,0.22500000000000003,0.7250000000000001,0.425,0.175,0.5,0.05,equal,0.2,0.375,COMPLETE
4297,0.025164659354467524,0.175,0.47500000000000003,0.4,0.2,0.05,0.05,equal,0.5,0.325,COMPLETE
4298,0.23952374494099657,0.275,0.5,0.425,0.2,0.3,0.07500000000000001,equal,0.4,0.425,COMPLETE
4299,0.4300227076822851,0.25,0.42500000000000004,0.45,0.175,0.5,0.05,equal,0.5,0.35000000000000003,COMPLETE
4300,0.6310795334192677,0.2,0.47500000000000003,0.45,0.175,0.47500000000000003,0.07500000000000001,equal,0.375,0.5,COMPLETE
4301,0.13184014795872337,0.425,0.45000000000000007,0.425,0.2,0.07500000000000001,0.05,equal,0.5,0.325,COMPLETE
4302,0.569691386986755,0.22500000000000003,0.4,0.425,0.15000000000000002,0.5,0.05,equal,0.4,0.35000000000000003,COMPLETE
4303,0.22745643035824084,0.325,0.45000000000000007,0.425,0.175,0.47500000000000003,0.07500000000000001,equal,0.275,0.375,COMPLETE
4304,0.3536491569836063,0.175,0.525,0.47500000000000003,0.2,0.5,0.05,equal,0.5,0.325,COMPLETE
4305,0.6310795334192679,0.22500000000000003,0.47500000000000003,0.45,0.2,0.47500000000000003,0.05,equal,0.375,0.22500000000000003,COMPLETE
4306,0.5255678314486353,0.2,0.42500000000000004,0.4,0.175,0.5,0.05,equal,0.5,0.4,COMPLETE
4307,0.48912957628853493,0.22500000000000003,0.42500000000000004,0.425,0.175,0.47500000000000003,0.07500000000000001,equal,0.5,0.375,COMPLETE
4308,0.5019703674716832,0.25,0.47500000000000003,0.45,0.22500000000000003,0.5,0.05,equal,0.375,0.35000000000000003,COMPLETE
4309,0.5400911462315858,0.175,0.45000000000000007,0.47500000000000003,0.15000000000000002,0.47500000000000003,0.05,equal,0.275,0.375,COMPLETE
4310,0.2660067602976016,0.2,0.5,0.4,0.22500000000000003,0.5,0.07500000000000001,equal,0.5,0.325,COMPLETE
4311,0.2774801315589213,0.05,0.45000000000000007,0.35000000000000003,0.2,0.47500000000000003,0.05,equal,0.4,0.35000000000000003,COMPLETE
4312,0.6310795334192677,0.2,0.47500000000000003,0.45,0.2,0.47500000000000003,0.05,equal,0.375,0.425,COMPLETE
4313,0.3946688575784774,0.22500000000000003,0.5,0.425,0.175,0.5,0.05,equal,0.5,0.375,COMPLETE
4314,0.5603063299689585,0.2,0.42500000000000004,0.45,0.175,0.47500000000000003,0.07500000000000001,linear,0.5,0.4,COMPLETE
4315,-0.028616264868866342,0.25,0.45000000000000007,0.425,0.4,0.5,0.05,equal,0.5,0.35000000000000003,COMPLETE
4316,0.4005690013916584,0.22500000000000003,0.4,0.425,0.22500000000000003,0.5,0.05,equal,0.275,0.325,COMPLETE
4317,0.34999340142128565,0.15000000000000002,0.47500000000000003,0.375,0.175,0.47500000000000003,0.07500000000000001,equal,0.375,0.375,COMPLETE
4318,0.195823680263359,0.175,0.45000000000000007,0.47500000000000003,0.175,0.5,0.25,equal,0.5,0.325,COMPLETE
4319,0.4428599515669632,0.25,0.37500000000000006,0.45,0.15000000000000002,0.47500000000000003,0.05,equal,0.275,0.4,COMPLETE
4320,0.39002809492313145,0.2,0.42500000000000004,0.4,0.2,0.5,0.05,equal,0.5,0.35000000000000003,COMPLETE
4321,0.4153658382516887,0.2,0.5,0.4,0.2,0.47500000000000003,0.05,equal,0.5,0.375,COMPLETE
4322,0.49225369216580234,0.22500000000000003,0.45000000000000007,0.425,0.22500000000000003,0.5,0.07500000000000001,equal,0.375,0.22500000000000003,COMPLETE
4323,0.5965893494737753,0.25,0.47500000000000003,0.45,0.15000000000000002,0.47500000000000003,0.05,equal,0.5,0.325,COMPLETE
4324,0.3115420539188853,0.22500000000000003,0.25,0.425,0.175,0.5,0.05,equal,0.4,0.35000000000000003,COMPLETE
4325,0.41536583825168827,0.175,0.525,0.375,0.175,0.47500000000000003,0.07500000000000001,equal,0.375,0.45,COMPLETE
4326,0.3773581720040917,0.2,0.42500000000000004,0.4,0.22500000000000003,0.5,0.05,equal,0.25,0.4,COMPLETE
4327,0.5899119806344126,0.2,0.45000000000000007,0.45,0.2,0.47500000000000003,0.05,equal,0.275,0.375,COMPLETE
4328,0.2660067602976019,0.22500000000000003,0.47500000000000003,0.425,0.22500000000000003,0.5,0.07500000000000001,equal,0.5,0.325,COMPLETE
4329,0.4548419093276135,0.275,0.4,0.425,0.2,0.47500000000000003,0.05,equal,0.5,0.35000000000000003,COMPLETE
4330,0.5323240058571823,0.15000000000000002,0.47500000000000003,0.525,0.175,0.5,0.05,equal,0.375,0.4,COMPLETE
4331,0.5675568155473311,0.1,0.42500000000000004,0.525,0.22500000000000003,0.47500000000000003,0.07500000000000001,equal,0.5,0.375,COMPLETE
4332,0.43577109558440186,0.175,0.5,0.47500000000000003,0.175,0.5,0.05,equal,0.4,0.325,COMPLETE
4333,0.4195033895646041,0.25,0.45000000000000007,0.45,0.22500000000000003,0.5,0.05,equal,0.275,0.35000000000000003,COMPLETE
4334,0.4672378376018478,0.2,0.47500000000000003,0.4,0.15000000000000002,0.47500000000000003,0.05,equal,0.22500000000000003,0.425,COMPLETE
4335,0.6166838131030877,0.22500000000000003,0.45000000000000007,0.45,0.175,0.47500000000000003,0.07500000000000001,equal,0.5,0.22500000000000003,COMPLETE
4336,0.5146161746285038,0.175,0.42500000000000004,0.47500000000000003,0.2,0.5,0.05,linear,0.5,0.325,COMPLETE
4337,0.5316497004832006,0.2,0.5,0.45,0.2,0.47500000000000003,0.05,equal,0.375,0.425,COMPLETE
4338,0.4677386629993295,0.22500000000000003,0.45000000000000007,0.425,0.22500000000000003,0.5,0.07500000000000001,equal,0.5,0.4,COMPLETE
4339,-0.06335072224747158,0.2,0.025,0.4,0.175,0.5,0.05,equal,0.4,0.375,COMPLETE
4340,0.07090018564528913,0.45,0.8750000000000001,0.425,0.15000000000000002,0.47500000000000003,0.05,equal,0.5,0.35000000000000003,COMPLETE
4341,0.3516960067632583,0.15000000000000002,0.47500000000000003,0.375,0.22500000000000003,0.47500000000000003,0.07500000000000001,equal,0.375,0.325,COMPLETE
4342,0.27901978008870854,0.25,0.55,0.45,0.22500000000000003,0.5,0.05,equal,0.5,0.375,COMPLETE
4343,0.49884505552690855,0.175,0.42500000000000004,0.47500000000000003,0.2,0.47500000000000003,0.05,equal,0.275,0.35000000000000003,COMPLETE
4344,0.23216057861220252,0.22500000000000003,0.35000000000000003,0.45,0.22500000000000003,0.5,0.07500000000000001,equal,0.25,0.325,COMPLETE
4345,0.07602364284450289,0.7250000000000001,0.5,0.07500000000000001,0.15000000000000002,0.47500000000000003,0.05,equal,0.3,0.4,COMPLETE
4346,0.49633760769352947,0.125,0.4,0.5,0.175,0.5,0.05,equal,0.35000000000000003,0.35000000000000003,COMPLETE
4347,0.5614558432416406,0.2,0.45000000000000007,0.4,0.2,0.47500000000000003,0.05,equal,0.5,0.375,COMPLETE
4348,-0.16911923981798252,0.22500000000000003,0.47500000000000003,0.425,0.22500000000000003,0.5,0.07500000000000001,equal,0.5,0.07500000000000001,COMPLETE
4349,0.4153658382516879,0.2,0.525,0.4,0.2,0.47500000000000003,0.05,equal,0.35000000000000003,0.4,COMPLETE
4350,0.6140766273833025,0.22500000000000003,0.42500000000000004,0.425,0.175,0.5,0.05,equal,0.3,0.325,COMPLETE
4351,0.11318641073124479,0.175,0.45000000000000007,0.47500000000000003,0.175,0.47500000000000003,0.3,equal,0.375,0.375,COMPLETE
4352,0.4735574587331807,0.25,0.47500000000000003,0.45,0.22500000000000003,0.5,0.07500000000000001,equal,0.4,0.35000000000000003,COMPLETE
4353,0.25776036452239726,0.275,0.4,0.425,0.22500000000000003,0.47500000000000003,0.15000000000000002,equal,0.5,0.375,COMPLETE
4354,0.35494615913508964,0.175,0.45000000000000007,0.4,0.2,0.275,0.05,equal,0.3,0.325,COMPLETE
4355,0.13046392643567495,0.22500000000000003,0.5,0.45,0.125,0.5,0.325,equal,0.375,0.4,COMPLETE
4356,0.6131078359831612,0.2,0.42500000000000004,0.45,0.175,0.5,0.05,equal,0.35000000000000003,0.325,COMPLETE
4357,-0.11422271391763672,0.6250000000000001,0.47500000000000003,0.325,0.175,0.47500000000000003,0.07500000000000001,linear,0.5,0.375,COMPLETE
4358,0.3405662386096012,0.22500000000000003,0.45000000000000007,0.425,0.125,0.375,0.05,equal,0.3,0.3,COMPLETE
4359,0.4759455386256412,0.25,0.47500000000000003,0.425,0.175,0.5,0.05,equal,0.5,0.35000000000000003,COMPLETE
4360,0.14538830510646567,0.2,0.5,0.45,0.2,0.15000000000000002,0.05,equal,0.375,0.3,COMPLETE
4361,0.45892893262608087,0.15000000000000002,0.42500000000000004,0.375,0.22500000000000003,0.47500000000000003,0.07500000000000001,equal,0.275,0.4,COMPLETE
4362,0.4647174946549036,0.175,0.4,0.47500000000000003,0.15000000000000002,0.5,0.05,equal,0.5,0.22500000000000003,COMPLETE
4363,0.5451183289893459,0.2,0.45000000000000007,0.4,0.2,0.47500000000000003,0.05,equal,0.3,0.325,COMPLETE
4364,0.14720273026984013,0.22500000000000003,0.47500000000000003,0.425,0.22500000000000003,0.5,0.07500000000000001,equal,0.1,0.375,COMPLETE
4365,0.4056355589744446,0.25,0.525,0.425,0.15000000000000002,0.47500000000000003,0.05,equal,0.5,0.35000000000000003,COMPLETE
4366,0.6409572857839799,0.2,0.45000000000000007,0.45,0.175,0.5,0.05,equal,0.3,0.375,COMPLETE
4367,0.4298363916578132,0.175,0.5,0.47500000000000003,0.2,0.47500000000000003,0.05,equal,0.4,0.15000000000000002,COMPLETE
4368,0.4677386629993295,0.22500000000000003,0.42500000000000004,0.45,0.22500000000000003,0.5,0.07500000000000001,equal,0.5,0.425,COMPLETE
4369,0.4619424238323002,0.2,0.37500000000000006,0.4,0.2,0.47500000000000003,0.05,equal,0.275,0.35000000000000003,COMPLETE
4370,0.49344117039144664,0.175,0.47500000000000003,0.5,0.22500000000000003,0.5,0.07500000000000001,equal,0.375,0.3,COMPLETE
4371,0.5143184472204515,0.275,0.45000000000000007,0.425,0.15000000000000002,0.47500000000000003,0.05,equal,0.5,0.325,COMPLETE
4372,0.1644198067735405,0.25,0.17500000000000002,0.425,0.175,0.5,0.05,equal,0.35000000000000003,0.325,COMPLETE
4373,0.5236671143685783,0.2,0.42500000000000004,0.4,0.2,0.47500000000000003,0.05,equal,0.5,0.375,COMPLETE
4374,0.4803580387742497,0.22500000000000003,0.45000000000000007,0.425,0.22500000000000003,0.5,0.07500000000000001,equal,0.3,0.45,COMPLETE
4375,0.5220780220208967,0.22500000000000003,0.47500000000000003,0.45,0.15000000000000002,0.47500000000000003,0.05,equal,0.4,0.4,COMPLETE
4376,0.5001172884112582,0.175,0.5,0.47500000000000003,0.2,0.47500000000000003,0.05,equal,0.275,0.3,COMPLETE
4377,0.4677386629993295,0.2,0.42500000000000004,0.45,0.22500000000000003,0.5,0.07500000000000001,equal,0.5,0.35000000000000003,COMPLETE
4378,0.23146249653009987,0.25,0.525,0.425,0.2,0.47500000000000003,0.05,linear,0.3,0.3,COMPLETE
4379,0.3454858731326621,0.3,0.45000000000000007,0.425,0.175,0.5,0.05,equal,0.22500000000000003,0.375,COMPLETE
4380,0.43374675325735657,0.22500000000000003,0.4,0.45,0.22500000000000003,0.5,0.07500000000000001,equal,0.375,0.4,COMPLETE
4381,0.5236943238613962,0.2,0.47500000000000003,0.4,0.2,0.47500000000000003,0.05,equal,0.35000000000000003,0.325,COMPLETE
4382,-0.07494572110878828,0.15000000000000002,0.45000000000000007,0.35000000000000003,0.07500000000000001,0.47500000000000003,0.425,equal,0.5,0.22500000000000003,COMPLETE
4383,0.36180513953190924,0.175,0.42500000000000004,0.375,0.175,0.5,0.05,equal,0.3,0.35000000000000003,COMPLETE
4384,0.41104856930219547,0.25,0.47500000000000003,0.425,0.175,0.47500000000000003,0.07500000000000001,equal,0.5,0.3,COMPLETE
4385,0.39850762857556066,0.22500000000000003,0.5,0.45,0.175,0.5,0.05,equal,0.275,0.425,COMPLETE
4386,0.48106519175251083,0.2,0.45000000000000007,0.4,0.15000000000000002,0.47500000000000003,0.05,equal,0.375,0.4,COMPLETE
4387,0.6178023927042292,0.175,0.47500000000000003,0.47500000000000003,0.175,0.5,0.05,equal,0.3,0.325,COMPLETE
4388,0.5025466302528729,0.15000000000000002,0.37500000000000006,0.375,0.22500000000000003,0.5,0.05,equal,0.4,0.375,COMPLETE
4389,0.5812588376929121,0.2,0.42500000000000004,0.45,0.175,0.47500000000000003,0.07500000000000001,equal,0.5,0.35000000000000003,COMPLETE
4390,0.26600676029760195,0.22500000000000003,0.5,0.425,0.22500000000000003,0.5,0.05,equal,0.35000000000000003,0.3,COMPLETE
4391,0.4702110117134354,0.275,0.45000000000000007,0.425,0.175,0.5,0.05,equal,0.3,0.325,COMPLETE
4392,0.4796345356206181,0.2,0.4,0.4,0.22500000000000003,0.47500000000000003,0.07500000000000001,equal,0.5,0.375,COMPLETE
