number,value,params_fund_net_buying,params_institutional_weight,params_number_fund_holdings,params_pe,params_revenue_growth,params_roe,params_stock_weight_option,params_take_profit,params_trailing_stop_loss,state
1448,0.23266423065457692,0.2,0.525,0.47500000000000003,0.25,0.5,0.07500000000000001,softmax,0.47500000000000003,0.275,COMPLETE
1449,0.26577925814957143,0.22500000000000003,0.5,0.425,0.22500000000000003,0.47500000000000003,0.05,softmax,0.47500000000000003,0.275,COMPLETE
1450,0.41502392723719217,0.25,0.45000000000000007,0.45,0.25,0.47500000000000003,0.07500000000000001,linear,0.47500000000000003,0.275,COMPLETE
1451,0.6021780566265794,0.2,0.47500000000000003,0.47500000000000003,0.22500000000000003,0.47500000000000003,0.05,equal,0.47500000000000003,0.275,COMPLETE
1452,-0.04324509952781866,0.22500000000000003,0.42500000000000004,0.425,0.25,0.5,0.2,equal,0.47500000000000003,0.275,COMPLETE
1453,0.5213506906568275,0.175,0.45000000000000007,0.4,0.25,0.47500000000000003,0.07500000000000001,equal,0.47500000000000003,0.275,COMPLETE
1454,0.16530157381368737,0.22500000000000003,0.47500000000000003,0.425,0.25,0.5,0.05,equal,0.47500000000000003,0.07500000000000001,COMPLETE
1455,0.17570214651670948,0.2,0.42500000000000004,0.47500000000000003,0.275,0.35000000000000003,0.05,softmax,0.47500000000000003,0.25,COMPLETE
1456,0.2577320484770159,0.275,0.4,0.45,0.25,0.47500000000000003,0.07500000000000001,equal,0.47500000000000003,0.275,COMPLETE
1457,0.6246360197681785,0.22500000000000003,0.45000000000000007,0.425,0.22500000000000003,0.47500000000000003,0.05,equal,0.47500000000000003,0.25,COMPLETE
1458,0.4575013620128511,0.25,0.47500000000000003,0.425,0.25,0.5,0.05,equal,0.47500000000000003,0.25,COMPLETE
1459,0.20838933780857116,0.175,0.5,0.4,0.275,0.2,0.05,equal,0.47500000000000003,0.25,COMPLETE
1460,0.2079538461908596,0.2,0.5,0.4,0.22500000000000003,0.47500000000000003,0.05,equal,0.07500000000000001,0.25,COMPLETE
1461,0.6431900236904107,0.22500000000000003,0.47500000000000003,0.425,0.22500000000000003,0.47500000000000003,0.05,equal,0.47500000000000003,0.25,COMPLETE
1462,0.5241212743427438,0.275,0.45000000000000007,0.425,0.22500000000000003,0.45,0.05,equal,0.45,0.25,COMPLETE
1463,0.05421239663967836,0.25,0.525,0.425,0.2,0.47500000000000003,0.325,softmax,0.47500000000000003,0.25,COMPLETE
1464,0.39561344060789533,0.25,0.47500000000000003,0.4,0.22500000000000003,0.47500000000000003,0.05,equal,0.45,0.25,COMPLETE
1465,0.47474592631266715,0.22500000000000003,0.45000000000000007,0.4,0.22500000000000003,0.5,0.05,equal,0.47500000000000003,0.25,COMPLETE
1466,0.18403701028222816,0.4,0.47500000000000003,0.425,0.275,0.45,0.05,equal,0.45,0.25,COMPLETE
1467,0.5279610128682568,0.25,0.5,0.425,0.22500000000000003,0.45,0.05,equal,0.47500000000000003,0.25,COMPLETE
1468,0.6054729525697827,0.25,0.45000000000000007,0.425,0.22500000000000003,0.47500000000000003,0.05,equal,0.47500000000000003,0.25,COMPLETE
1469,0.21125306854617168,0.22500000000000003,0.47500000000000003,0.4,0.25,0.5,0.05,softmax,0.45,0.25,COMPLETE
1470,0.6246360197681785,0.22500000000000003,0.45000000000000007,0.425,0.22500000000000003,0.47500000000000003,0.05,equal,0.47500000000000003,0.25,COMPLETE
1471,0.5945631391190089,0.275,0.42500000000000004,0.425,0.22500000000000003,0.47500000000000003,0.05,equal,0.45,0.325,COMPLETE
1472,0.164389732142955,0.25,0.17500000000000002,0.4,0.22500000000000003,0.175,0.05,equal,0.45,0.25,COMPLETE
1473,0.43776608073340073,0.275,0.45000000000000007,0.425,0.22500000000000003,0.5,0.05,linear,0.47500000000000003,0.25,COMPLETE
1474,0.02548881207833328,0.25,0.1,0.4,0.22500000000000003,0.45,0.05,equal,0.47500000000000003,0.25,COMPLETE
1475,0.5353989139898288,0.22500000000000003,0.45000000000000007,0.4,0.22500000000000003,0.47500000000000003,0.05,equal,0.47500000000000003,0.22500000000000003,COMPLETE
1476,0.14723613725354345,0.25,0.42500000000000004,0.425,0.4,0.47500000000000003,0.05,equal,0.47500000000000003,0.25,COMPLETE
1477,0.5105089172669328,0.22500000000000003,0.45000000000000007,0.4,0.22500000000000003,0.45,0.05,softmax,0.45,0.325,COMPLETE
1478,0.43284764900636385,0.22500000000000003,0.45000000000000007,0.425,0.25,0.5,0.05,equal,0.47500000000000003,0.25,COMPLETE
1479,0.5168053980009142,0.22500000000000003,0.42500000000000004,0.4,0.22500000000000003,0.47500000000000003,0.05,equal,0.45,0.275,COMPLETE
1480,0.5241212743427438,0.275,0.45000000000000007,0.425,0.22500000000000003,0.45,0.05,equal,0.47500000000000003,0.3,COMPLETE
1481,0.25208948275055487,0.5,0.42500000000000004,0.425,0.25,0.47500000000000003,0.05,equal,0.47500000000000003,0.275,COMPLETE
1482,0.43408960004487807,0.25,0.45000000000000007,0.425,0.25,0.5,0.05,equal,0.45,0.3,COMPLETE
1483,0.4994750417512618,0.22500000000000003,0.4,0.4,0.22500000000000003,0.45,0.05,equal,0.47500000000000003,0.22500000000000003,COMPLETE
1484,0.429077458277259,0.25,0.47500000000000003,0.425,0.22500000000000003,0.47500000000000003,0.05,softmax,0.47500000000000003,0.325,COMPLETE
1485,0.43284764900636385,0.22500000000000003,0.45000000000000007,0.4,0.25,0.47500000000000003,0.05,equal,0.45,0.25,COMPLETE
1486,0.3902089543187305,0.22500000000000003,0.47500000000000003,0.425,0.275,0.45,0.05,equal,0.47500000000000003,0.275,COMPLETE
1487,0.5168053980009136,0.22500000000000003,0.42500000000000004,0.375,0.22500000000000003,0.47500000000000003,0.05,equal,0.45,0.3,COMPLETE
1488,0.4583089763880938,0.25,0.4,0.425,0.275,0.45,0.05,equal,0.47500000000000003,0.25,COMPLETE
1489,0.1984862053754129,0.275,0.45000000000000007,0.425,0.25,0.5,0.05,equal,0.1,0.275,COMPLETE
1490,0.5228379177101226,0.2,0.42500000000000004,0.375,0.22500000000000003,0.47500000000000003,0.05,softmax,0.45,0.3,COMPLETE
1491,0.42668150926983434,0.22500000000000003,0.47500000000000003,0.4,0.22500000000000003,0.45,0.05,equal,0.47500000000000003,0.325,COMPLETE
1492,0.43284764900636385,0.22500000000000003,0.45000000000000007,0.425,0.25,0.5,0.05,equal,0.45,0.25,COMPLETE
1493,0.26988904778163114,0.2,0.47500000000000003,0.4,0.25,0.47500000000000003,0.05,equal,0.47500000000000003,0.22500000000000003,COMPLETE
1494,0.5241212743427435,0.25,0.42500000000000004,0.425,0.22500000000000003,0.45,0.05,equal,0.47500000000000003,0.275,COMPLETE
1495,0.2984542074312999,0.2,0.5,0.7000000000000001,0.22500000000000003,0.47500000000000003,0.05,linear,0.45,0.275,COMPLETE
1496,0.3769990954276245,0.22500000000000003,0.4,0.4,0.25,0.5,0.05,equal,0.47500000000000003,0.25,COMPLETE
1497,0.5225064050723864,0.2,0.45000000000000007,0.375,0.22500000000000003,0.47500000000000003,0.05,softmax,0.45,0.3,COMPLETE
1498,0.4328476490063638,0.25,0.42500000000000004,0.425,0.25,0.47500000000000003,0.05,equal,0.47500000000000003,0.25,COMPLETE
1499,0.42668150926983434,0.2,0.47500000000000003,0.4,0.22500000000000003,0.45,0.05,equal,0.45,0.275,COMPLETE
1500,0.3871832463845763,0.35000000000000003,0.45000000000000007,0.425,0.25,0.5,0.05,equal,0.375,0.3,COMPLETE
1501,0.3116513145008244,0.25,0.5,0.45,0.275,0.45,0.05,equal,0.45,0.275,COMPLETE
1502,0.5168053980009142,0.2,0.42500000000000004,0.4,0.25,0.47500000000000003,0.05,equal,0.47500000000000003,0.25,COMPLETE
1503,0.43408960004487834,0.22500000000000003,0.45000000000000007,0.425,0.25,0.47500000000000003,0.05,equal,0.47500000000000003,0.3,COMPLETE
1504,0.35260970554273763,0.25,0.47500000000000003,0.45,0.275,0.45,0.05,softmax,0.47500000000000003,0.325,COMPLETE
1505,0.5648664609825738,0.22500000000000003,0.4,0.425,0.22500000000000003,0.47500000000000003,0.05,equal,0.45,0.25,COMPLETE
1506,0.30082814045271244,0.175,0.42500000000000004,0.375,0.25,0.5,0.05,equal,0.47500000000000003,0.275,COMPLETE
1507,0.41200566924525106,0.22500000000000003,0.47500000000000003,0.425,0.22500000000000003,0.47500000000000003,0.05,equal,0.125,0.22500000000000003,COMPLETE
1508,0.4183964705441464,0.2,0.5,0.4,0.22500000000000003,0.45,0.05,equal,0.47500000000000003,0.275,COMPLETE
1509,0.43408960004487834,0.22500000000000003,0.45000000000000007,0.425,0.25,0.47500000000000003,0.05,equal,0.45,0.3,COMPLETE
1510,0.37030772976339993,0.2,0.42500000000000004,0.4,0.25,0.5,0.05,softmax,0.47500000000000003,0.25,COMPLETE
1511,0.41839647054414664,0.2,0.525,0.4,0.275,0.45,0.05,equal,0.425,0.275,COMPLETE
1512,0.4404955848818285,0.275,0.47500000000000003,0.45,0.22500000000000003,0.47500000000000003,0.05,equal,0.47500000000000003,0.3,COMPLETE
1513,0.6246360197681785,0.22500000000000003,0.45000000000000007,0.425,0.22500000000000003,0.47500000000000003,0.05,equal,0.45,0.275,COMPLETE
1514,0.42923563766842604,0.275,0.4,0.425,0.22500000000000003,0.45,0.05,equal,0.47500000000000003,0.275,COMPLETE
1515,0.6054729525697834,0.25,0.42500000000000004,0.425,0.22500000000000003,0.47500000000000003,0.05,equal,0.45,0.275,COMPLETE
1516,0.40965803868814304,0.25,0.4,0.425,0.22500000000000003,0.5,0.05,linear,0.47500000000000003,0.275,COMPLETE
1517,0.29557611059823213,0.3,0.45000000000000007,0.3,0.22500000000000003,0.45,0.05,equal,0.45,0.275,COMPLETE
1518,0.422572027063016,0.25,0.42500000000000004,0.425,0.25,0.47500000000000003,0.05,softmax,0.47500000000000003,0.275,COMPLETE
1519,0.3675611243416663,0.22500000000000003,0.45000000000000007,0.4,0.25,0.5,0.05,equal,0.22500000000000003,0.275,COMPLETE
1520,0.4557543377434947,0.275,0.42500000000000004,0.425,0.22500000000000003,0.45,0.05,equal,0.47500000000000003,0.3,COMPLETE
1521,0.27603128039552766,0.25,0.42500000000000004,0.425,0.375,0.47500000000000003,0.05,equal,0.425,0.275,COMPLETE
1522,0.11895512938927272,0.22500000000000003,0.8750000000000001,0.4,0.22500000000000003,0.47500000000000003,0.05,equal,0.47500000000000003,0.275,COMPLETE
1523,0.5241212743427449,0.22500000000000003,0.45000000000000007,0.4,0.22500000000000003,0.45,0.05,equal,0.45,0.3,COMPLETE
1524,0.45982358956379726,0.25,0.4,0.425,0.25,0.47500000000000003,0.05,softmax,0.47500000000000003,0.275,COMPLETE
1525,0.43284764900636385,0.22500000000000003,0.45000000000000007,0.4,0.25,0.5,0.05,equal,0.425,0.275,COMPLETE
1526,0.5653190101716724,0.22500000000000003,0.42500000000000004,0.425,0.275,0.45,0.05,equal,0.45,0.3,COMPLETE
1527,0.26693899519089076,0.22500000000000003,0.45000000000000007,0.4,0.25,0.5,0.05,equal,0.175,0.35000000000000003,COMPLETE
1528,0.5146797748870207,0.25,0.42500000000000004,0.45,0.22500000000000003,0.47500000000000003,0.05,equal,0.45,0.275,COMPLETE
1529,0.5137868161743696,0.2,0.45000000000000007,0.375,0.22500000000000003,0.45,0.05,equal,0.47500000000000003,0.3,COMPLETE
1530,0.439258875065868,0.275,0.47500000000000003,0.45,0.22500000000000003,0.47500000000000003,0.05,equal,0.47500000000000003,0.275,COMPLETE
1531,0.4355999062241679,0.2,0.4,0.375,0.25,0.47500000000000003,0.05,softmax,0.45,0.3,COMPLETE
1532,0.4587160048116588,0.25,0.45000000000000007,0.45,0.25,0.5,0.05,equal,0.47500000000000003,0.3,COMPLETE
1533,0.4684947100202378,0.22500000000000003,0.4,0.425,0.275,0.45,0.05,equal,0.47500000000000003,0.275,COMPLETE
1534,0.25232320108405404,0.2,0.47500000000000003,0.4,0.22500000000000003,0.25,0.05,equal,0.45,0.275,COMPLETE
1535,0.6054729525697832,0.22500000000000003,0.42500000000000004,0.425,0.22500000000000003,0.47500000000000003,0.05,equal,0.47500000000000003,0.275,COMPLETE
1536,0.4404955848818285,0.22500000000000003,0.45000000000000007,0.45,0.25,0.47500000000000003,0.05,equal,0.45,0.3,COMPLETE
1537,0.4570531208751424,0.175,0.42500000000000004,0.35000000000000003,0.275,0.45,0.05,softmax,0.4,0.15000000000000002,COMPLETE
1538,0.4404955848818285,0.25,0.47500000000000003,0.45,0.25,0.47500000000000003,0.05,equal,0.47500000000000003,0.3,COMPLETE
1539,0.34089034285712455,0.2,0.45000000000000007,0.4,0.25,0.5,0.05,linear,0.425,0.325,COMPLETE
1540,0.5333478649537176,0.22500000000000003,0.42500000000000004,0.425,0.22500000000000003,0.45,0.07500000000000001,equal,0.47500000000000003,0.275,COMPLETE
1541,-0.038985071740727836,0.2,0.47500000000000003,0.4,0.22500000000000003,0.15000000000000002,0.05,equal,0.45,0.3,COMPLETE
1542,-0.1824098757542557,0.25,0.45000000000000007,0.425,0.075,0.47500000000000003,0.45,equal,0.47500000000000003,0.275,COMPLETE
1543,0.32247017265598965,0.175,0.47500000000000003,0.375,0.22500000000000003,0.425,0.07500000000000001,equal,0.47500000000000003,0.3,COMPLETE
1544,0.2698890477816307,0.2,0.5,0.4,0.25,0.5,0.05,equal,0.45,0.275,COMPLETE
1545,0.5673410057443677,0.22500000000000003,0.4,0.425,0.22500000000000003,0.45,0.07500000000000001,softmax,0.45,0.275,COMPLETE
1546,0.2322510241136534,0.325,0.42500000000000004,0.45,0.25,0.47500000000000003,0.05,equal,0.47500000000000003,0.3,COMPLETE
1547,0.439258875065868,0.22500000000000003,0.45000000000000007,0.45,0.25,0.47500000000000003,0.05,equal,0.425,0.275,COMPLETE
1548,0.3948605479095605,0.22500000000000003,0.47500000000000003,0.425,0.22500000000000003,0.45,0.07500000000000001,equal,0.47500000000000003,0.325,COMPLETE
1549,0.010990365147749832,0.55,0.45000000000000007,0.175,0.22500000000000003,0.425,0.05,equal,0.47500000000000003,0.275,COMPLETE
1550,0.4483872012601523,0.25,0.4,0.45,0.25,0.47500000000000003,0.05,equal,0.47500000000000003,0.3,COMPLETE
1551,0.3422177726471514,0.275,0.5,0.45,0.25,0.5,0.07500000000000001,softmax,0.45,0.3,COMPLETE
1552,0.03417336814305914,0.2,0.42500000000000004,0.4,0.275,0.07500000000000001,0.07500000000000001,equal,0.45,0.275,COMPLETE
1553,0.4183964705441459,0.175,0.47500000000000003,0.375,0.275,0.45,0.05,equal,0.35000000000000003,0.275,COMPLETE
1554,0.33241678519664486,0.175,0.45000000000000007,0.7750000000000001,0.22500000000000003,0.47500000000000003,0.05,equal,0.325,0.325,COMPLETE
1555,0.4249828061147667,0.22500000000000003,0.42500000000000004,0.425,0.25,0.5,0.07500000000000001,equal,0.47500000000000003,0.275,COMPLETE
1556,0.50417272352063,0.25,0.47500000000000003,0.45,0.22500000000000003,0.45,0.05,equal,0.47500000000000003,0.275,COMPLETE
1557,0.5229055583623898,0.2,0.45000000000000007,0.4,0.22500000000000003,0.47500000000000003,0.05,softmax,0.47500000000000003,0.25,COMPLETE
1558,0.4242007107937483,0.25,0.4,0.425,0.25,0.47500000000000003,0.07500000000000001,equal,0.425,0.3,COMPLETE
1559,0.5333478649537176,0.22500000000000003,0.42500000000000004,0.425,0.22500000000000003,0.45,0.07500000000000001,equal,0.45,0.25,COMPLETE
1560,0.4966077569408941,0.175,0.45000000000000007,0.375,0.25,0.47500000000000003,0.07500000000000001,linear,0.45,0.275,COMPLETE
1561,0.41839647054414664,0.2,0.5,0.4,0.275,0.45,0.05,equal,0.47500000000000003,0.3,COMPLETE
1562,0.35571194412079316,0.275,0.47500000000000003,0.45,0.25,0.5,0.07500000000000001,equal,0.45,0.325,COMPLETE
1563,0.5648664609825738,0.22500000000000003,0.4,0.425,0.22500000000000003,0.47500000000000003,0.05,equal,0.47500000000000003,0.25,COMPLETE
1564,0.2932397155943285,0.3,0.45000000000000007,0.45,0.22500000000000003,0.425,0.05,equal,0.45,0.3,COMPLETE
1565,0.5451642220648188,0.2,0.45000000000000007,0.4,0.25,0.47500000000000003,0.05,softmax,0.47500000000000003,0.25,COMPLETE
1566,0.35832814534818225,0.175,0.47500000000000003,0.375,0.22500000000000003,0.45,0.05,equal,0.47500000000000003,0.275,COMPLETE
1567,0.0032429767250055502,0.22500000000000003,0.42500000000000004,0.425,0.25,0.5,0.22500000000000003,equal,0.425,0.3,COMPLETE
1568,0.07957486973882055,0.5750000000000001,0.5,0.4,0.25,0.47500000000000003,0.07500000000000001,equal,0.45,0.25,COMPLETE
1569,0.44185439477077654,0.2,0.42500000000000004,0.45,0.25,0.47500000000000003,0.07500000000000001,equal,0.47500000000000003,0.275,COMPLETE
1570,-0.02055594810612231,0.22500000000000003,0.45000000000000007,0.425,0.22500000000000003,0.45,0.3,equal,0.47500000000000003,0.275,COMPLETE
1571,0.2760552513159186,0.25,0.4,0.45,0.25,0.5,0.05,softmax,0.47500000000000003,0.325,COMPLETE
1572,0.09660605771002449,0.675,0.525,0.22500000000000003,0.22500000000000003,0.45,0.07500000000000001,equal,0.45,0.3,COMPLETE
1573,0.5307954049525634,0.2,0.47500000000000003,0.4,0.22500000000000003,0.47500000000000003,0.05,equal,0.47500000000000003,0.275,COMPLETE
1574,0.01713740224974991,0.22500000000000003,0.5,0.425,0.35000000000000003,0.5,0.05,equal,0.45,0.25,COMPLETE
1575,0.4976574576963162,0.175,0.45000000000000007,0.47500000000000003,0.275,0.425,0.07500000000000001,equal,0.425,0.3,COMPLETE
1576,0.06404300316418733,0.8500000000000001,0.42500000000000004,0.125,0.22500000000000003,0.47500000000000003,0.05,equal,0.47500000000000003,0.275,COMPLETE
1577,0.27901978008870937,0.25,0.55,0.45,0.25,0.45,0.07500000000000001,equal,0.47500000000000003,0.35000000000000003,COMPLETE
1578,0.4054610415188005,0.2,0.5,0.4,0.275,0.45,0.05,softmax,0.47500000000000003,0.25,COMPLETE
1579,0.23147221353201422,0.2,0.47500000000000003,0.425,0.25,0.5,0.07500000000000001,equal,0.45,0.275,COMPLETE
1580,0.6246360197681785,0.22500000000000003,0.45000000000000007,0.425,0.22500000000000003,0.47500000000000003,0.05,equal,0.47500000000000003,0.25,COMPLETE
1581,0.4725611422613596,0.275,0.4,0.425,0.22500000000000003,0.47500000000000003,0.05,equal,0.47500000000000003,0.22500000000000003,COMPLETE
1582,0.4501746662781859,0.275,0.42500000000000004,0.425,0.22500000000000003,0.45,0.05,linear,0.47500000000000003,0.22500000000000003,COMPLETE
1583,0.6054729525697834,0.25,0.42500000000000004,0.425,0.22500000000000003,0.47500000000000003,0.05,equal,0.5,0.25,COMPLETE
1584,0.6054729525697834,0.25,0.42500000000000004,0.425,0.22500000000000003,0.47500000000000003,0.05,equal,0.47500000000000003,0.25,COMPLETE
1585,0.08906004901579727,0.25,0.4,0.425,0.22500000000000003,0.3,0.05,softmax,0.5,0.22500000000000003,COMPLETE
1586,0.5353989139898288,0.22500000000000003,0.45000000000000007,0.4,0.22500000000000003,0.47500000000000003,0.05,equal,0.47500000000000003,0.25,COMPLETE
1587,0.4328476490063638,0.22500000000000003,0.42500000000000004,0.425,0.25,0.5,0.05,equal,0.5,0.25,COMPLETE
1588,0.5241212743427449,0.22500000000000003,0.45000000000000007,0.4,0.22500000000000003,0.45,0.05,equal,0.47500000000000003,0.25,COMPLETE
1589,0.4328476490063638,0.25,0.42500000000000004,0.425,0.25,0.47500000000000003,0.05,equal,0.5,0.22500000000000003,COMPLETE
1590,0.43284764900636385,0.22500000000000003,0.45000000000000007,0.4,0.25,0.5,0.05,equal,0.47500000000000003,0.25,COMPLETE
1591,-0.23238387786235568,0.275,0.4,0.45,0.15000000000000002,0.45,0.375,equal,0.47500000000000003,0.25,COMPLETE
1592,0.5925377343331217,0.25,0.45000000000000007,0.425,0.22500000000000003,0.47500000000000003,0.05,softmax,0.47500000000000003,0.25,COMPLETE
1593,0.39655852600791475,0.22500000000000003,0.45000000000000007,0.4,0.275,0.425,0.05,equal,0.5,0.25,COMPLETE
1594,0.20767551666806183,0.22500000000000003,0.4,0.45,0.22500000000000003,0.375,0.05,equal,0.5,0.22500000000000003,COMPLETE
1595,0.4328476490063638,0.25,0.42500000000000004,0.425,0.25,0.47500000000000003,0.05,equal,0.47500000000000003,0.25,COMPLETE
1596,0.5475869696547775,0.22500000000000003,0.45000000000000007,0.425,0.22500000000000003,0.45,0.05,equal,0.5,0.25,COMPLETE
1597,0.37698700305478755,0.2,0.42500000000000004,0.4,0.25,0.5,0.05,equal,0.47500000000000003,0.325,COMPLETE
1598,0.17125589898034999,0.25,0.47500000000000003,0.675,0.22500000000000003,0.47500000000000003,0.05,softmax,0.47500000000000003,0.25,COMPLETE
1599,0.17337694894942585,0.3,0.45000000000000007,0.425,0.22500000000000003,0.325,0.05,equal,0.5,0.25,COMPLETE
1600,0.16081047268398774,0.2,0.47500000000000003,0.375,0.25,0.45,0.25,equal,0.47500000000000003,0.22500000000000003,COMPLETE
1601,0.6054729525697834,0.22500000000000003,0.42500000000000004,0.45,0.25,0.47500000000000003,0.05,equal,0.5,0.25,COMPLETE
1602,0.23169671683485374,0.275,0.45000000000000007,0.45,0.25,0.5,0.05,equal,0.2,0.25,COMPLETE
1603,0.5236671143685783,0.2,0.42500000000000004,0.4,0.22500000000000003,0.45,0.05,equal,0.47500000000000003,0.22500000000000003,COMPLETE
1604,0.6054729525697832,0.25,0.45000000000000007,0.45,0.22500000000000003,0.47500000000000003,0.05,equal,0.47500000000000003,0.25,COMPLETE
1605,0.61946283466519,0.22500000000000003,0.47500000000000003,0.425,0.22500000000000003,0.47500000000000003,0.05,linear,0.47500000000000003,0.325,COMPLETE
1606,0.47634537914794267,0.175,0.4,0.375,0.275,0.425,0.05,softmax,0.5,0.22500000000000003,COMPLETE
1607,0.37698700305478755,0.2,0.42500000000000004,0.4,0.25,0.5,0.05,equal,0.47500000000000003,0.3,COMPLETE
1608,0.3948605479095605,0.22500000000000003,0.47500000000000003,0.425,0.22500000000000003,0.45,0.07500000000000001,equal,0.5,0.25,COMPLETE
1609,0.2713798651056756,0.2,0.47500000000000003,0.4,0.25,0.47500000000000003,0.05,equal,0.47500000000000003,0.3,COMPLETE
1610,0.5050924080127921,0.25,0.45000000000000007,0.45,0.25,0.45,0.07500000000000001,equal,0.5,0.275,COMPLETE
1611,0.4340896000448783,0.22500000000000003,0.42500000000000004,0.425,0.25,0.5,0.05,equal,0.47500000000000003,0.35000000000000003,COMPLETE
1612,0.5556667531723678,0.22500000000000003,0.4,0.425,0.22500000000000003,0.47500000000000003,0.07500000000000001,softmax,0.5,0.275,COMPLETE
1613,0.12393928958445982,0.47500000000000003,0.45000000000000007,0.425,0.275,0.45,0.05,equal,0.47500000000000003,0.25,COMPLETE
1614,0.5085973386994964,0.175,0.47500000000000003,0.4,0.22500000000000003,0.47500000000000003,0.05,equal,0.47500000000000003,0.3,COMPLETE
1615,-0.013148250710933992,0.2,0.45000000000000007,0.4,0.07500000000000001,0.425,0.47500000000000003,equal,0.5,0.275,COMPLETE
1616,0.18796172350812668,0.2,0.42500000000000004,0.35000000000000003,0.25,0.47500000000000003,0.07500000000000001,equal,0.5,0.25,COMPLETE
1617,0.48459569752087384,0.22500000000000003,0.4,0.45,0.22500000000000003,0.45,0.05,equal,0.47500000000000003,0.325,COMPLETE
1618,0.3684049180753285,0.275,0.5,0.45,0.25,0.5,0.07500000000000001,softmax,0.3,0.275,COMPLETE
1619,0.06508694253713784,0.6250000000000001,0.45000000000000007,0.325,0.22500000000000003,0.22500000000000003,0.05,equal,0.47500000000000003,0.25,COMPLETE
1620,0.4404955848818285,0.25,0.47500000000000003,0.45,0.25,0.47500000000000003,0.05,equal,0.5,0.3,COMPLETE
1621,0.3582289905841151,0.22500000000000003,0.42500000000000004,0.2,0.22500000000000003,0.45,0.07500000000000001,equal,0.47500000000000003,0.22500000000000003,COMPLETE
1622,0.49658946173019736,0.175,0.45000000000000007,0.375,0.25,0.47500000000000003,0.05,equal,0.47500000000000003,0.275,COMPLETE
