number,value,params_fund_net_buying,params_institutional_weight,params_number_fund_holdings,params_pe,params_revenue_growth,params_roe,params_stock_weight_option,params_take_profit,params_trailing_stop_loss,state
720,0.11502695915492372,0.125,0.42500000000000004,0.8,0.175,0.47500000000000003,0.125,linear,0.47500000000000003,0.22500000000000003,COMPLETE
721,0.09205295791731302,0.175,0.9,0.5,0.175,0.47500000000000003,0.125,equal,0.47500000000000003,0.22500000000000003,COMPLETE
722,0.17405492099991868,0.15000000000000002,0.37500000000000006,0.45,0.175,0.47500000000000003,0.15000000000000002,equal,0.5,0.25,COMPLETE
723,0.025174139330403453,0.375,0.4,0.5,0.15000000000000002,0.47500000000000003,0.125,equal,0.47500000000000003,0.2,COMPLETE
724,0.49385546351277976,0.125,0.42500000000000004,0.525,0.175,0.47500000000000003,0.125,equal,0.5,0.25,COMPLETE
725,0.0413696413706323,0.7250000000000001,0.4,0.175,0.175,0.47500000000000003,0.125,equal,0.47500000000000003,0.22500000000000003,COMPLETE
726,0.5999431722654397,0.15000000000000002,0.42500000000000004,0.47500000000000003,0.175,0.47500000000000003,0.125,equal,0.47500000000000003,0.25,COMPLETE
727,0.17405492099991868,0.125,0.37500000000000006,0.45,0.175,0.47500000000000003,0.15000000000000002,equal,0.47500000000000003,0.22500000000000003,COMPLETE
728,0.23429605187095157,0.175,0.42500000000000004,0.47500000000000003,0.15000000000000002,0.25,0.125,equal,0.5,0.22500000000000003,COMPLETE
729,0.5999431722654399,0.15000000000000002,0.4,0.45,0.175,0.47500000000000003,0.125,equal,0.47500000000000003,0.25,COMPLETE
730,0.1241615129956845,0.15000000000000002,0.37500000000000006,0.45,0.175,0.47500000000000003,0.15000000000000002,equal,0.47500000000000003,0.2,COMPLETE
731,0.3937146310604783,0.175,0.4,0.45,0.175,0.47500000000000003,0.15000000000000002,equal,0.5,0.22500000000000003,COMPLETE
732,0.2893152104555912,0.125,0.37500000000000006,0.45,0.15000000000000002,0.47500000000000003,0.125,equal,0.45,0.25,COMPLETE
733,0.3664588449900653,0.15000000000000002,0.4,0.07500000000000001,0.175,0.47500000000000003,0.125,equal,0.47500000000000003,0.22500000000000003,COMPLETE
734,0.48052527238937603,0.2,0.4,0.47500000000000003,0.175,0.47500000000000003,0.125,equal,0.45,0.275,COMPLETE
735,0.3468251282856241,0.15000000000000002,0.37500000000000006,0.45,0.175,0.47500000000000003,0.125,equal,0.47500000000000003,0.25,COMPLETE
736,0.24701424014713394,0.125,0.4,0.45,0.15000000000000002,0.47500000000000003,0.125,equal,0.45,0.2,COMPLETE
737,0.30712950378405607,0.175,0.37500000000000006,0.47500000000000003,0.15000000000000002,0.07500000000000001,0.15000000000000002,equal,0.47500000000000003,0.22500000000000003,COMPLETE
738,0.335189875063032,0.125,0.42500000000000004,0.45,0.175,0.47500000000000003,0.125,equal,0.47500000000000003,0.175,COMPLETE
739,0.1327487208697137,0.4,0.4,0.47500000000000003,0.175,0.47500000000000003,0.125,equal,0.5,0.275,COMPLETE
740,0.24239358998139174,0.175,0.35000000000000003,0.47500000000000003,0.175,0.47500000000000003,0.15000000000000002,equal,0.45,0.25,COMPLETE
741,-0.12014526259532293,0.15000000000000002,0.4,0.45,0.15,0.5,0.35000000000000003,equal,0.47500000000000003,0.22500000000000003,COMPLETE
742,0.45942370972605795,0.2,0.42500000000000004,0.47500000000000003,0.175,0.47500000000000003,0.125,linear,0.5,0.25,COMPLETE
743,0.10442128048556838,0.15000000000000002,0.37500000000000006,0.45,0.175,0.5,0.175,equal,0.47500000000000003,0.22500000000000003,COMPLETE
744,0.2324500428130229,0.125,0.42500000000000004,0.47500000000000003,0.175,0.47500000000000003,0.15000000000000002,equal,0.45,0.25,COMPLETE
745,0.21207957798054392,0.5750000000000001,0.37500000000000006,0.3,0.175,0.47500000000000003,0.125,equal,0.47500000000000003,0.275,COMPLETE
746,-0.010443935092956685,0.175,0.42500000000000004,0.45,0.175,0.47500000000000003,0.125,equal,0.1,0.2,COMPLETE
747,0.352646103422978,0.125,0.35000000000000003,0.45,0.175,0.47500000000000003,0.125,equal,0.45,0.22500000000000003,COMPLETE
748,0.2652099682297002,0.15000000000000002,0.4,0.47500000000000003,0.175,0.5,0.15000000000000002,equal,0.47500000000000003,0.22500000000000003,COMPLETE
749,0.49544404336059245,0.15000000000000002,0.4,0.47500000000000003,0.15000000000000002,0.47500000000000003,0.125,equal,0.5,0.25,COMPLETE
750,0.48052527238937587,0.175,0.42500000000000004,0.47500000000000003,0.175,0.47500000000000003,0.125,equal,0.45,0.275,COMPLETE
751,0.32199505189625643,0.125,0.37500000000000006,0.45,0.175,0.5,0.125,equal,0.45,0.25,COMPLETE
752,0.043914501289984684,0.47500000000000003,0.35000000000000003,0.47500000000000003,0.175,0.47500000000000003,0.15000000000000002,equal,0.47500000000000003,0.3,COMPLETE
753,0.29884466745495375,0.125,0.4,0.45,0.15000000000000002,0.47500000000000003,0.125,equal,0.47500000000000003,0.22500000000000003,COMPLETE
754,0.38011289235203727,0.2,0.42500000000000004,0.5,0.175,0.47500000000000003,0.15000000000000002,equal,0.45,0.22500000000000003,COMPLETE
755,0.11560206847263278,0.325,0.37500000000000006,0.47500000000000003,0.175,0.5,0.125,equal,0.125,0.25,COMPLETE
756,0.4805252723893762,0.175,0.4,0.47500000000000003,0.175,0.47500000000000003,0.125,equal,0.5,0.275,COMPLETE
757,-0.018755180152547096,0.15000000000000002,0.42500000000000004,0.45,0.175,0.47500000000000003,0.2,equal,0.47500000000000003,0.2,COMPLETE
758,0.29981425325462224,0.15000000000000002,0.35000000000000003,0.5,0.175,0.5,0.1,equal,0.45,0.25,COMPLETE
759,-0.11146618233274076,0.125,0.42500000000000004,0.525,0.07500000000000001,0.47500000000000003,0.4,equal,0.47500000000000003,0.22500000000000003,COMPLETE
760,0.06964460555473127,0.15000000000000002,0.37500000000000006,0.5,0.35000000000000003,0.47500000000000003,0.125,equal,0.45,0.22500000000000003,COMPLETE
761,0.4954440433605919,0.175,0.4,0.47500000000000003,0.15000000000000002,0.47500000000000003,0.1,equal,0.5,0.3,COMPLETE
762,0.2137743328396935,0.175,0.225,0.47500000000000003,0.175,0.5,0.1,equal,0.47500000000000003,0.2,COMPLETE
763,0.08881992649827755,0.125,0.45000000000000007,0.45,0.175,0.47500000000000003,0.15000000000000002,linear,0.45,0.22500000000000003,COMPLETE
764,0.39917090394920357,0.175,0.4,0.5,0.15000000000000002,0.47500000000000003,0.125,equal,0.47500000000000003,0.25,COMPLETE
765,0.34743511279338957,0.125,0.42500000000000004,0.525,0.2,0.45,0.1,equal,0.5,0.175,COMPLETE
766,0.5737017651119294,0.15000000000000002,0.37500000000000006,0.45,0.2,0.47500000000000003,0.1,equal,0.45,0.25,COMPLETE
767,0.38889574375181707,0.15000000000000002,0.4,0.47500000000000003,0.15000000000000002,0.45,0.125,equal,0.45,0.3,COMPLETE
768,0.2930321678553999,0.125,0.35000000000000003,0.525,0.175,0.5,0.1,equal,0.47500000000000003,0.22500000000000003,COMPLETE
769,0.29876751341260077,0.2,0.5750000000000001,0.5,0.175,0.47500000000000003,0.125,equal,0.47500000000000003,0.275,COMPLETE
770,0.5896802452268486,0.15000000000000002,0.42500000000000004,0.5,0.2,0.47500000000000003,0.1,equal,0.45,0.25,COMPLETE
771,0.4153595152167756,0.175,0.4,0.47500000000000003,0.2,0.5,0.125,equal,0.45,0.25,COMPLETE
772,-0.19997663201768295,0.125,0.42500000000000004,0.45,0.05,0.5,0.45,equal,0.45,0.275,COMPLETE
773,0.5561933915843675,0.15000000000000002,0.37500000000000006,0.47500000000000003,0.2,0.47500000000000003,0.1,equal,0.45,0.25,COMPLETE
774,0.3937146310604783,0.175,0.4,0.45,0.175,0.47500000000000003,0.15000000000000002,equal,0.45,0.275,COMPLETE
775,0.20922814039983406,0.125,0.42500000000000004,0.525,0.175,0.47500000000000003,0.25,equal,0.45,0.25,COMPLETE
776,-0.0919363128661248,0.2,0.35000000000000003,0.5,0.2,0.5,0.125,equal,0.45,0.07500000000000001,COMPLETE
777,0.5737017651119294,0.15000000000000002,0.37500000000000006,0.45,0.2,0.47500000000000003,0.1,equal,0.45,0.25,COMPLETE
778,-0.3655701838044038,0.15000000000000002,0.15,0.5,0.175,0.5,0.3,equal,0.45,0.25,COMPLETE
779,-0.030957843774683164,0.2,0.07500000000000001,0.47500000000000003,0.2,0.47500000000000003,0.1,equal,0.47500000000000003,0.25,COMPLETE
780,0.0740841597882128,0.125,0.4,0.5,0.15000000000000002,0.35000000000000003,0.125,equal,0.45,0.275,COMPLETE
781,0.5266574507857437,0.15000000000000002,0.42500000000000004,0.45,0.2,0.47500000000000003,0.1,equal,0.47500000000000003,0.25,COMPLETE
782,0.03499362646962337,0.175,0.37500000000000006,0.47500000000000003,0.375,0.47500000000000003,0.125,equal,0.45,0.275,COMPLETE
783,0.32741166454954873,0.3,0.42500000000000004,0.47500000000000003,0.2,0.47500000000000003,0.1,linear,0.47500000000000003,0.25,COMPLETE
784,0.41638994527791484,0.175,0.4,0.47500000000000003,0.175,0.5,0.1,equal,0.5,0.3,COMPLETE
785,0.38551207181002933,0.125,0.32500000000000007,0.525,0.22500000000000003,0.47500000000000003,0.125,equal,0.45,0.22500000000000003,COMPLETE
786,0.4558730177949177,0.15000000000000002,0.45000000000000007,0.5,0.175,0.47500000000000003,0.125,equal,0.47500000000000003,0.275,COMPLETE
787,-0.11657627323517507,0.125,0.37500000000000006,0.525,0.0,0.5,0.5,equal,0.45,0.25,COMPLETE
788,0.3937146310604783,0.175,0.42500000000000004,0.45,0.175,0.47500000000000003,0.15000000000000002,equal,0.47500000000000003,0.22500000000000003,COMPLETE
789,-0.15755003417586602,0.15000000000000002,0.35000000000000003,0.47500000000000003,0.4,0.47500000000000003,0.1,equal,0.5,0.25,COMPLETE
790,0.46471732739212435,0.125,0.4,0.5,0.2,0.45,0.1,equal,0.45,0.25,COMPLETE
791,0.5006128648460059,0.15000000000000002,0.45000000000000007,0.45,0.15000000000000002,0.47500000000000003,0.07500000000000001,equal,0.47500000000000003,0.275,COMPLETE
792,0.28968762622104205,0.22500000000000003,0.4,0.5,0.175,0.5,0.175,equal,0.45,0.22500000000000003,COMPLETE
793,-0.1094259799056431,0.2,0.42500000000000004,0.47500000000000003,0.22500000000000003,0.47500000000000003,0.275,equal,0.47500000000000003,0.2,COMPLETE
794,0.42834813155515394,0.15000000000000002,0.37500000000000006,0.45,0.22500000000000003,0.47500000000000003,0.125,equal,0.35000000000000003,0.3,COMPLETE
795,0.47178485626727706,0.175,0.42500000000000004,0.47500000000000003,0.15000000000000002,0.45,0.07500000000000001,equal,0.45,0.22500000000000003,COMPLETE
796,0.4099429417503546,0.15000000000000002,0.35000000000000003,0.5,0.2,0.5,0.07500000000000001,equal,0.5,0.25,COMPLETE
797,0.24706943784844274,0.125,0.4,0.55,0.175,0.47500000000000003,0.125,equal,0.47500000000000003,0.22500000000000003,COMPLETE
798,0.14493752154581324,0.425,0.45000000000000007,0.15000000000000002,0.2,0.45,0.1,equal,0.45,0.275,COMPLETE
799,0.3328034341012479,0.125,0.4,0.45,0.22500000000000003,0.45,0.15000000000000002,equal,0.47500000000000003,0.22500000000000003,COMPLETE
800,0.4476023013039082,0.175,0.37500000000000006,0.47500000000000003,0.2,0.47500000000000003,0.07500000000000001,equal,0.45,0.25,COMPLETE
801,0.46733306736946123,0.125,0.42500000000000004,0.525,0.2,0.47500000000000003,0.1,equal,0.47500000000000003,0.25,COMPLETE
802,0.26464648126825563,0.15000000000000002,0.32500000000000007,0.5,0.175,0.5,0.1,equal,0.45,0.22500000000000003,COMPLETE
803,0.05634835442488665,0.7750000000000001,0.35000000000000003,0.175,0.175,0.45,0.22500000000000003,equal,0.425,0.2,COMPLETE
804,0.49457399558635745,0.125,0.42500000000000004,0.425,0.22500000000000003,0.47500000000000003,0.125,equal,0.47500000000000003,0.25,COMPLETE
805,0.5548902792722052,0.175,0.45000000000000007,0.47500000000000003,0.15000000000000002,0.47500000000000003,0.07500000000000001,linear,0.5,0.22500000000000003,COMPLETE
806,0.33547858552371085,0.175,0.37500000000000006,0.5,0.15000000000000002,0.45,0.1,equal,0.45,0.275,COMPLETE
807,0.4336231894918112,0.2,0.4,0.47500000000000003,0.175,0.5,0.125,equal,0.5,0.3,COMPLETE
808,0.06752738596268602,0.15000000000000002,0.4,0.45,0.15000000000000002,0.22500000000000003,0.07500000000000001,equal,0.47500000000000003,0.25,COMPLETE
809,0.5675568155473305,0.125,0.45000000000000007,0.525,0.2,0.47500000000000003,0.1,equal,0.47500000000000003,0.22500000000000003,COMPLETE
810,0.20626850641766853,0.1,0.47500000000000003,0.55,0.2,0.45,0.125,equal,0.22500000000000003,0.2,COMPLETE
811,0.5561933915843675,0.15000000000000002,0.37500000000000006,0.47500000000000003,0.2,0.47500000000000003,0.1,equal,0.45,0.25,COMPLETE
812,0.518227303040805,0.22500000000000003,0.42500000000000004,0.5,0.2,0.47500000000000003,0.07500000000000001,equal,0.47500000000000003,0.22500000000000003,COMPLETE
813,0.23959474400797529,0.125,0.4,0.425,0.22500000000000003,0.5,0.125,equal,0.425,0.22500000000000003,COMPLETE
814,0.48542524816622,0.15000000000000002,0.42500000000000004,0.45,0.2,0.45,0.1,equal,0.47500000000000003,0.275,COMPLETE
815,0.2647145611641531,0.2,0.35000000000000003,0.5,0.175,0.47500000000000003,0.15000000000000002,equal,0.45,0.25,COMPLETE
816,0.25687365317933764,0.15000000000000002,0.37500000000000006,0.47500000000000003,0.15000000000000002,0.45,0.07500000000000001,equal,0.5,0.25,COMPLETE
817,0.14727633466473555,0.175,0.45000000000000007,0.45,0.175,0.5,0.275,equal,0.45,0.22500000000000003,COMPLETE
818,0.47905233971130123,0.175,0.4,0.47500000000000003,0.22500000000000003,0.47500000000000003,0.125,equal,0.47500000000000003,0.275,COMPLETE
819,0.46733306736946123,0.125,0.42500000000000004,0.525,0.2,0.47500000000000003,0.1,equal,0.47500000000000003,0.25,COMPLETE
820,0.21962264418190483,0.1,0.37500000000000006,0.525,0.15000000000000002,0.45,0.07500000000000001,equal,0.425,0.22500000000000003,COMPLETE
821,0.18564559214309417,0.15000000000000002,0.32500000000000007,0.5,0.175,0.5,0.125,equal,0.325,0.3,COMPLETE
822,0.5857828318788246,0.175,0.47500000000000003,0.45,0.2,0.47500000000000003,0.07500000000000001,equal,0.45,0.25,COMPLETE
823,0.6204961782136781,0.2,0.47500000000000003,0.45,0.2,0.47500000000000003,0.07500000000000001,equal,0.45,0.25,COMPLETE
824,0.0028786535603080796,0.525,0.47500000000000003,0.25,0.2,0.5,0.07500000000000001,equal,0.425,0.275,COMPLETE
825,0.36119010811396135,0.2,0.47500000000000003,0.425,0.2,0.5,0.07500000000000001,linear,0.45,0.25,COMPLETE
826,0.6204961782136781,0.2,0.47500000000000003,0.45,0.2,0.47500000000000003,0.07500000000000001,equal,0.45,0.275,COMPLETE
827,0.27489668591042765,0.25,0.35000000000000003,0.45,0.2,0.5,0.07500000000000001,equal,0.425,0.275,COMPLETE
828,-0.08887233298328254,0.22500000000000003,0.5,0.45,0.15,0.47500000000000003,0.375,equal,0.45,0.275,COMPLETE
829,0.30614494041702534,0.22500000000000003,0.525,0.425,0.2,0.47500000000000003,0.07500000000000001,equal,0.45,0.275,COMPLETE
830,0.5634092454712214,0.175,0.37500000000000006,0.425,0.2,0.47500000000000003,0.07500000000000001,equal,0.45,0.275,COMPLETE
831,0.30769214195588607,0.22500000000000003,0.525,0.45,0.2,0.5,0.07500000000000001,equal,0.425,0.3,COMPLETE
832,0.41536583825168827,0.2,0.5,0.425,0.2,0.47500000000000003,0.07500000000000001,equal,0.45,0.275,COMPLETE
833,0.6204961782136781,0.2,0.47500000000000003,0.45,0.2,0.47500000000000003,0.07500000000000001,equal,0.45,0.25,COMPLETE
834,0.38257715279994925,0.2,0.47500000000000003,0.425,0.2,0.5,0.07500000000000001,equal,0.425,0.275,COMPLETE
835,0.4747459263126675,0.2,0.47500000000000003,0.45,0.2,0.5,0.07500000000000001,equal,0.45,0.25,COMPLETE
836,0.40996635383646285,0.22500000000000003,0.5,0.45,0.2,0.47500000000000003,0.07500000000000001,equal,0.45,0.275,COMPLETE
837,0.3914465907341736,0.25,0.5,0.45,0.2,0.47500000000000003,0.07500000000000001,equal,0.425,0.25,COMPLETE
838,0.30614494041702534,0.2,0.525,0.425,0.2,0.47500000000000003,0.07500000000000001,equal,0.45,0.25,COMPLETE
839,0.30769214195588607,0.2,0.55,0.45,0.2,0.5,0.07500000000000001,equal,0.45,0.3,COMPLETE
840,0.40996635383646285,0.22500000000000003,0.5,0.45,0.2,0.47500000000000003,0.07500000000000001,equal,0.425,0.25,COMPLETE
841,0.30614494041702534,0.25,0.55,0.45,0.2,0.47500000000000003,0.07500000000000001,equal,0.47500000000000003,0.25,COMPLETE
842,0.2644920593842125,0.2,0.5,0.425,0.22500000000000003,0.5,0.07500000000000001,equal,0.47500000000000003,0.275,COMPLETE
843,0.6021780566265797,0.22500000000000003,0.47500000000000003,0.45,0.2,0.47500000000000003,0.07500000000000001,equal,0.5,0.25,COMPLETE
844,0.30614494041702534,0.22500000000000003,0.525,0.425,0.2,0.47500000000000003,0.07500000000000001,equal,0.5,0.275,COMPLETE
845,0.40996635383646285,0.22500000000000003,0.5,0.45,0.2,0.47500000000000003,0.07500000000000001,equal,0.5,0.25,COMPLETE
846,0.26449205938421283,0.22500000000000003,0.5,0.45,0.22500000000000003,0.5,0.07500000000000001,equal,0.5,0.25,COMPLETE
847,0.5353069497284678,0.2,0.47500000000000003,0.425,0.2,0.47500000000000003,0.07500000000000001,equal,0.5,0.275,COMPLETE
848,0.2855747750327238,0.25,0.525,0.45,0.2,0.5,0.07500000000000001,linear,0.5,0.25,COMPLETE
849,0.26224431127354175,0.2,0.47500000000000003,0.425,0.2,0.275,0.07500000000000001,equal,0.5,0.275,COMPLETE
850,0.40996635383646285,0.22500000000000003,0.5,0.45,0.2,0.47500000000000003,0.07500000000000001,equal,0.5,0.25,COMPLETE
851,0.42781564290642554,0.2,0.32500000000000007,0.45,0.2,0.47500000000000003,0.07500000000000001,equal,0.5,0.25,COMPLETE
852,0.5353069497284678,0.2,0.47500000000000003,0.425,0.2,0.47500000000000003,0.07500000000000001,equal,0.5,0.25,COMPLETE
853,0.2660067602976019,0.22500000000000003,0.5,0.45,0.22500000000000003,0.5,0.07500000000000001,equal,0.5,0.3,COMPLETE
854,0.37928278059124393,0.22500000000000003,0.47500000000000003,0.45,0.2,0.47500000000000003,0.07500000000000001,equal,0.15000000000000002,0.275,COMPLETE
855,0.24665310607563953,0.2,0.47500000000000003,0.425,0.22500000000000003,0.5,0.15000000000000002,equal,0.5,0.25,COMPLETE
856,0.5353069497284678,0.2,0.47500000000000003,0.425,0.2,0.47500000000000003,0.07500000000000001,equal,0.47500000000000003,0.3,COMPLETE
857,0.4278156429064257,0.25,0.35000000000000003,0.45,0.2,0.47500000000000003,0.07500000000000001,equal,0.47500000000000003,0.275,COMPLETE
858,0.40660105803889124,0.175,0.5,0.45,0.22500000000000003,0.47500000000000003,0.07500000000000001,equal,0.3,0.25,COMPLETE
859,0.19230318540165195,0.175,0.47500000000000003,0.425,0.22500000000000003,0.47500000000000003,0.15000000000000002,equal,0.5,0.275,COMPLETE
860,0.17246639911188266,0.45,0.35000000000000003,0.47500000000000003,0.2,0.47500000000000003,0.07500000000000001,equal,0.47500000000000003,0.25,COMPLETE
861,0.2120252317984099,0.275,0.37500000000000006,0.6250000000000001,0.22500000000000003,0.5,0.07500000000000001,equal,0.47500000000000003,0.25,COMPLETE
862,0.2922703035096117,0.2,0.32500000000000007,0.45,0.22500000000000003,0.5,0.07500000000000001,equal,0.5,0.25,COMPLETE
863,-0.01435992499429739,0.6250000000000001,0.47500000000000003,0.22500000000000003,0.2,0.47500000000000003,0.07500000000000001,equal,0.47500000000000003,0.275,COMPLETE
864,-0.05876054400605231,0.175,0.525,0.45,0.22500000000000003,0.47500000000000003,0.15000000000000002,equal,0.05,0.25,COMPLETE
865,0.4743499815518699,0.2,0.37500000000000006,0.45,0.2,0.47500000000000003,0.07500000000000001,equal,0.47500000000000003,0.25,COMPLETE
866,0.1574702471701112,0.175,0.45000000000000007,0.425,0.22500000000000003,0.47500000000000003,0.25,equal,0.5,0.25,COMPLETE
867,0.42781564290642543,0.175,0.30000000000000004,0.45,0.2,0.47500000000000003,0.07500000000000001,equal,0.47500000000000003,0.3,COMPLETE
868,0.29925702926573083,0.2,0.37500000000000006,0.47500000000000003,0.22500000000000003,0.5,0.07500000000000001,linear,0.47500000000000003,0.275,COMPLETE
869,0.2599872951777512,0.25,0.35000000000000003,0.47500000000000003,0.22500000000000003,0.5,0.07500000000000001,equal,0.5,0.25,COMPLETE
870,0.2618329905412359,0.175,0.4,0.425,0.22500000000000003,0.47500000000000003,0.15000000000000002,equal,0.47500000000000003,0.25,COMPLETE
871,0.41536583825168827,0.175,0.55,0.45,0.2,0.47500000000000003,0.07500000000000001,equal,0.45,0.275,COMPLETE
872,0.6021780566265794,0.2,0.47500000000000003,0.47500000000000003,0.2,0.47500000000000003,0.07500000000000001,equal,0.47500000000000003,0.25,COMPLETE
873,0.409966353836463,0.2,0.5,0.47500000000000003,0.2,0.5,0.07500000000000001,equal,0.47500000000000003,0.275,COMPLETE
874,0.33535140050241663,0.22500000000000003,0.47500000000000003,0.47500000000000003,0.2,0.47500000000000003,0.175,equal,0.47500000000000003,0.25,COMPLETE
875,0.42398164089702195,0.22500000000000003,0.275,0.47500000000000003,0.2,0.47500000000000003,0.07500000000000001,equal,0.45,0.275,COMPLETE
876,0.20162333885365785,0.35000000000000003,0.5,0.47500000000000003,0.175,0.47500000000000003,0.325,equal,0.5,0.25,COMPLETE
877,0.3369148112098348,0.22500000000000003,0.47500000000000003,0.47500000000000003,0.2,0.5,0.15000000000000002,equal,0.47500000000000003,0.3,COMPLETE
878,0.2866975022942874,0.2,0.525,0.47500000000000003,0.2,0.47500000000000003,0.07500000000000001,equal,0.45,0.25,COMPLETE
879,0.6021780566265794,0.2,0.47500000000000003,0.47500000000000003,0.2,0.47500000000000003,0.07500000000000001,equal,0.47500000000000003,0.25,COMPLETE
880,0.5260290739956602,0.22500000000000003,0.47500000000000003,0.47500000000000003,0.2,0.5,0.07500000000000001,equal,0.5,0.25,COMPLETE
881,0.3914465907341737,0.25,0.5,0.47500000000000003,0.2,0.47500000000000003,0.07500000000000001,equal,0.45,0.275,COMPLETE
882,0.29876751341260077,0.2,0.6000000000000001,0.47500000000000003,0.2,0.47500000000000003,0.125,equal,0.47500000000000003,0.275,COMPLETE
883,0.3914465907341737,0.22500000000000003,0.5,0.47500000000000003,0.2,0.47500000000000003,0.07500000000000001,equal,0.47500000000000003,0.25,COMPLETE
884,0.18667012280914014,0.2,0.47500000000000003,0.47500000000000003,0.2,0.5,0.15000000000000002,equal,0.125,0.25,COMPLETE
885,0.2866975022942874,0.2,0.525,0.47500000000000003,0.2,0.47500000000000003,0.07500000000000001,equal,0.45,0.275,COMPLETE
886,0.33378297974492543,0.25,0.47500000000000003,0.47500000000000003,0.2,0.5,0.125,equal,0.2,0.3,COMPLETE
887,0.6204961782136781,0.2,0.47500000000000003,0.45,0.2,0.47500000000000003,0.07500000000000001,equal,0.5,0.25,COMPLETE
888,0.3833971357804239,0.22500000000000003,0.47500000000000003,0.47500000000000003,0.2,0.47500000000000003,0.125,equal,0.5,0.25,COMPLETE
889,0.29876751341260066,0.2,0.5,0.45,0.2,0.47500000000000003,0.15000000000000002,equal,0.5,0.25,COMPLETE
