number,value,params_fund_net_buying,params_institutional_weight,params_number_fund_holdings,params_pe,params_revenue_growth,params_roe,params_stock_weight_option,params_take_profit,params_trailing_stop_loss,state
2174,0.41536583825168877,0.175,0.525,0.4,0.22500000000000003,0.47500000000000003,0.05,equal,0.45,0.325,COMPLETE
2175,0.40562385092662906,0.15000000000000002,0.55,0.375,0.22500000000000003,0.45,0.05,softmax,0.47500000000000003,0.35000000000000003,COMPLETE
2176,0.39416814276726186,0.22500000000000003,0.525,0.425,0.22500000000000003,0.45,0.07500000000000001,linear,0.45,0.35000000000000003,COMPLETE
2177,0.06718985232813848,0.6500000000000001,0.5,0.05,0.22500000000000003,0.47500000000000003,0.05,equal,0.47500000000000003,0.325,COMPLETE
2178,0.21557720018190102,0.175,0.5,0.4,0.25,0.47500000000000003,0.07500000000000001,equal,0.47500000000000003,0.35000000000000003,COMPLETE
2179,0.43605246991593605,0.25,0.5,0.425,0.22500000000000003,0.425,0.05,equal,0.45,0.35000000000000003,COMPLETE
2180,0.25363833099998745,0.2,0.525,0.4,0.25,0.5,0.05,equal,0.47500000000000003,0.325,COMPLETE
2181,0.3506420733072735,0.2,0.47500000000000003,0.4,0.22500000000000003,0.3,0.1,softmax,0.47500000000000003,0.325,COMPLETE
2182,0.563397412599374,0.2,0.47500000000000003,0.425,0.22500000000000003,0.47500000000000003,0.05,equal,0.47500000000000003,0.325,COMPLETE
2183,0.41536583825168844,0.22500000000000003,0.5,0.425,0.22500000000000003,0.45,0.07500000000000001,equal,0.45,0.325,COMPLETE
2184,0.22392065706416836,0.25,0.47500000000000003,0.425,0.25,0.47500000000000003,0.07500000000000001,equal,0.45,0.35000000000000003,COMPLETE
2185,-0.10543798312850206,0.275,0.5,0.425,0.125,0.5,0.375,equal,0.47500000000000003,0.375,COMPLETE
2186,0.5581714399373455,0.22500000000000003,0.47500000000000003,0.425,0.22500000000000003,0.45,0.05,softmax,0.45,0.325,COMPLETE
2187,0.4183964705441465,0.2,0.47500000000000003,0.4,0.275,0.425,0.05,equal,0.47500000000000003,0.325,COMPLETE
2188,0.2070175725176001,0.275,0.47500000000000003,0.425,0.25,0.47500000000000003,0.07500000000000001,linear,0.47500000000000003,0.325,COMPLETE
2189,0.5353989139898288,0.2,0.45000000000000007,0.4,0.22500000000000003,0.47500000000000003,0.05,equal,0.47500000000000003,0.325,COMPLETE
2190,0.40982396755878303,0.22500000000000003,0.5,0.425,0.25,0.45,0.1,equal,0.45,0.325,COMPLETE
2191,0.35075736649025113,0.175,0.45000000000000007,0.4,0.25,0.5,0.07500000000000001,equal,0.47500000000000003,0.35000000000000003,COMPLETE
2192,0.2673349040698488,0.25,0.525,0.425,0.22500000000000003,0.47500000000000003,0.05,softmax,0.45,0.325,COMPLETE
2193,0.3516960067632583,0.175,0.47500000000000003,0.4,0.22500000000000003,0.45,0.07500000000000001,equal,0.47500000000000003,0.325,COMPLETE
2194,0.6246360197681785,0.22500000000000003,0.45000000000000007,0.425,0.22500000000000003,0.47500000000000003,0.05,equal,0.47500000000000003,0.22500000000000003,COMPLETE
2195,0.41479896330216054,0.3,0.47500000000000003,0.425,0.25,0.5,0.05,equal,0.47500000000000003,0.325,COMPLETE
2196,0.35169600676325796,0.15000000000000002,0.45000000000000007,0.375,0.25,0.45,0.1,equal,0.45,0.25,COMPLETE
2197,0.4515467258391141,0.2,0.4,0.4,0.25,0.47500000000000003,0.07500000000000001,softmax,0.47500000000000003,0.25,COMPLETE
2198,0.4612226398212145,0.22500000000000003,0.45000000000000007,0.425,0.275,0.425,0.05,equal,0.45,0.325,COMPLETE
2199,0.277555368223483,0.2,0.5,0.45,0.25,0.47500000000000003,0.07500000000000001,equal,0.425,0.25,COMPLETE
2200,0.4855948309515268,0.25,0.42500000000000004,0.45,0.22500000000000003,0.45,0.07500000000000001,linear,0.47500000000000003,0.35000000000000003,COMPLETE
2201,0.4183964705441461,0.175,0.47500000000000003,0.4,0.275,0.45,0.05,equal,0.47500000000000003,0.22500000000000003,COMPLETE
2202,0.44617118692891733,0.22500000000000003,0.42500000000000004,0.425,0.25,0.5,0.05,equal,0.3,0.325,COMPLETE
2203,0.4928821363138601,0.175,0.45000000000000007,0.375,0.275,0.45,0.05,softmax,0.275,0.25,COMPLETE
2204,0.33078752244668075,0.25,0.47500000000000003,0.45,0.25,0.47500000000000003,0.07500000000000001,equal,0.47500000000000003,0.325,COMPLETE
2205,0.3852354227174859,0.2,0.4,0.45,0.25,0.5,0.07500000000000001,equal,0.425,0.25,COMPLETE
2206,0.6054729525697832,0.22500000000000003,0.42500000000000004,0.425,0.22500000000000003,0.47500000000000003,0.05,equal,0.45,0.275,COMPLETE
2207,0.5200012342861265,0.2,0.5,0.45,0.22500000000000003,0.47500000000000003,0.05,equal,0.47500000000000003,0.25,COMPLETE
2208,0.17927516964107482,0.22500000000000003,0.37500000000000006,0.425,0.15000000000000002,0.45,0.3,softmax,0.47500000000000003,0.275,COMPLETE
2209,0.3724313931539709,0.175,0.45000000000000007,0.4,0.25,0.45,0.1,equal,0.35000000000000003,0.325,COMPLETE
2210,0.29758391090076963,0.15000000000000002,0.47500000000000003,0.375,0.22500000000000003,0.47500000000000003,0.05,equal,0.47500000000000003,0.35000000000000003,COMPLETE
2211,0.07908648093568235,0.275,0.125,0.45,0.3,0.425,0.07500000000000001,equal,0.45,0.25,COMPLETE
2212,0.3757279228779003,0.2,0.42500000000000004,0.4,0.25,0.5,0.05,equal,0.47500000000000003,0.275,COMPLETE
2213,0.17349517091509342,0.25,0.45000000000000007,0.45,0.275,0.22500000000000003,0.07500000000000001,softmax,0.47500000000000003,0.22500000000000003,COMPLETE
2214,0.2522405447928824,0.22500000000000003,0.47500000000000003,0.425,0.25,0.47500000000000003,0.07500000000000001,linear,0.47500000000000003,0.275,COMPLETE
2215,0.1001146340701288,0.22500000000000003,0.5,0.425,0.275,0.15000000000000002,0.05,equal,0.45,0.325,COMPLETE
2216,0.5279610128682564,0.2,0.525,0.47500000000000003,0.22500000000000003,0.45,0.05,equal,0.47500000000000003,0.275,COMPLETE
2217,0.5801921385646454,0.2,0.4,0.45,0.25,0.47500000000000003,0.07500000000000001,equal,0.4,0.25,COMPLETE
2218,0.25048144829037855,0.175,0.45000000000000007,0.4,0.5,0.45,0.05,equal,0.375,0.3,COMPLETE
2219,0.3706873408051817,0.25,0.42500000000000004,0.45,0.25,0.5,0.07500000000000001,softmax,0.45,0.275,COMPLETE
2220,-0.1999766320176829,0.22500000000000003,0.45000000000000007,0.425,0.075,0.47500000000000003,0.45,equal,0.47500000000000003,0.275,COMPLETE
2221,0.019136917151288804,0.22500000000000003,0.42500000000000004,0.425,0.25,0.425,0.325,equal,0.425,0.325,COMPLETE
2222,0.40982396755878303,0.25,0.47500000000000003,0.45,0.25,0.45,0.1,equal,0.47500000000000003,0.3,COMPLETE
2223,0.10406256180342453,0.175,0.4,0.47500000000000003,0.22500000000000003,0.47500000000000003,0.05,equal,0.47500000000000003,0.1,COMPLETE
2224,0.576202309054106,0.2,0.45000000000000007,0.47500000000000003,0.22500000000000003,0.47500000000000003,0.05,softmax,0.25,0.25,COMPLETE
2225,0.17655763892950394,0.8500000000000001,0.5,0.1,0.35000000000000003,0.45,0.07500000000000001,equal,0.45,0.275,COMPLETE
2226,0.3626339877551975,0.2,0.42500000000000004,0.4,0.25,0.5,0.05,linear,0.45,0.275,COMPLETE
2227,0.2713798651056758,0.22500000000000003,0.47500000000000003,0.425,0.25,0.47500000000000003,0.07500000000000001,equal,0.47500000000000003,0.325,COMPLETE
2228,0.6074641265057518,0.22500000000000003,0.45000000000000007,0.425,0.275,0.45,0.05,equal,0.47500000000000003,0.25,COMPLETE
2229,0.326786113978883,0.25,0.42500000000000004,0.45,0.25,0.47500000000000003,0.07500000000000001,equal,0.47500000000000003,0.3,COMPLETE
2230,0.2611941242251034,0.275,0.55,0.45,0.22500000000000003,0.45,0.05,softmax,0.45,0.3,COMPLETE
2231,0.4144990840457404,0.2,0.47500000000000003,0.47500000000000003,0.275,0.425,0.05,equal,0.22500000000000003,0.25,COMPLETE
2232,0.4665351075252505,0.175,0.45000000000000007,0.5,0.25,0.5,0.07500000000000001,equal,0.47500000000000003,0.275,COMPLETE
2233,0.24382862661432153,0.2,0.42500000000000004,0.4,0.25,0.47500000000000003,0.1,equal,0.45,0.325,COMPLETE
2234,0.425543811008415,0.22500000000000003,0.5,0.425,0.22500000000000003,0.425,0.07500000000000001,equal,0.425,0.22500000000000003,COMPLETE
2235,0.43042114229022904,0.15000000000000002,0.4,0.375,0.22500000000000003,0.45,0.05,softmax,0.47500000000000003,0.3,COMPLETE
2236,0.45871600481165875,0.25,0.47500000000000003,0.45,0.25,0.5,0.05,equal,0.5,0.3,COMPLETE
2237,0.5041451248957044,0.175,0.37500000000000006,0.4,0.25,0.47500000000000003,0.07500000000000001,equal,0.47500000000000003,0.275,COMPLETE
2238,0.5076127191163743,0.15000000000000002,0.45000000000000007,0.5,0.22500000000000003,0.47500000000000003,0.05,linear,0.325,0.25,COMPLETE
2239,0.5047004148765754,0.2,0.45000000000000007,0.425,0.22500000000000003,0.45,0.07500000000000001,equal,0.5,0.3,COMPLETE
2240,0.034173368143058824,0.22500000000000003,0.42500000000000004,0.425,0.22500000000000003,0.15000000000000002,0.1,equal,0.47500000000000003,0.275,COMPLETE
2241,0.07586174435486695,0.275,0.5,0.45,0.25,0.47500000000000003,0.25,softmax,0.47500000000000003,0.325,COMPLETE
2242,0.21637261987486628,0.2,0.47500000000000003,0.47500000000000003,0.275,0.35000000000000003,0.05,equal,0.5,0.25,COMPLETE
2243,0.5015797626641589,0.175,0.45000000000000007,0.4,0.2,0.45,0.05,equal,0.45,0.35000000000000003,COMPLETE
2244,0.23749707555998295,0.425,0.4,0.425,0.25,0.47500000000000003,0.07500000000000001,equal,0.5,0.275,COMPLETE
2245,0.4328476490063638,0.22500000000000003,0.42500000000000004,0.425,0.25,0.5,0.05,equal,0.45,0.275,COMPLETE
2246,0.4126954535296556,0.2,0.525,0.45,0.275,0.4,0.05,softmax,0.47500000000000003,0.3,COMPLETE
2247,0.13080457649231544,0.25,0.17500000000000002,0.45,0.22500000000000003,0.45,0.07500000000000001,equal,0.35000000000000003,0.3,COMPLETE
2248,0.6246360197681785,0.22500000000000003,0.45000000000000007,0.425,0.22500000000000003,0.47500000000000003,0.05,equal,0.425,0.325,COMPLETE
2249,0.23317504025923372,0.3,0.47500000000000003,0.425,0.25,0.47500000000000003,0.07500000000000001,equal,0.5,0.22500000000000003,COMPLETE
2250,0.2490005667809783,0.2,0.4,0.47500000000000003,0.25,0.5,0.05,linear,0.3,0.275,COMPLETE
2251,0.08609178184297818,0.8750000000000001,0.5,0.07500000000000001,0.25,0.45,0.1,equal,0.47500000000000003,0.3,COMPLETE
2252,0.3306439236604546,0.25,0.42500000000000004,0.45,0.25,0.5,0.07500000000000001,softmax,0.25,0.275,COMPLETE
2253,0.5279610128682569,0.175,0.47500000000000003,0.47500000000000003,0.275,0.425,0.05,equal,0.5,0.25,COMPLETE
2254,0.21229745421655485,0.22500000000000003,0.45000000000000007,0.425,0.47500000000000003,0.45,0.05,equal,0.275,0.325,COMPLETE
2255,0.2713798651056758,0.22500000000000003,0.47500000000000003,0.425,0.25,0.47500000000000003,0.07500000000000001,equal,0.45,0.3,COMPLETE
2256,-0.044237521590982626,0.2,0.42500000000000004,0.4,0.25,0.45,0.275,equal,0.47500000000000003,0.25,COMPLETE
2257,0.4830779437105621,0.175,0.37500000000000006,0.4,0.22500000000000003,0.47500000000000003,0.05,softmax,0.47500000000000003,0.275,COMPLETE
2258,0.4565280003211528,0.2,0.45000000000000007,0.47500000000000003,0.3,0.45,0.05,equal,0.5,0.325,COMPLETE
2259,0.27426544638620304,0.22500000000000003,0.4,0.45,0.25,0.5,0.07500000000000001,equal,0.47500000000000003,0.3,COMPLETE
2260,0.3254098316326577,0.25,0.42500000000000004,0.45,0.25,0.47500000000000003,0.07500000000000001,equal,0.5,0.275,COMPLETE
2261,0.41839647054414664,0.2,0.5,0.4,0.275,0.45,0.05,equal,0.47500000000000003,0.3,COMPLETE
2262,0.3090042299711069,0.15000000000000002,0.45000000000000007,0.375,0.22500000000000003,0.425,0.1,softmax,0.45,0.25,COMPLETE
2263,0.61946283466519,0.22500000000000003,0.47500000000000003,0.425,0.22500000000000003,0.47500000000000003,0.05,linear,0.5,0.275,COMPLETE
2264,0.008101115665778605,0.25,0.45000000000000007,0.45,0.2,0.2,0.07500000000000001,equal,0.2,0.3,COMPLETE
2265,0.23959114670741066,0.175,0.525,0.47500000000000003,0.25,0.47500000000000003,0.07500000000000001,equal,0.45,0.22500000000000003,COMPLETE
2266,0.5015797626641589,0.2,0.42500000000000004,0.4,0.2,0.45,0.05,equal,0.5,0.275,COMPLETE
2267,0.45871600481165875,0.275,0.47500000000000003,0.45,0.25,0.5,0.05,equal,0.5,0.3,COMPLETE
2268,0.17880492198589695,0.22500000000000003,0.4,0.6500000000000001,0.275,0.275,0.05,softmax,0.47500000000000003,0.325,COMPLETE
2269,0.3490860027240515,0.2,0.42500000000000004,0.47500000000000003,0.25,0.47500000000000003,0.07500000000000001,equal,0.5,0.25,COMPLETE
2270,0.343658004632171,0.22500000000000003,0.5,0.425,0.175,0.25,0.425,equal,0.47500000000000003,0.275,COMPLETE
2271,0.4840573096194215,0.175,0.45000000000000007,0.5,0.22500000000000003,0.45,0.05,equal,0.45,0.25,COMPLETE
2272,0.42117123965357195,0.2,0.37500000000000006,0.45,0.25,0.47500000000000003,0.07500000000000001,equal,0.47500000000000003,0.3,COMPLETE
2273,0.2465328831910477,0.25,0.5750000000000001,0.45,0.25,0.5,0.05,softmax,0.5,0.275,COMPLETE
2274,0.3791255212678885,0.22500000000000003,0.47500000000000003,0.425,0.25,0.45,0.1,equal,0.425,0.3,COMPLETE
2275,0.6037266560378783,0.22500000000000003,0.45000000000000007,0.425,0.22500000000000003,0.47500000000000003,0.05,linear,0.47500000000000003,0.3,COMPLETE
2276,0.582661956449643,0.175,0.42500000000000004,0.47500000000000003,0.25,0.47500000000000003,0.07500000000000001,equal,0.5,0.35000000000000003,COMPLETE
2277,0.4183964705441465,0.2,0.47500000000000003,0.4,0.275,0.45,0.05,equal,0.47500000000000003,0.325,COMPLETE
2278,0.3897486664865666,0.15000000000000002,0.42500000000000004,0.35000000000000003,0.2,0.425,0.07500000000000001,equal,0.5,0.25,COMPLETE
2279,0.3518210612647146,0.25,0.5,0.45,0.22500000000000003,0.47500000000000003,0.05,softmax,0.47500000000000003,0.275,COMPLETE
2280,0.44185439477077676,0.22500000000000003,0.45000000000000007,0.425,0.25,0.5,0.07500000000000001,equal,0.45,0.275,COMPLETE
2281,0.15056182042277652,0.2,0.45000000000000007,0.45,0.25,0.45,0.175,equal,0.47500000000000003,0.3,COMPLETE
2282,0.2627328402238822,0.25,0.4,0.45,0.25,0.47500000000000003,0.1,equal,0.5,0.325,COMPLETE
2283,0.38767332423688905,0.175,0.47500000000000003,0.4,0.22500000000000003,0.45,0.05,equal,0.47500000000000003,0.25,COMPLETE
2284,0.4102328094556294,0.2,0.4,0.425,0.25,0.5,0.07500000000000001,softmax,0.5,0.22500000000000003,COMPLETE
2285,0.6054729525697832,0.22500000000000003,0.42500000000000004,0.425,0.22500000000000003,0.47500000000000003,0.05,equal,0.47500000000000003,0.275,COMPLETE
2286,0.34241194404750075,0.275,0.45000000000000007,0.45,0.2,0.425,0.07500000000000001,equal,0.45,0.3,COMPLETE
2287,-0.017921308603617243,0.2,0.47500000000000003,0.4,0.275,0.05,0.05,equal,0.5,0.35000000000000003,COMPLETE
2288,0.25960060442645067,0.175,0.42500000000000004,0.5,0.22500000000000003,0.375,0.05,linear,0.47500000000000003,0.25,COMPLETE
2289,0.41536583825168844,0.22500000000000003,0.5,0.425,0.22500000000000003,0.45,0.07500000000000001,equal,0.45,0.325,COMPLETE
2290,0.13671889833680875,0.25,0.525,0.45,0.175,0.47500000000000003,0.22500000000000003,softmax,0.5,0.275,COMPLETE
2291,0.10235152169849511,0.7000000000000001,0.45000000000000007,0.25,0.275,0.325,0.05,equal,0.22500000000000003,0.275,COMPLETE
2292,0.4205657714732931,0.2,0.4,0.47500000000000003,0.25,0.47500000000000003,0.07500000000000001,equal,0.5,0.3,COMPLETE
2293,0.43284764900636385,0.22500000000000003,0.45000000000000007,0.425,0.25,0.5,0.05,equal,0.47500000000000003,0.25,COMPLETE
2294,0.4963476086142242,0.175,0.47500000000000003,0.47500000000000003,0.22500000000000003,0.45,0.07500000000000001,equal,0.375,0.3,COMPLETE
2295,0.511008582584005,0.22500000000000003,0.42500000000000004,0.425,0.22500000000000003,0.45,0.05,softmax,0.47500000000000003,0.275,COMPLETE
2296,0.2713494140823302,0.25,0.37500000000000006,0.45,0.25,0.47500000000000003,0.07500000000000001,equal,0.45,0.325,COMPLETE
2297,0.3791255212678882,0.2,0.5,0.4,0.22500000000000003,0.425,0.1,equal,0.5,0.3,COMPLETE
2298,0.3435345058328817,0.2,0.47500000000000003,0.47500000000000003,0.25,0.5,0.1,equal,0.5,0.275,COMPLETE
2299,0.22618798486496783,0.3,0.45000000000000007,0.425,0.175,0.47500000000000003,0.2,equal,0.425,0.25,COMPLETE
2300,0.4890763102650881,0.2,0.42500000000000004,0.4,0.2,0.45,0.05,softmax,0.47500000000000003,0.3,COMPLETE
2301,0.45750136201285074,0.25,0.47500000000000003,0.45,0.25,0.5,0.05,equal,0.45,0.25,COMPLETE
2302,0.6013168689092465,0.22500000000000003,0.45000000000000007,0.425,0.22500000000000003,0.47500000000000003,0.05,linear,0.4,0.325,COMPLETE
2303,0.4202579755387996,0.15000000000000002,0.4,0.5,0.25,0.47500000000000003,0.07500000000000001,equal,0.47500000000000003,0.3,COMPLETE
2304,0.500017314836279,0.175,0.42500000000000004,0.4,0.275,0.45,0.05,equal,0.325,0.22500000000000003,COMPLETE
2305,0.35490442698458413,0.275,0.47500000000000003,0.45,0.22500000000000003,0.425,0.07500000000000001,equal,0.5,0.275,COMPLETE
2306,0.5942358029321161,0.175,0.45000000000000007,0.47500000000000003,0.25,0.47500000000000003,0.07500000000000001,softmax,0.47500000000000003,0.275,COMPLETE
2307,0.29708563507029034,0.22500000000000003,0.5,0.425,0.25,0.5,0.05,equal,0.45,0.325,COMPLETE
2308,0.5169134067688718,0.2,0.42500000000000004,0.45,0.275,0.45,0.05,equal,0.5,0.3,COMPLETE
2309,0.5118723179709881,0.22500000000000003,0.45000000000000007,0.425,0.22500000000000003,0.45,0.07500000000000001,equal,0.47500000000000003,0.275,COMPLETE
2310,0.47521676418665737,0.25,0.4,0.45,0.22500000000000003,0.47500000000000003,0.05,equal,0.5,0.3,COMPLETE
2311,0.31054199811236993,0.175,0.47500000000000003,0.375,0.2,0.425,0.07500000000000001,softmax,0.47500000000000003,0.25,COMPLETE
2312,0.4840573096194215,0.2,0.42500000000000004,0.47500000000000003,0.2,0.45,0.05,equal,0.425,0.375,COMPLETE
2313,0.28727829278578,0.22500000000000003,0.45000000000000007,0.425,0.25,0.47500000000000003,0.1,linear,0.5,0.3,COMPLETE
2314,0.4189174377386912,0.25,0.37500000000000006,0.45,0.22500000000000003,0.47500000000000003,0.05,equal,0.47500000000000003,0.275,COMPLETE
2315,0.2399689955749743,0.2,0.5,0.4,0.25,0.5,0.07500000000000001,equal,0.45,0.325,COMPLETE
2316,0.6431900236904107,0.22500000000000003,0.47500000000000003,0.425,0.22500000000000003,0.47500000000000003,0.05,equal,0.47500000000000003,0.35000000000000003,COMPLETE
2317,0.26493634863866006,0.25,0.525,0.425,0.3,0.45,0.05,softmax,0.45,0.325,COMPLETE
2318,0.3876733242368896,0.2,0.5,0.4,0.22500000000000003,0.47500000000000003,0.05,equal,0.45,0.35000000000000003,COMPLETE
2319,0.25363833099998745,0.2,0.55,0.4,0.25,0.5,0.05,equal,0.45,0.35000000000000003,COMPLETE
2320,0.1738509420789215,0.22500000000000003,0.5,0.425,0.325,0.45,0.05,equal,0.45,0.35000000000000003,COMPLETE
2321,0.3583107337016985,0.15000000000000002,0.525,0.375,0.3,0.45,0.05,equal,0.47500000000000003,0.325,COMPLETE
2322,0.20837332575885922,0.22500000000000003,0.5,0.425,0.275,0.3,0.05,softmax,0.45,0.35000000000000003,COMPLETE
2323,0.2321510568752077,0.275,0.525,0.425,0.22500000000000003,0.47500000000000003,0.05,equal,0.47500000000000003,0.35000000000000003,COMPLETE
2324,0.27137986510567524,0.175,0.5,0.375,0.25,0.5,0.05,equal,0.47500000000000003,0.325,COMPLETE
2325,0.5592680918801681,0.22500000000000003,0.47500000000000003,0.4,0.22500000000000003,0.47500000000000003,0.05,equal,0.47500000000000003,0.35000000000000003,COMPLETE
2326,-0.009168513344968673,0.2,0.05,0.4,0.22500000000000003,0.45,0.05,linear,0.45,0.375,COMPLETE
2327,0.4183964705441465,0.175,0.47500000000000003,0.4,0.275,0.425,0.05,equal,0.47500000000000003,0.375,COMPLETE
2328,0.2670999226618502,0.22500000000000003,0.525,0.425,0.22500000000000003,0.47500000000000003,0.05,softmax,0.47500000000000003,0.35000000000000003,COMPLETE
2329,0.4527504311784236,0.25,0.47500000000000003,0.425,0.275,0.45,0.05,equal,0.45,0.375,COMPLETE
2330,0.38767332423688905,0.175,0.5,0.375,0.22500000000000003,0.47500000000000003,0.05,equal,0.47500000000000003,0.325,COMPLETE
2331,0.27137986510567547,0.2,0.47500000000000003,0.4,0.25,0.5,0.05,equal,0.47500000000000003,0.35000000000000003,COMPLETE
2332,0.4183964705441465,0.2,0.47500000000000003,0.4,0.275,0.45,0.05,equal,0.45,0.375,COMPLETE
2333,0.40591196417948366,0.22500000000000003,0.5,0.425,0.275,0.45,0.05,softmax,0.47500000000000003,0.35000000000000003,COMPLETE
2334,0.29758391090076963,0.15000000000000002,0.47500000000000003,0.375,0.22500000000000003,0.47500000000000003,0.05,equal,0.47500000000000003,0.35000000000000003,COMPLETE
2335,0.3822180294047801,0.25,0.5,0.425,0.22500000000000003,0.47500000000000003,0.05,equal,0.45,0.35000000000000003,COMPLETE
2336,0.31864011542660947,0.22500000000000003,0.675,0.425,0.22500000000000003,0.47500000000000003,0.05,equal,0.47500000000000003,0.375,COMPLETE
2337,0.30221403986536666,0.175,0.45000000000000007,0.4,0.25,0.5,0.05,equal,0.45,0.375,COMPLETE
2338,0.23040090095869548,0.2,0.525,0.4,0.22500000000000003,0.47500000000000003,0.05,linear,0.47500000000000003,0.325,COMPLETE
2339,0.09235292253688902,0.8250000000000001,0.47500000000000003,0.05,0.275,0.425,0.05,softmax,0.425,0.35000000000000003,COMPLETE
2340,0.24343576518992088,0.25,0.45000000000000007,0.425,0.3,0.45,0.05,equal,0.47500000000000003,0.35000000000000003,COMPLETE
2341,0.37367440819757536,0.2,0.5,0.4,0.275,0.35000000000000003,0.05,equal,0.45,0.375,COMPLETE
2342,0.2935520231737535,0.22500000000000003,0.47500000000000003,0.425,0.3,0.45,0.05,equal,0.47500000000000003,0.35000000000000003,COMPLETE
2343,0.4404955848818283,0.275,0.45000000000000007,0.425,0.22500000000000003,0.47500000000000003,0.05,equal,0.47500000000000003,0.325,COMPLETE
2344,0.4225152505548522,0.22500000000000003,0.42500000000000004,0.425,0.25,0.5,0.05,softmax,0.45,0.375,COMPLETE
2345,-0.017921308603617243,0.2,0.47500000000000003,0.4,0.275,0.07500000000000001,0.05,equal,0.35000000000000003,0.35000000000000003,COMPLETE
2346,0.49181448985014736,0.25,0.45000000000000007,0.45,0.22500000000000003,0.45,0.05,equal,0.47500000000000003,0.35000000000000003,COMPLETE
2347,0.5353989139898288,0.175,0.45000000000000007,0.4,0.22500000000000003,0.47500000000000003,0.05,equal,0.45,0.375,COMPLETE
2348,0.4684947100202378,0.22500000000000003,0.4,0.425,0.275,0.45,0.05,equal,0.47500000000000003,0.35000000000000003,COMPLETE
2349,0.28347810303062326,0.2,0.5,0.45,0.25,0.5,0.05,softmax,0.47500000000000003,0.35000000000000003,COMPLETE
2350,0.4725850699290127,0.22500000000000003,0.42500000000000004,0.425,0.125,0.47500000000000003,0.05,equal,0.47500000000000003,0.375,COMPLETE
