number,value,params_fund_net_buying,params_institutional_weight,params_number_fund_holdings,params_pe,params_revenue_growth,params_roe,params_stock_weight_option,params_take_profit,params_trailing_stop_loss,state
4024,0.6080888952578705,0.2,0.47500000000000003,0.47500000000000003,0.22500000000000003,0.47500000000000003,0.07500000000000001,equal,0.3,0.375,COMPLETE
4025,0.6271896955157108,0.25,0.42500000000000004,0.45,0.175,0.47500000000000003,0.07500000000000001,equal,0.375,0.325,COMPLETE
4026,0.48880535148613324,0.2,0.45000000000000007,0.4,0.22500000000000003,0.5,0.05,equal,0.325,0.375,COMPLETE
4027,0.6221535571249034,0.175,0.45000000000000007,0.47500000000000003,0.175,0.5,0.05,equal,0.35000000000000003,0.35000000000000003,COMPLETE
4028,0.24805061983365495,0.22500000000000003,0.525,0.425,0.2,0.47500000000000003,0.05,equal,0.275,0.425,COMPLETE
4029,-0.18073888278491876,0.175,0.47500000000000003,0.47500000000000003,0.025,0.47500000000000003,0.5,equal,0.3,0.425,COMPLETE
4030,0.313823599917603,0.2,0.42500000000000004,0.4,0.22500000000000003,0.5,0.07500000000000001,equal,0.25,0.35000000000000003,COMPLETE
4031,0.4552292233816545,0.22500000000000003,0.45000000000000007,0.45,0.175,0.5,0.05,equal,0.4,0.375,COMPLETE
4032,0.3768374383395167,0.25,0.5,0.425,0.15000000000000002,0.47500000000000003,0.05,equal,0.325,0.325,COMPLETE
4033,0.45143471297660476,0.2,0.4,0.4,0.2,0.47500000000000003,0.05,equal,0.375,0.325,COMPLETE
4034,0.36109774724976046,0.15000000000000002,0.47500000000000003,0.47500000000000003,0.2,0.35000000000000003,0.05,equal,0.275,0.4,COMPLETE
4035,0.3041620576054207,0.22500000000000003,0.45000000000000007,0.425,0.22500000000000003,0.5,0.07500000000000001,equal,0.3,0.1,COMPLETE
4036,0.5919434025084293,0.175,0.47500000000000003,0.47500000000000003,0.15000000000000002,0.47500000000000003,0.05,equal,0.3,0.375,COMPLETE
4037,0.4195033895646039,0.25,0.42500000000000004,0.425,0.22500000000000003,0.5,0.07500000000000001,equal,0.275,0.35000000000000003,COMPLETE
4038,0.5316497004832005,0.22500000000000003,0.5,0.45,0.2,0.47500000000000003,0.05,equal,0.325,0.375,COMPLETE
4039,0.6409572857839799,0.2,0.45000000000000007,0.45,0.175,0.5,0.05,equal,0.35000000000000003,0.35000000000000003,COMPLETE
4040,0.4858373029359143,0.15000000000000002,0.42500000000000004,0.47500000000000003,0.15000000000000002,0.47500000000000003,0.05,equal,0.375,0.375,COMPLETE
4041,0.48880535148613324,0.2,0.45000000000000007,0.4,0.22500000000000003,0.5,0.05,equal,0.325,0.4,COMPLETE
4042,0.4315981749928191,0.25,0.4,0.425,0.22500000000000003,0.5,0.07500000000000001,equal,0.3,0.325,COMPLETE
4043,0.3948605479095596,0.2,0.525,0.45,0.2,0.47500000000000003,0.05,equal,0.3,0.325,COMPLETE
4044,0.27413099663159457,0.22500000000000003,0.47500000000000003,0.425,0.175,0.47500000000000003,0.07500000000000001,linear,0.1,0.375,COMPLETE
4045,0.4552292233816545,0.275,0.47500000000000003,0.425,0.175,0.5,0.05,equal,0.4,0.325,COMPLETE
4046,0.12335677229145106,0.175,0.5,0.375,0.175,0.47500000000000003,0.22500000000000003,equal,0.35000000000000003,0.4,COMPLETE
4047,0.4129155432430159,0.2,0.42500000000000004,0.4,0.2,0.375,0.05,equal,0.3,0.35000000000000003,COMPLETE
4048,0.6124948216838828,0.175,0.45000000000000007,0.47500000000000003,0.2,0.47500000000000003,0.05,equal,0.375,0.35000000000000003,COMPLETE
4049,0.05956221043359664,0.22500000000000003,0.47500000000000003,0.45,0.1,0.5,0.325,equal,0.325,0.375,COMPLETE
4050,0.2480506198336554,0.2,0.525,0.45,0.22500000000000003,0.5,0.07500000000000001,equal,0.275,0.325,COMPLETE
4051,0.5409096629398674,0.25,0.42500000000000004,0.45,0.2,0.47500000000000003,0.05,equal,0.3,0.375,COMPLETE
4052,0.4859987060892376,0.22500000000000003,0.45000000000000007,0.425,0.15000000000000002,0.47500000000000003,0.05,equal,0.35000000000000003,0.35000000000000003,COMPLETE
4053,0.039396184871750915,0.2,0.4,0.4,0.2,0.1,0.05,equal,0.375,0.325,COMPLETE
4054,0.5590158464883748,0.175,0.47500000000000003,0.375,0.175,0.5,0.05,equal,0.4,0.4,COMPLETE
4055,-0.044072849626364485,0.22500000000000003,0.45000000000000007,0.425,0.375,0.5,0.07500000000000001,equal,0.3,0.375,COMPLETE
4056,0.16539929883872573,0.25,0.775,0.45,0.2,0.47500000000000003,0.05,equal,0.325,0.35000000000000003,COMPLETE
4057,0.2399689955749737,0.175,0.5,0.375,0.22500000000000003,0.5,0.05,equal,0.325,0.325,COMPLETE
4058,0.4345019253381945,0.2,0.37500000000000006,0.4,0.175,0.47500000000000003,0.07500000000000001,equal,0.2,0.4,COMPLETE
4059,0.16496911403944373,0.375,0.47500000000000003,0.55,0.375,0.47500000000000003,0.07500000000000001,equal,0.3,0.375,COMPLETE
4060,0.12139983590170245,0.22500000000000003,0.8250000000000001,0.425,0.22500000000000003,0.5,0.05,equal,0.275,0.325,COMPLETE
4061,0.6262730764699653,0.2,0.42500000000000004,0.45,0.175,0.5,0.05,equal,0.375,0.35000000000000003,COMPLETE
4062,0.47117369553836497,0.275,0.45000000000000007,0.425,0.22500000000000003,0.5,0.05,equal,0.35000000000000003,0.4,COMPLETE
4063,0.47467287253530493,0.22500000000000003,0.45000000000000007,0.45,0.15000000000000002,0.47500000000000003,0.05,equal,0.3,0.45,COMPLETE
4064,0.18161414730592695,0.175,0.5750000000000001,0.47500000000000003,0.175,0.47500000000000003,0.07500000000000001,equal,0.15000000000000002,0.35000000000000003,COMPLETE
4065,0.2498419944629024,0.2,0.5,0.4,0.22500000000000003,0.5,0.05,linear,0.25,0.325,COMPLETE
4066,0.24805061983365495,0.22500000000000003,0.55,0.425,0.2,0.47500000000000003,0.05,equal,0.325,0.375,COMPLETE
4067,0.2660067602976019,0.25,0.47500000000000003,0.425,0.22500000000000003,0.47500000000000003,0.07500000000000001,equal,0.325,0.375,COMPLETE
4068,0.3863120637672073,0.125,0.42500000000000004,0.35000000000000003,0.175,0.5,0.05,equal,0.3,0.35000000000000003,COMPLETE
4069,0.3829873007297462,0.22500000000000003,0.4,0.45,0.22500000000000003,0.5,0.05,equal,0.275,0.4,COMPLETE
4070,0.3949660303860146,0.15000000000000002,0.5,0.375,0.175,0.5,0.05,equal,0.375,0.375,COMPLETE
4071,0.5033633163259765,0.2,0.45000000000000007,0.4,0.22500000000000003,0.47500000000000003,0.07500000000000001,equal,0.3,0.35000000000000003,COMPLETE
4072,0.4085948126411662,0.25,0.47500000000000003,0.425,0.175,0.47500000000000003,0.07500000000000001,equal,0.4,0.325,COMPLETE
4073,0.1241539856369488,0.175,0.45000000000000007,0.7000000000000001,0.22500000000000003,0.5,0.05,equal,0.3,0.425,COMPLETE
4074,0.5062739829022321,0.2,0.42500000000000004,0.4,0.2,0.47500000000000003,0.05,equal,0.35000000000000003,0.325,COMPLETE
4075,0.5674347556856268,0.2,0.47500000000000003,0.45,0.2,0.47500000000000003,0.05,equal,0.275,0.375,COMPLETE
4076,0.2660067602976016,0.22500000000000003,0.5,0.425,0.22500000000000003,0.5,0.07500000000000001,equal,0.325,0.4,COMPLETE
4077,0.4505774550802092,0.175,0.42500000000000004,0.4,0.175,0.5,0.05,equal,0.375,0.35000000000000003,COMPLETE
4078,0.5722516084793845,0.2,0.45000000000000007,0.45,0.15000000000000002,0.47500000000000003,0.05,equal,0.3,0.325,COMPLETE
4079,0.526555993118065,0.15000000000000002,0.47500000000000003,0.47500000000000003,0.2,0.47500000000000003,0.05,equal,0.3,0.375,COMPLETE
4080,0.6140766273833025,0.22500000000000003,0.42500000000000004,0.425,0.175,0.5,0.05,equal,0.325,0.35000000000000003,COMPLETE
4081,0.44379561728809686,0.25,0.4,0.425,0.22500000000000003,0.5,0.07500000000000001,equal,0.375,0.325,COMPLETE
4082,0.49654490382128624,0.275,0.45000000000000007,0.425,0.15000000000000002,0.47500000000000003,0.05,equal,0.35000000000000003,0.4,COMPLETE
4083,0.36254263611819926,0.22500000000000003,0.525,0.45,0.2,0.47500000000000003,0.05,equal,0.35000000000000003,0.375,COMPLETE
4084,0.28999945389805004,0.2,0.45000000000000007,0.45,0.175,0.5,0.175,equal,0.275,0.35000000000000003,COMPLETE
4085,0.46537867234066216,0.175,0.47500000000000003,0.47500000000000003,0.22500000000000003,0.5,0.07500000000000001,equal,0.4,0.325,COMPLETE
4086,-0.059735960472163424,0.25,0.5,0.45,0.2,0.47500000000000003,0.05,linear,0.05,0.375,COMPLETE
4087,0.46636935811011165,0.2,0.45000000000000007,0.4,0.15000000000000002,0.47500000000000003,0.05,equal,0.3,0.35000000000000003,COMPLETE
4088,0.4549322093842329,0.175,0.42500000000000004,0.47500000000000003,0.22500000000000003,0.5,0.07500000000000001,equal,0.325,0.4,COMPLETE
4089,0.523694323861396,0.22500000000000003,0.47500000000000003,0.425,0.175,0.47500000000000003,0.07500000000000001,equal,0.3,0.375,COMPLETE
4090,0.43211723557773984,0.22500000000000003,0.4,0.45,0.22500000000000003,0.5,0.05,equal,0.3,0.425,COMPLETE
4091,0.39850762857556266,0.175,0.5,0.47500000000000003,0.175,0.5,0.05,equal,0.275,0.325,COMPLETE
4092,0.6310795334192677,0.22500000000000003,0.47500000000000003,0.425,0.2,0.47500000000000003,0.05,equal,0.375,0.35000000000000003,COMPLETE
4093,0.24612353311819835,0.25,0.45000000000000007,0.45,0.2,0.325,0.05,equal,0.325,0.375,COMPLETE
4094,0.2480506198336554,0.2,0.525,0.4,0.22500000000000003,0.5,0.05,equal,0.3,0.35000000000000003,COMPLETE
4095,0.5062739829022321,0.2,0.42500000000000004,0.4,0.2,0.47500000000000003,0.05,equal,0.325,0.325,COMPLETE
4096,0.06063728030979604,0.8,0.47500000000000003,0.15000000000000002,0.15000000000000002,0.47500000000000003,0.05,equal,0.35000000000000003,0.325,COMPLETE
4097,0.2823139121492575,0.15000000000000002,0.45000000000000007,0.375,0.22500000000000003,0.5,0.07500000000000001,equal,0.275,0.375,COMPLETE
4098,0.43577109558440186,0.175,0.5,0.47500000000000003,0.175,0.5,0.05,equal,0.4,0.4,COMPLETE
4099,0.6094429834638788,0.2,0.4,0.45,0.22500000000000003,0.47500000000000003,0.07500000000000001,equal,0.375,0.375,COMPLETE
4100,0.5236943238613962,0.2,0.47500000000000003,0.4,0.2,0.47500000000000003,0.05,equal,0.3,0.35000000000000003,COMPLETE
4101,0.02297753364617439,0.22500000000000003,0.9500000000000001,0.425,0.175,0.5,0.05,equal,0.35000000000000003,0.325,COMPLETE
4102,0.24068012310828274,0.25,0.45000000000000007,0.425,0.22500000000000003,0.5,0.05,equal,0.125,0.375,COMPLETE
4103,0.4718003650208878,0.22500000000000003,0.42500000000000004,0.425,0.175,0.47500000000000003,0.07500000000000001,equal,0.325,0.325,COMPLETE
4104,0.5068109669230413,0.2,0.5,0.45,0.15000000000000002,0.47500000000000003,0.05,equal,0.3,0.4,COMPLETE
4105,0.1886572649669054,0.275,0.45000000000000007,0.425,0.2,0.3,0.07500000000000001,equal,0.275,0.425,COMPLETE
4106,0.36180513953190924,0.15000000000000002,0.42500000000000004,0.375,0.175,0.5,0.05,equal,0.3,0.35000000000000003,COMPLETE
4107,0.5975250803719272,0.175,0.47500000000000003,0.47500000000000003,0.2,0.47500000000000003,0.05,linear,0.325,0.375,COMPLETE
4108,-0.22901474110642747,0.22500000000000003,0.37500000000000006,0.425,0.125,0.5,0.35000000000000003,equal,0.375,0.35000000000000003,COMPLETE
4109,0.5899325967932698,0.25,0.45000000000000007,0.45,0.2,0.47500000000000003,0.05,equal,0.25,0.325,COMPLETE
4110,0.4549322093842329,0.175,0.42500000000000004,0.47500000000000003,0.22500000000000003,0.5,0.07500000000000001,equal,0.35000000000000003,0.375,COMPLETE
4111,0.5997514435684572,0.22500000000000003,0.47500000000000003,0.45,0.2,0.47500000000000003,0.05,equal,0.4,0.4,COMPLETE
4112,0.28824698379455066,0.3,0.525,0.425,0.175,0.47500000000000003,0.07500000000000001,equal,0.3,0.325,COMPLETE
4113,0.4759455386256409,0.2,0.45000000000000007,0.4,0.22500000000000003,0.5,0.05,equal,0.5,0.35000000000000003,COMPLETE
4114,0.2660067602976019,0.22500000000000003,0.5,0.45,0.22500000000000003,0.5,0.07500000000000001,equal,0.3,0.375,COMPLETE
4115,0.4933846091340663,0.175,0.4,0.47500000000000003,0.15000000000000002,0.47500000000000003,0.05,equal,0.375,0.325,COMPLETE
4116,-0.02449946850851971,0.675,0.47500000000000003,0.22500000000000003,0.175,0.5,0.05,equal,0.5,0.4,COMPLETE
4117,0.5230249105589782,0.2,0.45000000000000007,0.4,0.2,0.47500000000000003,0.05,equal,0.275,0.35000000000000003,COMPLETE
4118,0.48035803877424954,0.2,0.42500000000000004,0.45,0.22500000000000003,0.5,0.07500000000000001,equal,0.325,0.35000000000000003,COMPLETE
4119,0.5031627382863417,0.25,0.47500000000000003,0.425,0.15000000000000002,0.47500000000000003,0.05,equal,0.5,0.375,COMPLETE
4120,0.26600676029760195,0.22500000000000003,0.5,0.425,0.22500000000000003,0.5,0.05,equal,0.3,0.375,COMPLETE
4121,0.5989023234943217,0.25,0.42500000000000004,0.425,0.175,0.47500000000000003,0.07500000000000001,equal,0.5,0.4,COMPLETE
4122,0.15564452565991255,0.22500000000000003,0.47500000000000003,0.425,0.22500000000000003,0.5,0.05,equal,0.375,0.07500000000000001,COMPLETE
4123,0.4826669228264977,0.2,0.42500000000000004,0.4,0.2,0.47500000000000003,0.05,equal,0.275,0.35000000000000003,COMPLETE
4124,0.48035803877424954,0.175,0.45000000000000007,0.47500000000000003,0.22500000000000003,0.5,0.07500000000000001,equal,0.3,0.325,COMPLETE
4125,0.5005309948142408,0.2,0.5,0.45,0.2,0.47500000000000003,0.05,equal,0.5,0.35000000000000003,COMPLETE
4126,0.006950667595154812,0.275,0.45000000000000007,0.425,0.2,0.15000000000000002,0.05,equal,0.325,0.325,COMPLETE
4127,0.4702110117134355,0.22500000000000003,0.47500000000000003,0.45,0.175,0.5,0.05,equal,0.35000000000000003,0.375,COMPLETE
4128,0.4200655024728097,0.175,0.4,0.4,0.2,0.47500000000000003,0.05,linear,0.3,0.4,COMPLETE
4129,0.567556815547331,0.2,0.45000000000000007,0.45,0.175,0.47500000000000003,0.07500000000000001,equal,0.5,0.425,COMPLETE
4130,0.3095396146140019,0.47500000000000003,0.525,0.275,0.2,0.275,0.05,equal,0.325,0.325,COMPLETE
4131,0.4683295840381528,0.15000000000000002,0.45000000000000007,0.375,0.175,0.5,0.05,equal,0.4,0.375,COMPLETE
4132,0.17971949107898227,0.35000000000000003,0.5,0.55,0.22500000000000003,0.47500000000000003,0.07500000000000001,equal,0.35000000000000003,0.325,COMPLETE
4133,0.07465307583548872,0.7000000000000001,0.55,0.175,0.22500000000000003,0.5,0.05,equal,0.5,0.35000000000000003,COMPLETE
4134,-0.18073888278492006,0.22500000000000003,0.42500000000000004,0.425,0.05,0.47500000000000003,0.47500000000000003,equal,0.3,0.4,COMPLETE
4135,0.4759455386256408,0.175,0.47500000000000003,0.47500000000000003,0.22500000000000003,0.5,0.05,equal,0.5,0.325,COMPLETE
4136,0.2599507442139466,0.25,0.37500000000000006,0.425,0.175,0.47500000000000003,0.2,equal,0.375,0.375,COMPLETE
4137,0.12167940353724141,0.2,0.4,0.45,0.425,0.5,0.05,equal,0.3,0.35000000000000003,COMPLETE
4138,0.4286152753461079,0.22500000000000003,0.45000000000000007,0.45,0.22500000000000003,0.5,0.07500000000000001,equal,0.275,0.325,COMPLETE
4139,0.11259479424608701,0.2,0.47500000000000003,0.4,0.175,0.47500000000000003,0.3,equal,0.275,0.375,COMPLETE
4140,0.5777148101684926,0.22500000000000003,0.42500000000000004,0.425,0.15000000000000002,0.47500000000000003,0.05,equal,0.4,0.35000000000000003,COMPLETE
4141,0.4702110117134354,0.25,0.45000000000000007,0.425,0.175,0.5,0.05,equal,0.35000000000000003,0.375,COMPLETE
4142,-0.02431218384304845,0.55,0.5,0.22500000000000003,0.35000000000000003,0.47500000000000003,0.07500000000000001,equal,0.375,0.375,COMPLETE
4143,0.26567204076807277,0.175,0.47500000000000003,0.47500000000000003,0.2,0.35000000000000003,0.05,equal,0.5,0.4,COMPLETE
4144,0.545118328989346,0.2,0.45000000000000007,0.4,0.175,0.5,0.05,equal,0.325,0.35000000000000003,COMPLETE
4145,0.5105312565021094,0.22500000000000003,0.4,0.425,0.15000000000000002,0.47500000000000003,0.05,equal,0.5,0.47500000000000003,COMPLETE
4146,-0.02386553034881292,0.1,0.42500000000000004,0.875,0.22500000000000003,0.5,0.07500000000000001,equal,0.5,0.325,COMPLETE
4147,0.5236943238613962,0.2,0.47500000000000003,0.4,0.2,0.47500000000000003,0.05,equal,0.3,0.4,COMPLETE
4148,0.4678093998384097,0.25,0.47500000000000003,0.45,0.22500000000000003,0.5,0.05,linear,0.3,0.325,COMPLETE
4149,0.24805061983365495,0.2,0.525,0.45,0.22500000000000003,0.5,0.05,equal,0.325,0.375,COMPLETE
4150,0.5400549878164034,0.22500000000000003,0.45000000000000007,0.425,0.2,0.47500000000000003,0.05,equal,0.375,0.35000000000000003,COMPLETE
4151,0.23261229319603166,0.15000000000000002,0.42500000000000004,0.5,0.5,0.22500000000000003,0.07500000000000001,equal,0.5,0.325,COMPLETE
4152,0.5316497004832004,0.175,0.5,0.47500000000000003,0.175,0.47500000000000003,0.07500000000000001,equal,0.3,0.375,COMPLETE
4153,0.47117369553836497,0.275,0.45000000000000007,0.425,0.22500000000000003,0.5,0.05,equal,0.325,0.35000000000000003,COMPLETE
4154,0.03711788437376148,0.125,0.47500000000000003,0.375,0.15000000000000002,0.47500000000000003,0.05,equal,0.07500000000000001,0.35000000000000003,COMPLETE
4155,0.33237301968037747,0.2,0.47500000000000003,0.45,0.22500000000000003,0.5,0.07500000000000001,equal,0.5,0.4,COMPLETE
4156,0.16047515532024376,0.25,0.42500000000000004,0.675,0.2,0.175,0.05,equal,0.4,0.375,COMPLETE
4157,0.47293880905286956,0.2,0.4,0.4,0.15000000000000002,0.47500000000000003,0.05,equal,0.35000000000000003,0.325,COMPLETE
4158,0.4502373295808427,0.22500000000000003,0.5,0.45,0.175,0.5,0.05,equal,0.3,0.4,COMPLETE
4159,0.567556815547331,0.175,0.45000000000000007,0.47500000000000003,0.175,0.47500000000000003,0.07500000000000001,equal,0.5,0.425,COMPLETE
4160,0.15827799218284325,0.5,0.47500000000000003,0.425,0.22500000000000003,0.5,0.05,equal,0.375,0.375,COMPLETE
4161,0.30870981958609256,0.175,0.42500000000000004,0.375,0.22500000000000003,0.5,0.05,equal,0.5,0.325,COMPLETE
4162,0.6409572857839799,0.22500000000000003,0.45000000000000007,0.45,0.2,0.47500000000000003,0.05,equal,0.325,0.375,COMPLETE
4163,0.545118328989346,0.2,0.45000000000000007,0.4,0.175,0.5,0.05,equal,0.35000000000000003,0.35000000000000003,COMPLETE
4164,0.523694323861396,0.22500000000000003,0.47500000000000003,0.425,0.175,0.47500000000000003,0.07500000000000001,equal,0.3,0.325,COMPLETE
4165,0.2223502852289163,0.15000000000000002,0.525,0.375,0.22500000000000003,0.5,0.05,equal,0.5,0.35000000000000003,COMPLETE
4166,0.29001866321448466,0.25,0.42500000000000004,0.45,0.22500000000000003,0.47500000000000003,0.07500000000000001,equal,0.275,0.4,COMPLETE
4167,0.24805061983365573,0.2,0.5,0.4,0.175,0.5,0.05,equal,0.3,0.35000000000000003,COMPLETE
4168,0.5489096584656128,0.175,0.45000000000000007,0.47500000000000003,0.2,0.47500000000000003,0.05,equal,0.275,0.375,COMPLETE
4169,0.5634127257622562,0.22500000000000003,0.42500000000000004,0.425,0.15000000000000002,0.47500000000000003,0.05,linear,0.5,0.325,COMPLETE
4170,0.02563015945006126,0.2,0.1,0.45,0.22500000000000003,0.5,0.07500000000000001,equal,0.375,0.375,COMPLETE
4171,0.5024800386153757,0.175,0.4,0.47500000000000003,0.175,0.5,0.05,equal,0.325,0.35000000000000003,COMPLETE
4172,0.2480506198336554,0.22500000000000003,0.5,0.425,0.22500000000000003,0.47500000000000003,0.07500000000000001,equal,0.325,0.325,COMPLETE
4173,0.014073623440601445,0.25,0.925,0.45,0.175,0.5,0.22500000000000003,equal,0.5,0.375,COMPLETE
4174,0.39065972465186416,0.2,0.47500000000000003,0.4,0.2,0.325,0.05,equal,0.4,0.35000000000000003,COMPLETE
4175,0.24546707123439493,0.175,0.45000000000000007,0.4,0.2,0.47500000000000003,0.05,equal,0.35000000000000003,0.125,COMPLETE
4176,0.5674347556856268,0.22500000000000003,0.47500000000000003,0.425,0.2,0.47500000000000003,0.05,equal,0.275,0.4,COMPLETE
4177,0.13122840642792932,0.275,0.45000000000000007,0.425,0.175,0.5,0.275,equal,0.3,0.325,COMPLETE
4178,0.5110464068821691,0.2,0.47500000000000003,0.45,0.22500000000000003,0.47500000000000003,0.07500000000000001,equal,0.5,0.375,COMPLETE
4179,0.4514361622696307,0.25,0.4,0.425,0.22500000000000003,0.5,0.05,equal,0.375,0.325,COMPLETE
4180,0.21217510154537744,0.22500000000000003,0.5,0.425,0.2,0.2,0.05,equal,0.3,0.4,COMPLETE
4181,0.5090699070068689,0.2,0.42500000000000004,0.4,0.175,0.47500000000000003,0.07500000000000001,equal,0.5,0.425,COMPLETE
4182,0.39933394241267794,0.175,0.42500000000000004,0.47500000000000003,0.22500000000000003,0.5,0.05,equal,0.5,0.35000000000000003,COMPLETE
4183,0.6178023927042295,0.22500000000000003,0.47500000000000003,0.45,0.175,0.47500000000000003,0.07500000000000001,equal,0.3,0.375,COMPLETE
4184,0.3485858534755297,0.15000000000000002,0.45000000000000007,0.47500000000000003,0.22500000000000003,0.5,0.05,equal,0.25,0.325,COMPLETE
4185,0.4227274365202305,0.3,0.37500000000000006,0.425,0.15000000000000002,0.47500000000000003,0.05,equal,0.35000000000000003,0.35000000000000003,COMPLETE
4186,0.6544393809331743,0.2,0.45000000000000007,0.45,0.175,0.5,0.05,equal,0.375,0.4,COMPLETE
4187,0.4296881612134078,0.25,0.5,0.45,0.175,0.5,0.07500000000000001,equal,0.4,0.425,COMPLETE
4188,-0.105897559072559,0.2,0.45000000000000007,0.4,0.07500000000000001,0.5,0.375,equal,0.2,0.4,COMPLETE
4189,0.5965006572114379,0.22500000000000003,0.42500000000000004,0.425,0.175,0.5,0.05,equal,0.4,0.425,COMPLETE
4190,0.5384086386775806,0.2,0.45000000000000007,0.4,0.175,0.5,0.05,linear,0.4,0.425,COMPLETE
4191,0.30769214195588607,0.22500000000000003,0.525,0.425,0.175,0.5,0.07500000000000001,equal,0.375,0.425,COMPLETE
4192,0.45522922338165445,0.25,0.47500000000000003,0.45,0.175,0.5,0.05,equal,0.4,0.425,COMPLETE
4193,0.22477869928700664,0.4,0.4,0.425,0.175,0.5,0.05,equal,0.4,0.425,COMPLETE
4194,0.6310795334192677,0.175,0.47500000000000003,0.47500000000000003,0.175,0.5,0.05,equal,0.375,0.4,COMPLETE
4195,0.30769214195588607,0.22500000000000003,0.5,0.425,0.175,0.5,0.07500000000000001,equal,0.375,0.4,COMPLETE
4196,0.5373340622887588,0.2,0.42500000000000004,0.45,0.175,0.5,0.05,equal,0.22500000000000003,0.4,COMPLETE
4197,0.6036162669599417,0.175,0.45000000000000007,0.47500000000000003,0.175,0.5,0.05,equal,0.4,0.4,COMPLETE
4198,0.44163470463414123,0.15000000000000002,0.47500000000000003,0.375,0.175,0.5,0.05,equal,0.4,0.4,COMPLETE
4199,0.5534096633369282,0.275,0.45000000000000007,0.425,0.175,0.5,0.07500000000000001,equal,0.375,0.425,COMPLETE
4200,0.6262730764699653,0.2,0.42500000000000004,0.45,0.175,0.5,0.05,equal,0.375,0.425,COMPLETE
4201,0.3875631695064455,0.2,0.47500000000000003,0.4,0.175,0.5,0.05,equal,0.375,0.425,COMPLETE
4202,0.45729553175113224,0.25,0.5,0.45,0.175,0.5,0.07500000000000001,equal,0.375,0.4,COMPLETE
4203,0.21872158133785813,0.22500000000000003,0.55,0.425,0.175,0.5,0.05,equal,0.22500000000000003,0.15000000000000002,COMPLETE
4204,0.4126384905988657,0.175,0.45000000000000007,0.4,0.175,0.5,0.07500000000000001,equal,0.4,0.425,COMPLETE
