number,value,params_fund_net_buying,params_institutional_weight,params_number_fund_holdings,params_pe,params_revenue_growth,params_roe,params_stock_weight_option,params_take_profit,params_trailing_stop_loss,state
3653,0.5434355287985899,0.2,0.42500000000000004,0.425,0.175,0.5,0.05,equal,0.275,0.375,COMPLETE
3654,0.5470838547393414,0.22500000000000003,0.5,0.425,0.2,0.47500000000000003,0.05,equal,0.325,0.375,COMPLETE
3655,0.3158393722607603,0.15000000000000002,0.47500000000000003,0.35000000000000003,0.175,0.5,0.05,equal,0.3,0.4,COMPLETE
3656,0.37196656556578506,0.175,0.45000000000000007,0.375,0.15000000000000002,0.47500000000000003,0.05,equal,0.275,0.375,COMPLETE
3657,0.48880535148613324,0.25,0.47500000000000003,0.425,0.175,0.5,0.05,equal,0.3,0.375,COMPLETE
3658,0.5062739829022321,0.2,0.42500000000000004,0.4,0.2,0.47500000000000003,0.05,equal,0.325,0.4,COMPLETE
3659,0.4153658382516881,0.175,0.5,0.4,0.2,0.47500000000000003,0.05,equal,0.3,0.425,COMPLETE
3660,0.4702110117134354,0.22500000000000003,0.45000000000000007,0.425,0.175,0.5,0.05,equal,0.325,0.375,COMPLETE
3661,0.3734703386477225,0.2,0.47500000000000003,0.4,0.175,0.5,0.05,equal,0.3,0.375,COMPLETE
3662,0.24805061983365567,0.175,0.55,0.4,0.175,0.5,0.05,equal,0.325,0.4,COMPLETE
3663,0.6178023927042292,0.2,0.47500000000000003,0.425,0.2,0.47500000000000003,0.05,equal,0.3,0.375,COMPLETE
3664,0.4859987060892376,0.22500000000000003,0.45000000000000007,0.425,0.15000000000000002,0.47500000000000003,0.05,equal,0.3,0.4,COMPLETE
3665,0.5798127225808596,0.25,0.42500000000000004,0.425,0.2,0.47500000000000003,0.05,equal,0.275,0.375,COMPLETE
3666,0.3121742024653378,0.15000000000000002,0.2,0.375,0.15000000000000002,0.5,0.05,equal,0.3,0.375,COMPLETE
3667,0.5246453341276175,0.22500000000000003,0.5,0.425,0.2,0.47500000000000003,0.05,equal,0.275,0.4,COMPLETE
3668,0.5263865284454596,0.175,0.45000000000000007,0.4,0.175,0.5,0.05,equal,0.3,0.375,COMPLETE
3669,0.35415405944422024,0.125,0.47500000000000003,0.35000000000000003,0.175,0.5,0.05,equal,0.325,0.4,COMPLETE
3670,0.6131078359831613,0.2,0.42500000000000004,0.45,0.2,0.47500000000000003,0.05,equal,0.325,0.375,COMPLETE
3671,0.0962183184614228,0.2,0.47500000000000003,0.425,0.175,0.47500000000000003,0.25,linear,0.275,0.4,COMPLETE
3672,0.39726789279723207,0.25,0.5,0.425,0.175,0.5,0.05,equal,0.3,0.375,COMPLETE
3673,0.15982687993111439,0.15000000000000002,0.45000000000000007,0.8,0.2,0.15000000000000002,0.05,equal,0.325,0.375,COMPLETE
3674,-0.06234652741834082,0.22500000000000003,0.42500000000000004,0.425,0.175,0.5,0.3,equal,0.3,0.425,COMPLETE
3675,0.6409572857839799,0.2,0.45000000000000007,0.45,0.175,0.5,0.05,equal,0.3,0.45,COMPLETE
3676,0.302313027791682,0.35000000000000003,0.525,0.425,0.2,0.47500000000000003,0.05,equal,0.325,0.375,COMPLETE
3677,0.5236943238613962,0.175,0.47500000000000003,0.4,0.2,0.47500000000000003,0.05,equal,0.3,0.35000000000000003,COMPLETE
3678,-0.02357325355692953,0.6000000000000001,0.5,0.25,0.2,0.47500000000000003,0.05,equal,0.325,0.4,COMPLETE
3679,0.4392174118005623,0.175,0.45000000000000007,0.375,0.15000000000000002,0.5,0.05,equal,0.275,0.375,COMPLETE
3680,0.6140766273833025,0.22500000000000003,0.42500000000000004,0.425,0.175,0.5,0.05,equal,0.3,0.35000000000000003,COMPLETE
3681,0.46239760856645373,0.22500000000000003,0.45000000000000007,0.425,0.15000000000000002,0.47500000000000003,0.05,equal,0.275,0.375,COMPLETE
3682,0.450237329580842,0.2,0.47500000000000003,0.45,0.175,0.5,0.05,equal,0.3,0.425,COMPLETE
3683,0.6409572857839799,0.25,0.47500000000000003,0.425,0.2,0.47500000000000003,0.05,equal,0.325,0.35000000000000003,COMPLETE
3684,0.5081969201559844,0.2,0.42500000000000004,0.4,0.175,0.5,0.05,equal,0.3,0.375,COMPLETE
3685,0.5470838547393414,0.22500000000000003,0.5,0.425,0.2,0.47500000000000003,0.05,equal,0.325,0.4,COMPLETE
3686,0.5322918663877853,0.2,0.45000000000000007,0.45,0.175,0.5,0.07500000000000001,equal,0.3,0.375,COMPLETE
3687,0.45634782084469366,0.175,0.42500000000000004,0.4,0.15000000000000002,0.47500000000000003,0.05,equal,0.25,0.4,COMPLETE
3688,0.4367595902554935,0.22500000000000003,0.47500000000000003,0.425,0.175,0.5,0.05,equal,0.275,0.35000000000000003,COMPLETE
3689,0.6321192294830855,0.25,0.45000000000000007,0.45,0.175,0.47500000000000003,0.07500000000000001,equal,0.3,0.375,COMPLETE
3690,0.4538248164068305,0.175,0.42500000000000004,0.4,0.2,0.5,0.05,equal,0.325,0.425,COMPLETE
3691,0.40563555897444425,0.2,0.525,0.45,0.15000000000000002,0.47500000000000003,0.05,equal,0.275,0.35000000000000003,COMPLETE
3692,-0.08099247161672257,0.22500000000000003,0.47500000000000003,0.425,0.175,0.47500000000000003,0.325,equal,0.325,0.375,COMPLETE
3693,0.30769214195588607,0.2,0.55,0.45,0.175,0.5,0.07500000000000001,equal,0.3,0.35000000000000003,COMPLETE
3694,0.3688041049429426,0.25,0.5,0.425,0.2,0.5,0.05,equal,0.275,0.375,COMPLETE
3695,0.5232159711264126,0.2,0.45000000000000007,0.4,0.2,0.47500000000000003,0.05,linear,0.3,0.4,COMPLETE
3696,0.37077202831423894,0.15000000000000002,0.45000000000000007,0.375,0.175,0.5,0.07500000000000001,equal,0.3,0.4,COMPLETE
3697,-0.1095917140127505,0.22500000000000003,0.42500000000000004,0.425,0.125,0.47500000000000003,0.375,equal,0.325,0.35000000000000003,COMPLETE
3698,0.5236943238613962,0.175,0.47500000000000003,0.4,0.2,0.47500000000000003,0.05,equal,0.3,0.375,COMPLETE
3699,0.48880535148613324,0.22500000000000003,0.47500000000000003,0.425,0.175,0.5,0.05,equal,0.325,0.375,COMPLETE
3700,0.06365382655025315,0.7250000000000001,0.5,0.2,0.175,0.47500000000000003,0.07500000000000001,equal,0.3,0.35000000000000003,COMPLETE
3701,0.3172352252823121,0.175,0.45000000000000007,0.4,0.2,0.5,0.05,equal,0.3,0.4,COMPLETE
3702,0.5612766164860646,0.25,0.42500000000000004,0.45,0.15000000000000002,0.5,0.05,equal,0.25,0.375,COMPLETE
3703,0.6178023927042292,0.2,0.47500000000000003,0.45,0.2,0.47500000000000003,0.05,equal,0.325,0.35000000000000003,COMPLETE
3704,0.07624924308306928,0.2,0.45000000000000007,0.45,0.175,0.47500000000000003,0.275,equal,0.275,0.375,COMPLETE
3705,0.30769214195588607,0.22500000000000003,0.5,0.425,0.175,0.5,0.07500000000000001,equal,0.3,0.4,COMPLETE
3706,0.43413174399527343,0.175,0.42500000000000004,0.4,0.2,0.47500000000000003,0.05,equal,0.325,0.375,COMPLETE
3707,0.41792589777208683,0.22500000000000003,0.45000000000000007,0.425,0.175,0.5,0.05,equal,0.275,0.35000000000000003,COMPLETE
3708,0.5231472682863181,0.25,0.47500000000000003,0.45,0.2,0.47500000000000003,0.07500000000000001,equal,0.3,0.35000000000000003,COMPLETE
3709,0.595033788992593,0.2,0.42500000000000004,0.45,0.15000000000000002,0.5,0.05,equal,0.3,0.4,COMPLETE
3710,0.20237707023615398,0.175,0.5,0.4,0.175,0.47500000000000003,0.175,equal,0.3,0.375,COMPLETE
3711,0.468191836377839,0.22500000000000003,0.45000000000000007,0.425,0.2,0.5,0.05,linear,0.3,0.4,COMPLETE
3712,0.6178023927042292,0.2,0.47500000000000003,0.45,0.175,0.47500000000000003,0.07500000000000001,equal,0.325,0.375,COMPLETE
3713,0.26101354044240954,0.2,0.45000000000000007,0.45,0.2,0.325,0.05,equal,0.275,0.375,COMPLETE
3714,0.42862162311477,0.15000000000000002,0.525,0.375,0.15000000000000002,0.3,0.05,equal,0.325,0.4,COMPLETE
3715,0.5146478045336704,0.25,0.42500000000000004,0.425,0.175,0.5,0.07500000000000001,equal,0.325,0.35000000000000003,COMPLETE
3716,0.33801666398760755,0.22500000000000003,0.6250000000000001,0.425,0.2,0.47500000000000003,0.05,equal,0.3,0.425,COMPLETE
3717,0.48880535148613324,0.22500000000000003,0.47500000000000003,0.425,0.175,0.5,0.05,equal,0.3,0.375,COMPLETE
3718,0.2768093585599549,0.175,0.45000000000000007,0.675,0.15000000000000002,0.47500000000000003,0.05,equal,0.275,0.35000000000000003,COMPLETE
3719,0.30769214195588607,0.22500000000000003,0.5,0.425,0.175,0.5,0.07500000000000001,equal,0.325,0.35000000000000003,COMPLETE
3720,0.6131078359831613,0.2,0.42500000000000004,0.45,0.2,0.47500000000000003,0.05,equal,0.3,0.4,COMPLETE
3721,0.3734703386477225,0.2,0.47500000000000003,0.4,0.175,0.5,0.05,equal,0.3,0.375,COMPLETE
3722,0.3428348759044377,0.15000000000000002,0.45000000000000007,0.375,0.2,0.47500000000000003,0.07500000000000001,equal,0.325,0.35000000000000003,COMPLETE
3723,0.37344206733337226,0.25,0.5,0.425,0.175,0.5,0.05,equal,0.275,0.375,COMPLETE
3724,0.6053222943154498,0.2,0.45000000000000007,0.45,0.15000000000000002,0.47500000000000003,0.07500000000000001,equal,0.3,0.4,COMPLETE
3725,0.0355298514364773,0.5,0.47500000000000003,0.175,0.2,0.5,0.05,equal,0.325,0.375,COMPLETE
3726,0.43413174399527343,0.175,0.42500000000000004,0.4,0.2,0.47500000000000003,0.05,equal,0.3,0.35000000000000003,COMPLETE
3727,0.39850762857556266,0.2,0.47500000000000003,0.45,0.175,0.5,0.05,equal,0.275,0.375,COMPLETE
3728,0.5260054103748679,0.22500000000000003,0.45000000000000007,0.425,0.175,0.47500000000000003,0.07500000000000001,equal,0.325,0.4,COMPLETE
3729,0.2825324083608166,0.325,0.525,0.425,0.15000000000000002,0.47500000000000003,0.05,equal,0.3,0.35000000000000003,COMPLETE
3730,0.412361694073473,0.175,0.42500000000000004,0.4,0.175,0.5,0.05,equal,0.275,0.375,COMPLETE
3731,0.40020788408414576,0.25,0.5,0.425,0.2,0.5,0.05,equal,0.3,0.35000000000000003,COMPLETE
3732,0.5478120767053088,0.22500000000000003,0.47500000000000003,0.45,0.175,0.47500000000000003,0.07500000000000001,linear,0.25,0.375,COMPLETE
3733,0.488805351486133,0.2,0.45000000000000007,0.45,0.2,0.5,0.05,equal,0.325,0.375,COMPLETE
3734,0.6321192294830849,0.22500000000000003,0.42500000000000004,0.425,0.2,0.47500000000000003,0.05,equal,0.3,0.425,COMPLETE
3735,0.3939813704377464,0.175,0.47500000000000003,0.4,0.175,0.5,0.07500000000000001,equal,0.275,0.4,COMPLETE
3736,0.5260054103748681,0.25,0.45000000000000007,0.425,0.2,0.47500000000000003,0.05,equal,0.325,0.35000000000000003,COMPLETE
3737,0.24805061983365495,0.22500000000000003,0.525,0.425,0.175,0.5,0.05,equal,0.3,0.375,COMPLETE
3738,0.1980302726267876,0.2,0.5,0.45,0.2,0.2,0.07500000000000001,equal,0.325,0.35000000000000003,COMPLETE
3739,0.5851660751418166,0.2,0.42500000000000004,0.45,0.15000000000000002,0.47500000000000003,0.05,equal,0.375,0.375,COMPLETE
3740,0.4063819777487687,0.15000000000000002,0.45000000000000007,0.375,0.2,0.47500000000000003,0.05,equal,0.3,0.4,COMPLETE
3741,0.5408356776365569,0.22500000000000003,0.47500000000000003,0.425,0.175,0.5,0.07500000000000001,equal,0.3,0.4,COMPLETE
3742,0.4597254539261147,0.175,0.4,0.4,0.175,0.5,0.05,equal,0.3,0.375,COMPLETE
3743,0.46636935811011165,0.175,0.45000000000000007,0.4,0.15000000000000002,0.47500000000000003,0.05,equal,0.3,0.35000000000000003,COMPLETE
3744,0.4686353038907793,0.2,0.5,0.45,0.175,0.5,0.05,equal,0.325,0.35000000000000003,COMPLETE
3745,0.5442914274920452,0.2,0.42500000000000004,0.45,0.175,0.47500000000000003,0.07500000000000001,equal,0.275,0.375,COMPLETE
3746,0.5899119806344126,0.25,0.47500000000000003,0.425,0.2,0.47500000000000003,0.05,equal,0.275,0.4,COMPLETE
3747,0.39065972465186416,0.22500000000000003,0.47500000000000003,0.425,0.2,0.375,0.05,equal,0.375,0.375,COMPLETE
3748,0.39888152326021187,0.175,0.45000000000000007,0.4,0.175,0.5,0.07500000000000001,equal,0.325,0.425,COMPLETE
3749,0.6140766273833025,0.22500000000000003,0.42500000000000004,0.425,0.175,0.5,0.05,equal,0.3,0.35000000000000003,COMPLETE
3750,0.5068109669230413,0.2,0.5,0.45,0.15000000000000002,0.47500000000000003,0.05,equal,0.3,0.375,COMPLETE
3751,0.6409572857839799,0.25,0.47500000000000003,0.425,0.2,0.47500000000000003,0.05,equal,0.325,0.35000000000000003,COMPLETE
3752,0.4846635585892468,0.15000000000000002,0.4,0.375,0.175,0.5,0.07500000000000001,equal,0.4,0.4,COMPLETE
3753,-0.20066081065449093,0.2,0.45000000000000007,0.45,0.075,0.5,0.425,linear,0.275,0.375,COMPLETE
3754,0.5950337889925932,0.22500000000000003,0.42500000000000004,0.425,0.15000000000000002,0.47500000000000003,0.05,equal,0.3,0.35000000000000003,COMPLETE
3755,0.6409572857839799,0.2,0.45000000000000007,0.45,0.2,0.47500000000000003,0.05,equal,0.325,0.375,COMPLETE
3756,0.2805551833596714,0.25,0.47500000000000003,0.425,0.2,0.35000000000000003,0.07500000000000001,equal,0.3,0.4,COMPLETE
3757,0.24805061983365567,0.125,0.5750000000000001,0.375,0.175,0.5,0.05,equal,0.375,0.35000000000000003,COMPLETE
3758,0.24805061983365573,0.2,0.5,0.4,0.175,0.5,0.05,equal,0.3,0.425,COMPLETE
3759,0.6321192294830855,0.22500000000000003,0.45000000000000007,0.45,0.175,0.47500000000000003,0.07500000000000001,equal,0.325,0.375,COMPLETE
3760,0.41536583825168827,0.175,0.525,0.4,0.15000000000000002,0.47500000000000003,0.05,equal,0.275,0.4,COMPLETE
3761,0.6131078359831612,0.2,0.42500000000000004,0.45,0.175,0.5,0.05,equal,0.3,0.35000000000000003,COMPLETE
3762,0.4910843275623315,0.22500000000000003,0.47500000000000003,0.425,0.175,0.5,0.07500000000000001,equal,0.25,0.375,COMPLETE
3763,0.12992494026809953,0.4,0.45000000000000007,0.425,0.2,0.25,0.05,equal,0.325,0.375,COMPLETE
3764,0.6321192294830849,0.22500000000000003,0.42500000000000004,0.425,0.2,0.47500000000000003,0.05,equal,0.3,0.35000000000000003,COMPLETE
3765,0.3939813704377464,0.175,0.47500000000000003,0.4,0.175,0.5,0.07500000000000001,equal,0.275,0.4,COMPLETE
3766,0.5083477353823329,0.25,0.5,0.45,0.15000000000000002,0.47500000000000003,0.05,equal,0.375,0.375,COMPLETE
3767,0.13040436416333887,0.8750000000000001,0.4,0.05,0.175,0.5,0.05,equal,0.3,0.35000000000000003,COMPLETE
3768,0.5263865284454595,0.175,0.45000000000000007,0.4,0.2,0.47500000000000003,0.05,equal,0.3,0.375,COMPLETE
3769,0.5242172849190667,0.15000000000000002,0.42500000000000004,0.375,0.175,0.5,0.07500000000000001,equal,0.4,0.4,COMPLETE
3770,0.6178023927042292,0.2,0.47500000000000003,0.45,0.2,0.47500000000000003,0.05,equal,0.325,0.375,COMPLETE
3771,0.4702110117134354,0.22500000000000003,0.45000000000000007,0.425,0.175,0.5,0.05,equal,0.3,0.425,COMPLETE
3772,0.2471436516959351,0.2,0.5,0.45,0.2,0.275,0.07500000000000001,equal,0.3,0.35000000000000003,COMPLETE
3773,0.4352914419478921,0.25,0.4,0.45,0.175,0.5,0.05,equal,0.275,0.375,COMPLETE
3774,0.4845802255303101,0.2,0.47500000000000003,0.4,0.15000000000000002,0.47500000000000003,0.05,linear,0.325,0.35000000000000003,COMPLETE
3775,0.5997514435684571,0.22500000000000003,0.47500000000000003,0.425,0.2,0.47500000000000003,0.05,equal,0.4,0.375,COMPLETE
3776,0.13320330086916424,0.175,0.42500000000000004,0.6500000000000001,0.2,0.125,0.07500000000000001,equal,0.3,0.4,COMPLETE
3777,0.1243030898187423,0.22500000000000003,0.45000000000000007,0.425,0.175,0.47500000000000003,0.25,equal,0.325,0.4,COMPLETE
3778,0.41714502310747714,0.2,0.5,0.45,0.175,0.5,0.05,equal,0.275,0.375,COMPLETE
3779,0.5116897704700882,0.25,0.42500000000000004,0.425,0.15000000000000002,0.47500000000000003,0.05,equal,0.375,0.35000000000000003,COMPLETE
3780,0.3076921419558863,0.175,0.525,0.4,0.175,0.5,0.07500000000000001,equal,0.275,0.35000000000000003,COMPLETE
3781,0.4538248164068305,0.15000000000000002,0.45000000000000007,0.375,0.2,0.5,0.05,equal,0.3,0.4,COMPLETE
3782,0.4816855689472004,0.2,0.4,0.45,0.2,0.47500000000000003,0.05,equal,0.325,0.375,COMPLETE
3783,-0.19833377715521683,0.175,0.47500000000000003,0.4,0.025,0.47500000000000003,0.5,equal,0.3,0.375,COMPLETE
3784,0.4702110117134354,0.22500000000000003,0.45000000000000007,0.425,0.175,0.5,0.05,equal,0.325,0.35000000000000003,COMPLETE
3785,0.30769214195588607,0.22500000000000003,0.55,0.425,0.175,0.47500000000000003,0.07500000000000001,equal,0.3,0.4,COMPLETE
3786,0.48880535148613324,0.2,0.47500000000000003,0.45,0.2,0.5,0.05,equal,0.325,0.375,COMPLETE
3787,0.3768374383395167,0.25,0.5,0.425,0.15000000000000002,0.47500000000000003,0.05,equal,0.275,0.35000000000000003,COMPLETE
3788,0.0856614397217151,0.8500000000000001,0.45000000000000007,0.125,0.175,0.5,0.07500000000000001,equal,0.3,0.4,COMPLETE
3789,0.6262730764699654,0.2,0.42500000000000004,0.45,0.2,0.47500000000000003,0.05,equal,0.375,0.375,COMPLETE
3790,0.4702110117134354,0.22500000000000003,0.45000000000000007,0.425,0.175,0.5,0.05,equal,0.3,0.35000000000000003,COMPLETE
3791,0.37922921548444355,0.175,0.47500000000000003,0.4,0.2,0.47500000000000003,0.07500000000000001,equal,0.325,0.375,COMPLETE
3792,0.595033788992593,0.2,0.42500000000000004,0.45,0.15000000000000002,0.5,0.05,equal,0.3,0.35000000000000003,COMPLETE
3793,0.6178023927042292,0.22500000000000003,0.47500000000000003,0.425,0.2,0.47500000000000003,0.05,equal,0.3,0.4,COMPLETE
3794,0.46253674605363726,0.175,0.4,0.4,0.175,0.5,0.05,linear,0.4,0.375,COMPLETE
3795,0.10185865289911696,0.47500000000000003,0.45000000000000007,0.425,0.175,0.47500000000000003,0.07500000000000001,equal,0.275,0.375,COMPLETE
3796,0.29929808372485234,0.375,0.5,0.425,0.2,0.5,0.05,equal,0.325,0.35000000000000003,COMPLETE
3797,-0.19833377715521683,0.125,0.47500000000000003,0.375,0.05,0.47500000000000003,0.47500000000000003,equal,0.325,0.425,COMPLETE
3798,0.12067831339527316,0.25,0.42500000000000004,0.45,0.35000000000000003,0.47500000000000003,0.07500000000000001,equal,0.375,0.4,COMPLETE
3799,0.10189637527301564,0.15000000000000002,0.45000000000000007,0.35000000000000003,0.175,0.5,0.05,equal,0.05,0.375,COMPLETE
3800,0.38127083320453514,0.22500000000000003,0.5,0.45,0.2,0.5,0.05,equal,0.3,0.35000000000000003,COMPLETE
3801,0.4153658382516877,0.2,0.525,0.45,0.175,0.47500000000000003,0.07500000000000001,equal,0.3,0.35000000000000003,COMPLETE
3802,0.3875631695064454,0.2,0.45000000000000007,0.4,0.2,0.5,0.05,equal,0.375,0.4,COMPLETE
3803,0.4953308140528348,0.25,0.4,0.425,0.15000000000000002,0.47500000000000003,0.05,equal,0.3,0.375,COMPLETE
3804,0.5451183289893459,0.175,0.47500000000000003,0.4,0.175,0.5,0.05,equal,0.325,0.375,COMPLETE
3805,0.5997514435684572,0.22500000000000003,0.47500000000000003,0.45,0.2,0.47500000000000003,0.05,equal,0.4,0.35000000000000003,COMPLETE
3806,0.4481953720493269,0.2,0.42500000000000004,0.45,0.175,0.5,0.07500000000000001,equal,0.275,0.375,COMPLETE
3807,-0.13436237055588118,0.6250000000000001,0.5,0.325,0.15000000000000002,0.47500000000000003,0.05,equal,0.25,0.375,COMPLETE
3808,0.3172352252823121,0.175,0.45000000000000007,0.4,0.2,0.5,0.05,equal,0.3,0.4,COMPLETE
3809,0.4007919959775752,0.275,0.47500000000000003,0.425,0.2,0.47500000000000003,0.05,equal,0.275,0.35000000000000003,COMPLETE
3810,0.6140766273833025,0.22500000000000003,0.42500000000000004,0.425,0.175,0.5,0.05,equal,0.325,0.35000000000000003,COMPLETE
3811,0.4880382692171087,0.175,0.45000000000000007,0.4,0.175,0.47500000000000003,0.07500000000000001,equal,0.3,0.4,COMPLETE
3812,0.32650266348233875,0.25,0.5,0.425,0.175,0.5,0.07500000000000001,equal,0.325,0.375,COMPLETE
3813,0.5019074635544102,0.2,0.4,0.45,0.15000000000000002,0.47500000000000003,0.05,equal,0.275,0.425,COMPLETE
3814,0.488805351486133,0.22500000000000003,0.45000000000000007,0.425,0.2,0.5,0.05,equal,0.3,0.35000000000000003,COMPLETE
3815,0.5048553932829349,0.175,0.45000000000000007,0.4,0.2,0.47500000000000003,0.05,linear,0.3,0.4,COMPLETE
3816,0.46326331304828533,0.2,0.47500000000000003,0.45,0.175,0.5,0.05,equal,0.375,0.375,COMPLETE
3817,0.6140766273833015,0.25,0.42500000000000004,0.425,0.175,0.47500000000000003,0.07500000000000001,equal,0.325,0.45,COMPLETE
3818,0.5032479503012194,0.22500000000000003,0.47500000000000003,0.45,0.15000000000000002,0.5,0.05,equal,0.3,0.375,COMPLETE
3819,0.4880382692171088,0.15000000000000002,0.45000000000000007,0.4,0.175,0.47500000000000003,0.07500000000000001,equal,0.325,0.35000000000000003,COMPLETE
3820,0.4702110117134354,0.2,0.42500000000000004,0.45,0.2,0.5,0.05,equal,0.3,0.375,COMPLETE
3821,0.5246453341276175,0.22500000000000003,0.5,0.425,0.2,0.47500000000000003,0.05,equal,0.275,0.4,COMPLETE
3822,0.4824309012881795,0.2,0.47500000000000003,0.45,0.15000000000000002,0.47500000000000003,0.05,equal,0.275,0.375,COMPLETE
3823,0.30769214195588557,0.25,0.525,0.425,0.175,0.5,0.07500000000000001,equal,0.3,0.35000000000000003,COMPLETE
3824,0.02989644474091968,0.175,0.4,0.4,0.175,0.47500000000000003,0.22500000000000003,equal,0.325,0.4,COMPLETE
3825,0.488805351486133,0.22500000000000003,0.45000000000000007,0.425,0.2,0.5,0.05,equal,0.3,0.375,COMPLETE
3826,0.48164583778753395,0.2,0.5,0.45,0.175,0.5,0.05,equal,0.375,0.375,COMPLETE
3827,0.6321192294830849,0.22500000000000003,0.42500000000000004,0.425,0.2,0.47500000000000003,0.05,equal,0.3,0.35000000000000003,COMPLETE
3828,0.5030653769263557,0.175,0.45000000000000007,0.375,0.175,0.5,0.05,equal,0.275,0.425,COMPLETE
3829,0.6178023927042292,0.2,0.47500000000000003,0.45,0.175,0.47500000000000003,0.07500000000000001,equal,0.325,0.375,COMPLETE
3830,0.2384711012495132,0.2,0.42500000000000004,0.45,0.175,0.5,0.2,equal,0.3,0.35000000000000003,COMPLETE
3831,0.3189749833432264,0.275,0.30000000000000004,0.425,0.15000000000000002,0.47500000000000003,0.05,equal,0.4,0.4,COMPLETE
3832,0.5534096633369282,0.25,0.45000000000000007,0.425,0.175,0.5,0.07500000000000001,equal,0.375,0.375,COMPLETE
3833,0.24805061983365495,0.22500000000000003,0.525,0.425,0.2,0.47500000000000003,0.05,equal,0.325,0.45,COMPLETE
3834,0.5408356776365568,0.22500000000000003,0.47500000000000003,0.45,0.175,0.5,0.07500000000000001,equal,0.3,0.35000000000000003,COMPLETE
3835,0.09877347385373557,0.175,0.975,0.4,0.2,0.47500000000000003,0.05,equal,0.3,0.35000000000000003,COMPLETE
3836,0.4289230271063845,0.15000000000000002,0.45000000000000007,0.375,0.2,0.5,0.05,equal,0.25,0.4,COMPLETE
3837,0.4816855689472004,0.2,0.4,0.45,0.2,0.47500000000000003,0.05,equal,0.325,0.375,COMPLETE
3838,0.052386864608206254,0.2,0.47500000000000003,0.45,0.2,0.07500000000000001,0.07500000000000001,linear,0.3,0.375,COMPLETE
3839,0.3768374383395167,0.25,0.5,0.425,0.15000000000000002,0.47500000000000003,0.05,equal,0.275,0.325,COMPLETE
3840,0.6131078359831612,0.2,0.42500000000000004,0.45,0.175,0.5,0.05,equal,0.325,0.35000000000000003,COMPLETE
3841,0.3499934014212858,0.175,0.47500000000000003,0.375,0.175,0.47500000000000003,0.07500000000000001,equal,0.275,0.4,COMPLETE
3842,0.1312284064279296,0.22500000000000003,0.42500000000000004,0.425,0.175,0.5,0.275,equal,0.375,0.325,COMPLETE
3843,0.4153658382516877,0.2,0.55,0.4,0.15000000000000002,0.47500000000000003,0.05,equal,0.3,0.4,COMPLETE
3844,0.3646879298152224,0.3,0.5,0.425,0.2,0.47500000000000003,0.05,equal,0.325,0.35000000000000003,COMPLETE
