number,value,params_fund_net_buying,params_institutional_weight,params_number_fund_holdings,params_pe,params_revenue_growth,params_roe,params_stock_weight_option,params_take_profit,params_trailing_stop_loss,state
3074,0.468790590874879,0.25,0.45000000000000007,0.45,0.275,0.45,0.05,equal,0.45,0.275,COMPLETE
3075,0.0785330347761642,0.22500000000000003,0.42500000000000004,0.45,0.22500000000000003,0.5,0.25,equal,0.47500000000000003,0.25,COMPLETE
3076,0.22010181991256283,0.325,0.5,0.55,0.25,0.47500000000000003,0.1,equal,0.5,0.35000000000000003,COMPLETE
3077,0.37912552126788807,0.2,0.47500000000000003,0.4,0.22500000000000003,0.45,0.07500000000000001,equal,0.5,0.325,COMPLETE
3078,0.5186039954596487,0.175,0.45000000000000007,0.375,0.22500000000000003,0.47500000000000003,0.05,equal,0.35000000000000003,0.275,COMPLETE
3079,0.5277865566855137,0.22500000000000003,0.4,0.425,0.2,0.45,0.05,softmax,0.47500000000000003,0.3,COMPLETE
3080,0.439258875065868,0.25,0.47500000000000003,0.45,0.25,0.47500000000000003,0.05,equal,0.5,0.25,COMPLETE
3081,0.46688272720965035,0.2,0.42500000000000004,0.47500000000000003,0.25,0.5,0.07500000000000001,equal,0.45,0.275,COMPLETE
3082,0.32754131428290156,0.175,0.45000000000000007,0.47500000000000003,0.4,0.45,0.05,equal,0.47500000000000003,0.3,COMPLETE
3083,0.05993654869163074,0.7000000000000001,0.42500000000000004,0.175,0.25,0.47500000000000003,0.07500000000000001,equal,0.5,0.275,COMPLETE
3084,0.2522421215586058,0.22500000000000003,0.5,0.425,0.25,0.5,0.07500000000000001,softmax,0.47500000000000003,0.35000000000000003,COMPLETE
3085,0.40982396755878225,0.15000000000000002,0.47500000000000003,0.35000000000000003,0.275,0.45,0.05,equal,0.5,0.325,COMPLETE
3086,0.3151916191624503,0.22500000000000003,0.45000000000000007,0.6500000000000001,0.3,0.425,0.05,equal,0.425,0.3,COMPLETE
3087,0.5303639071172315,0.25,0.42500000000000004,0.45,0.22500000000000003,0.47500000000000003,0.05,equal,0.325,0.3,COMPLETE
3088,0.32247017265599,0.2,0.45000000000000007,0.4,0.22500000000000003,0.425,0.1,equal,0.45,0.325,COMPLETE
3089,0.13600704153995244,0.22500000000000003,0.5,0.425,0.175,0.47500000000000003,0.22500000000000003,softmax,0.47500000000000003,0.25,COMPLETE
3090,0.22318253432662577,0.425,0.4,0.425,0.22500000000000003,0.45,0.07500000000000001,equal,0.47500000000000003,0.275,COMPLETE
3091,0.11385648409706398,0.2,0.45000000000000007,0.4,0.25,0.5,0.1,equal,0.5,0.275,COMPLETE
3092,0.38767332423688905,0.175,0.47500000000000003,0.375,0.22500000000000003,0.47500000000000003,0.05,equal,0.5,0.275,COMPLETE
3093,0.5211957555337041,0.22500000000000003,0.5,0.45,0.275,0.45,0.05,equal,0.47500000000000003,0.3,COMPLETE
3094,0.4153884575242992,0.25,0.42500000000000004,0.425,0.25,0.47500000000000003,0.07500000000000001,softmax,0.45,0.3,COMPLETE
3095,0.36320103249906655,0.275,0.47500000000000003,0.425,0.2,0.4,0.07500000000000001,equal,0.25,0.375,COMPLETE
3096,0.5675568155473311,0.175,0.42500000000000004,0.47500000000000003,0.22500000000000003,0.45,0.07500000000000001,equal,0.47500000000000003,0.325,COMPLETE
3097,0.33984942684378416,0.2,0.45000000000000007,0.4,0.25,0.5,0.05,equal,0.3,0.25,COMPLETE
3098,0.4684947100202378,0.22500000000000003,0.4,0.45,0.275,0.45,0.05,equal,0.5,0.275,COMPLETE
3099,0.3931846762804633,0.22500000000000003,0.525,0.45,0.15000000000000002,0.47500000000000003,0.05,softmax,0.45,0.3,COMPLETE
3100,0.37912552126788807,0.2,0.47500000000000003,0.4,0.22500000000000003,0.45,0.07500000000000001,equal,0.47500000000000003,0.25,COMPLETE
3101,0.43236799669277665,0.25,0.37500000000000006,0.45,0.25,0.47500000000000003,0.05,equal,0.5,0.3,COMPLETE
3102,0.000581139438007805,0.6500000000000001,0.42500000000000004,0.25,0.25,0.5,0.05,equal,0.47500000000000003,0.325,COMPLETE
3103,0.22236298067362503,0.275,0.47500000000000003,0.425,0.25,0.47500000000000003,0.07500000000000001,equal,0.5,0.275,COMPLETE
3104,0.25841565120173504,0.2,0.55,0.47500000000000003,0.22500000000000003,0.47500000000000003,0.05,equal,0.45,0.25,COMPLETE
3105,0.49216135372457753,0.175,0.45000000000000007,0.5,0.2,0.45,0.05,softmax,0.35000000000000003,0.275,COMPLETE
3106,-0.12373823278515184,0.25,0.45000000000000007,0.45,0.225,0.47500000000000003,0.3,equal,0.5,0.3,COMPLETE
3107,0.12049155421411374,0.22500000000000003,0.8500000000000001,0.45,0.25,0.5,0.07500000000000001,equal,0.47500000000000003,0.325,COMPLETE
3108,0.21027572977976272,0.175,0.5,0.47500000000000003,0.275,0.425,0.07500000000000001,equal,0.07500000000000001,0.3,COMPLETE
3109,0.5236671143685783,0.22500000000000003,0.42500000000000004,0.425,0.2,0.45,0.05,equal,0.45,0.25,COMPLETE
3110,0.27874248394989465,0.25,0.47500000000000003,0.425,0.25,0.47500000000000003,0.1,softmax,0.47500000000000003,0.275,COMPLETE
3111,0.4300166965017419,0.15000000000000002,0.4,0.375,0.22500000000000003,0.47500000000000003,0.05,equal,0.5,0.35000000000000003,COMPLETE
3112,0.5211387698150434,0.2,0.45000000000000007,0.4,0.275,0.45,0.05,equal,0.47500000000000003,0.275,COMPLETE
3113,0.23301960795430576,0.2,0.47500000000000003,0.4,0.25,0.5,0.07500000000000001,equal,0.425,0.3,COMPLETE
3114,0.44573078851453735,0.22500000000000003,0.35000000000000003,0.45,0.25,0.47500000000000003,0.07500000000000001,equal,0.375,0.275,COMPLETE
3115,0.4889023586932729,0.2,0.45000000000000007,0.4,0.2,0.45,0.05,softmax,0.47500000000000003,0.3,COMPLETE
3116,0.5653190101716724,0.22500000000000003,0.42500000000000004,0.425,0.275,0.45,0.05,equal,0.5,0.325,COMPLETE
3117,0.2956266197070444,0.2,0.5,0.45,0.25,0.5,0.05,equal,0.47500000000000003,0.25,COMPLETE
3118,0.3765310644082838,0.275,0.5,0.425,0.22500000000000003,0.425,0.1,equal,0.425,0.3,COMPLETE
3119,0.43116460780157767,0.175,0.4,0.6250000000000001,0.25,0.47500000000000003,0.07500000000000001,equal,0.5,0.275,COMPLETE
3120,0.3526372318557889,0.25,0.525,0.45,0.22500000000000003,0.47500000000000003,0.05,softmax,0.47500000000000003,0.325,COMPLETE
3121,-0.005730517182565748,0.22500000000000003,0.45000000000000007,0.425,0.275,0.07500000000000001,0.05,equal,0.4,0.25,COMPLETE
3122,0.1779899893114291,0.22500000000000003,0.7500000000000001,0.425,0.22500000000000003,0.45,0.07500000000000001,equal,0.5,0.3,COMPLETE
3123,0.031614593407909994,0.15000000000000002,0.47500000000000003,0.5,0.25,0.5,0.07500000000000001,equal,0.45,0.05,COMPLETE
3124,0.5342181630118251,0.2,0.42500000000000004,0.47500000000000003,0.22500000000000003,0.47500000000000003,0.05,equal,0.47500000000000003,0.275,COMPLETE
3125,0.1935783650528118,0.175,0.37500000000000006,0.7500000000000001,0.2,0.425,0.07500000000000001,softmax,0.47500000000000003,0.25,COMPLETE
3126,0.5210527709871444,0.25,0.47500000000000003,0.425,0.175,0.47500000000000003,0.05,equal,0.5,0.35000000000000003,COMPLETE
3127,0.5211387698150434,0.2,0.45000000000000007,0.4,0.275,0.45,0.05,equal,0.5,0.3,COMPLETE
3128,0.5050924080127922,0.22500000000000003,0.42500000000000004,0.45,0.25,0.45,0.07500000000000001,equal,0.45,0.275,COMPLETE
3129,0.37683743833951633,0.25,0.45000000000000007,0.425,0.2,0.425,0.05,equal,0.45,0.325,COMPLETE
3130,0.33871209028898386,0.3,0.47500000000000003,0.425,0.25,0.5,0.07500000000000001,softmax,0.47500000000000003,0.275,COMPLETE
3131,0.27901978008870937,0.2,0.5,0.47500000000000003,0.25,0.47500000000000003,0.07500000000000001,equal,0.5,0.3,COMPLETE
3132,0.6246360197681787,0.2,0.42500000000000004,0.45,0.22500000000000003,0.47500000000000003,0.05,equal,0.47500000000000003,0.25,COMPLETE
3133,0.42770697317603357,0.22500000000000003,0.4,0.45,0.275,0.45,0.05,equal,0.275,0.275,COMPLETE
3134,0.6246360197681785,0.22500000000000003,0.45000000000000007,0.425,0.22500000000000003,0.47500000000000003,0.05,equal,0.47500000000000003,0.3,COMPLETE
3135,0.5675568155473311,0.175,0.45000000000000007,0.47500000000000003,0.22500000000000003,0.45,0.07500000000000001,equal,0.5,0.47500000000000003,COMPLETE
3136,0.4573047846505224,0.25,0.47500000000000003,0.45,0.25,0.5,0.05,softmax,0.325,0.325,COMPLETE
3137,0.5307954049525634,0.2,0.47500000000000003,0.4,0.22500000000000003,0.47500000000000003,0.05,equal,0.45,0.3,COMPLETE
3138,0.39634435420365444,0.2,0.4,0.4,0.25,0.45,0.1,equal,0.4,0.275,COMPLETE
3139,0.4249828061147667,0.22500000000000003,0.42500000000000004,0.45,0.25,0.47500000000000003,0.07500000000000001,equal,0.47500000000000003,0.25,COMPLETE
3140,0.3822180294047801,0.25,0.5,0.425,0.22500000000000003,0.47500000000000003,0.05,equal,0.47500000000000003,0.35000000000000003,COMPLETE
3141,0.44293565715481253,0.275,0.45000000000000007,0.425,0.25,0.5,0.05,softmax,0.425,0.3,COMPLETE
3142,0.09329318512858642,0.8250000000000001,0.42500000000000004,0.15,0.22500000000000003,0.45,0.07500000000000001,equal,0.25,0.275,COMPLETE
3143,-0.06278126585220375,0.175,0.47500000000000003,0.5,0.25,0.45,0.275,equal,0.5,0.3,COMPLETE
3144,0.15999057899527763,0.22500000000000003,0.45000000000000007,0.45,0.3,0.275,0.05,equal,0.5,0.325,COMPLETE
3145,0.25214045975357446,0.2,0.525,0.4,0.25,0.47500000000000003,0.07500000000000001,equal,0.47500000000000003,0.275,COMPLETE
3146,0.21765043219862473,0.15000000000000002,0.47500000000000003,0.375,0.25,0.5,0.1,softmax,0.5,0.25,COMPLETE
3147,0.4056355589744446,0.25,0.5,0.425,0.2,0.45,0.05,equal,0.47500000000000003,0.275,COMPLETE
3148,0.6246360197681787,0.22500000000000003,0.42500000000000004,0.45,0.22500000000000003,0.47500000000000003,0.05,equal,0.5,0.3,COMPLETE
3149,0.3710282314279863,0.2,0.45000000000000007,0.4,0.275,0.425,0.07500000000000001,equal,0.45,0.325,COMPLETE
3150,0.21097892555340003,0.22500000000000003,0.4,0.425,0.175,0.375,0.07500000000000001,equal,0.47500000000000003,0.25,COMPLETE
3151,0.4314466653959443,0.175,0.42500000000000004,0.375,0.22500000000000003,0.47500000000000003,0.05,softmax,0.5,0.3,COMPLETE
3152,0.3449516172355417,0.175,0.47500000000000003,0.47500000000000003,0.15000000000000002,0.4,0.05,equal,0.47500000000000003,0.275,COMPLETE
3153,0.36330288802614796,0.2,0.45000000000000007,0.45,0.25,0.45,0.1,equal,0.175,0.325,COMPLETE
3154,0.46532490339092425,0.25,0.37500000000000006,0.425,0.22500000000000003,0.47500000000000003,0.05,equal,0.45,0.3,COMPLETE
3155,0.26449205938421283,0.22500000000000003,0.525,0.45,0.25,0.5,0.07500000000000001,equal,0.47500000000000003,0.25,COMPLETE
3156,0.26572875599629237,0.2,0.5750000000000001,0.47500000000000003,0.275,0.45,0.05,softmax,0.5,0.275,COMPLETE
3157,0.26988904778163125,0.22500000000000003,0.47500000000000003,0.425,0.25,0.47500000000000003,0.07500000000000001,equal,0.45,0.275,COMPLETE
3158,0.5193600509196172,0.15000000000000002,0.5,0.5,0.275,0.425,0.05,equal,0.5,0.35000000000000003,COMPLETE
3159,0.3743990996380781,0.25,0.4,0.425,0.25,0.5,0.05,equal,0.47500000000000003,0.3,COMPLETE
3160,0.3948605479095605,0.175,0.55,0.47500000000000003,0.22500000000000003,0.45,0.07500000000000001,equal,0.35000000000000003,0.325,COMPLETE
3161,0.5945631391190089,0.275,0.42500000000000004,0.425,0.22500000000000003,0.47500000000000003,0.05,equal,0.47500000000000003,0.275,COMPLETE
3162,0.40008373376695316,0.2,0.45000000000000007,0.4,0.25,0.45,0.1,equal,0.5,0.25,COMPLETE
3163,0.4314723632596319,0.22500000000000003,0.45000000000000007,0.45,0.25,0.47500000000000003,0.07500000000000001,softmax,0.45,0.3,COMPLETE
3164,0.475787454678798,0.22500000000000003,0.47500000000000003,0.45,0.2,0.45,0.05,equal,0.47500000000000003,0.275,COMPLETE
3165,-0.03907735629127298,0.5750000000000001,0.47500000000000003,0.15000000000000002,0.25,0.47500000000000003,0.07500000000000001,equal,0.425,0.325,COMPLETE
3166,0.30524527016427716,0.25,0.42500000000000004,0.45,0.25,0.5,0.05,equal,0.325,0.3,COMPLETE
3167,0.466597938787758,0.175,0.45000000000000007,0.375,0.175,0.47500000000000003,0.05,softmax,0.5,0.275,COMPLETE
3168,0.38767332423688966,0.2,0.5,0.4,0.22500000000000003,0.45,0.07500000000000001,equal,0.47500000000000003,0.25,COMPLETE
3169,-0.19213672243360322,0.2,0.4,0.4,0.1,0.425,0.4,equal,0.5,0.07500000000000001,COMPLETE
3170,0.24482941749175113,0.22500000000000003,0.35000000000000003,0.45,0.25,0.5,0.05,equal,0.45,0.3,COMPLETE
3171,0.24343576518992088,0.275,0.45000000000000007,0.425,0.3,0.45,0.05,equal,0.47500000000000003,0.3,COMPLETE
3172,0.35678048757863323,0.2,0.42500000000000004,0.47500000000000003,0.25,0.47500000000000003,0.07500000000000001,softmax,0.3,0.25,COMPLETE
3173,0.4404955848818286,0.25,0.47500000000000003,0.425,0.22500000000000003,0.47500000000000003,0.05,equal,0.5,0.375,COMPLETE
3174,0.38623101854755953,0.175,0.5,0.47500000000000003,0.22500000000000003,0.45,0.07500000000000001,equal,0.47500000000000003,0.275,COMPLETE
3175,0.6054729525697832,0.22500000000000003,0.42500000000000004,0.425,0.22500000000000003,0.47500000000000003,0.05,equal,0.45,0.325,COMPLETE
3176,0.5015797626641589,0.2,0.45000000000000007,0.4,0.2,0.425,0.05,equal,0.5,0.35000000000000003,COMPLETE
3177,0.32617779769461264,0.22500000000000003,0.47500000000000003,0.45,0.25,0.5,0.07500000000000001,softmax,0.47500000000000003,0.3,COMPLETE
3178,0.4583089763880938,0.25,0.4,0.425,0.275,0.45,0.05,equal,0.5,0.25,COMPLETE
3179,0.3558052799268683,0.2,0.37500000000000006,0.7000000000000001,0.22500000000000003,0.47500000000000003,0.05,equal,0.47500000000000003,0.275,COMPLETE
3180,0.19923370301314686,0.22500000000000003,0.45000000000000007,0.425,0.25,0.5,0.1,equal,0.45,0.3,COMPLETE
3181,0.18523849516965785,0.175,0.5,0.47500000000000003,0.25,0.47500000000000003,0.07500000000000001,equal,0.2,0.325,COMPLETE
3182,0.5177845957390668,0.25,0.42500000000000004,0.45,0.22500000000000003,0.45,0.07500000000000001,softmax,0.375,0.275,COMPLETE
3183,0.5125098056381763,0.15000000000000002,0.47500000000000003,0.5,0.22500000000000003,0.47500000000000003,0.05,equal,0.5,0.25,COMPLETE
3184,0.1371237807463646,0.275,0.45000000000000007,0.425,0.275,0.3,0.175,equal,0.47500000000000003,0.3,COMPLETE
3185,0.40563555897444414,0.22500000000000003,0.525,0.45,0.2,0.45,0.05,equal,0.47500000000000003,0.275,COMPLETE
3186,0.35075736649025113,0.2,0.42500000000000004,0.4,0.25,0.5,0.07500000000000001,equal,0.47500000000000003,0.325,COMPLETE
3187,0.6021780566265794,0.175,0.47500000000000003,0.47500000000000003,0.22500000000000003,0.47500000000000003,0.05,equal,0.5,0.3,COMPLETE
3188,0.5936853113932875,0.22500000000000003,0.45000000000000007,0.425,0.275,0.45,0.05,softmax,0.45,0.275,COMPLETE
3189,0.3793733546744676,0.25,0.5,0.425,0.275,0.425,0.07500000000000001,equal,0.5,0.275,COMPLETE
3190,0.535398913989829,0.2,0.42500000000000004,0.4,0.22500000000000003,0.47500000000000003,0.05,equal,0.47500000000000003,0.3,COMPLETE
3191,0.475787454678798,0.25,0.47500000000000003,0.45,0.2,0.45,0.05,equal,0.47500000000000003,0.25,COMPLETE
3192,0.2759261108448525,0.22500000000000003,0.4,0.45,0.25,0.47500000000000003,0.07500000000000001,equal,0.22500000000000003,0.325,COMPLETE
3193,0.3376547147653545,0.2,0.45000000000000007,0.4,0.25,0.5,0.07500000000000001,softmax,0.5,0.3,COMPLETE
3194,0.35832387729707804,0.22500000000000003,0.47500000000000003,0.425,0.15000000000000002,0.45,0.05,equal,0.45,0.275,COMPLETE
3195,0.009523818526324043,0.15000000000000002,0.45000000000000007,0.825,0.25,0.5,0.05,equal,0.425,0.25,COMPLETE
3196,0.3791255212678885,0.2,0.5,0.4,0.25,0.45,0.1,equal,0.45,0.3,COMPLETE
3197,0.06384528244221162,0.2,0.37500000000000006,0.4,0.2,0.05,0.07500000000000001,equal,0.4,0.275,COMPLETE
3198,0.3455426475776696,0.175,0.42500000000000004,0.47500000000000003,0.175,0.425,0.05,softmax,0.325,0.325,COMPLETE
3199,0.6246360197681791,0.22500000000000003,0.47500000000000003,0.45,0.22500000000000003,0.47500000000000003,0.05,equal,0.5,0.25,COMPLETE
3200,0.4315950320522179,0.275,0.42500000000000004,0.425,0.25,0.47500000000000003,0.07500000000000001,equal,0.47500000000000003,0.35000000000000003,COMPLETE
3201,0.10452151184684383,0.175,0.125,0.47500000000000003,0.275,0.45,0.05,equal,0.5,0.3,COMPLETE
3202,0.5903124965648179,0.25,0.4,0.425,0.22500000000000003,0.47500000000000003,0.05,equal,0.375,0.275,COMPLETE
3203,0.43024845750760343,0.22500000000000003,0.45000000000000007,0.45,0.25,0.47500000000000003,0.07500000000000001,softmax,0.47500000000000003,0.275,COMPLETE
3204,0.21557720018190102,0.2,0.5,0.4,0.25,0.47500000000000003,0.1,equal,0.47500000000000003,0.375,COMPLETE
3205,0.5927991613131751,0.2,0.45000000000000007,0.45,0.22500000000000003,0.45,0.07500000000000001,equal,0.5,0.3,COMPLETE
3206,0.4328476490063638,0.22500000000000003,0.42500000000000004,0.425,0.25,0.5,0.05,equal,0.47500000000000003,0.25,COMPLETE
3207,0.197138875110497,0.25,0.47500000000000003,0.45,0.275,0.35000000000000003,0.05,equal,0.5,0.3,COMPLETE
3208,0.4430496362610283,0.22500000000000003,0.45000000000000007,0.425,0.25,0.47500000000000003,0.07500000000000001,softmax,0.35000000000000003,0.325,COMPLETE
3209,0.3948605479095605,0.2,0.5,0.4,0.2,0.45,0.05,equal,0.275,0.25,COMPLETE
3210,0.03635414972335981,0.15000000000000002,0.1,0.525,0.22500000000000003,0.47500000000000003,0.05,equal,0.47500000000000003,0.3,COMPLETE
3211,0.3439304176627926,0.175,0.4,0.375,0.25,0.5,0.07500000000000001,equal,0.47500000000000003,0.325,COMPLETE
3212,0.38729989321299035,0.3,0.525,0.425,0.2,0.45,0.05,equal,0.45,0.275,COMPLETE
3213,0.45258118399346536,0.25,0.45000000000000007,0.45,0.275,0.425,0.05,softmax,0.425,0.35000000000000003,COMPLETE
3214,0.23301960795430562,0.175,0.47500000000000003,0.375,0.25,0.47500000000000003,0.07500000000000001,equal,0.45,0.3,COMPLETE
3215,0.3682658371043273,0.22500000000000003,0.42500000000000004,0.425,0.2,0.4,0.05,equal,0.5,0.275,COMPLETE
3216,0.30603652081927785,0.2,0.45000000000000007,0.47500000000000003,0.25,0.47500000000000003,0.1,equal,0.5,0.25,COMPLETE
3217,0.13789444774421192,0.45,0.5,0.425,0.5,0.45,0.05,equal,0.47500000000000003,0.3,COMPLETE
3218,0.2482257938583214,0.275,0.47500000000000003,0.425,0.25,0.5,0.07500000000000001,equal,0.5,0.275,COMPLETE
3219,0.5100300048557904,0.22500000000000003,0.42500000000000004,0.45,0.275,0.45,0.05,softmax,0.47500000000000003,0.325,COMPLETE
3220,0.15349416276559227,0.7500000000000001,0.525,0.1,0.275,0.425,0.07500000000000001,equal,0.45,0.275,COMPLETE
3221,0.47521676418665704,0.22500000000000003,0.4,0.45,0.22500000000000003,0.47500000000000003,0.05,equal,0.47500000000000003,0.25,COMPLETE
3222,0.4665351075252505,0.175,0.45000000000000007,0.5,0.25,0.5,0.07500000000000001,equal,0.5,0.275,COMPLETE
3223,0.48469470182065866,0.25,0.47500000000000003,0.45,0.22500000000000003,0.47500000000000003,0.05,equal,0.47500000000000003,0.275,COMPLETE
3224,-0.04597521129004317,0.55,0.42500000000000004,0.275,0.22500000000000003,0.45,0.07500000000000001,softmax,0.5,0.3,COMPLETE
3225,0.2330196079543058,0.2,0.47500000000000003,0.4,0.25,0.47500000000000003,0.1,equal,0.45,0.325,COMPLETE
3226,0.2647254507072732,0.22500000000000003,0.5,0.45,0.175,0.45,0.05,equal,0.1,0.3,COMPLETE
3227,0.5015797626641589,0.2,0.45000000000000007,0.4,0.2,0.45,0.05,equal,0.47500000000000003,0.275,COMPLETE
3228,0.2448294174917513,0.25,0.37500000000000006,0.425,0.25,0.5,0.05,equal,0.5,0.3,COMPLETE
3229,0.5687534496493587,0.175,0.42500000000000004,0.47500000000000003,0.25,0.47500000000000003,0.07500000000000001,softmax,0.5,0.275,COMPLETE
3230,0.35005184605850226,0.2,0.45000000000000007,0.4,0.22500000000000003,0.45,0.07500000000000001,equal,0.47500000000000003,0.325,COMPLETE
3231,0.47521676418665704,0.22500000000000003,0.4,0.45,0.22500000000000003,0.47500000000000003,0.05,equal,0.45,0.25,COMPLETE
3232,0.40518215807691443,0.15000000000000002,0.47500000000000003,0.375,0.2,0.425,0.05,equal,0.5,0.3,COMPLETE
3233,-0.19997663201768287,0.22500000000000003,0.47500000000000003,0.425,0.05,0.5,0.45,equal,0.3,0.25,COMPLETE
3234,0.4153884575242992,0.25,0.42500000000000004,0.425,0.25,0.47500000000000003,0.07500000000000001,softmax,0.47500000000000003,0.35000000000000003,COMPLETE
3235,0.4161053030550977,0.175,0.45000000000000007,0.47500000000000003,0.25,0.5,0.05,equal,0.47500000000000003,0.275,COMPLETE
3236,0.6409572857839799,0.2,0.45000000000000007,0.45,0.22500000000000003,0.47500000000000003,0.05,equal,0.35000000000000003,0.325,COMPLETE
3237,0.3812708332045347,0.15000000000000002,0.5,0.5,0.22500000000000003,0.5,0.05,equal,0.35000000000000003,0.35000000000000003,COMPLETE
3238,0.22010076319294278,0.175,0.4,0.5,0.22500000000000003,0.5,0.05,equal,0.35000000000000003,0.35000000000000003,COMPLETE
3239,0.12049155421411374,0.175,0.8750000000000001,0.47500000000000003,0.22500000000000003,0.5,0.05,equal,0.35000000000000003,0.325,COMPLETE
3240,0.6265385175837092,0.175,0.45000000000000007,0.47500000000000003,0.22500000000000003,0.47500000000000003,0.05,softmax,0.35000000000000003,0.35000000000000003,COMPLETE
3241,0.526555993118065,0.15000000000000002,0.47500000000000003,0.5,0.22500000000000003,0.47500000000000003,0.05,equal,0.35000000000000003,0.35000000000000003,COMPLETE
3242,0.5616299729147134,0.175,0.42500000000000004,0.47500000000000003,0.22500000000000003,0.47500000000000003,0.05,equal,0.375,0.35000000000000003,COMPLETE
3243,0.2480506198336554,0.15000000000000002,0.55,0.5,0.22500000000000003,0.5,0.05,equal,0.35000000000000003,0.35000000000000003,COMPLETE
3244,0.5316497004832006,0.175,0.5,0.47500000000000003,0.22500000000000003,0.47500000000000003,0.05,equal,0.325,0.325,COMPLETE
3245,0.6042289003577057,0.2,0.47500000000000003,0.47500000000000003,0.22500000000000003,0.47500000000000003,0.05,softmax,0.35000000000000003,0.325,COMPLETE
3246,-0.10731249177078095,0.2,0.42500000000000004,0.45,0.0,0.5,0.5,equal,0.325,0.325,COMPLETE
3247,0.44477812987054455,0.175,0.4,0.47500000000000003,0.22500000000000003,0.47500000000000003,0.05,equal,0.35000000000000003,0.35000000000000003,COMPLETE
3248,0.4702110117134354,0.2,0.45000000000000007,0.47500000000000003,0.22500000000000003,0.5,0.05,equal,0.35000000000000003,0.325,COMPLETE
3249,0.6178023927042294,0.175,0.47500000000000003,0.47500000000000003,0.22500000000000003,0.47500000000000003,0.05,equal,0.325,0.325,COMPLETE
3250,0.6087661357007818,0.2,0.42500000000000004,0.45,0.22500000000000003,0.47500000000000003,0.05,softmax,0.4,0.325,COMPLETE
3251,0.24805061983365495,0.2,0.525,0.45,0.22500000000000003,0.5,0.05,equal,0.3,0.35000000000000003,COMPLETE
