number,value,params_fund_net_buying,params_institutional_weight,params_number_fund_holdings,params_pe,params_revenue_growth,params_roe,params_stock_weight_option,params_take_profit,params_trailing_stop_loss,state
1083,0.4153658382516887,0.2,0.5,0.425,0.2,0.47500000000000003,0.05,equal,0.5,0.3,COMPLETE
1084,0.4759455386256409,0.22500000000000003,0.45000000000000007,0.425,0.2,0.5,0.07500000000000001,equal,0.5,0.325,COMPLETE
1085,0.6431900236904107,0.22500000000000003,0.47500000000000003,0.425,0.22500000000000003,0.47500000000000003,0.05,equal,0.47500000000000003,0.3,COMPLETE
1086,0.5168053980009133,0.22500000000000003,0.45000000000000007,0.4,0.25,0.45,0.05,equal,0.47500000000000003,0.3,COMPLETE
1087,0.5307954049525634,0.2,0.47500000000000003,0.4,0.22500000000000003,0.47500000000000003,0.05,equal,0.47500000000000003,0.325,COMPLETE
1088,0.279019780088709,0.22500000000000003,0.5,0.425,0.22500000000000003,0.47500000000000003,0.05,equal,0.47500000000000003,0.3,COMPLETE
1089,0.4587160048116591,0.25,0.47500000000000003,0.425,0.22500000000000003,0.5,0.05,equal,0.47500000000000003,0.3,COMPLETE
1090,0.2321510568752077,0.275,0.525,0.425,0.25,0.47500000000000003,0.05,equal,0.47500000000000003,0.325,COMPLETE
1091,0.4759455386256409,0.2,0.45000000000000007,0.4,0.22500000000000003,0.5,0.05,equal,0.47500000000000003,0.3,COMPLETE
1092,0.25363833099998745,0.25,0.55,0.425,0.25,0.45,0.05,equal,0.47500000000000003,0.325,COMPLETE
1093,0.38767332423688905,0.2,0.5,0.375,0.22500000000000003,0.47500000000000003,0.05,equal,0.35000000000000003,0.3,COMPLETE
1094,0.6431900236904107,0.22500000000000003,0.47500000000000003,0.425,0.22500000000000003,0.47500000000000003,0.05,equal,0.47500000000000003,0.3,COMPLETE
1095,0.3902435250255829,0.275,0.45000000000000007,0.425,0.25,0.47500000000000003,0.05,equal,0.47500000000000003,0.3,COMPLETE
1096,0.3499655460144019,0.25,0.5,0.4,0.25,0.35000000000000003,0.05,equal,0.47500000000000003,0.3,COMPLETE
1097,0.47594553862564115,0.22500000000000003,0.45000000000000007,0.4,0.22500000000000003,0.5,0.05,equal,0.47500000000000003,0.325,COMPLETE
1098,0.42668150926983434,0.22500000000000003,0.47500000000000003,0.4,0.22500000000000003,0.45,0.05,equal,0.47500000000000003,0.3,COMPLETE
1099,0.27901978008870854,0.25,0.525,0.425,0.22500000000000003,0.47500000000000003,0.05,equal,0.47500000000000003,0.3,COMPLETE
1100,0.4759455386256409,0.22500000000000003,0.45000000000000007,0.425,0.22500000000000003,0.5,0.05,equal,0.47500000000000003,0.3,COMPLETE
1101,0.279019780088709,0.22500000000000003,0.5,0.425,0.22500000000000003,0.47500000000000003,0.05,equal,0.47500000000000003,0.325,COMPLETE
1102,0.4007919959775752,0.25,0.47500000000000003,0.425,0.22500000000000003,0.47500000000000003,0.05,equal,0.275,0.325,COMPLETE
1103,0.5168053980009133,0.22500000000000003,0.45000000000000007,0.4,0.25,0.45,0.05,equal,0.5,0.3,COMPLETE
1104,0.4386418329942271,0.275,0.47500000000000003,0.45,0.22500000000000003,0.5,0.05,linear,0.47500000000000003,0.3,COMPLETE
1105,0.38767332423688905,0.2,0.5,0.375,0.22500000000000003,0.47500000000000003,0.05,equal,0.47500000000000003,0.325,COMPLETE
1106,0.2790197800887094,0.22500000000000003,0.5750000000000001,0.425,0.25,0.45,0.05,equal,0.5,0.3,COMPLETE
1107,0.6054729525697827,0.25,0.45000000000000007,0.425,0.22500000000000003,0.47500000000000003,0.05,equal,0.5,0.3,COMPLETE
1108,0.3902435250255829,0.275,0.45000000000000007,0.425,0.25,0.47500000000000003,0.05,equal,0.5,0.3,COMPLETE
1109,0.45621168352267855,0.3,0.45000000000000007,0.425,0.22500000000000003,0.5,0.05,equal,0.5,0.3,COMPLETE
1110,0.4404955848818283,0.275,0.45000000000000007,0.425,0.22500000000000003,0.47500000000000003,0.05,equal,0.5,0.3,COMPLETE
1111,0.5168053980009135,0.25,0.45000000000000007,0.4,0.25,0.45,0.05,equal,0.5,0.325,COMPLETE
1112,0.44049558488182883,0.275,0.47500000000000003,0.425,0.22500000000000003,0.47500000000000003,0.05,equal,0.5,0.3,COMPLETE
1113,0.4587160048116588,0.25,0.45000000000000007,0.4,0.22500000000000003,0.5,0.05,equal,0.5,0.325,COMPLETE
1114,0.39692052476088063,0.25,0.47500000000000003,0.4,0.22500000000000003,0.47500000000000003,0.05,equal,0.5,0.3,COMPLETE
1115,0.4404955848818285,0.275,0.47500000000000003,0.45,0.22500000000000003,0.47500000000000003,0.05,equal,0.5,0.325,COMPLETE
1116,0.6054729525697832,0.25,0.45000000000000007,0.425,0.25,0.45,0.05,equal,0.5,0.3,COMPLETE
1117,0.6054729525697832,0.25,0.45000000000000007,0.425,0.25,0.45,0.05,equal,0.5,0.3,COMPLETE
1118,0.06912933332763622,0.7500000000000001,0.45000000000000007,0.15000000000000002,0.25,0.45,0.05,equal,0.5,0.3,COMPLETE
1119,0.15332067981356606,0.3,0.45000000000000007,0.45,0.275,0.45,0.05,equal,0.1,0.325,COMPLETE
1120,0.3236014891846697,0.25,0.45000000000000007,0.4,0.25,0.4,0.05,equal,0.5,0.325,COMPLETE
1121,0.4584139159363086,0.3,0.45000000000000007,0.45,0.25,0.45,0.05,equal,0.5,0.3,COMPLETE
1122,0.46596621226004775,0.325,0.45000000000000007,0.425,0.25,0.45,0.05,equal,0.5,0.35000000000000003,COMPLETE
1123,0.5079616755062939,0.275,0.45000000000000007,0.45,0.22500000000000003,0.45,0.05,equal,0.5,0.3,COMPLETE
1124,0.45092848064438046,0.275,0.45000000000000007,0.425,0.275,0.45,0.05,linear,0.5,0.3,COMPLETE
1125,0.3523741961229686,0.25,0.45000000000000007,0.375,0.25,0.45,0.07500000000000001,equal,0.5,0.3,COMPLETE
1126,0.45871600481165875,0.275,0.47500000000000003,0.45,0.25,0.5,0.05,equal,0.5,0.325,COMPLETE
1127,0.35237419612296805,0.25,0.45000000000000007,0.4,0.25,0.45,0.07500000000000001,equal,0.5,0.3,COMPLETE
1128,0.24975199562798056,0.25,0.5,0.425,0.25,0.5,0.05,equal,0.5,0.35000000000000003,COMPLETE
1129,0.4527504311784236,0.25,0.47500000000000003,0.425,0.275,0.45,0.05,equal,0.5,0.325,COMPLETE
1130,0.4340896000448781,0.25,0.45000000000000007,0.425,0.25,0.5,0.07500000000000001,equal,0.5,0.3,COMPLETE
1131,0.3821548398599261,0.25,0.5,0.45,0.25,0.47500000000000003,0.05,equal,0.5,0.3,COMPLETE
1132,0.45871600481165814,0.275,0.47500000000000003,0.45,0.22500000000000003,0.5,0.07500000000000001,equal,0.5,0.325,COMPLETE
1133,0.3035697717078945,0.3,0.45000000000000007,0.45,0.25,0.4,0.05,equal,0.5,0.3,COMPLETE
1134,0.02197550380359626,0.4,0.47500000000000003,0.425,0.05,0.45,0.45,equal,0.5,0.3,COMPLETE
1135,0.43408960004487834,0.22500000000000003,0.45000000000000007,0.4,0.25,0.5,0.05,equal,0.5,0.325,COMPLETE
1136,0.22392065706416836,0.22500000000000003,0.5,0.4,0.275,0.47500000000000003,0.05,equal,0.5,0.3,COMPLETE
1137,0.35571194412079343,0.275,0.5,0.45,0.25,0.47500000000000003,0.07500000000000001,equal,0.5,0.35000000000000003,COMPLETE
1138,0.36945560721167775,0.22500000000000003,0.47500000000000003,0.375,0.25,0.45,0.05,equal,0.5,0.325,COMPLETE
1139,0.4340896000448781,0.25,0.45000000000000007,0.425,0.25,0.47500000000000003,0.07500000000000001,equal,0.5,0.3,COMPLETE
1140,-0.11593177709223498,0.22500000000000003,0.525,0.4,0.05,0.5,0.425,equal,0.5,0.325,COMPLETE
1141,0.50417272352063,0.25,0.47500000000000003,0.45,0.22500000000000003,0.45,0.05,equal,0.5,0.3,COMPLETE
1142,0.35075736649025063,0.22500000000000003,0.45000000000000007,0.4,0.22500000000000003,0.47500000000000003,0.07500000000000001,equal,0.5,0.3,COMPLETE
1143,0.38274487019067177,0.2,0.5,0.375,0.22500000000000003,0.375,0.07500000000000001,equal,0.5,0.325,COMPLETE
1144,0.29513979427034176,0.3,0.45000000000000007,0.425,0.25,0.47500000000000003,0.05,equal,0.5,0.3,COMPLETE
1145,0.029252062394559963,0.2,0.47500000000000003,0.4,0.22500000000000003,0.5,0.07500000000000001,equal,0.5,0.1,COMPLETE
1146,0.3019810387312168,0.275,0.525,0.45,0.25,0.47500000000000003,0.05,linear,0.5,0.325,COMPLETE
1147,0.6074641265057518,0.22500000000000003,0.45000000000000007,0.425,0.275,0.45,0.05,equal,0.5,0.3,COMPLETE
1148,0.39158504366646474,0.2,0.45000000000000007,0.375,0.275,0.45,0.07500000000000001,equal,0.3,0.3,COMPLETE
1149,0.5260600310921522,0.22500000000000003,0.45000000000000007,0.4,0.275,0.45,0.05,equal,0.5,0.3,COMPLETE
1150,0.5260600310921522,0.2,0.42500000000000004,0.4,0.275,0.45,0.05,equal,0.5,0.3,COMPLETE
1151,0.391585043666465,0.22500000000000003,0.45000000000000007,0.425,0.275,0.45,0.07500000000000001,equal,0.5,0.3,COMPLETE
1152,0.5653190101716724,0.22500000000000003,0.42500000000000004,0.425,0.275,0.45,0.05,equal,0.5,0.3,COMPLETE
1153,0.08609178184297815,0.8250000000000001,0.47500000000000003,0.125,0.275,0.45,0.07500000000000001,equal,0.5,0.3,COMPLETE
1154,0.5211387698150434,0.2,0.45000000000000007,0.4,0.275,0.45,0.05,equal,0.5,0.3,COMPLETE
1155,0.5260600310921522,0.2,0.42500000000000004,0.4,0.275,0.45,0.05,equal,0.5,0.3,COMPLETE
1156,0.1546880935006571,0.22500000000000003,0.5,0.425,0.3,0.2,0.07500000000000001,equal,0.5,0.3,COMPLETE
1157,0.18494608899012635,0.425,0.45000000000000007,0.425,0.25,0.45,0.05,equal,0.5,0.275,COMPLETE
1158,-0.04973901934480459,0.5750000000000001,0.47500000000000003,0.25,0.275,0.45,0.07500000000000001,equal,0.5,0.3,COMPLETE
1159,0.40924687229866363,0.25,0.42500000000000004,0.425,0.3,0.45,0.05,equal,0.5,0.275,COMPLETE
1160,0.09813992969822027,0.2,0.47500000000000003,0.4,0.325,0.47500000000000003,0.07500000000000001,equal,0.5,0.3,COMPLETE
1161,0.425543811008415,0.22500000000000003,0.5,0.425,0.25,0.425,0.05,equal,0.5,0.275,COMPLETE
1162,0.35075736649025063,0.2,0.45000000000000007,0.4,0.25,0.47500000000000003,0.07500000000000001,equal,0.5,0.3,COMPLETE
1163,0.43284764900636385,0.22500000000000003,0.45000000000000007,0.425,0.25,0.47500000000000003,0.05,equal,0.5,0.275,COMPLETE
1164,0.24263950204982979,0.25,0.47500000000000003,0.45,0.25,0.375,0.07500000000000001,equal,0.5,0.3,COMPLETE
1165,0.47474592631266715,0.22500000000000003,0.42500000000000004,0.425,0.22500000000000003,0.5,0.05,equal,0.5,0.275,COMPLETE
1166,0.35005184605850226,0.2,0.45000000000000007,0.4,0.22500000000000003,0.45,0.07500000000000001,equal,0.5,0.3,COMPLETE
1167,0.25405387936606433,0.2,0.47500000000000003,0.375,0.275,0.47500000000000003,0.05,linear,0.5,0.3,COMPLETE
1168,0.439654730911739,0.25,0.42500000000000004,0.45,0.22500000000000003,0.5,0.05,equal,0.5,0.275,COMPLETE
1169,0.41839647054414664,0.22500000000000003,0.5,0.425,0.25,0.45,0.07500000000000001,equal,0.5,0.325,COMPLETE
1170,0.4858776278351101,0.25,0.47500000000000003,0.45,0.22500000000000003,0.47500000000000003,0.05,equal,0.5,0.3,COMPLETE
1171,0.04893771377569944,0.2,0.45000000000000007,0.425,0.35000000000000003,0.5,0.07500000000000001,equal,0.5,0.3,COMPLETE
1172,0.2521404597535739,0.22500000000000003,0.525,0.425,0.25,0.47500000000000003,0.05,equal,0.5,0.275,COMPLETE
1173,0.39411924347865546,0.2,0.47500000000000003,0.375,0.22500000000000003,0.45,0.05,equal,0.25,0.325,COMPLETE
1174,0.35571194412079343,0.275,0.5,0.45,0.22500000000000003,0.47500000000000003,0.07500000000000001,equal,0.5,0.3,COMPLETE
1175,0.47474592631266693,0.22500000000000003,0.45000000000000007,0.425,0.22500000000000003,0.5,0.05,equal,0.5,0.275,COMPLETE
1176,0.3332516165796901,0.25,0.42500000000000004,0.45,0.22500000000000003,0.47500000000000003,0.07500000000000001,equal,0.5,0.325,COMPLETE
1177,0.4183964705441464,0.2,0.5,0.4,0.22500000000000003,0.45,0.05,equal,0.5,0.3,COMPLETE
1178,0.06816024089088522,0.22500000000000003,0.45000000000000007,0.7000000000000001,0.22500000000000003,0.47500000000000003,0.07500000000000001,equal,0.5,0.275,COMPLETE
1179,0.10373749837752874,0.25,0.125,0.45,0.45,0.47500000000000003,0.05,equal,0.5,0.275,COMPLETE
1180,0.4266815092698344,0.2,0.47500000000000003,0.4,0.25,0.4,0.05,equal,0.5,0.3,COMPLETE
1181,-0.1159317770922357,0.25,0.47500000000000003,0.45,0.125,0.45,0.4,equal,0.5,0.3,COMPLETE
1182,0.6078636465947449,0.22500000000000003,0.42500000000000004,0.425,0.22500000000000003,0.47500000000000003,0.07500000000000001,equal,0.5,0.3,COMPLETE
1183,0.3571102889210767,0.2,0.42500000000000004,0.4,0.22500000000000003,0.5,0.07500000000000001,equal,0.5,0.3,COMPLETE
1184,0.4262276866870688,0.22500000000000003,0.42500000000000004,0.425,0.25,0.47500000000000003,0.07500000000000001,equal,0.5,0.3,COMPLETE
1185,0.021355634502370165,0.2,0.42500000000000004,0.375,0.25,0.175,0.07500000000000001,equal,0.5,0.275,COMPLETE
1186,0.48542524816622,0.22500000000000003,0.42500000000000004,0.425,0.22500000000000003,0.425,0.07500000000000001,equal,0.5,0.275,COMPLETE
1187,0.5062199822735887,0.2,0.42500000000000004,0.4,0.22500000000000003,0.47500000000000003,0.07500000000000001,linear,0.5,0.3,COMPLETE
1188,0.4665351075252506,0.22500000000000003,0.45000000000000007,0.425,0.22500000000000003,0.5,0.07500000000000001,equal,0.5,0.275,COMPLETE
1189,0.044692993754918184,0.22500000000000003,0.42500000000000004,0.425,0.22500000000000003,0.45,0.22500000000000003,equal,0.5,0.3,COMPLETE
1190,0.3748322084036934,0.2,0.45000000000000007,0.4,0.22500000000000003,0.5,0.07500000000000001,equal,0.5,0.275,COMPLETE
1191,-0.17121301084995003,0.2,0.42500000000000004,0.4,0.175,0.47500000000000003,0.35000000000000003,equal,0.5,0.3,COMPLETE
1192,0.44308694209790783,0.22500000000000003,0.45000000000000007,0.425,0.25,0.47500000000000003,0.07500000000000001,equal,0.5,0.3,COMPLETE
1193,0.15938099954442808,0.47500000000000003,0.45000000000000007,0.425,0.25,0.3,0.07500000000000001,equal,0.5,0.3,COMPLETE
1194,0.4307871337366049,0.2,0.45000000000000007,0.425,0.275,0.45,0.07500000000000001,equal,0.5,0.275,COMPLETE
1195,-0.05755490232728193,0.5,0.42500000000000004,0.275,0.22500000000000003,0.47500000000000003,0.07500000000000001,equal,0.325,0.3,COMPLETE
1196,-0.011085063984275528,0.22500000000000003,0.45000000000000007,0.425,0.5,0.425,0.07500000000000001,equal,0.05,0.275,COMPLETE
1197,0.41732760018598003,0.2,0.42500000000000004,0.4,0.22500000000000003,0.5,0.05,equal,0.5,0.3,COMPLETE
1198,0.24652807306508728,0.22500000000000003,0.5,0.425,0.22500000000000003,0.47500000000000003,0.07500000000000001,equal,0.5,0.275,COMPLETE
1199,0.48222381390891905,0.25,0.47500000000000003,0.45,0.25,0.45,0.05,equal,0.5,0.3,COMPLETE
1200,0.37057927215221,0.2,0.45000000000000007,0.375,0.22500000000000003,0.47500000000000003,0.07500000000000001,equal,0.5,0.3,COMPLETE
1201,0.1748326885097456,0.22500000000000003,0.42500000000000004,0.425,0.25,0.3,0.05,equal,0.5,0.275,COMPLETE
1202,0.47474592631266715,0.22500000000000003,0.47500000000000003,0.45,0.22500000000000003,0.5,0.05,equal,0.5,0.275,COMPLETE
1203,0.4822238139089189,0.275,0.5,0.45,0.22500000000000003,0.45,0.05,equal,0.5,0.3,COMPLETE
1204,0.05668275615778587,0.22500000000000003,0.45000000000000007,0.425,0.22500000000000003,0.47500000000000003,0.275,equal,0.5,0.3,COMPLETE
1205,0.40008373376695316,0.2,0.47500000000000003,0.4,0.22500000000000003,0.47500000000000003,0.07500000000000001,equal,0.5,0.3,COMPLETE
1206,0.4575013620128508,0.25,0.45000000000000007,0.45,0.25,0.5,0.05,equal,0.5,0.275,COMPLETE
1207,0.09877347385373557,0.2,0.975,0.4,0.22500000000000003,0.47500000000000003,0.07500000000000001,equal,0.47500000000000003,0.3,COMPLETE
1208,0.23601092570357612,0.22500000000000003,0.5,0.425,0.275,0.45,0.07500000000000001,linear,0.5,0.275,COMPLETE
1209,0.277555368223483,0.25,0.55,0.45,0.275,0.47500000000000003,0.05,equal,0.5,0.275,COMPLETE
1210,0.26790954263371947,0.2,0.525,0.4,0.3,0.5,0.05,equal,0.47500000000000003,0.3,COMPLETE
1211,0.6078636465947449,0.22500000000000003,0.42500000000000004,0.425,0.22500000000000003,0.47500000000000003,0.07500000000000001,equal,0.5,0.275,COMPLETE
1212,0.5528847654074804,0.2,0.42500000000000004,0.425,0.25,0.45,0.07500000000000001,equal,0.5,0.275,COMPLETE
1213,0.6149197823374779,0.22500000000000003,0.42500000000000004,0.45,0.22500000000000003,0.47500000000000003,0.07500000000000001,equal,0.47500000000000003,0.275,COMPLETE
1214,0.4750779963518796,0.25,0.42500000000000004,0.45,0.22500000000000003,0.5,0.07500000000000001,equal,0.47500000000000003,0.275,COMPLETE
1215,0.330581061210119,0.275,0.42500000000000004,0.45,0.25,0.47500000000000003,0.07500000000000001,equal,0.47500000000000003,0.275,COMPLETE
1216,0.634291357863731,0.2,0.42500000000000004,0.45,0.25,0.45,0.07500000000000001,equal,0.47500000000000003,0.275,COMPLETE
1217,0.634291357863731,0.2,0.42500000000000004,0.45,0.25,0.45,0.07500000000000001,equal,0.47500000000000003,0.275,COMPLETE
1218,0.4141233637060799,0.2,0.42500000000000004,0.45,0.25,0.425,0.07500000000000001,equal,0.47500000000000003,0.275,COMPLETE
1219,0.4141233637060799,0.2,0.42500000000000004,0.45,0.25,0.425,0.07500000000000001,equal,0.47500000000000003,0.275,COMPLETE
1220,-0.027552470551861857,0.2,0.42500000000000004,0.45,0.22500000000000003,0.425,0.325,equal,0.47500000000000003,0.275,COMPLETE
1221,0.4141233637060799,0.2,0.42500000000000004,0.45,0.25,0.425,0.07500000000000001,equal,0.47500000000000003,0.275,COMPLETE
1222,0.4141233637060799,0.2,0.42500000000000004,0.45,0.25,0.425,0.07500000000000001,equal,0.47500000000000003,0.275,COMPLETE
1223,0.3523741961229686,0.2,0.42500000000000004,0.35000000000000003,0.25,0.45,0.07500000000000001,equal,0.47500000000000003,0.275,COMPLETE
1224,0.5067015926455128,0.2,0.42500000000000004,0.425,0.25,0.425,0.07500000000000001,equal,0.47500000000000003,0.275,COMPLETE
1225,-0.04300569772424924,0.6250000000000001,0.42500000000000004,0.25,0.275,0.45,0.07500000000000001,equal,0.47500000000000003,0.275,COMPLETE
1226,0.5099718008745959,0.22500000000000003,0.42500000000000004,0.425,0.275,0.45,0.07500000000000001,equal,0.47500000000000003,0.275,COMPLETE
1227,0.4141233637060799,0.2,0.42500000000000004,0.45,0.25,0.425,0.07500000000000001,equal,0.47500000000000003,0.275,COMPLETE
1228,0.5528847654074804,0.2,0.42500000000000004,0.425,0.25,0.45,0.07500000000000001,equal,0.47500000000000003,0.275,COMPLETE
1229,0.3461464402380618,0.22500000000000003,0.42500000000000004,0.45,0.25,0.45,0.07500000000000001,equal,0.175,0.275,COMPLETE
1230,-0.012762982111935717,0.22500000000000003,0.025,0.425,0.25,0.425,0.07500000000000001,linear,0.47500000000000003,0.275,COMPLETE
1231,-0.03908113106622419,0.55,0.42500000000000004,0.15000000000000002,0.275,0.45,0.07500000000000001,equal,0.47500000000000003,0.275,COMPLETE
1232,0.552884765407481,0.2,0.42500000000000004,0.4,0.25,0.45,0.07500000000000001,equal,0.47500000000000003,0.275,COMPLETE
1233,0.5980313599028034,0.2,0.42500000000000004,0.45,0.275,0.45,0.07500000000000001,equal,0.47500000000000003,0.275,COMPLETE
1234,0.12796884981597265,0.675,0.42500000000000004,0.25,0.25,0.325,0.07500000000000001,equal,0.2,0.275,COMPLETE
1235,-0.14083639796097308,0.525,0.45000000000000007,0.325,0.25,0.45,0.07500000000000001,equal,0.47500000000000003,0.275,COMPLETE
1236,0.5528847654074804,0.2,0.42500000000000004,0.425,0.25,0.45,0.07500000000000001,equal,0.47500000000000003,0.275,COMPLETE
1237,0.5074395141935752,0.25,0.45000000000000007,0.45,0.275,0.45,0.07500000000000001,equal,0.45,0.275,COMPLETE
1238,0.5076403907873439,0.22500000000000003,0.42500000000000004,0.425,0.25,0.45,0.07500000000000001,equal,0.47500000000000003,0.275,COMPLETE
1239,0.006759164752912598,0.2,0.45000000000000007,0.4,0.22500000000000003,0.425,0.25,equal,0.47500000000000003,0.275,COMPLETE
1240,0.07564415183105601,0.9,0.45000000000000007,0.075,0.25,0.45,0.07500000000000001,equal,0.45,0.275,COMPLETE
1241,0.4619273254069797,0.25,0.42500000000000004,0.45,0.275,0.45,0.07500000000000001,equal,0.425,0.275,COMPLETE
1242,0.19208546542427946,0.22500000000000003,0.225,0.45,0.25,0.45,0.07500000000000001,equal,0.47500000000000003,0.275,COMPLETE
1243,0.35397112630560396,0.175,0.45000000000000007,0.375,0.25,0.425,0.07500000000000001,equal,0.47500000000000003,0.275,COMPLETE
1244,0.01910746498459049,0.25,0.42500000000000004,0.45,0.25,0.15000000000000002,0.07500000000000001,equal,0.45,0.3,COMPLETE
1245,0.634291357863731,0.22500000000000003,0.45000000000000007,0.425,0.25,0.45,0.07500000000000001,equal,0.47500000000000003,0.275,COMPLETE
1246,0.41175050502257154,0.2,0.42500000000000004,0.4,0.275,0.45,0.07500000000000001,equal,0.45,0.275,COMPLETE
1247,0.4830611793937559,0.2,0.4,0.425,0.275,0.45,0.07500000000000001,equal,0.47500000000000003,0.275,COMPLETE
1248,0.39538838744607097,0.22500000000000003,0.45000000000000007,0.45,0.25,0.425,0.07500000000000001,equal,0.45,0.275,COMPLETE
1249,0.5067015926455128,0.175,0.42500000000000004,0.4,0.25,0.425,0.07500000000000001,equal,0.47500000000000003,0.275,COMPLETE
1250,0.548327201254069,0.2,0.45000000000000007,0.425,0.25,0.45,0.07500000000000001,equal,0.425,0.275,COMPLETE
1251,0.4678115986760196,0.2,0.4,0.45,0.25,0.425,0.07500000000000001,equal,0.47500000000000003,0.275,COMPLETE
1252,0.5318837988582779,0.22500000000000003,0.45000000000000007,0.425,0.25,0.425,0.07500000000000001,equal,0.45,0.275,COMPLETE
1253,0.43927499028078454,0.22500000000000003,0.42500000000000004,0.425,0.275,0.45,0.07500000000000001,linear,0.22500000000000003,0.275,COMPLETE
1254,0.15445854995488667,0.2,0.45000000000000007,0.4,0.4,0.45,0.07500000000000001,equal,0.47500000000000003,0.275,COMPLETE
1255,0.3899327503698241,0.175,0.4,0.375,0.275,0.45,0.07500000000000001,equal,0.45,0.275,COMPLETE
1256,0.47251690217725095,0.22500000000000003,0.42500000000000004,0.45,0.25,0.425,0.07500000000000001,equal,0.47500000000000003,0.275,COMPLETE
1257,0.16786549842407128,0.175,0.45000000000000007,0.375,0.25,0.45,0.07500000000000001,equal,0.07500000000000001,0.275,COMPLETE
1258,0.548327201254069,0.2,0.45000000000000007,0.425,0.25,0.45,0.07500000000000001,equal,0.47500000000000003,0.275,COMPLETE
1259,0.4952721129575179,0.22500000000000003,0.4,0.45,0.25,0.45,0.07500000000000001,equal,0.47500000000000003,0.275,COMPLETE
1260,0.5980313599028034,0.2,0.42500000000000004,0.45,0.275,0.45,0.07500000000000001,equal,0.45,0.3,COMPLETE
1261,0.634291357863731,0.22500000000000003,0.45000000000000007,0.425,0.25,0.45,0.07500000000000001,equal,0.47500000000000003,0.3,COMPLETE
1262,0.4998701476562033,0.175,0.42500000000000004,0.4,0.25,0.45,0.07500000000000001,equal,0.45,0.275,COMPLETE
1263,0.3409121315616909,0.2,0.45000000000000007,0.45,0.22500000000000003,0.425,0.07500000000000001,equal,0.45,0.275,COMPLETE
1264,0.5807717658091015,0.22500000000000003,0.4,0.425,0.25,0.45,0.07500000000000001,equal,0.47500000000000003,0.3,COMPLETE
1265,-0.03949449046874898,0.175,0.42500000000000004,0.4,0.22500000000000003,0.45,0.2,equal,0.47500000000000003,0.3,COMPLETE
