number,value,params_fund_net_buying,params_institutional_weight,params_number_fund_holdings,params_pe,params_revenue_growth,params_roe,params_stock_weight_option,params_take_profit,params_trailing_stop_loss,state
890,0.39031974363245103,0.22500000000000003,0.5,0.45,0.2,0.47500000000000003,0.07500000000000001,linear,0.5,0.275,COMPLETE
891,0.409966353836463,0.25,0.525,0.47500000000000003,0.2,0.5,0.07500000000000001,equal,0.5,0.25,COMPLETE
892,0.29876751341260066,0.2,0.47500000000000003,0.45,0.2,0.47500000000000003,0.125,equal,0.5,0.25,COMPLETE
893,0.30769214195588557,0.2,0.5,0.45,0.2,0.5,0.07500000000000001,equal,0.5,0.3,COMPLETE
894,0.41447750345809653,0.275,0.45000000000000007,0.47500000000000003,0.2,0.47500000000000003,0.125,equal,0.5,0.25,COMPLETE
895,0.6021780566265794,0.22500000000000003,0.47500000000000003,0.47500000000000003,0.2,0.47500000000000003,0.07500000000000001,equal,0.5,0.275,COMPLETE
896,0.26459604678772797,0.25,0.47500000000000003,0.47500000000000003,0.2,0.47500000000000003,0.07500000000000001,equal,0.5,0.275,COMPLETE
897,0.29642461472496107,0.275,0.525,0.47500000000000003,0.2,0.47500000000000003,0.15000000000000002,equal,0.5,0.275,COMPLETE
898,0.28809072992254836,0.22500000000000003,0.5,0.47500000000000003,0.2,0.325,0.125,equal,0.5,0.275,COMPLETE
899,-0.18240987575425638,0.22500000000000003,0.47500000000000003,0.47500000000000003,0.025,0.5,0.47500000000000003,equal,0.5,0.275,COMPLETE
900,0.5342181630118251,0.22500000000000003,0.45000000000000007,0.47500000000000003,0.2,0.47500000000000003,0.07500000000000001,equal,0.5,0.3,COMPLETE
901,0.40037360444686154,0.25,0.45000000000000007,0.47500000000000003,0.2,0.47500000000000003,0.1,equal,0.5,0.275,COMPLETE
902,-0.10241035932742293,0.22500000000000003,0.5,0.47500000000000003,0.075,0.5,0.425,equal,0.5,0.275,COMPLETE
903,0.3003044552569023,0.2,0.47500000000000003,0.45,0.2,0.47500000000000003,0.125,equal,0.5,0.3,COMPLETE
904,0.3914465907341737,0.25,0.5,0.47500000000000003,0.2,0.47500000000000003,0.1,equal,0.5,0.275,COMPLETE
905,0.5342181630118251,0.22500000000000003,0.45000000000000007,0.47500000000000003,0.2,0.47500000000000003,0.07500000000000001,equal,0.5,0.275,COMPLETE
906,0.20913944206879737,0.2,0.5750000000000001,0.45,0.2,0.5,0.15000000000000002,equal,0.425,0.25,COMPLETE
907,0.2751074864307821,0.275,0.47500000000000003,0.47500000000000003,0.2,0.47500000000000003,0.2,equal,0.425,0.325,COMPLETE
908,0.38896692242461783,0.2,0.45000000000000007,0.45,0.2,0.5,0.125,equal,0.5,0.275,COMPLETE
909,0.6204961782136781,0.2,0.47500000000000003,0.45,0.2,0.47500000000000003,0.07500000000000001,equal,0.5,0.25,COMPLETE
910,0.08846655273317441,0.8750000000000001,0.5,0.05,0.2,0.47500000000000003,0.05,equal,0.5,0.25,COMPLETE
911,0.3914465907341736,0.22500000000000003,0.525,0.47500000000000003,0.2,0.47500000000000003,0.07500000000000001,equal,0.5,0.275,COMPLETE
912,0.5832609244998748,0.22500000000000003,0.47500000000000003,0.47500000000000003,0.2,0.47500000000000003,0.05,linear,0.5,0.25,COMPLETE
913,0.26459604678772797,0.25,0.47500000000000003,0.47500000000000003,0.2,0.47500000000000003,0.07500000000000001,equal,0.5,0.25,COMPLETE
914,0.4153658382516877,0.2,0.5,0.45,0.2,0.47500000000000003,0.07500000000000001,equal,0.5,0.3,COMPLETE
915,0.5046121885151549,0.22500000000000003,0.47500000000000003,0.5,0.2,0.47500000000000003,0.07500000000000001,equal,0.5,0.275,COMPLETE
916,0.16128993025002616,0.2,0.525,0.5,0.2,0.05,0.05,equal,0.5,0.25,COMPLETE
917,0.4747459263126675,0.2,0.47500000000000003,0.45,0.2,0.5,0.07500000000000001,equal,0.5,0.275,COMPLETE
918,-0.009046231795274392,0.675,0.45000000000000007,0.275,0.2,0.47500000000000003,0.07500000000000001,equal,0.5,0.25,COMPLETE
919,0.4913132435075531,0.2,0.5,0.5,0.175,0.47500000000000003,0.07500000000000001,equal,0.5,0.25,COMPLETE
920,0.6431900236904103,0.2,0.45000000000000007,0.425,0.175,0.5,0.05,equal,0.5,0.275,COMPLETE
921,0.4747459263126672,0.22500000000000003,0.47500000000000003,0.425,0.175,0.5,0.05,equal,0.5,0.275,COMPLETE
922,0.45639384100682284,0.22500000000000003,0.45000000000000007,0.425,0.175,0.5,0.05,equal,0.5,0.275,COMPLETE
923,0.456393841006823,0.25,0.45000000000000007,0.45,0.175,0.5,0.05,equal,0.5,0.275,COMPLETE
924,0.47474592631266765,0.2,0.47500000000000003,0.425,0.175,0.5,0.05,equal,0.5,0.25,COMPLETE
925,0.4747459263126672,0.22500000000000003,0.47500000000000003,0.425,0.175,0.5,0.05,equal,0.5,0.275,COMPLETE
926,0.6431900236904103,0.2,0.45000000000000007,0.425,0.175,0.5,0.05,equal,0.5,0.25,COMPLETE
927,0.38870405082520926,0.22500000000000003,0.45000000000000007,0.4,0.175,0.5,0.05,equal,0.5,0.25,COMPLETE
928,0.561455843241641,0.2,0.45000000000000007,0.4,0.175,0.5,0.05,equal,0.5,0.275,COMPLETE
929,0.45639384100682284,0.22500000000000003,0.45000000000000007,0.425,0.175,0.5,0.05,equal,0.5,0.25,COMPLETE
930,0.561455843241641,0.2,0.45000000000000007,0.4,0.175,0.5,0.05,equal,0.5,0.275,COMPLETE
931,0.45639384100682284,0.25,0.45000000000000007,0.425,0.175,0.5,0.05,equal,0.5,0.25,COMPLETE
932,0.4541497946451428,0.2,0.47500000000000003,0.425,0.175,0.5,0.05,linear,0.5,0.25,COMPLETE
933,0.04941667783476545,0.275,0.45000000000000007,0.45,0.15000000000000002,0.07500000000000001,0.05,equal,0.5,0.25,COMPLETE
934,0.45639384100682284,0.22500000000000003,0.45000000000000007,0.425,0.175,0.5,0.05,equal,0.5,0.275,COMPLETE
935,0.3933630884883756,0.2,0.5,0.425,0.175,0.5,0.05,equal,0.5,0.25,COMPLETE
936,0.47474592631266765,0.2,0.47500000000000003,0.425,0.175,0.5,0.05,equal,0.5,0.275,COMPLETE
937,0.456393841006823,0.25,0.45000000000000007,0.45,0.175,0.5,0.05,equal,0.5,0.25,COMPLETE
938,0.24241847195485253,0.175,0.45000000000000007,0.425,0.175,0.25,0.05,equal,0.5,0.25,COMPLETE
939,0.535306949728468,0.175,0.5,0.4,0.15000000000000002,0.5,0.05,equal,0.5,0.275,COMPLETE
940,0.31734356494031074,0.2,0.47500000000000003,0.45,0.175,0.5,0.125,equal,0.5,0.25,COMPLETE
941,0.26259114295790675,0.175,0.45000000000000007,0.4,0.175,0.5,0.125,equal,0.5,0.25,COMPLETE
942,0.2721675497881106,0.175,0.5,0.4,0.175,0.5,0.15000000000000002,equal,0.5,0.275,COMPLETE
943,0.5247165179991811,0.22500000000000003,0.47500000000000003,0.45,0.15000000000000002,0.47500000000000003,0.05,equal,0.5,0.25,COMPLETE
944,0.047564013830585075,0.22500000000000003,0.45000000000000007,0.47500000000000003,0.425,0.5,0.05,equal,0.5,0.25,COMPLETE
945,0.2721675497881106,0.2,0.47500000000000003,0.45,0.175,0.47500000000000003,0.15000000000000002,equal,0.47500000000000003,0.275,COMPLETE
946,0.2192470240390603,0.175,0.45000000000000007,0.425,0.175,0.5,0.175,equal,0.5,0.275,COMPLETE
947,0.3575068183676616,0.175,0.5,0.5,0.175,0.47500000000000003,0.125,equal,0.47500000000000003,0.25,COMPLETE
948,0.26259114295790714,0.2,0.45000000000000007,0.45,0.175,0.47500000000000003,0.125,equal,0.5,0.25,COMPLETE
949,0.15140983334924973,0.25,0.42500000000000004,0.47500000000000003,0.45,0.47500000000000003,0.05,equal,0.47500000000000003,0.275,COMPLETE
950,0.37483220840369347,0.175,0.47500000000000003,0.425,0.2,0.5,0.07500000000000001,equal,0.5,0.25,COMPLETE
951,0.3914465907341736,0.22500000000000003,0.525,0.47500000000000003,0.2,0.47500000000000003,0.07500000000000001,equal,0.47500000000000003,0.25,COMPLETE
952,0.24473379065902257,0.2,0.42500000000000004,0.5,0.175,0.47500000000000003,0.175,equal,0.5,0.275,COMPLETE
953,0.33352236554629755,0.175,0.45000000000000007,0.5,0.2,0.47500000000000003,0.15000000000000002,linear,0.47500000000000003,0.275,COMPLETE
954,0.26901423438037053,0.22500000000000003,0.47500000000000003,0.47500000000000003,0.175,0.35000000000000003,0.375,equal,0.47500000000000003,0.25,COMPLETE
955,0.21469736589335833,0.175,0.42500000000000004,0.7750000000000001,0.15000000000000002,0.5,0.05,equal,0.5,0.25,COMPLETE
956,0.29876751341260077,0.2,0.5,0.45,0.175,0.47500000000000003,0.125,equal,0.47500000000000003,0.25,COMPLETE
957,0.47905233971130157,0.2,0.42500000000000004,0.45,0.2,0.5,0.125,equal,0.5,0.275,COMPLETE
958,0.13352096123440665,0.175,0.55,0.675,0.15000000000000002,0.2,0.1,equal,0.47500000000000003,0.25,COMPLETE
959,0.40037360444686154,0.25,0.45000000000000007,0.47500000000000003,0.2,0.47500000000000003,0.1,equal,0.47500000000000003,0.275,COMPLETE
960,-0.0013160513914980757,0.175,0.47500000000000003,0.425,0.475,0.47500000000000003,0.05,equal,0.5,0.25,COMPLETE
961,0.30769214195588607,0.22500000000000003,0.525,0.45,0.2,0.47500000000000003,0.07500000000000001,equal,0.47500000000000003,0.3,COMPLETE
962,0.5038969414563379,0.2,0.45000000000000007,0.47500000000000003,0.2,0.5,0.125,equal,0.5,0.25,COMPLETE
963,0.49094646780243445,0.2,0.42500000000000004,0.5,0.175,0.47500000000000003,0.07500000000000001,equal,0.47500000000000003,0.25,COMPLETE
964,0.2905530220635424,0.175,0.47500000000000003,0.4,0.175,0.5,0.1,equal,0.47500000000000003,0.275,COMPLETE
965,0.3914465907341737,0.22500000000000003,0.5,0.47500000000000003,0.2,0.47500000000000003,0.07500000000000001,equal,0.5,0.25,COMPLETE
966,0.48362887920914155,0.175,0.42500000000000004,0.425,0.15000000000000002,0.47500000000000003,0.05,equal,0.47500000000000003,0.25,COMPLETE
967,0.18855814659849274,0.2,0.45000000000000007,0.45,0.175,0.5,0.1,equal,0.5,0.125,COMPLETE
968,0.4820146045205509,0.175,0.42500000000000004,0.5,0.175,0.47500000000000003,0.125,equal,0.47500000000000003,0.3,COMPLETE
969,0.6246360197681787,0.22500000000000003,0.45000000000000007,0.45,0.2,0.47500000000000003,0.07500000000000001,equal,0.5,0.275,COMPLETE
970,0.3886008099693314,0.275,0.47500000000000003,0.45,0.2,0.47500000000000003,0.07500000000000001,equal,0.5,0.3,COMPLETE
971,0.12873337075994518,0.25,0.5,0.45,0.175,0.5,0.3,equal,0.325,0.275,COMPLETE
972,0.5792319116363137,0.275,0.47500000000000003,0.45,0.15000000000000002,0.47500000000000003,0.05,equal,0.5,0.275,COMPLETE
973,0.22958789017728137,0.25,0.45000000000000007,0.6500000000000001,0.2,0.47500000000000003,0.07500000000000001,equal,0.5,0.3,COMPLETE
974,0.30614494041702534,0.22500000000000003,0.5,0.425,0.175,0.5,0.07500000000000001,equal,0.5,0.275,COMPLETE
975,0.3765659849083023,0.22500000000000003,0.525,0.45,0.15000000000000002,0.325,0.05,equal,0.5,0.275,COMPLETE
976,0.3848672964563077,0.3,0.45000000000000007,0.47500000000000003,0.2,0.47500000000000003,0.07500000000000001,linear,0.5,0.275,COMPLETE
977,0.39232152068162945,0.25,0.47500000000000003,0.45,0.15000000000000002,0.45,0.07500000000000001,equal,0.5,0.3,COMPLETE
978,0.5031627382863417,0.22500000000000003,0.45000000000000007,0.425,0.15000000000000002,0.47500000000000003,0.05,equal,0.5,0.275,COMPLETE
979,0.44073384390283066,0.2,0.47500000000000003,0.425,0.175,0.5,0.07500000000000001,equal,0.5,0.275,COMPLETE
980,0.40996635383646285,0.22500000000000003,0.5,0.45,0.2,0.47500000000000003,0.07500000000000001,equal,0.5,0.275,COMPLETE
981,0.6246360197681787,0.22500000000000003,0.45000000000000007,0.45,0.2,0.47500000000000003,0.05,equal,0.5,0.3,COMPLETE
982,0.45761747012649034,0.25,0.47500000000000003,0.45,0.2,0.5,0.05,equal,0.5,0.3,COMPLETE
983,0.4922891539087087,0.25,0.45000000000000007,0.45,0.15000000000000002,0.45,0.05,equal,0.5,0.325,COMPLETE
984,0.5633974125993744,0.22500000000000003,0.5,0.425,0.2,0.47500000000000003,0.05,equal,0.5,0.3,COMPLETE
985,0.6021780566265795,0.22500000000000003,0.47500000000000003,0.425,0.2,0.47500000000000003,0.05,equal,0.5,0.3,COMPLETE
986,0.47594553862564115,0.25,0.47500000000000003,0.425,0.2,0.5,0.05,equal,0.5,0.325,COMPLETE
987,0.24805061983365495,0.25,0.525,0.425,0.2,0.47500000000000003,0.05,equal,0.5,0.3,COMPLETE
988,0.35490442698458413,0.3,0.47500000000000003,0.45,0.2,0.45,0.05,equal,0.5,0.3,COMPLETE
989,0.41536583825168844,0.22500000000000003,0.5,0.4,0.2,0.47500000000000003,0.05,equal,0.5,0.325,COMPLETE
990,0.3733914247790526,0.275,0.47500000000000003,0.35000000000000003,0.2,0.5,0.05,equal,0.5,0.3,COMPLETE
991,0.5614558432416406,0.22500000000000003,0.47500000000000003,0.4,0.2,0.47500000000000003,0.05,equal,0.5,0.3,COMPLETE
992,0.4056355589744446,0.25,0.5,0.425,0.2,0.45,0.05,equal,0.5,0.3,COMPLETE
993,0.5425044014830847,0.22500000000000003,0.45000000000000007,0.4,0.2,0.47500000000000003,0.05,equal,0.5,0.3,COMPLETE
994,0.4759455386256409,0.22500000000000003,0.45000000000000007,0.425,0.2,0.5,0.05,equal,0.47500000000000003,0.3,COMPLETE
995,-0.030624170157069277,0.25,0.525,0.45,0.2,0.47500000000000003,0.05,linear,0.47500000000000003,0.07500000000000001,COMPLETE
996,0.6021780566265795,0.22500000000000003,0.47500000000000003,0.425,0.2,0.47500000000000003,0.05,equal,0.5,0.325,COMPLETE
997,0.3872998932129908,0.275,0.5,0.425,0.2,0.45,0.05,equal,0.5,0.325,COMPLETE
998,0.26600676029760195,0.25,0.5,0.4,0.2,0.5,0.05,equal,0.5,0.325,COMPLETE
999,0.1072252260851101,0.275,0.47500000000000003,0.35000000000000003,0.2,0.47500000000000003,0.05,equal,0.07500000000000001,0.325,COMPLETE
1000,0.5614558432416406,0.22500000000000003,0.47500000000000003,0.4,0.2,0.47500000000000003,0.05,equal,0.5,0.35000000000000003,COMPLETE
1001,0.22458162289951708,0.375,0.5,0.45,0.2,0.45,0.05,equal,0.5,0.325,COMPLETE
1002,0.47594553862564115,0.25,0.47500000000000003,0.425,0.2,0.5,0.05,equal,0.5,0.325,COMPLETE
1003,0.5633974125993744,0.22500000000000003,0.5,0.425,0.2,0.47500000000000003,0.05,equal,0.5,0.325,COMPLETE
1004,0.2480506198336554,0.22500000000000003,0.55,0.4,0.2,0.47500000000000003,0.05,equal,0.5,0.325,COMPLETE
1005,0.5210527709871444,0.22500000000000003,0.45000000000000007,0.425,0.2,0.45,0.05,equal,0.5,0.3,COMPLETE
1006,0.30964369835910355,0.25,0.47500000000000003,0.425,0.2,0.5,0.05,equal,0.175,0.3,COMPLETE
1007,0.24805061983365495,0.22500000000000003,0.525,0.4,0.2,0.47500000000000003,0.05,equal,0.5,0.325,COMPLETE
1008,0.5614558432416406,0.2,0.45000000000000007,0.4,0.2,0.47500000000000003,0.05,equal,0.5,0.3,COMPLETE
1009,0.43190786597075315,0.22500000000000003,0.47500000000000003,0.375,0.2,0.45,0.05,equal,0.5,0.3,COMPLETE
1010,0.39065972465186416,0.2,0.45000000000000007,0.425,0.2,0.375,0.05,equal,0.5,0.3,COMPLETE
1011,0.41536583825168844,0.2,0.525,0.375,0.2,0.47500000000000003,0.05,equal,0.5,0.3,COMPLETE
1012,0.037902955608169815,0.2,0.5,0.425,0.175,0.1,0.05,equal,0.5,0.325,COMPLETE
1013,0.3069607934666698,0.275,0.47500000000000003,0.325,0.2,0.5,0.05,equal,0.22500000000000003,0.35000000000000003,COMPLETE
1014,0.1149700239028593,0.2,0.45000000000000007,0.425,0.375,0.3,0.07500000000000001,equal,0.47500000000000003,0.3,COMPLETE
1015,0.14319510091697862,0.22500000000000003,0.8750000000000001,0.45,0.175,0.22500000000000003,0.07500000000000001,equal,0.5,0.3,COMPLETE
1016,0.6021780566265795,0.25,0.47500000000000003,0.45,0.2,0.47500000000000003,0.05,equal,0.47500000000000003,0.325,COMPLETE
1017,0.37202469510180686,0.25,0.5,0.425,0.2,0.5,0.05,equal,0.5,0.325,COMPLETE
1018,0.5832175199153726,0.25,0.47500000000000003,0.45,0.2,0.47500000000000003,0.05,linear,0.47500000000000003,0.35000000000000003,COMPLETE
1019,0.4056355589744446,0.25,0.5,0.425,0.2,0.45,0.05,equal,0.5,0.325,COMPLETE
1020,0.037902955608169815,0.22500000000000003,0.47500000000000003,0.425,0.2,0.175,0.05,equal,0.47500000000000003,0.35000000000000003,COMPLETE
1021,0.24805061983365495,0.22500000000000003,0.525,0.4,0.2,0.5,0.05,equal,0.5,0.35000000000000003,COMPLETE
1022,0.33509650686447257,0.25,0.5,0.45,0.2,0.47500000000000003,0.05,equal,0.47500000000000003,0.325,COMPLETE
1023,0.21217510154537714,0.22500000000000003,0.47500000000000003,0.425,0.2,0.25,0.05,equal,0.5,0.325,COMPLETE
1024,0.6021780566265797,0.22500000000000003,0.47500000000000003,0.45,0.2,0.47500000000000003,0.05,equal,0.47500000000000003,0.3,COMPLETE
1025,0.4822238139089189,0.275,0.5,0.45,0.22500000000000003,0.45,0.05,equal,0.5,0.325,COMPLETE
1026,0.6021780566265795,0.25,0.47500000000000003,0.45,0.2,0.47500000000000003,0.05,equal,0.47500000000000003,0.325,COMPLETE
1027,0.33117382419726227,0.275,0.55,0.45,0.2,0.47500000000000003,0.05,equal,0.275,0.325,COMPLETE
1028,0.3350965068644727,0.25,0.5,0.425,0.2,0.47500000000000003,0.05,equal,0.5,0.325,COMPLETE
1029,0.35364915698360666,0.275,0.525,0.45,0.2,0.5,0.05,equal,0.47500000000000003,0.325,COMPLETE
1030,0.2079359633783352,0.3,0.47500000000000003,0.45,0.2,0.47500000000000003,0.05,equal,0.47500000000000003,0.325,COMPLETE
1031,0.5835067706578329,0.25,0.47500000000000003,0.425,0.22500000000000003,0.45,0.05,equal,0.5,0.325,COMPLETE
1032,0.37202469510180686,0.25,0.5,0.425,0.2,0.5,0.05,equal,0.47500000000000003,0.325,COMPLETE
1033,0.6021780566265795,0.22500000000000003,0.47500000000000003,0.425,0.2,0.47500000000000003,0.05,equal,0.47500000000000003,0.3,COMPLETE
1034,0.2321510568752077,0.275,0.525,0.4,0.22500000000000003,0.47500000000000003,0.05,equal,0.5,0.3,COMPLETE
1035,0.3850186158668066,0.25,0.47500000000000003,0.4,0.22500000000000003,0.45,0.05,equal,0.5,0.3,COMPLETE
1036,0.26600676029760195,0.22500000000000003,0.5,0.4,0.2,0.5,0.05,equal,0.47500000000000003,0.35000000000000003,COMPLETE
1037,0.5614558432416414,0.25,0.47500000000000003,0.4,0.2,0.47500000000000003,0.05,equal,0.47500000000000003,0.3,COMPLETE
1038,0.24805061983365495,0.22500000000000003,0.525,0.425,0.2,0.47500000000000003,0.05,equal,0.5,0.325,COMPLETE
1039,0.6021780566265795,0.22500000000000003,0.47500000000000003,0.425,0.2,0.47500000000000003,0.05,equal,0.47500000000000003,0.3,COMPLETE
1040,0.35265481907588214,0.275,0.5,0.425,0.2,0.5,0.05,linear,0.5,0.3,COMPLETE
1041,0.42554381100841504,0.25,0.525,0.425,0.22500000000000003,0.45,0.05,equal,0.47500000000000003,0.325,COMPLETE
1042,0.5614558432416406,0.22500000000000003,0.47500000000000003,0.4,0.2,0.47500000000000003,0.05,equal,0.5,0.3,COMPLETE
1043,0.3822180294047801,0.25,0.5,0.425,0.22500000000000003,0.47500000000000003,0.05,equal,0.47500000000000003,0.3,COMPLETE
1044,0.4183964705441464,0.22500000000000003,0.5,0.4,0.22500000000000003,0.45,0.05,equal,0.5,0.3,COMPLETE
1045,0.47594553862564115,0.25,0.47500000000000003,0.425,0.2,0.5,0.05,equal,0.47500000000000003,0.3,COMPLETE
1046,0.41536583825168844,0.22500000000000003,0.5,0.4,0.2,0.47500000000000003,0.05,equal,0.5,0.325,COMPLETE
1047,0.38391671908528624,0.22500000000000003,0.47500000000000003,0.375,0.2,0.5,0.05,equal,0.47500000000000003,0.3,COMPLETE
1048,0.5835067706578329,0.25,0.47500000000000003,0.425,0.22500000000000003,0.45,0.05,equal,0.5,0.325,COMPLETE
1049,0.24805061983365495,0.275,0.55,0.425,0.2,0.47500000000000003,0.05,equal,0.5,0.325,COMPLETE
1050,0.41536583825168844,0.22500000000000003,0.5,0.4,0.2,0.47500000000000003,0.05,equal,0.47500000000000003,0.3,COMPLETE
1051,0.4587160048116591,0.3,0.47500000000000003,0.425,0.2,0.5,0.05,equal,0.47500000000000003,0.3,COMPLETE
1052,0.6431900236904107,0.22500000000000003,0.47500000000000003,0.425,0.22500000000000003,0.47500000000000003,0.05,equal,0.5,0.3,COMPLETE
1053,0.4183964705441464,0.22500000000000003,0.5,0.4,0.22500000000000003,0.45,0.05,equal,0.5,0.3,COMPLETE
1054,0.25363833099998745,0.25,0.525,0.375,0.22500000000000003,0.47500000000000003,0.05,equal,0.5,0.3,COMPLETE
1055,0.26600676029760195,0.22500000000000003,0.5,0.4,0.22500000000000003,0.5,0.05,equal,0.5,0.3,COMPLETE
1056,0.6431900236904107,0.22500000000000003,0.47500000000000003,0.425,0.22500000000000003,0.47500000000000003,0.05,equal,0.5,0.325,COMPLETE
1057,0.39692052476088063,0.25,0.47500000000000003,0.4,0.22500000000000003,0.47500000000000003,0.05,equal,0.5,0.35000000000000003,COMPLETE
1058,0.2599053807468983,0.275,0.55,0.425,0.22500000000000003,0.45,0.05,equal,0.5,0.325,COMPLETE
1059,0.3822180294047801,0.25,0.5,0.425,0.22500000000000003,0.47500000000000003,0.05,equal,0.5,0.325,COMPLETE
1060,0.5592680918801681,0.22500000000000003,0.47500000000000003,0.4,0.22500000000000003,0.47500000000000003,0.05,equal,0.5,0.35000000000000003,COMPLETE
1061,0.2292141788261385,0.22500000000000003,0.525,0.425,0.22500000000000003,0.5,0.05,linear,0.5,0.325,COMPLETE
1062,0.40891404767119777,0.22500000000000003,0.47500000000000003,0.375,0.22500000000000003,0.47500000000000003,0.05,equal,0.5,0.325,COMPLETE
1063,0.5713279633516815,0.22500000000000003,0.47500000000000003,0.425,0.22500000000000003,0.45,0.05,equal,0.5,0.325,COMPLETE
1064,0.37202469510180686,0.25,0.5,0.425,0.22500000000000003,0.5,0.05,equal,0.5,0.325,COMPLETE
1065,0.2321510568752077,0.275,0.525,0.425,0.22500000000000003,0.47500000000000003,0.05,equal,0.5,0.3,COMPLETE
1066,0.3969205247608802,0.25,0.47500000000000003,0.4,0.22500000000000003,0.5,0.05,equal,0.5,0.3,COMPLETE
1067,0.5592680918801681,0.22500000000000003,0.47500000000000003,0.4,0.22500000000000003,0.47500000000000003,0.05,equal,0.5,0.35000000000000003,COMPLETE
1068,0.0743881075205807,0.25,0.5,0.425,0.5,0.45,0.05,equal,0.5,0.3,COMPLETE
1069,0.26600676029760195,0.22500000000000003,0.5,0.425,0.22500000000000003,0.5,0.05,equal,0.5,0.3,COMPLETE
1070,0.5592680918801681,0.22500000000000003,0.47500000000000003,0.4,0.22500000000000003,0.47500000000000003,0.05,equal,0.5,0.325,COMPLETE
1071,0.19510431651517007,0.275,0.525,0.425,0.22500000000000003,0.275,0.05,equal,0.5,0.3,COMPLETE
1072,0.21717484572926055,0.2,0.45000000000000007,0.4,0.22500000000000003,0.275,0.07500000000000001,equal,0.5,0.325,COMPLETE
1073,0.38602184294228764,0.2,0.47500000000000003,0.375,0.2,0.47500000000000003,0.05,equal,0.5,0.3,COMPLETE
1074,0.3139755464474461,0.325,0.45000000000000007,0.425,0.22500000000000003,0.45,0.05,equal,0.5,0.325,COMPLETE
1075,0.5353069497284676,0.22500000000000003,0.47500000000000003,0.425,0.2,0.47500000000000003,0.07500000000000001,equal,0.5,0.3,COMPLETE
1076,0.3265026634823385,0.2,0.5,0.375,0.2,0.5,0.07500000000000001,equal,0.5,0.35000000000000003,COMPLETE
1077,0.5241212743427441,0.25,0.45000000000000007,0.425,0.22500000000000003,0.45,0.05,equal,0.5,0.3,COMPLETE
1078,0.5614558432416406,0.22500000000000003,0.47500000000000003,0.4,0.2,0.47500000000000003,0.05,equal,0.5,0.325,COMPLETE
1079,0.30769214195588557,0.25,0.525,0.45,0.2,0.47500000000000003,0.07500000000000001,equal,0.5,0.3,COMPLETE
1080,0.3265026634823385,0.2,0.5,0.4,0.2,0.5,0.07500000000000001,equal,0.5,0.3,COMPLETE
1081,0.17741817902559964,0.3,0.45000000000000007,0.45,0.2,0.47500000000000003,0.07500000000000001,equal,0.15000000000000002,0.325,COMPLETE
1082,0.5640647054984622,0.25,0.47500000000000003,0.425,0.22500000000000003,0.45,0.05,linear,0.5,0.35000000000000003,COMPLETE
